tb_eval/data/ROCm/data/performance/golden_results/block_pointer_matmul_perf.json
[
    {
        "params": {
            "M": 64,
            "N": 64,
            "K": 64,
            "num_warps": 4,
            "dtype_str": "fp16"
        },
        "ms": 0.0075,
        "min_ms": 0.0079,
        "max_ms": 0.0073,
        "GB/s": 3.26,
        "TFLOPS": 0.07
    },
    {
        "params": {
            "M": 128,
            "N": 128,
            "K": 128,
            "num_warps": 4,
            "dtype_str": "fp16"
        },
        "ms": 0.0091,
        "min_ms": 0.0094,
        "max_ms": 0.0089,
        "GB/s": 10.8,
        "TFLOPS": 0.46
    },
    {
        "params": {
            "M": 64,
            "N": 128,
            "K": 256,
            "num_warps": 4,
            "dtype_str": "fp16"
        },
        "ms": 0.0093,
        "min_ms": 0.0095,
        "max_ms": 0.0091,
        "GB/s": 12.38,
        "TFLOPS": 0.45
    },
    {
        "params": {
            "M": 256,
            "N": 64,
            "K": 128,
            "num_warps": 4,
            "dtype_str": "fp16"
        },
        "ms": 0.0094,
        "min_ms": 0.0096,
        "max_ms": 0.0093,
        "GB/s": 12.22,
        "TFLOPS": 0.45
    },
    {
        "params": {
            "M": 128,
            "N": 256,
            "K": 64,
            "num_warps": 4,
            "dtype_str": "fp16"
        },
        "ms": 0.0142,
        "min_ms": 0.0146,
        "max_ms": 0.0139,
        "GB/s": 8.06,
        "TFLOPS": 0.29
    },
    {
        "params": {
            "M": 64,
            "N": 64,
            "K": 64,
            "num_warps": 8,
            "dtype_str": "fp16"
        },
        "ms": 0.0073,
        "min_ms": 0.0076,
        "max_ms": 0.007,
        "GB/s": 3.35,
        "TFLOPS": 0.07
    },
    {
        "params": {
            "M": 128,
            "N": 128,
            "K": 128,
            "num_warps": 8,
            "dtype_str": "fp16"
        },
        "ms": 0.0087,
        "min_ms": 0.0088,
        "max_ms": 0.0085,
        "GB/s": 11.35,
        "TFLOPS": 0.48
    },
    {
        "params": {
            "M": 64,
            "N": 128,
            "K": 256,
            "num_warps": 8,
            "dtype_str": "fp16"
        },
        "ms": 0.0088,
        "min_ms": 0.009,
        "max_ms": 0.0087,
        "GB/s": 13.0,
        "TFLOPS": 0.48
    },
    {
        "params": {
            "M": 256,
            "N": 64,
            "K": 128,
            "num_warps": 8,
            "dtype_str": "fp16"
        },
        "ms": 0.0089,
        "min_ms": 0.0091,
        "max_ms": 0.0087,
        "GB/s": 12.89,
        "TFLOPS": 0.47
    },
    {
        "params": {
            "M": 128,
            "N": 256,
            "K": 64,
            "num_warps": 8,
            "dtype_str": "fp16"
        },
        "ms": 0.0133,
        "min_ms": 0.0138,
        "max_ms": 0.012,
        "GB/s": 8.62,
        "TFLOPS": 0.32
    },
    {
        "params": {
            "M": 64,
            "N": 64,
            "K": 64,
            "num_warps": 4,
            "dtype_str": "fp32"
        },
        "ms": 0.0075,
        "min_ms": 0.0077,
        "max_ms": 0.0072,
        "GB/s": 6.59,
        "TFLOPS": 0.07
    },
    {
        "params": {
            "M": 128,
            "N": 128,
            "K": 128,
            "num_warps": 4,
            "dtype_str": "fp32"
        },
        "ms": 0.0212,
        "min_ms": 0.0215,
        "max_ms": 0.021,
        "GB/s": 9.27,
        "TFLOPS": 0.2
    },
    {
        "params": {
            "M": 64,
            "N": 128,
            "K": 256,
            "num_warps": 4,
            "dtype_str": "fp32"
        },
        "error": "out of resource: shared memory, Required: 131072, Hardware limit: 65536. Reducing block sizes or `num_stages` may help."
    },
    {
        "params": {
            "M": 256,
            "N": 64,
            "K": 128,
            "num_warps": 4,
            "dtype_str": "fp32"
        },
        "error": "out of resource: shared memory, Required: 131072, Hardware limit: 65536. Reducing block sizes or `num_stages` may help."
    },
    {
        "params": {
            "M": 128,
            "N": 256,
            "K": 64,
            "num_warps": 4,
            "dtype_str": "fp32"
        },
        "ms": 0.0271,
        "min_ms": 0.0275,
        "max_ms": 0.0267,
        "GB/s": 8.46,
        "TFLOPS": 0.15
    },
    {
        "params": {
            "M": 64,
            "N": 64,
            "K": 64,
            "num_warps": 8,
            "dtype_str": "fp32"
        },
        "ms": 0.0079,
        "min_ms": 0.008,
        "max_ms": 0.0077,
        "GB/s": 6.26,
        "TFLOPS": 0.07
    },
    {
        "params": {
            "M": 128,
            "N": 128,
            "K": 128,
            "num_warps": 8,
            "dtype_str": "fp32"
        },
        "ms": 0.0225,
        "min_ms": 0.0229,
        "max_ms": 0.0223,
        "GB/s": 8.73,
        "TFLOPS": 0.19
    },
    {
        "params": {
            "M": 64,
            "N": 128,
            "K": 256,
            "num_warps": 8,
            "dtype_str": "fp32"
        },
        "error": "out of resource: shared memory, Required: 131072, Hardware limit: 65536. Reducing block sizes or `num_stages` may help."
    },
    {
        "params": {
            "M": 256,
            "N": 64,
            "K": 128,
            "num_warps": 8,
            "dtype_str": "fp32"
        },
        "error": "out of resource: shared memory, Required: 131072, Hardware limit: 65536. Reducing block sizes or `num_stages` may help."
    },
    {
        "params": {
            "M": 128,
            "N": 256,
            "K": 64,
            "num_warps": 8,
            "dtype_str": "fp32"
        },
        "ms": 0.0255,
        "min_ms": 0.0259,
        "max_ms": 0.0252,
        "GB/s": 8.98,
        "TFLOPS": 0.16
    }
]