tb_eval/data/ROCm/data/performance/golden_results/gemm_fusion_triton_perf.json
[
    {
        "params": {
            "M": 128,
            "N": 128,
            "K": 32,
            "block_m": 32,
            "block_n": 32,
            "block_k": 32,
            "dtype_str": "fp16",
            "num_warps": 4
        },
        "ms": 0.0075,
        "min_ms": 0.008,
        "max_ms": 0.0072,
        "GB/s": 4.37,
        "TFLOPS": 0.28
    },
    {
        "params": {
            "M": 128,
            "N": 128,
            "K": 32,
            "block_m": 32,
            "block_n": 64,
            "block_k": 32,
            "dtype_str": "fp16",
            "num_warps": 4
        },
        "ms": 0.0074,
        "min_ms": 0.0077,
        "max_ms": 0.0072,
        "GB/s": 4.42,
        "TFLOPS": 0.28
    },
    {
        "params": {
            "M": 128,
            "N": 128,
            "K": 32,
            "block_m": 32,
            "block_n": 128,
            "block_k": 32,
            "dtype_str": "fp16",
            "num_warps": 4
        },
        "ms": 0.0073,
        "min_ms": 0.0077,
        "max_ms": 0.0071,
        "GB/s": 4.47,
        "TFLOPS": 0.29
    },
    {
        "params": {
            "M": 128,
            "N": 128,
            "K": 32,
            "block_m": 64,
            "block_n": 32,
            "block_k": 32,
            "dtype_str": "fp16",
            "num_warps": 4
        },
        "ms": 0.0073,
        "min_ms": 0.0076,
        "max_ms": 0.007,
        "GB/s": 4.52,
        "TFLOPS": 0.29
    },
    {
        "params": {
            "M": 128,
            "N": 128,
            "K": 32,
            "block_m": 64,
            "block_n": 64,
            "block_k": 32,
            "dtype_str": "fp16",
            "num_warps": 4
        },
        "ms": 0.0073,
        "min_ms": 0.0077,
        "max_ms": 0.007,
        "GB/s": 4.49,
        "TFLOPS": 0.29
    },
    {
        "params": {
            "M": 128,
            "N": 128,
            "K": 32,
            "block_m": 64,
            "block_n": 128,
            "block_k": 32,
            "dtype_str": "fp16",
            "num_warps": 4
        },
        "ms": 0.0073,
        "min_ms": 0.0077,
        "max_ms": 0.007,
        "GB/s": 4.52,
        "TFLOPS": 0.29
    },
    {
        "params": {
            "M": 128,
            "N": 128,
            "K": 32,
            "block_m": 128,
            "block_n": 32,
            "block_k": 32,
            "dtype_str": "fp16",
            "num_warps": 4
        },
        "ms": 0.0073,
        "min_ms": 0.0076,
        "max_ms": 0.0069,
        "GB/s": 4.52,
        "TFLOPS": 0.29
    },
    {
        "params": {
            "M": 128,
            "N": 128,
            "K": 32,
            "block_m": 128,
            "block_n": 64,
            "block_k": 32,
            "dtype_str": "fp16",
            "num_warps": 4
        },
        "ms": 0.0073,
        "min_ms": 0.0077,
        "max_ms": 0.0069,
        "GB/s": 4.52,
        "TFLOPS": 0.29
    },
    {
        "params": {
            "M": 128,
            "N": 128,
            "K": 32,
            "block_m": 128,
            "block_n": 128,
            "block_k": 32,
            "dtype_str": "fp16",
            "num_warps": 4
        },
        "ms": 0.0073,
        "min_ms": 0.0077,
        "max_ms": 0.007,
        "GB/s": 4.49,
        "TFLOPS": 0.29
    },
    {
        "params": {
            "M": 128,
            "N": 256,
            "K": 32,
            "block_m": 32,
            "block_n": 32,
            "block_k": 32,
            "dtype_str": "fp16",
            "num_warps": 4
        },
        "ms": 0.0078,
        "min_ms": 0.008,
        "max_ms": 0.0077,
        "GB/s": 6.29,
        "TFLOPS": 0.54
    },
    {
        "params": {
            "M": 128,
            "N": 256,
            "K": 32,
            "block_m": 32,
            "block_n": 64,
            "block_k": 32,
            "dtype_str": "fp16",
            "num_warps": 4
        },
        "ms": 0.0074,
        "min_ms": 0.0078,
        "max_ms": 0.0071,
        "GB/s": 6.66,
        "TFLOPS": 0.57
    },
    {
        "params": {
            "M": 128,
            "N": 256,
            "K": 32,
            "block_m": 32,
            "block_n": 128,
            "block_k": 32,
            "dtype_str": "fp16",
            "num_warps": 4
        },
        "ms": 0.0073,
        "min_ms": 0.0077,
        "max_ms": 0.0071,
        "GB/s": 6.7,
        "TFLOPS": 0.57
    },
    {
        "params": {
            "M": 128,
            "N": 256,
            "K": 32,
            "block_m": 64,
            "block_n": 32,
            "block_k": 32,
            "dtype_str": "fp16",
            "num_warps": 4
        },
        "ms": 0.0079,
        "min_ms": 0.0081,
        "max_ms": 0.0078,
        "GB/s": 6.22,
        "TFLOPS": 0.53
    },
    {
        "params": {
            "M": 128,
            "N": 256,
            "K": 32,
            "block_m": 64,
            "block_n": 64,
            "block_k": 32,
            "dtype_str": "fp16",
            "num_warps": 4
        },
        "ms": 0.0073,
        "min_ms": 0.0077,
        "max_ms": 0.0071,
        "GB/s": 6.77,
        "TFLOPS": 0.58
    },
    {
        "params": {
            "M": 128,
            "N": 256,
            "K": 32,
            "block_m": 64,
            "block_n": 128,
            "block_k": 32,
            "dtype_str": "fp16",
            "num_warps": 4
        },
        "ms": 0.0073,
        "min_ms": 0.0076,
        "max_ms": 0.0072,
        "GB/s": 6.74,
        "TFLOPS": 0.57
    },
    {
        "params": {
            "M": 128,
            "N": 256,
            "K": 32,
            "block_m": 128,
            "block_n": 32,
            "block_k": 32,
            "dtype_str": "fp16",
            "num_warps": 4
        },
        "ms": 0.0081,
        "min_ms": 0.0082,
        "max_ms": 0.008,
        "GB/s": 6.1,
        "TFLOPS": 0.52
    },
    {
        "params": {
            "M": 128,
            "N": 256,
            "K": 32,
            "block_m": 128,
            "block_n": 64,
            "block_k": 32,
            "dtype_str": "fp16",
            "num_warps": 4
        },
        "ms": 0.0074,
        "min_ms": 0.0077,
        "max_ms": 0.0073,
        "GB/s": 6.66,
        "TFLOPS": 0.57
    },
    {
        "params": {
            "M": 128,
            "N": 256,
            "K": 32,
            "block_m": 128,
            "block_n": 128,
            "block_k": 32,
            "dtype_str": "fp16",
            "num_warps": 4
        },
        "ms": 0.0073,
        "min_ms": 0.0077,
        "max_ms": 0.0072,
        "GB/s": 6.7,
        "TFLOPS": 0.57
    },
    {
        "params": {
            "M": 128,
            "N": 512,
            "K": 32,
            "block_m": 32,
            "block_n": 32,
            "block_k": 32,
            "dtype_str": "fp16",
            "num_warps": 4
        },
        "ms": 0.011,
        "min_ms": 0.0111,
        "max_ms": 0.0109,
        "GB/s": 7.46,
        "TFLOPS": 0.76
    },
    {
        "params": {
            "M": 128,
            "N": 512,
            "K": 32,
            "block_m": 32,
            "block_n": 64,
            "block_k": 32,
            "dtype_str": "fp16",
            "num_warps": 4
        },
        "ms": 0.0095,
        "min_ms": 0.0096,
        "max_ms": 0.0094,
        "GB/s": 8.66,
        "TFLOPS": 0.89
    },
    {
        "params": {
            "M": 128,
            "N": 512,
            "K": 32,
            "block_m": 32,
            "block_n": 128,
            "block_k": 32,
            "dtype_str": "fp16",
            "num_warps": 4
        },
        "ms": 0.0091,
        "min_ms": 0.0093,
        "max_ms": 0.0091,
        "GB/s": 8.96,
        "TFLOPS": 0.92
    },
    {
        "params": {
            "M": 128,
            "N": 512,
            "K": 32,
            "block_m": 64,
            "block_n": 32,
            "block_k": 32,
            "dtype_str": "fp16",
            "num_warps": 4
        },
        "ms": 0.0111,
        "min_ms": 0.0112,
        "max_ms": 0.011,
        "GB/s": 7.38,
        "TFLOPS": 0.76
    },
    {
        "params": {
            "M": 128,
            "N": 512,
            "K": 32,
            "block_m": 64,
            "block_n": 64,
            "block_k": 32,
            "dtype_str": "fp16",
            "num_warps": 4
        },
        "ms": 0.0095,
        "min_ms": 0.0097,
        "max_ms": 0.0094,
        "GB/s": 8.59,
        "TFLOPS": 0.88
    },
    {
        "params": {
            "M": 128,
            "N": 512,
            "K": 32,
            "block_m": 64,
            "block_n": 128,
            "block_k": 32,
            "dtype_str": "fp16",
            "num_warps": 4
        },
        "ms": 0.0093,
        "min_ms": 0.0095,
        "max_ms": 0.0092,
        "GB/s": 8.77,
        "TFLOPS": 0.9
    },
    {
        "params": {
            "M": 128,
            "N": 512,
            "K": 32,
            "block_m": 128,
            "block_n": 32,
            "block_k": 32,
            "dtype_str": "fp16",
            "num_warps": 4
        },
        "ms": 0.0112,
        "min_ms": 0.0113,
        "max_ms": 0.0111,
        "GB/s": 7.3,
        "TFLOPS": 0.75
    },
    {
        "params": {
            "M": 128,
            "N": 512,
            "K": 32,
            "block_m": 128,
            "block_n": 64,
            "block_k": 32,
            "dtype_str": "fp16",
            "num_warps": 4
        },
        "ms": 0.0097,
        "min_ms": 0.0099,
        "max_ms": 0.0096,
        "GB/s": 8.44,
        "TFLOPS": 0.86
    },
    {
        "params": {
            "M": 128,
            "N": 512,
            "K": 32,
            "block_m": 128,
            "block_n": 128,
            "block_k": 32,
            "dtype_str": "fp16",
            "num_warps": 4
        },
        "ms": 0.0094,
        "min_ms": 0.0096,
        "max_ms": 0.0093,
        "GB/s": 8.73,
        "TFLOPS": 0.89
    },
    {
        "params": {
            "M": 128,
            "N": 1024,
            "K": 32,
            "block_m": 32,
            "block_n": 32,
            "block_k": 32,
            "dtype_str": "fp16",
            "num_warps": 4
        },
        "ms": 0.0176,
        "min_ms": 0.0178,
        "max_ms": 0.0174,
        "GB/s": 8.4,
        "TFLOPS": 0.96
    },
    {
        "params": {
            "M": 128,
            "N": 1024,
            "K": 32,
            "block_m": 32,
            "block_n": 64,
            "block_k": 32,
            "dtype_str": "fp16",
            "num_warps": 4
        },
        "ms": 0.0144,
        "min_ms": 0.0145,
        "max_ms": 0.0143,
        "GB/s": 10.27,
        "TFLOPS": 1.17
    },
    {
        "params": {
            "M": 128,
            "N": 1024,
            "K": 32,
            "block_m": 32,
            "block_n": 128,
            "block_k": 32,
            "dtype_str": "fp16",
            "num_warps": 4
        },
        "ms": 0.0134,
        "min_ms": 0.0134,
        "max_ms": 0.0133,
        "GB/s": 11.01,
        "TFLOPS": 1.25
    },
    {
        "params": {
            "M": 128,
            "N": 1024,
            "K": 32,
            "block_m": 64,
            "block_n": 32,
            "block_k": 32,
            "dtype_str": "fp16",
            "num_warps": 4
        },
        "ms": 0.0176,
        "min_ms": 0.0178,
        "max_ms": 0.0175,
        "GB/s": 8.36,
        "TFLOPS": 0.95
    },
    {
        "params": {
            "M": 128,
            "N": 1024,
            "K": 32,
            "block_m": 64,
            "block_n": 64,
            "block_k": 32,
            "dtype_str": "fp16",
            "num_warps": 4
        },
        "ms": 0.0144,
        "min_ms": 0.0146,
        "max_ms": 0.0143,
        "GB/s": 10.24,
        "TFLOPS": 1.17
    },
    {
        "params": {
            "M": 128,
            "N": 1024,
            "K": 32,
            "block_m": 64,
            "block_n": 128,
            "block_k": 32,
            "dtype_str": "fp16",
            "num_warps": 4
        },
        "ms": 0.0136,
        "min_ms": 0.0137,
        "max_ms": 0.0135,
        "GB/s": 10.88,
        "TFLOPS": 1.24
    },
    {
        "params": {
            "M": 128,
            "N": 1024,
            "K": 32,
            "block_m": 128,
            "block_n": 32,
            "block_k": 32,
            "dtype_str": "fp16",
            "num_warps": 4
        },
        "ms": 0.0177,
        "min_ms": 0.0179,
        "max_ms": 0.0176,
        "GB/s": 8.32,
        "TFLOPS": 0.95
    },
    {
        "params": {
            "M": 128,
            "N": 1024,
            "K": 32,
            "block_m": 128,
            "block_n": 64,
            "block_k": 32,
            "dtype_str": "fp16",
            "num_warps": 4
        },
        "ms": 0.0146,
        "min_ms": 0.0147,
        "max_ms": 0.0145,
        "GB/s": 10.1,
        "TFLOPS": 1.15
    },
    {
        "params": {
            "M": 128,
            "N": 1024,
            "K": 32,
            "block_m": 128,
            "block_n": 128,
            "block_k": 32,
            "dtype_str": "fp16",
            "num_warps": 4
        },
        "ms": 0.0137,
        "min_ms": 0.0138,
        "max_ms": 0.0136,
        "GB/s": 10.79,
        "TFLOPS": 1.23
    },
    {
        "params": {
            "M": 128,
            "N": 2048,
            "K": 32,
            "block_m": 32,
            "block_n": 32,
            "block_k": 32,
            "dtype_str": "fp16",
            "num_warps": 4
        },
        "ms": 0.0306,
        "min_ms": 0.0308,
        "max_ms": 0.0304,
        "GB/s": 9.09,
        "TFLOPS": 1.1
    },
    {
        "params": {
            "M": 128,
            "N": 2048,
            "K": 32,
            "block_m": 32,
            "block_n": 64,
            "block_k": 32,
            "dtype_str": "fp16",
            "num_warps": 4
        },
        "ms": 0.024,
        "min_ms": 0.0242,
        "max_ms": 0.0239,
        "GB/s": 11.6,
        "TFLOPS": 1.4
    },
    {
        "params": {
            "M": 128,
            "N": 2048,
            "K": 32,
            "block_m": 32,
            "block_n": 128,
            "block_k": 32,
            "dtype_str": "fp16",
            "num_warps": 4
        },
        "ms": 0.0217,
        "min_ms": 0.0218,
        "max_ms": 0.0216,
        "GB/s": 12.84,
        "TFLOPS": 1.55
    },
    {
        "params": {
            "M": 128,
            "N": 2048,
            "K": 32,
            "block_m": 64,
            "block_n": 32,
            "block_k": 32,
            "dtype_str": "fp16",
            "num_warps": 4
        },
        "ms": 0.0307,
        "min_ms": 0.0308,
        "max_ms": 0.0305,
        "GB/s": 9.08,
        "TFLOPS": 1.09
    },
    {
        "params": {
            "M": 128,
            "N": 2048,
            "K": 32,
            "block_m": 64,
            "block_n": 64,
            "block_k": 32,
            "dtype_str": "fp16",
            "num_warps": 4
        },
        "ms": 0.0241,
        "min_ms": 0.0243,
        "max_ms": 0.024,
        "GB/s": 11.56,
        "TFLOPS": 1.39
    },
    {
        "params": {
            "M": 128,
            "N": 2048,
            "K": 32,
            "block_m": 64,
            "block_n": 128,
            "block_k": 32,
            "dtype_str": "fp16",
            "num_warps": 4
        },
        "ms": 0.022,
        "min_ms": 0.0221,
        "max_ms": 0.0218,
        "GB/s": 12.68,
        "TFLOPS": 1.53
    },
    {
        "params": {
            "M": 128,
            "N": 2048,
            "K": 32,
            "block_m": 128,
            "block_n": 32,
            "block_k": 32,
            "dtype_str": "fp16",
            "num_warps": 4
        },
        "ms": 0.0306,
        "min_ms": 0.0308,
        "max_ms": 0.0304,
        "GB/s": 9.09,
        "TFLOPS": 1.1
    },
    {
        "params": {
            "M": 128,
            "N": 2048,
            "K": 32,
            "block_m": 128,
            "block_n": 64,
            "block_k": 32,
            "dtype_str": "fp16",
            "num_warps": 4
        },
        "ms": 0.0243,
        "min_ms": 0.0245,
        "max_ms": 0.0242,
        "GB/s": 11.46,
        "TFLOPS": 1.38
    },
    {
        "params": {
            "M": 128,
            "N": 2048,
            "K": 32,
            "block_m": 128,
            "block_n": 128,
            "block_k": 32,
            "dtype_str": "fp16",
            "num_warps": 4
        },
        "ms": 0.0222,
        "min_ms": 0.0224,
        "max_ms": 0.0221,
        "GB/s": 12.56,
        "TFLOPS": 1.51
    },
    {
        "params": {
            "M": 128,
            "N": 4096,
            "K": 32,
            "block_m": 32,
            "block_n": 32,
            "block_k": 32,
            "dtype_str": "fp16",
            "num_warps": 4
        },
        "ms": 0.057,
        "min_ms": 0.0573,
        "max_ms": 0.0568,
        "GB/s": 9.48,
        "TFLOPS": 1.18
    },
    {
        "params": {
            "M": 128,
            "N": 4096,
            "K": 32,
            "block_m": 32,
            "block_n": 64,
            "block_k": 32,
            "dtype_str": "fp16",
            "num_warps": 4
        },
        "ms": 0.0433,
        "min_ms": 0.0435,
        "max_ms": 0.0432,
        "GB/s": 12.48,
        "TFLOPS": 1.55
    },
    {
        "params": {
            "M": 128,
            "N": 4096,
            "K": 32,
            "block_m": 32,
            "block_n": 128,
            "block_k": 32,
            "dtype_str": "fp16",
            "num_warps": 4
        },
        "ms": 0.0384,
        "min_ms": 0.0386,
        "max_ms": 0.0384,
        "GB/s": 14.06,
        "TFLOPS": 1.75
    },
    {
        "params": {
            "M": 128,
            "N": 4096,
            "K": 32,
            "block_m": 64,
            "block_n": 32,
            "block_k": 32,
            "dtype_str": "fp16",
            "num_warps": 4
        },
        "ms": 0.057,
        "min_ms": 0.0573,
        "max_ms": 0.0566,
        "GB/s": 9.49,
        "TFLOPS": 1.18
    },
    {
        "params": {
            "M": 128,
            "N": 4096,
            "K": 32,
            "block_m": 64,
            "block_n": 64,
            "block_k": 32,
            "dtype_str": "fp16",
            "num_warps": 4
        },
        "ms": 0.0433,
        "min_ms": 0.0435,
        "max_ms": 0.0432,
        "GB/s": 12.48,
        "TFLOPS": 1.55
    },
    {
        "params": {
            "M": 128,
            "N": 4096,
            "K": 32,
            "block_m": 64,
            "block_n": 128,
            "block_k": 32,
            "dtype_str": "fp16",
            "num_warps": 4
        },
        "ms": 0.0386,
        "min_ms": 0.0388,
        "max_ms": 0.0386,
        "GB/s": 13.99,
        "TFLOPS": 1.74
    },
    {
        "params": {
            "M": 128,
            "N": 4096,
            "K": 32,
            "block_m": 128,
            "block_n": 32,
            "block_k": 32,
            "dtype_str": "fp16",
            "num_warps": 4
        },
        "ms": 0.0567,
        "min_ms": 0.0571,
        "max_ms": 0.0563,
        "GB/s": 9.54,
        "TFLOPS": 1.18
    },
    {
        "params": {
            "M": 128,
            "N": 4096,
            "K": 32,
            "block_m": 128,
            "block_n": 64,
            "block_k": 32,
            "dtype_str": "fp16",
            "num_warps": 4
        },
        "ms": 0.0437,
        "min_ms": 0.0439,
        "max_ms": 0.0435,
        "GB/s": 12.36,
        "TFLOPS": 1.53
    },
    {
        "params": {
            "M": 128,
            "N": 4096,
            "K": 32,
            "block_m": 128,
            "block_n": 128,
            "block_k": 32,
            "dtype_str": "fp16",
            "num_warps": 4
        },
        "ms": 0.0391,
        "min_ms": 0.0392,
        "max_ms": 0.039,
        "GB/s": 13.83,
        "TFLOPS": 1.72
    },
    {
        "params": {
            "M": 256,
            "N": 128,
            "K": 32,
            "block_m": 32,
            "block_n": 32,
            "block_k": 32,
            "dtype_str": "fp16",
            "num_warps": 4
        },
        "ms": 0.0072,
        "min_ms": 0.0075,
        "max_ms": 0.0068,
        "GB/s": 6.85,
        "TFLOPS": 0.58
    },
    {
        "params": {
            "M": 256,
            "N": 128,
            "K": 32,
            "block_m": 32,
            "block_n": 64,
            "block_k": 32,
            "dtype_str": "fp16",
            "num_warps": 4
        },
        "ms": 0.0071,
        "min_ms": 0.0075,
        "max_ms": 0.0067,
        "GB/s": 6.93,
        "TFLOPS": 0.59
    },
    {
        "params": {
            "M": 256,
            "N": 128,
            "K": 32,
            "block_m": 32,
            "block_n": 128,
            "block_k": 32,
            "dtype_str": "fp16",
            "num_warps": 4
        },
        "ms": 0.0071,
        "min_ms": 0.0075,
        "max_ms": 0.0067,
        "GB/s": 6.93,
        "TFLOPS": 0.59
    },
    {
        "params": {
            "M": 256,
            "N": 128,
            "K": 32,
            "block_m": 64,
            "block_n": 32,
            "block_k": 32,
            "dtype_str": "fp16",
            "num_warps": 4
        },
        "ms": 0.0073,
        "min_ms": 0.0077,
        "max_ms": 0.0069,
        "GB/s": 6.74,
        "TFLOPS": 0.57
    },
    {
        "params": {
            "M": 256,
            "N": 128,
            "K": 32,
            "block_m": 64,
            "block_n": 64,
            "block_k": 32,
            "dtype_str": "fp16",
            "num_warps": 4
        },
        "ms": 0.0072,
        "min_ms": 0.0077,
        "max_ms": 0.0068,
        "GB/s": 6.81,
        "TFLOPS": 0.58
    },
    {
        "params": {
            "M": 256,
            "N": 128,
            "K": 32,
            "block_m": 64,
            "block_n": 128,
            "block_k": 32,
            "dtype_str": "fp16",
            "num_warps": 4
        },
        "ms": 0.0073,
        "min_ms": 0.0077,
        "max_ms": 0.0069,
        "GB/s": 6.74,
        "TFLOPS": 0.57
    },
    {
        "params": {
            "M": 256,
            "N": 128,
            "K": 32,
            "block_m": 128,
            "block_n": 32,
            "block_k": 32,
            "dtype_str": "fp16",
            "num_warps": 4
        },
        "ms": 0.0072,
        "min_ms": 0.0076,
        "max_ms": 0.0068,
        "GB/s": 6.85,
        "TFLOPS": 0.58
    },
    {
        "params": {
            "M": 256,
            "N": 128,
            "K": 32,
            "block_m": 128,
            "block_n": 64,
            "block_k": 32,
            "dtype_str": "fp16",
            "num_warps": 4
        },
        "ms": 0.0072,
        "min_ms": 0.0076,
        "max_ms": 0.0068,
        "GB/s": 6.85,
        "TFLOPS": 0.58
    },
    {
        "params": {
            "M": 256,
            "N": 128,
            "K": 32,
            "block_m": 128,
            "block_n": 128,
            "block_k": 32,
            "dtype_str": "fp16",
            "num_warps": 4
        },
        "ms": 0.0072,
        "min_ms": 0.0075,
        "max_ms": 0.0068,
        "GB/s": 6.85,
        "TFLOPS": 0.58
    },
    {
        "params": {
            "M": 256,
            "N": 256,
            "K": 32,
            "block_m": 32,
            "block_n": 32,
            "block_k": 32,
            "dtype_str": "fp16",
            "num_warps": 4
        },
        "ms": 0.0079,
        "min_ms": 0.0081,
        "max_ms": 0.0079,
        "GB/s": 8.25,
        "TFLOPS": 1.06
    },
    {
        "params": {
            "M": 256,
            "N": 256,
            "K": 32,
            "block_m": 32,
            "block_n": 64,
            "block_k": 32,
            "dtype_str": "fp16",
            "num_warps": 4
        },
        "ms": 0.0073,
        "min_ms": 0.0077,
        "max_ms": 0.0071,
        "GB/s": 9.03,
        "TFLOPS": 1.16
    },
    {
        "params": {
            "M": 256,
            "N": 256,
            "K": 32,
            "block_m": 32,
            "block_n": 128,
            "block_k": 32,
            "dtype_str": "fp16",
            "num_warps": 4
        },
        "ms": 0.0072,
        "min_ms": 0.0076,
        "max_ms": 0.0071,
        "GB/s": 9.08,
        "TFLOPS": 1.16
    },
    {
        "params": {
            "M": 256,
            "N": 256,
            "K": 32,
            "block_m": 64,
            "block_n": 32,
            "block_k": 32,
            "dtype_str": "fp16",
            "num_warps": 4
        },
        "ms": 0.008,
        "min_ms": 0.0081,
        "max_ms": 0.0079,
        "GB/s": 8.17,
        "TFLOPS": 1.05
    },
    {
        "params": {
            "M": 256,
            "N": 256,
            "K": 32,
            "block_m": 64,
            "block_n": 64,
            "block_k": 32,
            "dtype_str": "fp16",
            "num_warps": 4
        },
        "ms": 0.0073,
        "min_ms": 0.0077,
        "max_ms": 0.0072,
        "GB/s": 8.93,
        "TFLOPS": 1.14
    },
    {
        "params": {
            "M": 256,
            "N": 256,
            "K": 32,
            "block_m": 64,
            "block_n": 128,
            "block_k": 32,
            "dtype_str": "fp16",
            "num_warps": 4
        },
        "ms": 0.0075,
        "min_ms": 0.0078,
        "max_ms": 0.0073,
        "GB/s": 8.79,
        "TFLOPS": 1.12
    },
    {
        "params": {
            "M": 256,
            "N": 256,
            "K": 32,
            "block_m": 128,
            "block_n": 32,
            "block_k": 32,
            "dtype_str": "fp16",
            "num_warps": 4
        },
        "ms": 0.0081,
        "min_ms": 0.0083,
        "max_ms": 0.008,
        "GB/s": 8.09,
        "TFLOPS": 1.04
    },
    {
        "params": {
            "M": 256,
            "N": 256,
            "K": 32,
            "block_m": 128,
            "block_n": 64,
            "block_k": 32,
            "dtype_str": "fp16",
            "num_warps": 4
        },
        "ms": 0.0074,
        "min_ms": 0.0077,
        "max_ms": 0.0073,
        "GB/s": 8.84,
        "TFLOPS": 1.13
    },
    {
        "params": {
            "M": 256,
            "N": 256,
            "K": 32,
            "block_m": 128,
            "block_n": 128,
            "block_k": 32,
            "dtype_str": "fp16",
            "num_warps": 4
        },
        "ms": 0.0074,
        "min_ms": 0.0077,
        "max_ms": 0.0073,
        "GB/s": 8.84,
        "TFLOPS": 1.13
    },
    {
        "params": {
            "M": 256,
            "N": 512,
            "K": 32,
            "block_m": 32,
            "block_n": 32,
            "block_k": 32,
            "dtype_str": "fp16",
            "num_warps": 4
        },
        "ms": 0.0112,
        "min_ms": 0.0113,
        "max_ms": 0.0111,
        "GB/s": 8.79,
        "TFLOPS": 1.5
    },
    {
        "params": {
            "M": 256,
            "N": 512,
            "K": 32,
            "block_m": 32,
            "block_n": 64,
            "block_k": 32,
            "dtype_str": "fp16",
            "num_warps": 4
        },
        "ms": 0.0096,
        "min_ms": 0.0098,
        "max_ms": 0.0095,
        "GB/s": 10.22,
        "TFLOPS": 1.74
    },
    {
        "params": {
            "M": 256,
            "N": 512,
            "K": 32,
            "block_m": 32,
            "block_n": 128,
            "block_k": 32,
            "dtype_str": "fp16",
            "num_warps": 4
        },
        "ms": 0.0092,
        "min_ms": 0.0095,
        "max_ms": 0.0091,
        "GB/s": 10.71,
        "TFLOPS": 1.83
    },
    {
        "params": {
            "M": 256,
            "N": 512,
            "K": 32,
            "block_m": 64,
            "block_n": 32,
            "block_k": 32,
            "dtype_str": "fp16",
            "num_warps": 4
        },
        "ms": 0.0112,
        "min_ms": 0.0113,
        "max_ms": 0.0111,
        "GB/s": 8.79,
        "TFLOPS": 1.5
    },
    {
        "params": {
            "M": 256,
            "N": 512,
            "K": 32,
            "block_m": 64,
            "block_n": 64,
            "block_k": 32,
            "dtype_str": "fp16",
            "num_warps": 4
        },
        "ms": 0.0097,
        "min_ms": 0.0097,
        "max_ms": 0.0095,
        "GB/s": 10.17,
        "TFLOPS": 1.74
    },
    {
        "params": {
            "M": 256,
            "N": 512,
            "K": 32,
            "block_m": 64,
            "block_n": 128,
            "block_k": 32,
            "dtype_str": "fp16",
            "num_warps": 4
        },
        "ms": 0.0095,
        "min_ms": 0.0096,
        "max_ms": 0.0094,
        "GB/s": 10.39,
        "TFLOPS": 1.77
    },
    {
        "params": {
            "M": 256,
            "N": 512,
            "K": 32,
            "block_m": 128,
            "block_n": 32,
            "block_k": 32,
            "dtype_str": "fp16",
            "num_warps": 4
        },
        "ms": 0.0112,
        "min_ms": 0.0114,
        "max_ms": 0.0111,
        "GB/s": 8.76,
        "TFLOPS": 1.49
    },
    {
        "params": {
            "M": 256,
            "N": 512,
            "K": 32,
            "block_m": 128,
            "block_n": 64,
            "block_k": 32,
            "dtype_str": "fp16",
            "num_warps": 4
        },
        "ms": 0.0097,
        "min_ms": 0.0099,
        "max_ms": 0.0097,
        "GB/s": 10.09,
        "TFLOPS": 1.72
    },
    {
        "params": {
            "M": 256,
            "N": 512,
            "K": 32,
            "block_m": 128,
            "block_n": 128,
            "block_k": 32,
            "dtype_str": "fp16",
            "num_warps": 4
        },
        "ms": 0.0095,
        "min_ms": 0.0096,
        "max_ms": 0.0093,
        "GB/s": 10.39,
        "TFLOPS": 1.77
    },
    {
        "params": {
            "M": 256,
            "N": 1024,
            "K": 32,
            "block_m": 32,
            "block_n": 32,
            "block_k": 32,
            "dtype_str": "fp16",
            "num_warps": 4
        },
        "ms": 0.0178,
        "min_ms": 0.018,
        "max_ms": 0.0177,
        "GB/s": 9.2,
        "TFLOPS": 1.88
    },
    {
        "params": {
            "M": 256,
            "N": 1024,
            "K": 32,
            "block_m": 32,
            "block_n": 64,
            "block_k": 32,
            "dtype_str": "fp16",
            "num_warps": 4
        },
        "ms": 0.0146,
        "min_ms": 0.0147,
        "max_ms": 0.0145,
        "GB/s": 11.26,
        "TFLOPS": 2.31
    },
    {
        "params": {
            "M": 256,
            "N": 1024,
            "K": 32,
            "block_m": 32,
            "block_n": 128,
            "block_k": 32,
            "dtype_str": "fp16",
            "num_warps": 4
        },
        "ms": 0.0134,
        "min_ms": 0.0136,
        "max_ms": 0.0133,
        "GB/s": 12.2,
        "TFLOPS": 2.5
    },
    {
        "params": {
            "M": 256,
            "N": 1024,
            "K": 32,
            "block_m": 64,
            "block_n": 32,
            "block_k": 32,
            "dtype_str": "fp16",
            "num_warps": 4
        },
        "ms": 0.0178,
        "min_ms": 0.0179,
        "max_ms": 0.0177,
        "GB/s": 9.22,
        "TFLOPS": 1.89
    },
    {
        "params": {
            "M": 256,
            "N": 1024,
            "K": 32,
            "block_m": 64,
            "block_n": 64,
            "block_k": 32,
            "dtype_str": "fp16",
            "num_warps": 4
        },
        "ms": 0.0145,
        "min_ms": 0.0146,
        "max_ms": 0.0144,
        "GB/s": 11.29,
        "TFLOPS": 2.31
    },
    {
        "params": {
            "M": 256,
            "N": 1024,
            "K": 32,
            "block_m": 64,
            "block_n": 128,
            "block_k": 32,
            "dtype_str": "fp16",
            "num_warps": 4
        },
        "ms": 0.0137,
        "min_ms": 0.0138,
        "max_ms": 0.0136,
        "GB/s": 11.98,
        "TFLOPS": 2.45
    },
    {
        "params": {
            "M": 256,
            "N": 1024,
            "K": 32,
            "block_m": 128,
            "block_n": 32,
            "block_k": 32,
            "dtype_str": "fp16",
            "num_warps": 4
        },
        "ms": 0.0178,
        "min_ms": 0.0179,
        "max_ms": 0.0176,
        "GB/s": 9.2,
        "TFLOPS": 1.89
    },
    {
        "params": {
            "M": 256,
            "N": 1024,
            "K": 32,
            "block_m": 128,
            "block_n": 64,
            "block_k": 32,
            "dtype_str": "fp16",
            "num_warps": 4
        },
        "ms": 0.0146,
        "min_ms": 0.0148,
        "max_ms": 0.0145,
        "GB/s": 11.2,
        "TFLOPS": 2.29
    },
    {
        "params": {
            "M": 256,
            "N": 1024,
            "K": 32,
            "block_m": 128,
            "block_n": 128,
            "block_k": 32,
            "dtype_str": "fp16",
            "num_warps": 4
        },
        "ms": 0.0137,
        "min_ms": 0.0139,
        "max_ms": 0.0136,
        "GB/s": 11.95,
        "TFLOPS": 2.45
    },
    {
        "params": {
            "M": 256,
            "N": 2048,
            "K": 32,
            "block_m": 32,
            "block_n": 32,
            "block_k": 32,
            "dtype_str": "fp16",
            "num_warps": 4
        },
        "ms": 0.031,
        "min_ms": 0.0311,
        "max_ms": 0.0308,
        "GB/s": 9.53,
        "TFLOPS": 2.17
    },
    {
        "params": {
            "M": 256,
            "N": 2048,
            "K": 32,
            "block_m": 32,
            "block_n": 64,
            "block_k": 32,
            "dtype_str": "fp16",
            "num_warps": 4
        },
        "ms": 0.0243,
        "min_ms": 0.0245,
        "max_ms": 0.0242,
        "GB/s": 12.14,
        "TFLOPS": 2.76
    },
    {
        "params": {
            "M": 256,
            "N": 2048,
            "K": 32,
            "block_m": 32,
            "block_n": 128,
            "block_k": 32,
            "dtype_str": "fp16",
            "num_warps": 4
        },
        "ms": 0.0218,
        "min_ms": 0.0219,
        "max_ms": 0.0217,
        "GB/s": 13.52,
        "TFLOPS": 3.08
    },
    {
        "params": {
            "M": 256,
            "N": 2048,
            "K": 32,
            "block_m": 64,
            "block_n": 32,
            "block_k": 32,
            "dtype_str": "fp16",
            "num_warps": 4
        },
        "ms": 0.0308,
        "min_ms": 0.031,
        "max_ms": 0.0307,
        "GB/s": 9.57,
        "TFLOPS": 2.18
    },
    {
        "params": {
            "M": 256,
            "N": 2048,
            "K": 32,
            "block_m": 64,
            "block_n": 64,
            "block_k": 32,
            "dtype_str": "fp16",
            "num_warps": 4
        },
        "ms": 0.0242,
        "min_ms": 0.0243,
        "max_ms": 0.0241,
        "GB/s": 12.18,
        "TFLOPS": 2.77
    },
    {
        "params": {
            "M": 256,
            "N": 2048,
            "K": 32,
            "block_m": 64,
            "block_n": 128,
            "block_k": 32,
            "dtype_str": "fp16",
            "num_warps": 4
        },
        "ms": 0.0221,
        "min_ms": 0.0223,
        "max_ms": 0.022,
        "GB/s": 13.35,
        "TFLOPS": 3.04
    },
    {
        "params": {
            "M": 256,
            "N": 2048,
            "K": 32,
            "block_m": 128,
            "block_n": 32,
            "block_k": 32,
            "dtype_str": "fp16",
            "num_warps": 4
        },
        "ms": 0.0308,
        "min_ms": 0.0309,
        "max_ms": 0.0306,
        "GB/s": 9.59,
        "TFLOPS": 2.18
    },
    {
        "params": {
            "M": 256,
            "N": 2048,
            "K": 32,
            "block_m": 128,
            "block_n": 64,
            "block_k": 32,
            "dtype_str": "fp16",
            "num_warps": 4
        },
        "ms": 0.0243,
        "min_ms": 0.0245,
        "max_ms": 0.0243,
        "GB/s": 12.12,
        "TFLOPS": 2.76
    },
    {
        "params": {
            "M": 256,
            "N": 2048,
            "K": 32,
            "block_m": 128,
            "block_n": 128,
            "block_k": 32,
            "dtype_str": "fp16",
            "num_warps": 4
        },
        "ms": 0.0223,
        "min_ms": 0.0227,
        "max_ms": 0.0221,
        "GB/s": 13.25,
        "TFLOPS": 3.02
    },
    {
        "params": {
            "M": 256,
            "N": 4096,
            "K": 32,
            "block_m": 32,
            "block_n": 32,
            "block_k": 32,
            "dtype_str": "fp16",
            "num_warps": 4
        },
        "ms": 0.0575,
        "min_ms": 0.0577,
        "max_ms": 0.0573,
        "GB/s": 9.7,
        "TFLOPS": 2.34
    },
    {
        "params": {
            "M": 256,
            "N": 4096,
            "K": 32,
            "block_m": 32,
            "block_n": 64,
            "block_k": 32,
            "dtype_str": "fp16",
            "num_warps": 4
        },
        "ms": 0.0437,
        "min_ms": 0.0439,
        "max_ms": 0.0436,
        "GB/s": 12.74,
        "TFLOPS": 3.07
    },
    {
        "params": {
            "M": 256,
            "N": 4096,
            "K": 32,
            "block_m": 32,
            "block_n": 128,
            "block_k": 32,
            "dtype_str": "fp16",
            "num_warps": 4
        },
        "ms": 0.0386,
        "min_ms": 0.0387,
        "max_ms": 0.0385,
        "GB/s": 14.43,
        "TFLOPS": 3.48
    },
    {
        "params": {
            "M": 256,
            "N": 4096,
            "K": 32,
            "block_m": 64,
            "block_n": 32,
            "block_k": 32,
            "dtype_str": "fp16",
            "num_warps": 4
        },
        "ms": 0.0573,
        "min_ms": 0.0575,
        "max_ms": 0.057,
        "GB/s": 9.73,
        "TFLOPS": 2.34
    },
    {
        "params": {
            "M": 256,
            "N": 4096,
            "K": 32,
            "block_m": 64,
            "block_n": 64,
            "block_k": 32,
            "dtype_str": "fp16",
            "num_warps": 4
        },
        "ms": 0.0435,
        "min_ms": 0.0437,
        "max_ms": 0.0434,
        "GB/s": 12.79,
        "TFLOPS": 3.08
    },
    {
        "params": {
            "M": 256,
            "N": 4096,
            "K": 32,
            "block_m": 64,
            "block_n": 128,
            "block_k": 32,
            "dtype_str": "fp16",
            "num_warps": 4
        },
        "ms": 0.0388,
        "min_ms": 0.039,
        "max_ms": 0.0387,
        "GB/s": 14.34,
        "TFLOPS": 3.45
    },
    {
        "params": {
            "M": 256,
            "N": 4096,
            "K": 32,
            "block_m": 128,
            "block_n": 32,
            "block_k": 32,
            "dtype_str": "fp16",
            "num_warps": 4
        },
        "ms": 0.0569,
        "min_ms": 0.0571,
        "max_ms": 0.0565,
        "GB/s": 9.8,
        "TFLOPS": 2.36
    },
    {
        "params": {
            "M": 256,
            "N": 4096,
            "K": 32,
            "block_m": 128,
            "block_n": 64,
            "block_k": 32,
            "dtype_str": "fp16",
            "num_warps": 4
        },
        "ms": 0.0437,
        "min_ms": 0.0438,
        "max_ms": 0.0435,
        "GB/s": 12.76,
        "TFLOPS": 3.07
    },
    {
        "params": {
            "M": 256,
            "N": 4096,
            "K": 32,
            "block_m": 128,
            "block_n": 128,
            "block_k": 32,
            "dtype_str": "fp16",
            "num_warps": 4
        },
        "ms": 0.0392,
        "min_ms": 0.0393,
        "max_ms": 0.0391,
        "GB/s": 14.22,
        "TFLOPS": 3.43
    },
    {
        "params": {
            "M": 512,
            "N": 128,
            "K": 32,
            "block_m": 32,
            "block_n": 32,
            "block_k": 32,
            "dtype_str": "fp16",
            "num_warps": 4
        },
        "ms": 0.0072,
        "min_ms": 0.0077,
        "max_ms": 0.0069,
        "GB/s": 11.35,
        "TFLOPS": 1.16
    },
    {
        "params": {
            "M": 512,
            "N": 128,
            "K": 32,
            "block_m": 32,
            "block_n": 64,
            "block_k": 32,
            "dtype_str": "fp16",
            "num_warps": 4
        },
        "ms": 0.0072,
        "min_ms": 0.0075,
        "max_ms": 0.0068,
        "GB/s": 11.42,
        "TFLOPS": 1.17
    },
    {
        "params": {
            "M": 512,
            "N": 128,
            "K": 32,
            "block_m": 32,
            "block_n": 128,
            "block_k": 32,
            "dtype_str": "fp16",
            "num_warps": 4
        },
        "ms": 0.0071,
        "min_ms": 0.0076,
        "max_ms": 0.0068,
        "GB/s": 11.48,
        "TFLOPS": 1.18
    },
    {
        "params": {
            "M": 512,
            "N": 128,
            "K": 32,
            "block_m": 64,
            "block_n": 32,
            "block_k": 32,
            "dtype_str": "fp16",
            "num_warps": 4
        },
        "ms": 0.0073,
        "min_ms": 0.0077,
        "max_ms": 0.0069,
        "GB/s": 11.29,
        "TFLOPS": 1.16
    },
    {
        "params": {
            "M": 512,
            "N": 128,
            "K": 32,
            "block_m": 64,
            "block_n": 64,
            "block_k": 32,
            "dtype_str": "fp16",
            "num_warps": 4
        },
        "ms": 0.0073,
        "min_ms": 0.0076,
        "max_ms": 0.0069,
        "GB/s": 11.29,
        "TFLOPS": 1.16
    },
    {
        "params": {
            "M": 512,
            "N": 128,
            "K": 32,
            "block_m": 64,
            "block_n": 128,
            "block_k": 32,
            "dtype_str": "fp16",
            "num_warps": 4
        },
        "ms": 0.0073,
        "min_ms": 0.0076,
        "max_ms": 0.0069,
        "GB/s": 11.29,
        "TFLOPS": 1.16
    },
    {
        "params": {
            "M": 512,
            "N": 128,
            "K": 32,
            "block_m": 128,
            "block_n": 32,
            "block_k": 32,
            "dtype_str": "fp16",
            "num_warps": 4
        },
        "ms": 0.0072,
        "min_ms": 0.0076,
        "max_ms": 0.0069,
        "GB/s": 11.35,
        "TFLOPS": 1.16
    },
    {
        "params": {
            "M": 512,
            "N": 128,
            "K": 32,
            "block_m": 128,
            "block_n": 64,
            "block_k": 32,
            "dtype_str": "fp16",
            "num_warps": 4
        },
        "ms": 0.0072,
        "min_ms": 0.0076,
        "max_ms": 0.0068,
        "GB/s": 11.41,
        "TFLOPS": 1.17
    },
    {
        "params": {
            "M": 512,
            "N": 128,
            "K": 32,
            "block_m": 128,
            "block_n": 128,
            "block_k": 32,
            "dtype_str": "fp16",
            "num_warps": 4
        },
        "ms": 0.0072,
        "min_ms": 0.0076,
        "max_ms": 0.0067,
        "GB/s": 11.42,
        "TFLOPS": 1.17
    },
    {
        "params": {
            "M": 512,
            "N": 256,
            "K": 32,
            "block_m": 32,
            "block_n": 32,
            "block_k": 32,
            "dtype_str": "fp16",
            "num_warps": 4
        },
        "ms": 0.0079,
        "min_ms": 0.0081,
        "max_ms": 0.0078,
        "GB/s": 12.38,
        "TFLOPS": 2.11
    },
    {
        "params": {
            "M": 512,
            "N": 256,
            "K": 32,
            "block_m": 32,
            "block_n": 64,
            "block_k": 32,
            "dtype_str": "fp16",
            "num_warps": 4
        },
        "ms": 0.0072,
        "min_ms": 0.0075,
        "max_ms": 0.0071,
        "GB/s": 13.62,
        "TFLOPS": 2.33
    },
    {
        "params": {
            "M": 512,
            "N": 256,
            "K": 32,
            "block_m": 32,
            "block_n": 128,
            "block_k": 32,
            "dtype_str": "fp16",
            "num_warps": 4
        },
        "ms": 0.0072,
        "min_ms": 0.0076,
        "max_ms": 0.0071,
        "GB/s": 13.7,
        "TFLOPS": 2.34
    },
    {
        "params": {
            "M": 512,
            "N": 256,
            "K": 32,
            "block_m": 64,
            "block_n": 32,
            "block_k": 32,
            "dtype_str": "fp16",
            "num_warps": 4
        },
        "ms": 0.0081,
        "min_ms": 0.0082,
        "max_ms": 0.008,
        "GB/s": 12.2,
        "TFLOPS": 2.08
    },
    {
        "params": {
            "M": 512,
            "N": 256,
            "K": 32,
            "block_m": 64,
            "block_n": 64,
            "block_k": 32,
            "dtype_str": "fp16",
            "num_warps": 4
        },
        "ms": 0.0074,
        "min_ms": 0.0078,
        "max_ms": 0.0072,
        "GB/s": 13.33,
        "TFLOPS": 2.27
    },
    {
        "params": {
            "M": 512,
            "N": 256,
            "K": 32,
            "block_m": 64,
            "block_n": 128,
            "block_k": 32,
            "dtype_str": "fp16",
            "num_warps": 4
        },
        "ms": 0.0075,
        "min_ms": 0.0078,
        "max_ms": 0.0073,
        "GB/s": 13.18,
        "TFLOPS": 2.25
    },
    {
        "params": {
            "M": 512,
            "N": 256,
            "K": 32,
            "block_m": 128,
            "block_n": 32,
            "block_k": 32,
            "dtype_str": "fp16",
            "num_warps": 4
        },
        "ms": 0.0081,
        "min_ms": 0.0083,
        "max_ms": 0.008,
        "GB/s": 12.2,
        "TFLOPS": 2.08
    },
    {
        "params": {
            "M": 512,
            "N": 256,
            "K": 32,
            "block_m": 128,
            "block_n": 64,
            "block_k": 32,
            "dtype_str": "fp16",
            "num_warps": 4
        },
        "ms": 0.0073,
        "min_ms": 0.0077,
        "max_ms": 0.0073,
        "GB/s": 13.4,
        "TFLOPS": 2.29
    },
    {
        "params": {
            "M": 512,
            "N": 256,
            "K": 32,
            "block_m": 128,
            "block_n": 128,
            "block_k": 32,
            "dtype_str": "fp16",
            "num_warps": 4
        },
        "ms": 0.0074,
        "min_ms": 0.0077,
        "max_ms": 0.0073,
        "GB/s": 13.25,
        "TFLOPS": 2.26
    },
    {
        "params": {
            "M": 512,
            "N": 512,
            "K": 32,
            "block_m": 32,
            "block_n": 32,
            "block_k": 32,
            "dtype_str": "fp16",
            "num_warps": 4
        },
        "ms": 0.0111,
        "min_ms": 0.0113,
        "max_ms": 0.0111,
        "GB/s": 11.76,
        "TFLOPS": 3.01
    },
    {
        "params": {
            "M": 512,
            "N": 512,
            "K": 32,
            "block_m": 32,
            "block_n": 64,
            "block_k": 32,
            "dtype_str": "fp16",
            "num_warps": 4
        },
        "ms": 0.0096,
        "min_ms": 0.0099,
        "max_ms": 0.0095,
        "GB/s": 13.62,
        "TFLOPS": 3.49
    },
    {
        "params": {
            "M": 512,
            "N": 512,
            "K": 32,
            "block_m": 32,
            "block_n": 128,
            "block_k": 32,
            "dtype_str": "fp16",
            "num_warps": 4
        },
        "ms": 0.0092,
        "min_ms": 0.0094,
        "max_ms": 0.0091,
        "GB/s": 14.21,
        "TFLOPS": 3.64
    },
    {
        "params": {
            "M": 512,
            "N": 512,
            "K": 32,
            "block_m": 64,
            "block_n": 32,
            "block_k": 32,
            "dtype_str": "fp16",
            "num_warps": 4
        },
        "ms": 0.0113,
        "min_ms": 0.0115,
        "max_ms": 0.0112,
        "GB/s": 11.59,
        "TFLOPS": 2.97
    },
    {
        "params": {
            "M": 512,
            "N": 512,
            "K": 32,
            "block_m": 64,
            "block_n": 64,
            "block_k": 32,
            "dtype_str": "fp16",
            "num_warps": 4
        },
        "ms": 0.0097,
        "min_ms": 0.0099,
        "max_ms": 0.0096,
        "GB/s": 13.45,
        "TFLOPS": 3.44
    },
    {
        "params": {
            "M": 512,
            "N": 512,
            "K": 32,
            "block_m": 64,
            "block_n": 128,
            "block_k": 32,
            "dtype_str": "fp16",
            "num_warps": 4
        },
        "ms": 0.0095,
        "min_ms": 0.0098,
        "max_ms": 0.0095,
        "GB/s": 13.74,
        "TFLOPS": 3.52
    },
    {
        "params": {
            "M": 512,
            "N": 512,
            "K": 32,
            "block_m": 128,
            "block_n": 32,
            "block_k": 32,
            "dtype_str": "fp16",
            "num_warps": 4
        },
        "ms": 0.0113,
        "min_ms": 0.0114,
        "max_ms": 0.0112,
        "GB/s": 11.63,
        "TFLOPS": 2.98
    },
    {
        "params": {
            "M": 512,
            "N": 512,
            "K": 32,
            "block_m": 128,
            "block_n": 64,
            "block_k": 32,
            "dtype_str": "fp16",
            "num_warps": 4
        },
        "ms": 0.0098,
        "min_ms": 0.0099,
        "max_ms": 0.0097,
        "GB/s": 13.4,
        "TFLOPS": 3.43
    },
    {
        "params": {
            "M": 512,
            "N": 512,
            "K": 32,
            "block_m": 128,
            "block_n": 128,
            "block_k": 32,
            "dtype_str": "fp16",
            "num_warps": 4
        },
        "ms": 0.0095,
        "min_ms": 0.0097,
        "max_ms": 0.0094,
        "GB/s": 13.79,
        "TFLOPS": 3.53
    },
    {
        "params": {
            "M": 512,
            "N": 1024,
            "K": 32,
            "block_m": 32,
            "block_n": 32,
            "block_k": 32,
            "dtype_str": "fp16",
            "num_warps": 4
        },
        "ms": 0.0178,
        "min_ms": 0.018,
        "max_ms": 0.0177,
        "GB/s": 11.07,
        "TFLOPS": 3.78
    },
    {
        "params": {
            "M": 512,
            "N": 1024,
            "K": 32,
            "block_m": 32,
            "block_n": 64,
            "block_k": 32,
            "dtype_str": "fp16",
            "num_warps": 4
        },
        "ms": 0.0146,
        "min_ms": 0.0147,
        "max_ms": 0.0145,
        "GB/s": 13.51,
        "TFLOPS": 4.61
    },
    {
        "params": {
            "M": 512,
            "N": 1024,
            "K": 32,
            "block_m": 32,
            "block_n": 128,
            "block_k": 32,
            "dtype_str": "fp16",
            "num_warps": 4
        },
        "ms": 0.0135,
        "min_ms": 0.0136,
        "max_ms": 0.0134,
        "GB/s": 14.59,
        "TFLOPS": 4.98
    },
    {
        "params": {
            "M": 512,
            "N": 1024,
            "K": 32,
            "block_m": 64,
            "block_n": 32,
            "block_k": 32,
            "dtype_str": "fp16",
            "num_warps": 4
        },
        "ms": 0.018,
        "min_ms": 0.0181,
        "max_ms": 0.0178,
        "GB/s": 10.95,
        "TFLOPS": 3.74
    },
    {
        "params": {
            "M": 512,
            "N": 1024,
            "K": 32,
            "block_m": 64,
            "block_n": 64,
            "block_k": 32,
            "dtype_str": "fp16",
            "num_warps": 4
        },
        "ms": 0.0146,
        "min_ms": 0.0148,
        "max_ms": 0.0145,
        "GB/s": 13.44,
        "TFLOPS": 4.59
    },
    {
        "params": {
            "M": 512,
            "N": 1024,
            "K": 32,
            "block_m": 64,
            "block_n": 128,
            "block_k": 32,
            "dtype_str": "fp16",
            "num_warps": 4
        },
        "ms": 0.0138,
        "min_ms": 0.014,
        "max_ms": 0.0137,
        "GB/s": 14.3,
        "TFLOPS": 4.88
    },
    {
        "params": {
            "M": 512,
            "N": 1024,
            "K": 32,
            "block_m": 128,
            "block_n": 32,
            "block_k": 32,
            "dtype_str": "fp16",
            "num_warps": 4
        },
        "ms": 0.0178,
        "min_ms": 0.018,
        "max_ms": 0.0177,
        "GB/s": 11.02,
        "TFLOPS": 3.76
    },
    {
        "params": {
            "M": 512,
            "N": 1024,
            "K": 32,
            "block_m": 128,
            "block_n": 64,
            "block_k": 32,
            "dtype_str": "fp16",
            "num_warps": 4
        },
        "ms": 0.0147,
        "min_ms": 0.0148,
        "max_ms": 0.0146,
        "GB/s": 13.4,
        "TFLOPS": 4.57
    },
    {
        "params": {
            "M": 512,
            "N": 1024,
            "K": 32,
            "block_m": 128,
            "block_n": 128,
            "block_k": 32,
            "dtype_str": "fp16",
            "num_warps": 4
        },
        "ms": 0.0138,
        "min_ms": 0.0139,
        "max_ms": 0.0137,
        "GB/s": 14.3,
        "TFLOPS": 4.88
    },
    {
        "params": {
            "M": 512,
            "N": 2048,
            "K": 32,
            "block_m": 32,
            "block_n": 32,
            "block_k": 32,
            "dtype_str": "fp16",
            "num_warps": 4
        },
        "ms": 0.0309,
        "min_ms": 0.031,
        "max_ms": 0.0308,
        "GB/s": 10.61,
        "TFLOPS": 4.35
    },
    {
        "params": {
            "M": 512,
            "N": 2048,
            "K": 32,
            "block_m": 32,
            "block_n": 64,
            "block_k": 32,
            "dtype_str": "fp16",
            "num_warps": 4
        },
        "ms": 0.0243,
        "min_ms": 0.0245,
        "max_ms": 0.0242,
        "GB/s": 13.49,
        "TFLOPS": 5.52
    },
    {
        "params": {
            "M": 512,
            "N": 2048,
            "K": 32,
            "block_m": 32,
            "block_n": 128,
            "block_k": 32,
            "dtype_str": "fp16",
            "num_warps": 4
        },
        "ms": 0.0218,
        "min_ms": 0.0219,
        "max_ms": 0.0218,
        "GB/s": 15.02,
        "TFLOPS": 6.15
    },
    {
        "params": {
            "M": 512,
            "N": 2048,
            "K": 32,
            "block_m": 64,
            "block_n": 32,
            "block_k": 32,
            "dtype_str": "fp16",
            "num_warps": 4
        },
        "ms": 0.0311,
        "min_ms": 0.0312,
        "max_ms": 0.031,
        "GB/s": 10.53,
        "TFLOPS": 4.31
    },
    {
        "params": {
            "M": 512,
            "N": 2048,
            "K": 32,
            "block_m": 64,
            "block_n": 64,
            "block_k": 32,
            "dtype_str": "fp16",
            "num_warps": 4
        },
        "ms": 0.0244,
        "min_ms": 0.0246,
        "max_ms": 0.0243,
        "GB/s": 13.44,
        "TFLOPS": 5.51
    },
    {
        "params": {
            "M": 512,
            "N": 2048,
            "K": 32,
            "block_m": 64,
            "block_n": 128,
            "block_k": 32,
            "dtype_str": "fp16",
            "num_warps": 4
        },
        "ms": 0.0221,
        "min_ms": 0.0223,
        "max_ms": 0.0221,
        "GB/s": 14.81,
        "TFLOPS": 6.06
    },
    {
        "params": {
            "M": 512,
            "N": 2048,
            "K": 32,
            "block_m": 128,
            "block_n": 32,
            "block_k": 32,
            "dtype_str": "fp16",
            "num_warps": 4
        },
        "ms": 0.0308,
        "min_ms": 0.031,
        "max_ms": 0.0307,
        "GB/s": 10.63,
        "TFLOPS": 4.35
    },
    {
        "params": {
            "M": 512,
            "N": 2048,
            "K": 32,
            "block_m": 128,
            "block_n": 64,
            "block_k": 32,
            "dtype_str": "fp16",
            "num_warps": 4
        },
        "ms": 0.0244,
        "min_ms": 0.0245,
        "max_ms": 0.0243,
        "GB/s": 13.44,
        "TFLOPS": 5.51
    },
    {
        "params": {
            "M": 512,
            "N": 2048,
            "K": 32,
            "block_m": 128,
            "block_n": 128,
            "block_k": 32,
            "dtype_str": "fp16",
            "num_warps": 4
        },
        "ms": 0.0223,
        "min_ms": 0.0224,
        "max_ms": 0.0221,
        "GB/s": 14.73,
        "TFLOPS": 6.03
    },
    {
        "params": {
            "M": 512,
            "N": 4096,
            "K": 32,
            "block_m": 32,
            "block_n": 32,
            "block_k": 32,
            "dtype_str": "fp16",
            "num_warps": 4
        },
        "ms": 0.0574,
        "min_ms": 0.0576,
        "max_ms": 0.0571,
        "GB/s": 10.28,
        "TFLOPS": 4.68
    },
    {
        "params": {
            "M": 512,
            "N": 4096,
            "K": 32,
            "block_m": 32,
            "block_n": 64,
            "block_k": 32,
            "dtype_str": "fp16",
            "num_warps": 4
        },
        "ms": 0.0437,
        "min_ms": 0.0439,
        "max_ms": 0.0436,
        "GB/s": 13.48,
        "TFLOPS": 6.14
    },
    {
        "params": {
            "M": 512,
            "N": 4096,
            "K": 32,
            "block_m": 32,
            "block_n": 128,
            "block_k": 32,
            "dtype_str": "fp16",
            "num_warps": 4
        },
        "ms": 0.0386,
        "min_ms": 0.0388,
        "max_ms": 0.0386,
        "GB/s": 15.26,
        "TFLOPS": 6.95
    },
    {
        "params": {
            "M": 512,
            "N": 4096,
            "K": 32,
            "block_m": 64,
            "block_n": 32,
            "block_k": 32,
            "dtype_str": "fp16",
            "num_warps": 4
        },
        "ms": 0.0576,
        "min_ms": 0.0578,
        "max_ms": 0.0575,
        "GB/s": 10.24,
        "TFLOPS": 4.66
    },
    {
        "params": {
            "M": 512,
            "N": 4096,
            "K": 32,
            "block_m": 64,
            "block_n": 64,
            "block_k": 32,
            "dtype_str": "fp16",
            "num_warps": 4
        },
        "ms": 0.0438,
        "min_ms": 0.0439,
        "max_ms": 0.0437,
        "GB/s": 13.47,
        "TFLOPS": 6.13
    },
    {
        "params": {
            "M": 512,
            "N": 4096,
            "K": 32,
            "block_m": 64,
            "block_n": 128,
            "block_k": 32,
            "dtype_str": "fp16",
            "num_warps": 4
        },
        "ms": 0.0389,
        "min_ms": 0.0391,
        "max_ms": 0.0388,
        "GB/s": 15.17,
        "TFLOPS": 6.9
    },
    {
        "params": {
            "M": 512,
            "N": 4096,
            "K": 32,
            "block_m": 128,
            "block_n": 32,
            "block_k": 32,
            "dtype_str": "fp16",
            "num_warps": 4
        },
        "ms": 0.0571,
        "min_ms": 0.0573,
        "max_ms": 0.0568,
        "GB/s": 10.34,
        "TFLOPS": 4.71
    },
    {
        "params": {
            "M": 512,
            "N": 4096,
            "K": 32,
            "block_m": 128,
            "block_n": 64,
            "block_k": 32,
            "dtype_str": "fp16",
            "num_warps": 4
        },
        "ms": 0.0438,
        "min_ms": 0.0439,
        "max_ms": 0.0436,
        "GB/s": 13.48,
        "TFLOPS": 6.13
    },
    {
        "params": {
            "M": 512,
            "N": 4096,
            "K": 32,
            "block_m": 128,
            "block_n": 128,
            "block_k": 32,
            "dtype_str": "fp16",
            "num_warps": 4
        },
        "ms": 0.0391,
        "min_ms": 0.0393,
        "max_ms": 0.0391,
        "GB/s": 15.07,
        "TFLOPS": 6.86
    },
    {
        "params": {
            "M": 1024,
            "N": 128,
            "K": 32,
            "block_m": 32,
            "block_n": 32,
            "block_k": 32,
            "dtype_str": "fp16",
            "num_warps": 4
        },
        "ms": 0.0072,
        "min_ms": 0.0076,
        "max_ms": 0.0069,
        "GB/s": 20.43,
        "TFLOPS": 2.32
    },
    {
        "params": {
            "M": 1024,
            "N": 128,
            "K": 32,
            "block_m": 32,
            "block_n": 64,
            "block_k": 32,
            "dtype_str": "fp16",
            "num_warps": 4
        },
        "ms": 0.0071,
        "min_ms": 0.0075,
        "max_ms": 0.0068,
        "GB/s": 20.66,
        "TFLOPS": 2.35
    },
    {
        "params": {
            "M": 1024,
            "N": 128,
            "K": 32,
            "block_m": 32,
            "block_n": 128,
            "block_k": 32,
            "dtype_str": "fp16",
            "num_warps": 4
        },
        "ms": 0.0071,
        "min_ms": 0.0075,
        "max_ms": 0.0067,
        "GB/s": 20.66,
        "TFLOPS": 2.35
    },
    {
        "params": {
            "M": 1024,
            "N": 128,
            "K": 32,
            "block_m": 64,
            "block_n": 32,
            "block_k": 32,
            "dtype_str": "fp16",
            "num_warps": 4
        },
        "ms": 0.0072,
        "min_ms": 0.0076,
        "max_ms": 0.0068,
        "GB/s": 20.43,
        "TFLOPS": 2.32
    },
    {
        "params": {
            "M": 1024,
            "N": 128,
            "K": 32,
            "block_m": 64,
            "block_n": 64,
            "block_k": 32,
            "dtype_str": "fp16",
            "num_warps": 4
        },
        "ms": 0.0073,
        "min_ms": 0.0076,
        "max_ms": 0.0069,
        "GB/s": 20.32,
        "TFLOPS": 2.31
    },
    {
        "params": {
            "M": 1024,
            "N": 128,
            "K": 32,
            "block_m": 64,
            "block_n": 128,
            "block_k": 32,
            "dtype_str": "fp16",
            "num_warps": 4
        },
        "ms": 0.0072,
        "min_ms": 0.0076,
        "max_ms": 0.0068,
        "GB/s": 20.55,
        "TFLOPS": 2.34
    },
    {
        "params": {
            "M": 1024,
            "N": 128,
            "K": 32,
            "block_m": 128,
            "block_n": 32,
            "block_k": 32,
            "dtype_str": "fp16",
            "num_warps": 4
        },
        "ms": 0.0074,
        "min_ms": 0.0078,
        "max_ms": 0.0071,
        "GB/s": 19.99,
        "TFLOPS": 2.27
    },
    {
        "params": {
            "M": 1024,
            "N": 128,
            "K": 32,
            "block_m": 128,
            "block_n": 64,
            "block_k": 32,
            "dtype_str": "fp16",
            "num_warps": 4
        },
        "ms": 0.0073,
        "min_ms": 0.0077,
        "max_ms": 0.0069,
        "GB/s": 20.32,
        "TFLOPS": 2.31
    },
    {
        "params": {
            "M": 1024,
            "N": 128,
            "K": 32,
            "block_m": 128,
            "block_n": 128,
            "block_k": 32,
            "dtype_str": "fp16",
            "num_warps": 4
        },
        "ms": 0.0072,
        "min_ms": 0.0076,
        "max_ms": 0.0069,
        "GB/s": 20.43,
        "TFLOPS": 2.32
    },
    {
        "params": {
            "M": 1024,
            "N": 256,
            "K": 32,
            "block_m": 32,
            "block_n": 32,
            "block_k": 32,
            "dtype_str": "fp16",
            "num_warps": 4
        },
        "ms": 0.008,
        "min_ms": 0.0081,
        "max_ms": 0.0079,
        "GB/s": 20.54,
        "TFLOPS": 4.21
    },
    {
        "params": {
            "M": 1024,
            "N": 256,
            "K": 32,
            "block_m": 32,
            "block_n": 64,
            "block_k": 32,
            "dtype_str": "fp16",
            "num_warps": 4
        },
        "ms": 0.0073,
        "min_ms": 0.0076,
        "max_ms": 0.0072,
        "GB/s": 22.58,
        "TFLOPS": 4.62
    },
    {
        "params": {
            "M": 1024,
            "N": 256,
            "K": 32,
            "block_m": 32,
            "block_n": 128,
            "block_k": 32,
            "dtype_str": "fp16",
            "num_warps": 4
        },
        "ms": 0.0073,
        "min_ms": 0.0076,
        "max_ms": 0.0071,
        "GB/s": 22.58,
        "TFLOPS": 4.62
    },
    {
        "params": {
            "M": 1024,
            "N": 256,
            "K": 32,
            "block_m": 64,
            "block_n": 32,
            "block_k": 32,
            "dtype_str": "fp16",
            "num_warps": 4
        },
        "ms": 0.0081,
        "min_ms": 0.0083,
        "max_ms": 0.008,
        "GB/s": 20.23,
        "TFLOPS": 4.14
    },
    {
        "params": {
            "M": 1024,
            "N": 256,
            "K": 32,
            "block_m": 64,
            "block_n": 64,
            "block_k": 32,
            "dtype_str": "fp16",
            "num_warps": 4
        },
        "ms": 0.0074,
        "min_ms": 0.0078,
        "max_ms": 0.0073,
        "GB/s": 22.09,
        "TFLOPS": 4.52
    },
    {
        "params": {
            "M": 1024,
            "N": 256,
            "K": 32,
            "block_m": 64,
            "block_n": 128,
            "block_k": 32,
            "dtype_str": "fp16",
            "num_warps": 4
        },
        "ms": 0.0075,
        "min_ms": 0.0078,
        "max_ms": 0.0074,
        "GB/s": 21.85,
        "TFLOPS": 4.48
    },
    {
        "params": {
            "M": 1024,
            "N": 256,
            "K": 32,
            "block_m": 128,
            "block_n": 32,
            "block_k": 32,
            "dtype_str": "fp16",
            "num_warps": 4
        },
        "ms": 0.0083,
        "min_ms": 0.0084,
        "max_ms": 0.0081,
        "GB/s": 19.84,
        "TFLOPS": 4.06
    },
    {
        "params": {
            "M": 1024,
            "N": 256,
            "K": 32,
            "block_m": 128,
            "block_n": 64,
            "block_k": 32,
            "dtype_str": "fp16",
            "num_warps": 4
        },
        "ms": 0.0075,
        "min_ms": 0.0078,
        "max_ms": 0.0074,
        "GB/s": 21.74,
        "TFLOPS": 4.45
    },
    {
        "params": {
            "M": 1024,
            "N": 256,
            "K": 32,
            "block_m": 128,
            "block_n": 128,
            "block_k": 32,
            "dtype_str": "fp16",
            "num_warps": 4
        },
        "ms": 0.0075,
        "min_ms": 0.0078,
        "max_ms": 0.0074,
        "GB/s": 21.74,
        "TFLOPS": 4.45
    },
    {
        "params": {
            "M": 1024,
            "N": 512,
            "K": 32,
            "block_m": 32,
            "block_n": 32,
            "block_k": 32,
            "dtype_str": "fp16",
            "num_warps": 4
        },
        "ms": 0.0112,
        "min_ms": 0.0114,
        "max_ms": 0.0111,
        "GB/s": 17.58,
        "TFLOPS": 6.0
    },
    {
        "params": {
            "M": 1024,
            "N": 512,
            "K": 32,
            "block_m": 32,
            "block_n": 64,
            "block_k": 32,
            "dtype_str": "fp16",
            "num_warps": 4
        },
        "ms": 0.0097,
        "min_ms": 0.0099,
        "max_ms": 0.0096,
        "GB/s": 20.26,
        "TFLOPS": 6.92
    },
    {
        "params": {
            "M": 1024,
            "N": 512,
            "K": 32,
            "block_m": 32,
            "block_n": 128,
            "block_k": 32,
            "dtype_str": "fp16",
            "num_warps": 4
        },
        "ms": 0.0093,
        "min_ms": 0.0095,
        "max_ms": 0.0092,
        "GB/s": 21.14,
        "TFLOPS": 7.21
    },
    {
        "params": {
            "M": 1024,
            "N": 512,
            "K": 32,
            "block_m": 64,
            "block_n": 32,
            "block_k": 32,
            "dtype_str": "fp16",
            "num_warps": 4
        },
        "ms": 0.0113,
        "min_ms": 0.0115,
        "max_ms": 0.0113,
        "GB/s": 17.33,
        "TFLOPS": 5.91
    },
    {
        "params": {
            "M": 1024,
            "N": 512,
            "K": 32,
            "block_m": 64,
            "block_n": 64,
            "block_k": 32,
            "dtype_str": "fp16",
            "num_warps": 4
        },
        "ms": 0.0098,
        "min_ms": 0.01,
        "max_ms": 0.0097,
        "GB/s": 20.1,
        "TFLOPS": 6.86
    },
    {
        "params": {
            "M": 1024,
            "N": 512,
            "K": 32,
            "block_m": 64,
            "block_n": 128,
            "block_k": 32,
            "dtype_str": "fp16",
            "num_warps": 4
        },
        "ms": 0.0096,
        "min_ms": 0.0098,
        "max_ms": 0.0095,
        "GB/s": 20.43,
        "TFLOPS": 6.97
    },
    {
        "params": {
            "M": 1024,
            "N": 512,
            "K": 32,
            "block_m": 128,
            "block_n": 32,
            "block_k": 32,
            "dtype_str": "fp16",
            "num_warps": 4
        },
        "ms": 0.0115,
        "min_ms": 0.0116,
        "max_ms": 0.0114,
        "GB/s": 17.15,
        "TFLOPS": 5.85
    },
    {
        "params": {
            "M": 1024,
            "N": 512,
            "K": 32,
            "block_m": 128,
            "block_n": 64,
            "block_k": 32,
            "dtype_str": "fp16",
            "num_warps": 4
        },
        "ms": 0.0099,
        "min_ms": 0.0101,
        "max_ms": 0.0099,
        "GB/s": 19.77,
        "TFLOPS": 6.75
    },
    {
        "params": {
            "M": 1024,
            "N": 512,
            "K": 32,
            "block_m": 128,
            "block_n": 128,
            "block_k": 32,
            "dtype_str": "fp16",
            "num_warps": 4
        },
        "ms": 0.0097,
        "min_ms": 0.0099,
        "max_ms": 0.0095,
        "GB/s": 20.35,
        "TFLOPS": 6.95
    },
    {
        "params": {
            "M": 1024,
            "N": 1024,
            "K": 32,
            "block_m": 32,
            "block_n": 32,
            "block_k": 32,
            "dtype_str": "fp16",
            "num_warps": 4
        },
        "ms": 0.0178,
        "min_ms": 0.018,
        "max_ms": 0.0176,
        "GB/s": 14.76,
        "TFLOPS": 7.56
    },
    {
        "params": {
            "M": 1024,
            "N": 1024,
            "K": 32,
            "block_m": 32,
            "block_n": 64,
            "block_k": 32,
            "dtype_str": "fp16",
            "num_warps": 4
        },
        "ms": 0.0145,
        "min_ms": 0.0148,
        "max_ms": 0.0144,
        "GB/s": 18.06,
        "TFLOPS": 9.25
    },
    {
        "params": {
            "M": 1024,
            "N": 1024,
            "K": 32,
            "block_m": 32,
            "block_n": 128,
            "block_k": 32,
            "dtype_str": "fp16",
            "num_warps": 4
        },
        "ms": 0.0135,
        "min_ms": 0.0137,
        "max_ms": 0.0134,
        "GB/s": 19.4,
        "TFLOPS": 9.93
    },
    {
        "params": {
            "M": 1024,
            "N": 1024,
            "K": 32,
            "block_m": 64,
            "block_n": 32,
            "block_k": 32,
            "dtype_str": "fp16",
            "num_warps": 4
        },
        "ms": 0.0179,
        "min_ms": 0.0181,
        "max_ms": 0.0178,
        "GB/s": 14.66,
        "TFLOPS": 7.51
    },
    {
        "params": {
            "M": 1024,
            "N": 1024,
            "K": 32,
            "block_m": 64,
            "block_n": 64,
            "block_k": 32,
            "dtype_str": "fp16",
            "num_warps": 4
        },
        "ms": 0.0146,
        "min_ms": 0.0148,
        "max_ms": 0.0145,
        "GB/s": 17.96,
        "TFLOPS": 9.2
    },
    {
        "params": {
            "M": 1024,
            "N": 1024,
            "K": 32,
            "block_m": 64,
            "block_n": 128,
            "block_k": 32,
            "dtype_str": "fp16",
            "num_warps": 4
        },
        "ms": 0.0138,
        "min_ms": 0.014,
        "max_ms": 0.0137,
        "GB/s": 19.01,
        "TFLOPS": 9.73
    },
    {
        "params": {
            "M": 1024,
            "N": 1024,
            "K": 32,
            "block_m": 128,
            "block_n": 32,
            "block_k": 32,
            "dtype_str": "fp16",
            "num_warps": 4
        },
        "ms": 0.018,
        "min_ms": 0.0182,
        "max_ms": 0.0179,
        "GB/s": 14.56,
        "TFLOPS": 7.46
    },
    {
        "params": {
            "M": 1024,
            "N": 1024,
            "K": 32,
            "block_m": 128,
            "block_n": 64,
            "block_k": 32,
            "dtype_str": "fp16",
            "num_warps": 4
        },
        "ms": 0.0148,
        "min_ms": 0.0149,
        "max_ms": 0.0147,
        "GB/s": 17.72,
        "TFLOPS": 9.07
    },
    {
        "params": {
            "M": 1024,
            "N": 1024,
            "K": 32,
            "block_m": 128,
            "block_n": 128,
            "block_k": 32,
            "dtype_str": "fp16",
            "num_warps": 4
        },
        "ms": 0.0139,
        "min_ms": 0.014,
        "max_ms": 0.0138,
        "GB/s": 18.9,
        "TFLOPS": 9.68
    },
    {
        "params": {
            "M": 1024,
            "N": 2048,
            "K": 32,
            "block_m": 32,
            "block_n": 32,
            "block_k": 32,
            "dtype_str": "fp16",
            "num_warps": 4
        },
        "ms": 0.0308,
        "min_ms": 0.031,
        "max_ms": 0.0307,
        "GB/s": 12.79,
        "TFLOPS": 8.73
    },
    {
        "params": {
            "M": 1024,
            "N": 2048,
            "K": 32,
            "block_m": 32,
            "block_n": 64,
            "block_k": 32,
            "dtype_str": "fp16",
            "num_warps": 4
        },
        "ms": 0.0243,
        "min_ms": 0.0245,
        "max_ms": 0.0241,
        "GB/s": 16.21,
        "TFLOPS": 11.07
    },
    {
        "params": {
            "M": 1024,
            "N": 2048,
            "K": 32,
            "block_m": 32,
            "block_n": 128,
            "block_k": 32,
            "dtype_str": "fp16",
            "num_warps": 4
        },
        "ms": 0.0219,
        "min_ms": 0.0224,
        "max_ms": 0.0218,
        "GB/s": 17.96,
        "TFLOPS": 12.26
    },
    {
        "params": {
            "M": 1024,
            "N": 2048,
            "K": 32,
            "block_m": 64,
            "block_n": 32,
            "block_k": 32,
            "dtype_str": "fp16",
            "num_warps": 4
        },
        "ms": 0.031,
        "min_ms": 0.0311,
        "max_ms": 0.0309,
        "GB/s": 12.7,
        "TFLOPS": 8.67
    },
    {
        "params": {
            "M": 1024,
            "N": 2048,
            "K": 32,
            "block_m": 64,
            "block_n": 64,
            "block_k": 32,
            "dtype_str": "fp16",
            "num_warps": 4
        },
        "ms": 0.0243,
        "min_ms": 0.0245,
        "max_ms": 0.0242,
        "GB/s": 16.18,
        "TFLOPS": 11.05
    },
    {
        "params": {
            "M": 1024,
            "N": 2048,
            "K": 32,
            "block_m": 64,
            "block_n": 128,
            "block_k": 32,
            "dtype_str": "fp16",
            "num_warps": 4
        },
        "ms": 0.0222,
        "min_ms": 0.0225,
        "max_ms": 0.0221,
        "GB/s": 17.7,
        "TFLOPS": 12.09
    },
    {
        "params": {
            "M": 1024,
            "N": 2048,
            "K": 32,
            "block_m": 128,
            "block_n": 32,
            "block_k": 32,
            "dtype_str": "fp16",
            "num_warps": 4
        },
        "ms": 0.0311,
        "min_ms": 0.0313,
        "max_ms": 0.031,
        "GB/s": 12.64,
        "TFLOPS": 8.63
    },
    {
        "params": {
            "M": 1024,
            "N": 2048,
            "K": 32,
            "block_m": 128,
            "block_n": 64,
            "block_k": 32,
            "dtype_str": "fp16",
            "num_warps": 4
        },
        "ms": 0.0245,
        "min_ms": 0.0247,
        "max_ms": 0.0244,
        "GB/s": 16.03,
        "TFLOPS": 10.94
    },
    {
        "params": {
            "M": 1024,
            "N": 2048,
            "K": 32,
            "block_m": 128,
            "block_n": 128,
            "block_k": 32,
            "dtype_str": "fp16",
            "num_warps": 4
        },
        "ms": 0.0223,
        "min_ms": 0.0226,
        "max_ms": 0.0222,
        "GB/s": 17.61,
        "TFLOPS": 12.02
    },
    {
        "params": {
            "M": 1024,
            "N": 4096,
            "K": 32,
            "block_m": 32,
            "block_n": 32,
            "block_k": 32,
            "dtype_str": "fp16",
            "num_warps": 4
        },
        "ms": 0.0571,
        "min_ms": 0.0573,
        "max_ms": 0.0569,
        "GB/s": 11.48,
        "TFLOPS": 9.4
    },
    {
        "params": {
            "M": 1024,
            "N": 4096,
            "K": 32,
            "block_m": 32,
            "block_n": 64,
            "block_k": 32,
            "dtype_str": "fp16",
            "num_warps": 4
        },
        "ms": 0.0436,
        "min_ms": 0.0437,
        "max_ms": 0.0435,
        "GB/s": 15.04,
        "TFLOPS": 12.32
    },
    {
        "params": {
            "M": 1024,
            "N": 4096,
            "K": 32,
            "block_m": 32,
            "block_n": 128,
            "block_k": 32,
            "dtype_str": "fp16",
            "num_warps": 4
        },
        "ms": 0.0387,
        "min_ms": 0.0388,
        "max_ms": 0.0386,
        "GB/s": 16.94,
        "TFLOPS": 13.88
    },
    {
        "params": {
            "M": 1024,
            "N": 4096,
            "K": 32,
            "block_m": 64,
            "block_n": 32,
            "block_k": 32,
            "dtype_str": "fp16",
            "num_warps": 4
        },
        "ms": 0.0573,
        "min_ms": 0.0575,
        "max_ms": 0.0572,
        "GB/s": 11.43,
        "TFLOPS": 9.36
    },
    {
        "params": {
            "M": 1024,
            "N": 4096,
            "K": 32,
            "block_m": 64,
            "block_n": 64,
            "block_k": 32,
            "dtype_str": "fp16",
            "num_warps": 4
        },
        "ms": 0.0436,
        "min_ms": 0.0438,
        "max_ms": 0.0435,
        "GB/s": 15.02,
        "TFLOPS": 12.31
    },
    {
        "params": {
            "M": 1024,
            "N": 4096,
            "K": 32,
            "block_m": 64,
            "block_n": 128,
            "block_k": 32,
            "dtype_str": "fp16",
            "num_warps": 4
        },
        "ms": 0.0389,
        "min_ms": 0.0391,
        "max_ms": 0.0388,
        "GB/s": 16.83,
        "TFLOPS": 13.79
    },
    {
        "params": {
            "M": 1024,
            "N": 4096,
            "K": 32,
            "block_m": 128,
            "block_n": 32,
            "block_k": 32,
            "dtype_str": "fp16",
            "num_warps": 4
        },
        "ms": 0.0575,
        "min_ms": 0.0577,
        "max_ms": 0.0573,
        "GB/s": 11.4,
        "TFLOPS": 9.34
    },
    {
        "params": {
            "M": 1024,
            "N": 4096,
            "K": 32,
            "block_m": 128,
            "block_n": 64,
            "block_k": 32,
            "dtype_str": "fp16",
            "num_warps": 4
        },
        "ms": 0.044,
        "min_ms": 0.0442,
        "max_ms": 0.0439,
        "GB/s": 14.89,
        "TFLOPS": 12.2
    },
    {
        "params": {
            "M": 1024,
            "N": 4096,
            "K": 32,
            "block_m": 128,
            "block_n": 128,
            "block_k": 32,
            "dtype_str": "fp16",
            "num_warps": 4
        },
        "ms": 0.0393,
        "min_ms": 0.0394,
        "max_ms": 0.0392,
        "GB/s": 16.68,
        "TFLOPS": 13.66
    },
    {
        "params": {
            "M": 2048,
            "N": 128,
            "K": 32,
            "block_m": 32,
            "block_n": 32,
            "block_k": 32,
            "dtype_str": "fp16",
            "num_warps": 4
        },
        "ms": 0.0073,
        "min_ms": 0.0076,
        "max_ms": 0.0069,
        "GB/s": 38.38,
        "TFLOPS": 4.62
    },
    {
        "params": {
            "M": 2048,
            "N": 128,
            "K": 32,
            "block_m": 32,
            "block_n": 64,
            "block_k": 32,
            "dtype_str": "fp16",
            "num_warps": 4
        },
        "ms": 0.0072,
        "min_ms": 0.0076,
        "max_ms": 0.0068,
        "GB/s": 38.81,
        "TFLOPS": 4.68
    },
    {
        "params": {
            "M": 2048,
            "N": 128,
            "K": 32,
            "block_m": 32,
            "block_n": 128,
            "block_k": 32,
            "dtype_str": "fp16",
            "num_warps": 4
        },
        "ms": 0.0071,
        "min_ms": 0.0076,
        "max_ms": 0.0067,
        "GB/s": 39.03,
        "TFLOPS": 4.7
    },
    {
        "params": {
            "M": 2048,
            "N": 128,
            "K": 32,
            "block_m": 64,
            "block_n": 32,
            "block_k": 32,
            "dtype_str": "fp16",
            "num_warps": 4
        },
        "ms": 0.0073,
        "min_ms": 0.0077,
        "max_ms": 0.0069,
        "GB/s": 38.17,
        "TFLOPS": 4.6
    },
    {
        "params": {
            "M": 2048,
            "N": 128,
            "K": 32,
            "block_m": 64,
            "block_n": 64,
            "block_k": 32,
            "dtype_str": "fp16",
            "num_warps": 4
        },
        "ms": 0.0073,
        "min_ms": 0.0077,
        "max_ms": 0.0069,
        "GB/s": 38.38,
        "TFLOPS": 4.62
    },
    {
        "params": {
            "M": 2048,
            "N": 128,
            "K": 32,
            "block_m": 64,
            "block_n": 128,
            "block_k": 32,
            "dtype_str": "fp16",
            "num_warps": 4
        },
        "ms": 0.0073,
        "min_ms": 0.0077,
        "max_ms": 0.0069,
        "GB/s": 38.18,
        "TFLOPS": 4.6
    },
    {
        "params": {
            "M": 2048,
            "N": 128,
            "K": 32,
            "block_m": 128,
            "block_n": 32,
            "block_k": 32,
            "dtype_str": "fp16",
            "num_warps": 4
        },
        "ms": 0.0073,
        "min_ms": 0.0077,
        "max_ms": 0.0069,
        "GB/s": 37.96,
        "TFLOPS": 4.57
    },
    {
        "params": {
            "M": 2048,
            "N": 128,
            "K": 32,
            "block_m": 128,
            "block_n": 64,
            "block_k": 32,
            "dtype_str": "fp16",
            "num_warps": 4
        },
        "ms": 0.0073,
        "min_ms": 0.0077,
        "max_ms": 0.0069,
        "GB/s": 38.17,
        "TFLOPS": 4.6
    },
    {
        "params": {
            "M": 2048,
            "N": 128,
            "K": 32,
            "block_m": 128,
            "block_n": 128,
            "block_k": 32,
            "dtype_str": "fp16",
            "num_warps": 4
        },
        "ms": 0.0073,
        "min_ms": 0.0077,
        "max_ms": 0.0069,
        "GB/s": 38.17,
        "TFLOPS": 4.6
    },
    {
        "params": {
            "M": 2048,
            "N": 256,
            "K": 32,
            "block_m": 32,
            "block_n": 32,
            "block_k": 32,
            "dtype_str": "fp16",
            "num_warps": 4
        },
        "ms": 0.008,
        "min_ms": 0.0081,
        "max_ms": 0.0079,
        "GB/s": 36.78,
        "TFLOPS": 8.37
    },
    {
        "params": {
            "M": 2048,
            "N": 256,
            "K": 32,
            "block_m": 32,
            "block_n": 64,
            "block_k": 32,
            "dtype_str": "fp16",
            "num_warps": 4
        },
        "ms": 0.0074,
        "min_ms": 0.0078,
        "max_ms": 0.0072,
        "GB/s": 39.98,
        "TFLOPS": 9.1
    },
    {
        "params": {
            "M": 2048,
            "N": 256,
            "K": 32,
            "block_m": 32,
            "block_n": 128,
            "block_k": 32,
            "dtype_str": "fp16",
            "num_warps": 4
        },
        "ms": 0.0073,
        "min_ms": 0.0077,
        "max_ms": 0.0072,
        "GB/s": 40.42,
        "TFLOPS": 9.2
    },
    {
        "params": {
            "M": 2048,
            "N": 256,
            "K": 32,
            "block_m": 64,
            "block_n": 32,
            "block_k": 32,
            "dtype_str": "fp16",
            "num_warps": 4
        },
        "ms": 0.0081,
        "min_ms": 0.0083,
        "max_ms": 0.008,
        "GB/s": 36.23,
        "TFLOPS": 8.25
    },
    {
        "params": {
            "M": 2048,
            "N": 256,
            "K": 32,
            "block_m": 64,
            "block_n": 64,
            "block_k": 32,
            "dtype_str": "fp16",
            "num_warps": 4
        },
        "ms": 0.0075,
        "min_ms": 0.0078,
        "max_ms": 0.0073,
        "GB/s": 39.34,
        "TFLOPS": 8.95
    },
    {
        "params": {
            "M": 2048,
            "N": 256,
            "K": 32,
            "block_m": 64,
            "block_n": 128,
            "block_k": 32,
            "dtype_str": "fp16",
            "num_warps": 4
        },
        "ms": 0.0076,
        "min_ms": 0.0079,
        "max_ms": 0.0075,
        "GB/s": 38.92,
        "TFLOPS": 8.86
    },
    {
        "params": {
            "M": 2048,
            "N": 256,
            "K": 32,
            "block_m": 128,
            "block_n": 32,
            "block_k": 32,
            "dtype_str": "fp16",
            "num_warps": 4
        },
        "ms": 0.0083,
        "min_ms": 0.0085,
        "max_ms": 0.0082,
        "GB/s": 35.54,
        "TFLOPS": 8.09
    },
    {
        "params": {
            "M": 2048,
            "N": 256,
            "K": 32,
            "block_m": 128,
            "block_n": 64,
            "block_k": 32,
            "dtype_str": "fp16",
            "num_warps": 4
        },
        "ms": 0.0076,
        "min_ms": 0.0079,
        "max_ms": 0.0074,
        "GB/s": 38.92,
        "TFLOPS": 8.86
    },
    {
        "params": {
            "M": 2048,
            "N": 256,
            "K": 32,
            "block_m": 128,
            "block_n": 128,
            "block_k": 32,
            "dtype_str": "fp16",
            "num_warps": 4
        },
        "ms": 0.0076,
        "min_ms": 0.0079,
        "max_ms": 0.0075,
        "GB/s": 38.71,
        "TFLOPS": 8.81
    },
    {
        "params": {
            "M": 2048,
            "N": 512,
            "K": 32,
            "block_m": 32,
            "block_n": 32,
            "block_k": 32,
            "dtype_str": "fp16",
            "num_warps": 4
        },
        "ms": 0.0113,
        "min_ms": 0.0115,
        "max_ms": 0.0112,
        "GB/s": 29.09,
        "TFLOPS": 11.91
    },
    {
        "params": {
            "M": 2048,
            "N": 512,
            "K": 32,
            "block_m": 32,
            "block_n": 64,
            "block_k": 32,
            "dtype_str": "fp16",
            "num_warps": 4
        },
        "ms": 0.0098,
        "min_ms": 0.01,
        "max_ms": 0.0097,
        "GB/s": 33.5,
        "TFLOPS": 13.72
    },
    {
        "params": {
            "M": 2048,
            "N": 512,
            "K": 32,
            "block_m": 32,
            "block_n": 128,
            "block_k": 32,
            "dtype_str": "fp16",
            "num_warps": 4
        },
        "ms": 0.0094,
        "min_ms": 0.0097,
        "max_ms": 0.0093,
        "GB/s": 34.78,
        "TFLOPS": 14.25
    },
    {
        "params": {
            "M": 2048,
            "N": 512,
            "K": 32,
            "block_m": 64,
            "block_n": 32,
            "block_k": 32,
            "dtype_str": "fp16",
            "num_warps": 4
        },
        "ms": 0.0113,
        "min_ms": 0.0115,
        "max_ms": 0.0113,
        "GB/s": 28.88,
        "TFLOPS": 11.83
    },
    {
        "params": {
            "M": 2048,
            "N": 512,
            "K": 32,
            "block_m": 64,
            "block_n": 64,
            "block_k": 32,
            "dtype_str": "fp16",
            "num_warps": 4
        },
        "ms": 0.0098,
        "min_ms": 0.01,
        "max_ms": 0.0097,
        "GB/s": 33.36,
        "TFLOPS": 13.67
    },
    {
        "params": {
            "M": 2048,
            "N": 512,
            "K": 32,
            "block_m": 64,
            "block_n": 128,
            "block_k": 32,
            "dtype_str": "fp16",
            "num_warps": 4
        },
        "ms": 0.0097,
        "min_ms": 0.0099,
        "max_ms": 0.0095,
        "GB/s": 33.91,
        "TFLOPS": 13.89
    },
    {
        "params": {
            "M": 2048,
            "N": 512,
            "K": 32,
            "block_m": 128,
            "block_n": 32,
            "block_k": 32,
            "dtype_str": "fp16",
            "num_warps": 4
        },
        "ms": 0.0115,
        "min_ms": 0.0117,
        "max_ms": 0.0114,
        "GB/s": 28.58,
        "TFLOPS": 11.7
    },
    {
        "params": {
            "M": 2048,
            "N": 512,
            "K": 32,
            "block_m": 128,
            "block_n": 64,
            "block_k": 32,
            "dtype_str": "fp16",
            "num_warps": 4
        },
        "ms": 0.01,
        "min_ms": 0.0103,
        "max_ms": 0.0099,
        "GB/s": 32.82,
        "TFLOPS": 13.44
    },
    {
        "params": {
            "M": 2048,
            "N": 512,
            "K": 32,
            "block_m": 128,
            "block_n": 128,
            "block_k": 32,
            "dtype_str": "fp16",
            "num_warps": 4
        },
        "ms": 0.0097,
        "min_ms": 0.0099,
        "max_ms": 0.0096,
        "GB/s": 33.77,
        "TFLOPS": 13.83
    },
    {
        "params": {
            "M": 2048,
            "N": 1024,
            "K": 32,
            "block_m": 32,
            "block_n": 32,
            "block_k": 32,
            "dtype_str": "fp16",
            "num_warps": 4
        },
        "ms": 0.0178,
        "min_ms": 0.018,
        "max_ms": 0.0177,
        "GB/s": 22.09,
        "TFLOPS": 15.08
    },
    {
        "params": {
            "M": 2048,
            "N": 1024,
            "K": 32,
            "block_m": 32,
            "block_n": 64,
            "block_k": 32,
            "dtype_str": "fp16",
            "num_warps": 4
        },
        "ms": 0.0146,
        "min_ms": 0.0148,
        "max_ms": 0.0146,
        "GB/s": 26.87,
        "TFLOPS": 18.34
    },
    {
        "params": {
            "M": 2048,
            "N": 1024,
            "K": 32,
            "block_m": 32,
            "block_n": 128,
            "block_k": 32,
            "dtype_str": "fp16",
            "num_warps": 4
        },
        "ms": 0.0136,
        "min_ms": 0.0138,
        "max_ms": 0.0135,
        "GB/s": 28.93,
        "TFLOPS": 19.75
    },
    {
        "params": {
            "M": 2048,
            "N": 1024,
            "K": 32,
            "block_m": 64,
            "block_n": 32,
            "block_k": 32,
            "dtype_str": "fp16",
            "num_warps": 4
        },
        "ms": 0.0178,
        "min_ms": 0.018,
        "max_ms": 0.0178,
        "GB/s": 22.04,
        "TFLOPS": 15.05
    },
    {
        "params": {
            "M": 2048,
            "N": 1024,
            "K": 32,
            "block_m": 64,
            "block_n": 64,
            "block_k": 32,
            "dtype_str": "fp16",
            "num_warps": 4
        },
        "ms": 0.0146,
        "min_ms": 0.0148,
        "max_ms": 0.0145,
        "GB/s": 26.94,
        "TFLOPS": 18.39
    },
    {
        "params": {
            "M": 2048,
            "N": 1024,
            "K": 32,
            "block_m": 64,
            "block_n": 128,
            "block_k": 32,
            "dtype_str": "fp16",
            "num_warps": 4
        },
        "ms": 0.0138,
        "min_ms": 0.014,
        "max_ms": 0.0137,
        "GB/s": 28.43,
        "TFLOPS": 19.41
    },
    {
        "params": {
            "M": 2048,
            "N": 1024,
            "K": 32,
            "block_m": 128,
            "block_n": 32,
            "block_k": 32,
            "dtype_str": "fp16",
            "num_warps": 4
        },
        "ms": 0.018,
        "min_ms": 0.0182,
        "max_ms": 0.0179,
        "GB/s": 21.84,
        "TFLOPS": 14.91
    },
    {
        "params": {
            "M": 2048,
            "N": 1024,
            "K": 32,
            "block_m": 128,
            "block_n": 64,
            "block_k": 32,
            "dtype_str": "fp16",
            "num_warps": 4
        },
        "ms": 0.0148,
        "min_ms": 0.015,
        "max_ms": 0.0147,
        "GB/s": 26.58,
        "TFLOPS": 18.14
    },
    {
        "params": {
            "M": 2048,
            "N": 1024,
            "K": 32,
            "block_m": 128,
            "block_n": 128,
            "block_k": 32,
            "dtype_str": "fp16",
            "num_warps": 4
        },
        "ms": 0.0139,
        "min_ms": 0.0141,
        "max_ms": 0.0138,
        "GB/s": 28.27,
        "TFLOPS": 19.3
    },
    {
        "params": {
            "M": 2048,
            "N": 2048,
            "K": 32,
            "block_m": 32,
            "block_n": 32,
            "block_k": 32,
            "dtype_str": "fp16",
            "num_warps": 4
        },
        "ms": 0.031,
        "min_ms": 0.0312,
        "max_ms": 0.0309,
        "GB/s": 16.9,
        "TFLOPS": 17.3
    },
    {
        "params": {
            "M": 2048,
            "N": 2048,
            "K": 32,
            "block_m": 32,
            "block_n": 64,
            "block_k": 32,
            "dtype_str": "fp16",
            "num_warps": 4
        },
        "ms": 0.0245,
        "min_ms": 0.0247,
        "max_ms": 0.0243,
        "GB/s": 21.44,
        "TFLOPS": 21.95
    },
    {
        "params": {
            "M": 2048,
            "N": 2048,
            "K": 32,
            "block_m": 32,
            "block_n": 128,
            "block_k": 32,
            "dtype_str": "fp16",
            "num_warps": 4
        },
        "ms": 0.0221,
        "min_ms": 0.0225,
        "max_ms": 0.0221,
        "GB/s": 23.69,
        "TFLOPS": 24.26
    },
    {
        "params": {
            "M": 2048,
            "N": 2048,
            "K": 32,
            "block_m": 64,
            "block_n": 32,
            "block_k": 32,
            "dtype_str": "fp16",
            "num_warps": 4
        },
        "ms": 0.031,
        "min_ms": 0.0312,
        "max_ms": 0.0309,
        "GB/s": 16.9,
        "TFLOPS": 17.3
    },
    {
        "params": {
            "M": 2048,
            "N": 2048,
            "K": 32,
            "block_m": 64,
            "block_n": 64,
            "block_k": 32,
            "dtype_str": "fp16",
            "num_warps": 4
        },
        "ms": 0.0243,
        "min_ms": 0.0245,
        "max_ms": 0.0242,
        "GB/s": 21.54,
        "TFLOPS": 22.06
    },
    {
        "params": {
            "M": 2048,
            "N": 2048,
            "K": 32,
            "block_m": 64,
            "block_n": 128,
            "block_k": 32,
            "dtype_str": "fp16",
            "num_warps": 4
        },
        "ms": 0.0223,
        "min_ms": 0.0227,
        "max_ms": 0.0222,
        "GB/s": 23.52,
        "TFLOPS": 24.08
    },
    {
        "params": {
            "M": 2048,
            "N": 2048,
            "K": 32,
            "block_m": 128,
            "block_n": 32,
            "block_k": 32,
            "dtype_str": "fp16",
            "num_warps": 4
        },
        "ms": 0.0312,
        "min_ms": 0.0314,
        "max_ms": 0.031,
        "GB/s": 16.83,
        "TFLOPS": 17.23
    },
    {
        "params": {
            "M": 2048,
            "N": 2048,
            "K": 32,
            "block_m": 128,
            "block_n": 64,
            "block_k": 32,
            "dtype_str": "fp16",
            "num_warps": 4
        },
        "ms": 0.0246,
        "min_ms": 0.0249,
        "max_ms": 0.0245,
        "GB/s": 21.3,
        "TFLOPS": 21.81
    },
    {
        "params": {
            "M": 2048,
            "N": 2048,
            "K": 32,
            "block_m": 128,
            "block_n": 128,
            "block_k": 32,
            "dtype_str": "fp16",
            "num_warps": 4
        },
        "ms": 0.0224,
        "min_ms": 0.0227,
        "max_ms": 0.0223,
        "GB/s": 23.39,
        "TFLOPS": 23.95
    },
    {
        "params": {
            "M": 2048,
            "N": 4096,
            "K": 32,
            "block_m": 32,
            "block_n": 32,
            "block_k": 32,
            "dtype_str": "fp16",
            "num_warps": 4
        },
        "ms": 0.0574,
        "min_ms": 0.0577,
        "max_ms": 0.0573,
        "GB/s": 13.7,
        "TFLOPS": 18.7
    },
    {
        "params": {
            "M": 2048,
            "N": 4096,
            "K": 32,
            "block_m": 32,
            "block_n": 64,
            "block_k": 32,
            "dtype_str": "fp16",
            "num_warps": 4
        },
        "ms": 0.0439,
        "min_ms": 0.044,
        "max_ms": 0.0437,
        "GB/s": 17.93,
        "TFLOPS": 24.48
    },
    {
        "params": {
            "M": 2048,
            "N": 4096,
            "K": 32,
            "block_m": 32,
            "block_n": 128,
            "block_k": 32,
            "dtype_str": "fp16",
            "num_warps": 4
        },
        "ms": 0.039,
        "min_ms": 0.0393,
        "max_ms": 0.0389,
        "GB/s": 20.16,
        "TFLOPS": 27.52
    },
    {
        "params": {
            "M": 2048,
            "N": 4096,
            "K": 32,
            "block_m": 64,
            "block_n": 32,
            "block_k": 32,
            "dtype_str": "fp16",
            "num_warps": 4
        },
        "ms": 0.0573,
        "min_ms": 0.0575,
        "max_ms": 0.0572,
        "GB/s": 13.73,
        "TFLOPS": 18.74
    },
    {
        "params": {
            "M": 2048,
            "N": 4096,
            "K": 32,
            "block_m": 64,
            "block_n": 64,
            "block_k": 32,
            "dtype_str": "fp16",
            "num_warps": 4
        },
        "ms": 0.0436,
        "min_ms": 0.0437,
        "max_ms": 0.0435,
        "GB/s": 18.03,
        "TFLOPS": 24.62
    },
    {
        "params": {
            "M": 2048,
            "N": 4096,
            "K": 32,
            "block_m": 64,
            "block_n": 128,
            "block_k": 32,
            "dtype_str": "fp16",
            "num_warps": 4
        },
        "ms": 0.0391,
        "min_ms": 0.0392,
        "max_ms": 0.039,
        "GB/s": 20.14,
        "TFLOPS": 27.5
    },
    {
        "params": {
            "M": 2048,
            "N": 4096,
            "K": 32,
            "block_m": 128,
            "block_n": 32,
            "block_k": 32,
            "dtype_str": "fp16",
            "num_warps": 4
        },
        "ms": 0.0575,
        "min_ms": 0.0577,
        "max_ms": 0.0573,
        "GB/s": 13.69,
        "TFLOPS": 18.69
    },
    {
        "params": {
            "M": 2048,
            "N": 4096,
            "K": 32,
            "block_m": 128,
            "block_n": 64,
            "block_k": 32,
            "dtype_str": "fp16",
            "num_warps": 4
        },
        "ms": 0.044,
        "min_ms": 0.0442,
        "max_ms": 0.0439,
        "GB/s": 17.86,
        "TFLOPS": 24.39
    },
    {
        "params": {
            "M": 2048,
            "N": 4096,
            "K": 32,
            "block_m": 128,
            "block_n": 128,
            "block_k": 32,
            "dtype_str": "fp16",
            "num_warps": 4
        },
        "ms": 0.0394,
        "min_ms": 0.0395,
        "max_ms": 0.0393,
        "GB/s": 19.98,
        "TFLOPS": 27.27
    },
    {
        "params": {
            "M": 4096,
            "N": 128,
            "K": 32,
            "block_m": 32,
            "block_n": 32,
            "block_k": 32,
            "dtype_str": "fp16",
            "num_warps": 4
        },
        "ms": 0.0073,
        "min_ms": 0.0077,
        "max_ms": 0.0069,
        "GB/s": 74.11,
        "TFLOPS": 9.2
    },
    {
        "params": {
            "M": 4096,
            "N": 128,
            "K": 32,
            "block_m": 32,
            "block_n": 64,
            "block_k": 32,
            "dtype_str": "fp16",
            "num_warps": 4
        },
        "ms": 0.0071,
        "min_ms": 0.0076,
        "max_ms": 0.0067,
        "GB/s": 76.18,
        "TFLOPS": 9.46
    },
    {
        "params": {
            "M": 4096,
            "N": 128,
            "K": 32,
            "block_m": 32,
            "block_n": 128,
            "block_k": 32,
            "dtype_str": "fp16",
            "num_warps": 4
        },
        "ms": 0.0071,
        "min_ms": 0.0075,
        "max_ms": 0.0067,
        "GB/s": 75.77,
        "TFLOPS": 9.4
    },
    {
        "params": {
            "M": 4096,
            "N": 128,
            "K": 32,
            "block_m": 64,
            "block_n": 32,
            "block_k": 32,
            "dtype_str": "fp16",
            "num_warps": 4
        },
        "ms": 0.0073,
        "min_ms": 0.0077,
        "max_ms": 0.0069,
        "GB/s": 74.1,
        "TFLOPS": 9.2
    },
    {
        "params": {
            "M": 4096,
            "N": 128,
            "K": 32,
            "block_m": 64,
            "block_n": 64,
            "block_k": 32,
            "dtype_str": "fp16",
            "num_warps": 4
        },
        "ms": 0.0073,
        "min_ms": 0.0077,
        "max_ms": 0.0068,
        "GB/s": 74.51,
        "TFLOPS": 9.25
    },
    {
        "params": {
            "M": 4096,
            "N": 128,
            "K": 32,
            "block_m": 64,
            "block_n": 128,
            "block_k": 32,
            "dtype_str": "fp16",
            "num_warps": 4
        },
        "ms": 0.0073,
        "min_ms": 0.0077,
        "max_ms": 0.0069,
        "GB/s": 74.1,
        "TFLOPS": 9.2
    },
    {
        "params": {
            "M": 4096,
            "N": 128,
            "K": 32,
            "block_m": 128,
            "block_n": 32,
            "block_k": 32,
            "dtype_str": "fp16",
            "num_warps": 4
        },
        "ms": 0.0073,
        "min_ms": 0.0077,
        "max_ms": 0.0069,
        "GB/s": 74.1,
        "TFLOPS": 9.2
    },
    {
        "params": {
            "M": 4096,
            "N": 128,
            "K": 32,
            "block_m": 128,
            "block_n": 64,
            "block_k": 32,
            "dtype_str": "fp16",
            "num_warps": 4
        },
        "ms": 0.0073,
        "min_ms": 0.0077,
        "max_ms": 0.0069,
        "GB/s": 74.1,
        "TFLOPS": 9.2
    },
    {
        "params": {
            "M": 4096,
            "N": 128,
            "K": 32,
            "block_m": 128,
            "block_n": 128,
            "block_k": 32,
            "dtype_str": "fp16",
            "num_warps": 4
        },
        "ms": 0.0073,
        "min_ms": 0.0077,
        "max_ms": 0.0069,
        "GB/s": 74.1,
        "TFLOPS": 9.2
    },
    {
        "params": {
            "M": 4096,
            "N": 256,
            "K": 32,
            "block_m": 32,
            "block_n": 32,
            "block_k": 32,
            "dtype_str": "fp16",
            "num_warps": 4
        },
        "ms": 0.0082,
        "min_ms": 0.0084,
        "max_ms": 0.0081,
        "GB/s": 68.11,
        "TFLOPS": 16.41
    },
    {
        "params": {
            "M": 4096,
            "N": 256,
            "K": 32,
            "block_m": 32,
            "block_n": 64,
            "block_k": 32,
            "dtype_str": "fp16",
            "num_warps": 4
        },
        "ms": 0.0075,
        "min_ms": 0.0078,
        "max_ms": 0.0074,
        "GB/s": 74.3,
        "TFLOPS": 17.9
    },
    {
        "params": {
            "M": 4096,
            "N": 256,
            "K": 32,
            "block_m": 32,
            "block_n": 128,
            "block_k": 32,
            "dtype_str": "fp16",
            "num_warps": 4
        },
        "ms": 0.0075,
        "min_ms": 0.0078,
        "max_ms": 0.0073,
        "GB/s": 74.7,
        "TFLOPS": 18.0
    },
    {
        "params": {
            "M": 4096,
            "N": 256,
            "K": 32,
            "block_m": 64,
            "block_n": 32,
            "block_k": 32,
            "dtype_str": "fp16",
            "num_warps": 4
        },
        "ms": 0.0082,
        "min_ms": 0.0084,
        "max_ms": 0.0081,
        "GB/s": 67.78,
        "TFLOPS": 16.33
    },
    {
        "params": {
            "M": 4096,
            "N": 256,
            "K": 32,
            "block_m": 64,
            "block_n": 64,
            "block_k": 32,
            "dtype_str": "fp16",
            "num_warps": 4
        },
        "ms": 0.0075,
        "min_ms": 0.0079,
        "max_ms": 0.0074,
        "GB/s": 73.91,
        "TFLOPS": 17.81
    },
    {
        "params": {
            "M": 4096,
            "N": 256,
            "K": 32,
            "block_m": 64,
            "block_n": 128,
            "block_k": 32,
            "dtype_str": "fp16",
            "num_warps": 4
        },
        "ms": 0.0077,
        "min_ms": 0.008,
        "max_ms": 0.0075,
        "GB/s": 72.74,
        "TFLOPS": 17.53
    },
    {
        "params": {
            "M": 4096,
            "N": 256,
            "K": 32,
            "block_m": 128,
            "block_n": 32,
            "block_k": 32,
            "dtype_str": "fp16",
            "num_warps": 4
        },
        "ms": 0.0083,
        "min_ms": 0.0086,
        "max_ms": 0.0082,
        "GB/s": 66.8,
        "TFLOPS": 16.1
    },
    {
        "params": {
            "M": 4096,
            "N": 256,
            "K": 32,
            "block_m": 128,
            "block_n": 64,
            "block_k": 32,
            "dtype_str": "fp16",
            "num_warps": 4
        },
        "ms": 0.0077,
        "min_ms": 0.008,
        "max_ms": 0.0075,
        "GB/s": 72.74,
        "TFLOPS": 17.53
    },
    {
        "params": {
            "M": 4096,
            "N": 256,
            "K": 32,
            "block_m": 128,
            "block_n": 128,
            "block_k": 32,
            "dtype_str": "fp16",
            "num_warps": 4
        },
        "ms": 0.0077,
        "min_ms": 0.008,
        "max_ms": 0.0075,
        "GB/s": 72.74,
        "TFLOPS": 17.53
    },
    {
        "params": {
            "M": 4096,
            "N": 512,
            "K": 32,
            "block_m": 32,
            "block_n": 32,
            "block_k": 32,
            "dtype_str": "fp16",
            "num_warps": 4
        },
        "ms": 0.0116,
        "min_ms": 0.0118,
        "max_ms": 0.0115,
        "GB/s": 50.91,
        "TFLOPS": 23.17
    },
    {
        "params": {
            "M": 4096,
            "N": 512,
            "K": 32,
            "block_m": 32,
            "block_n": 64,
            "block_k": 32,
            "dtype_str": "fp16",
            "num_warps": 4
        },
        "ms": 0.0101,
        "min_ms": 0.0103,
        "max_ms": 0.0099,
        "GB/s": 58.61,
        "TFLOPS": 26.68
    },
    {
        "params": {
            "M": 4096,
            "N": 512,
            "K": 32,
            "block_m": 32,
            "block_n": 128,
            "block_k": 32,
            "dtype_str": "fp16",
            "num_warps": 4
        },
        "ms": 0.0097,
        "min_ms": 0.0101,
        "max_ms": 0.0096,
        "GB/s": 60.54,
        "TFLOPS": 27.55
    },
    {
        "params": {
            "M": 4096,
            "N": 512,
            "K": 32,
            "block_m": 64,
            "block_n": 32,
            "block_k": 32,
            "dtype_str": "fp16",
            "num_warps": 4
        },
        "ms": 0.0115,
        "min_ms": 0.0117,
        "max_ms": 0.0113,
        "GB/s": 51.44,
        "TFLOPS": 23.41
    },
    {
        "params": {
            "M": 4096,
            "N": 512,
            "K": 32,
            "block_m": 64,
            "block_n": 64,
            "block_k": 32,
            "dtype_str": "fp16",
            "num_warps": 4
        },
        "ms": 0.0099,
        "min_ms": 0.0102,
        "max_ms": 0.0098,
        "GB/s": 59.33,
        "TFLOPS": 27.0
    },
    {
        "params": {
            "M": 4096,
            "N": 512,
            "K": 32,
            "block_m": 64,
            "block_n": 128,
            "block_k": 32,
            "dtype_str": "fp16",
            "num_warps": 4
        },
        "ms": 0.0098,
        "min_ms": 0.01,
        "max_ms": 0.0097,
        "GB/s": 60.29,
        "TFLOPS": 27.44
    },
    {
        "params": {
            "M": 4096,
            "N": 512,
            "K": 32,
            "block_m": 128,
            "block_n": 32,
            "block_k": 32,
            "dtype_str": "fp16",
            "num_warps": 4
        },
        "ms": 0.0115,
        "min_ms": 0.0117,
        "max_ms": 0.0114,
        "GB/s": 51.08,
        "TFLOPS": 23.25
    },
    {
        "params": {
            "M": 4096,
            "N": 512,
            "K": 32,
            "block_m": 128,
            "block_n": 64,
            "block_k": 32,
            "dtype_str": "fp16",
            "num_warps": 4
        },
        "ms": 0.0101,
        "min_ms": 0.0103,
        "max_ms": 0.0099,
        "GB/s": 58.61,
        "TFLOPS": 26.68
    },
    {
        "params": {
            "M": 4096,
            "N": 512,
            "K": 32,
            "block_m": 128,
            "block_n": 128,
            "block_k": 32,
            "dtype_str": "fp16",
            "num_warps": 4
        },
        "ms": 0.0098,
        "min_ms": 0.01,
        "max_ms": 0.0097,
        "GB/s": 60.29,
        "TFLOPS": 27.44
    },
    {
        "params": {
            "M": 4096,
            "N": 1024,
            "K": 32,
            "block_m": 32,
            "block_n": 32,
            "block_k": 32,
            "dtype_str": "fp16",
            "num_warps": 4
        },
        "ms": 0.0182,
        "min_ms": 0.0185,
        "max_ms": 0.0181,
        "GB/s": 36.0,
        "TFLOPS": 29.5
    },
    {
        "params": {
            "M": 4096,
            "N": 1024,
            "K": 32,
            "block_m": 32,
            "block_n": 64,
            "block_k": 32,
            "dtype_str": "fp16",
            "num_warps": 4
        },
        "ms": 0.0151,
        "min_ms": 0.0154,
        "max_ms": 0.015,
        "GB/s": 43.36,
        "TFLOPS": 35.52
    },
    {
        "params": {
            "M": 4096,
            "N": 1024,
            "K": 32,
            "block_m": 32,
            "block_n": 128,
            "block_k": 32,
            "dtype_str": "fp16",
            "num_warps": 4
        },
        "ms": 0.0142,
        "min_ms": 0.0145,
        "max_ms": 0.014,
        "GB/s": 46.17,
        "TFLOPS": 37.83
    },
    {
        "params": {
            "M": 4096,
            "N": 1024,
            "K": 32,
            "block_m": 64,
            "block_n": 32,
            "block_k": 32,
            "dtype_str": "fp16",
            "num_warps": 4
        },
        "ms": 0.018,
        "min_ms": 0.0182,
        "max_ms": 0.0179,
        "GB/s": 36.41,
        "TFLOPS": 29.82
    },
    {
        "params": {
            "M": 4096,
            "N": 1024,
            "K": 32,
            "block_m": 64,
            "block_n": 64,
            "block_k": 32,
            "dtype_str": "fp16",
            "num_warps": 4
        },
        "ms": 0.0148,
        "min_ms": 0.0149,
        "max_ms": 0.0147,
        "GB/s": 44.42,
        "TFLOPS": 36.39
    },
    {
        "params": {
            "M": 4096,
            "N": 1024,
            "K": 32,
            "block_m": 64,
            "block_n": 128,
            "block_k": 32,
            "dtype_str": "fp16",
            "num_warps": 4
        },
        "ms": 0.014,
        "min_ms": 0.0142,
        "max_ms": 0.0139,
        "GB/s": 46.84,
        "TFLOPS": 38.37
    },
    {
        "params": {
            "M": 4096,
            "N": 1024,
            "K": 32,
            "block_m": 128,
            "block_n": 32,
            "block_k": 32,
            "dtype_str": "fp16",
            "num_warps": 4
        },
        "ms": 0.018,
        "min_ms": 0.0183,
        "max_ms": 0.0179,
        "GB/s": 36.32,
        "TFLOPS": 29.76
    },
    {
        "params": {
            "M": 4096,
            "N": 1024,
            "K": 32,
            "block_m": 128,
            "block_n": 64,
            "block_k": 32,
            "dtype_str": "fp16",
            "num_warps": 4
        },
        "ms": 0.0149,
        "min_ms": 0.015,
        "max_ms": 0.0148,
        "GB/s": 44.06,
        "TFLOPS": 36.09
    },
    {
        "params": {
            "M": 4096,
            "N": 1024,
            "K": 32,
            "block_m": 128,
            "block_n": 128,
            "block_k": 32,
            "dtype_str": "fp16",
            "num_warps": 4
        },
        "ms": 0.014,
        "min_ms": 0.0142,
        "max_ms": 0.0139,
        "GB/s": 46.83,
        "TFLOPS": 38.37
    },
    {
        "params": {
            "M": 4096,
            "N": 2048,
            "K": 32,
            "block_m": 32,
            "block_n": 32,
            "block_k": 32,
            "dtype_str": "fp16",
            "num_warps": 4
        },
        "ms": 0.0315,
        "min_ms": 0.0317,
        "max_ms": 0.0314,
        "GB/s": 24.99,
        "TFLOPS": 34.12
    },
    {
        "params": {
            "M": 4096,
            "N": 2048,
            "K": 32,
            "block_m": 32,
            "block_n": 64,
            "block_k": 32,
            "dtype_str": "fp16",
            "num_warps": 4
        },
        "ms": 0.0256,
        "min_ms": 0.0259,
        "max_ms": 0.0251,
        "GB/s": 30.75,
        "TFLOPS": 41.98
    },
    {
        "params": {
            "M": 4096,
            "N": 2048,
            "K": 32,
            "block_m": 32,
            "block_n": 128,
            "block_k": 32,
            "dtype_str": "fp16",
            "num_warps": 4
        },
        "ms": 0.0242,
        "min_ms": 0.0247,
        "max_ms": 0.0235,
        "GB/s": 32.48,
        "TFLOPS": 44.34
    },
    {
        "params": {
            "M": 4096,
            "N": 2048,
            "K": 32,
            "block_m": 64,
            "block_n": 32,
            "block_k": 32,
            "dtype_str": "fp16",
            "num_warps": 4
        },
        "ms": 0.0311,
        "min_ms": 0.0312,
        "max_ms": 0.031,
        "GB/s": 25.31,
        "TFLOPS": 34.56
    },
    {
        "params": {
            "M": 4096,
            "N": 2048,
            "K": 32,
            "block_m": 64,
            "block_n": 64,
            "block_k": 32,
            "dtype_str": "fp16",
            "num_warps": 4
        },
        "ms": 0.0246,
        "min_ms": 0.0249,
        "max_ms": 0.0244,
        "GB/s": 32.0,
        "TFLOPS": 43.69
    },
    {
        "params": {
            "M": 4096,
            "N": 2048,
            "K": 32,
            "block_m": 64,
            "block_n": 128,
            "block_k": 32,
            "dtype_str": "fp16",
            "num_warps": 4
        },
        "ms": 0.0225,
        "min_ms": 0.0228,
        "max_ms": 0.0223,
        "GB/s": 34.97,
        "TFLOPS": 47.74
    },
    {
        "params": {
            "M": 4096,
            "N": 2048,
            "K": 32,
            "block_m": 128,
            "block_n": 32,
            "block_k": 32,
            "dtype_str": "fp16",
            "num_warps": 4
        },
        "ms": 0.031,
        "min_ms": 0.0312,
        "max_ms": 0.0309,
        "GB/s": 25.38,
        "TFLOPS": 34.65
    },
    {
        "params": {
            "M": 4096,
            "N": 2048,
            "K": 32,
            "block_m": 128,
            "block_n": 64,
            "block_k": 32,
            "dtype_str": "fp16",
            "num_warps": 4
        },
        "ms": 0.0246,
        "min_ms": 0.0249,
        "max_ms": 0.0245,
        "GB/s": 31.95,
        "TFLOPS": 43.62
    },
    {
        "params": {
            "M": 4096,
            "N": 2048,
            "K": 32,
            "block_m": 128,
            "block_n": 128,
            "block_k": 32,
            "dtype_str": "fp16",
            "num_warps": 4
        },
        "ms": 0.0226,
        "min_ms": 0.023,
        "max_ms": 0.0224,
        "GB/s": 34.84,
        "TFLOPS": 47.57
    },
    {
        "params": {
            "M": 4096,
            "N": 4096,
            "K": 32,
            "block_m": 32,
            "block_n": 32,
            "block_k": 32,
            "dtype_str": "fp16",
            "num_warps": 4
        },
        "ms": 0.0586,
        "min_ms": 0.0588,
        "max_ms": 0.0584,
        "GB/s": 17.9,
        "TFLOPS": 36.66
    },
    {
        "params": {
            "M": 4096,
            "N": 4096,
            "K": 32,
            "block_m": 32,
            "block_n": 64,
            "block_k": 32,
            "dtype_str": "fp16",
            "num_warps": 4
        },
        "ms": 0.0454,
        "min_ms": 0.0459,
        "max_ms": 0.0449,
        "GB/s": 23.08,
        "TFLOPS": 47.28
    },
    {
        "params": {
            "M": 4096,
            "N": 4096,
            "K": 32,
            "block_m": 32,
            "block_n": 128,
            "block_k": 32,
            "dtype_str": "fp16",
            "num_warps": 4
        },
        "ms": 0.0411,
        "min_ms": 0.0417,
        "max_ms": 0.0407,
        "GB/s": 25.49,
        "TFLOPS": 52.21
    },
    {
        "params": {
            "M": 4096,
            "N": 4096,
            "K": 32,
            "block_m": 64,
            "block_n": 32,
            "block_k": 32,
            "dtype_str": "fp16",
            "num_warps": 4
        },
        "ms": 0.0577,
        "min_ms": 0.0579,
        "max_ms": 0.0576,
        "GB/s": 18.18,
        "TFLOPS": 37.22
    },
    {
        "params": {
            "M": 4096,
            "N": 4096,
            "K": 32,
            "block_m": 64,
            "block_n": 64,
            "block_k": 32,
            "dtype_str": "fp16",
            "num_warps": 4
        },
        "ms": 0.0439,
        "min_ms": 0.0441,
        "max_ms": 0.0438,
        "GB/s": 23.86,
        "TFLOPS": 48.87
    },
    {
        "params": {
            "M": 4096,
            "N": 4096,
            "K": 32,
            "block_m": 64,
            "block_n": 128,
            "block_k": 32,
            "dtype_str": "fp16",
            "num_warps": 4
        },
        "ms": 0.0393,
        "min_ms": 0.0395,
        "max_ms": 0.0392,
        "GB/s": 26.69,
        "TFLOPS": 54.66
    },
    {
        "params": {
            "M": 4096,
            "N": 4096,
            "K": 32,
            "block_m": 128,
            "block_n": 32,
            "block_k": 32,
            "dtype_str": "fp16",
            "num_warps": 4
        },
        "ms": 0.0573,
        "min_ms": 0.0576,
        "max_ms": 0.0572,
        "GB/s": 18.29,
        "TFLOPS": 37.46
    },
    {
        "params": {
            "M": 4096,
            "N": 4096,
            "K": 32,
            "block_m": 128,
            "block_n": 64,
            "block_k": 32,
            "dtype_str": "fp16",
            "num_warps": 4
        },
        "ms": 0.0439,
        "min_ms": 0.0441,
        "max_ms": 0.0438,
        "GB/s": 23.86,
        "TFLOPS": 48.87
    },
    {
        "params": {
            "M": 4096,
            "N": 4096,
            "K": 32,
            "block_m": 128,
            "block_n": 128,
            "block_k": 32,
            "dtype_str": "fp16",
            "num_warps": 4
        },
        "ms": 0.0395,
        "min_ms": 0.0397,
        "max_ms": 0.0394,
        "GB/s": 26.55,
        "TFLOPS": 54.38
    },
    {
        "params": {
            "M": 128,
            "N": 128,
            "K": 64,
            "block_m": 32,
            "block_n": 32,
            "block_k": 64,
            "dtype_str": "fp16",
            "num_warps": 4
        },
        "ms": 0.0074,
        "min_ms": 0.0078,
        "max_ms": 0.0071,
        "GB/s": 8.84,
        "TFLOPS": 0.57
    },
    {
        "params": {
            "M": 128,
            "N": 128,
            "K": 64,
            "block_m": 32,
            "block_n": 64,
            "block_k": 64,
            "dtype_str": "fp16",
            "num_warps": 4
        },
        "ms": 0.0074,
        "min_ms": 0.0078,
        "max_ms": 0.0071,
        "GB/s": 8.88,
        "TFLOPS": 0.57
    },
    {
        "params": {
            "M": 128,
            "N": 128,
            "K": 64,
            "block_m": 64,
            "block_n": 32,
            "block_k": 64,
            "dtype_str": "fp16",
            "num_warps": 4
        },
        "ms": 0.008,
        "min_ms": 0.0082,
        "max_ms": 0.0079,
        "GB/s": 8.21,
        "TFLOPS": 0.53
    },
    {
        "params": {
            "M": 128,
            "N": 128,
            "K": 64,
            "block_m": 64,
            "block_n": 64,
            "block_k": 64,
            "dtype_str": "fp16",
            "num_warps": 4
        },
        "ms": 0.0097,
        "min_ms": 0.0123,
        "max_ms": 0.0086,
        "GB/s": 6.73,
        "TFLOPS": 0.43
    },
    {
        "params": {
            "M": 128,
            "N": 128,
            "K": 64,
            "block_m": 128,
            "block_n": 32,
            "block_k": 64,
            "dtype_str": "fp16",
            "num_warps": 4
        },
        "ms": 0.0085,
        "min_ms": 0.0087,
        "max_ms": 0.0084,
        "GB/s": 7.67,
        "TFLOPS": 0.49
    },
    {
        "params": {
            "M": 128,
            "N": 128,
            "K": 64,
            "block_m": 128,
            "block_n": 64,
            "block_k": 64,
            "dtype_str": "fp16",
            "num_warps": 4
        },
        "ms": 0.0083,
        "min_ms": 0.0085,
        "max_ms": 0.0082,
        "GB/s": 7.9,
        "TFLOPS": 0.51
    },
    {
        "params": {
            "M": 128,
            "N": 256,
            "K": 64,
            "block_m": 32,
            "block_n": 32,
            "block_k": 64,
            "dtype_str": "fp16",
            "num_warps": 4
        },
        "ms": 0.0089,
        "min_ms": 0.009,
        "max_ms": 0.0088,
        "GB/s": 11.05,
        "TFLOPS": 0.94
    },
    {
        "params": {
            "M": 128,
            "N": 256,
            "K": 64,
            "block_m": 32,
            "block_n": 64,
            "block_k": 64,
            "dtype_str": "fp16",
            "num_warps": 4
        },
        "ms": 0.0087,
        "min_ms": 0.0089,
        "max_ms": 0.0087,
        "GB/s": 11.25,
        "TFLOPS": 0.96
    },
    {
        "params": {
            "M": 128,
            "N": 256,
            "K": 64,
            "block_m": 64,
            "block_n": 32,
            "block_k": 64,
            "dtype_str": "fp16",
            "num_warps": 4
        },
        "ms": 0.0106,
        "min_ms": 0.0108,
        "max_ms": 0.0105,
        "GB/s": 9.25,
        "TFLOPS": 0.79
    },
    {
        "params": {
            "M": 128,
            "N": 256,
            "K": 64,
            "block_m": 64,
            "block_n": 64,
            "block_k": 64,
            "dtype_str": "fp16",
            "num_warps": 4
        },
        "ms": 0.0099,
        "min_ms": 0.01,
        "max_ms": 0.0098,
        "GB/s": 9.93,
        "TFLOPS": 0.85
    },
    {
        "params": {
            "M": 128,
            "N": 256,
            "K": 64,
            "block_m": 128,
            "block_n": 32,
            "block_k": 64,
            "dtype_str": "fp16",
            "num_warps": 4
        },
        "ms": 0.0111,
        "min_ms": 0.0112,
        "max_ms": 0.011,
        "GB/s": 8.88,
        "TFLOPS": 0.76
    },
    {
        "params": {
            "M": 128,
            "N": 256,
            "K": 64,
            "block_m": 128,
            "block_n": 64,
            "block_k": 64,
            "dtype_str": "fp16",
            "num_warps": 4
        },
        "ms": 0.0103,
        "min_ms": 0.0105,
        "max_ms": 0.0102,
        "GB/s": 9.5,
        "TFLOPS": 0.81
    },
    {
        "params": {
            "M": 128,
            "N": 512,
            "K": 64,
            "block_m": 32,
            "block_n": 32,
            "block_k": 64,
            "dtype_str": "fp16",
            "num_warps": 4
        },
        "ms": 0.0129,
        "min_ms": 0.013,
        "max_ms": 0.0128,
        "GB/s": 12.69,
        "TFLOPS": 1.3
    },
    {
        "params": {
            "M": 128,
            "N": 512,
            "K": 64,
            "block_m": 32,
            "block_n": 64,
            "block_k": 64,
            "dtype_str": "fp16",
            "num_warps": 4
        },
        "ms": 0.0125,
        "min_ms": 0.0126,
        "max_ms": 0.0124,
        "GB/s": 13.14,
        "TFLOPS": 1.35
    },
    {
        "params": {
            "M": 128,
            "N": 512,
            "K": 64,
            "block_m": 64,
            "block_n": 32,
            "block_k": 64,
            "dtype_str": "fp16",
            "num_warps": 4
        },
        "ms": 0.016,
        "min_ms": 0.0162,
        "max_ms": 0.0159,
        "GB/s": 10.24,
        "TFLOPS": 1.05
    },
    {
        "params": {
            "M": 128,
            "N": 512,
            "K": 64,
            "block_m": 64,
            "block_n": 64,
            "block_k": 64,
            "dtype_str": "fp16",
            "num_warps": 4
        },
        "ms": 0.0142,
        "min_ms": 0.0144,
        "max_ms": 0.0141,
        "GB/s": 11.58,
        "TFLOPS": 1.19
    },
    {
        "params": {
            "M": 128,
            "N": 512,
            "K": 64,
            "block_m": 128,
            "block_n": 32,
            "block_k": 64,
            "dtype_str": "fp16",
            "num_warps": 4
        },
        "ms": 0.0166,
        "min_ms": 0.0167,
        "max_ms": 0.0164,
        "GB/s": 9.89,
        "TFLOPS": 1.01
    },
    {
        "params": {
            "M": 128,
            "N": 512,
            "K": 64,
            "block_m": 128,
            "block_n": 64,
            "block_k": 64,
            "dtype_str": "fp16",
            "num_warps": 4
        },
        "ms": 0.0146,
        "min_ms": 0.0147,
        "max_ms": 0.0145,
        "GB/s": 11.23,
        "TFLOPS": 1.15
    },
    {
        "params": {
            "M": 128,
            "N": 1024,
            "K": 64,
            "block_m": 32,
            "block_n": 32,
            "block_k": 64,
            "dtype_str": "fp16",
            "num_warps": 4
        },
        "ms": 0.0209,
        "min_ms": 0.0212,
        "max_ms": 0.0208,
        "GB/s": 14.09,
        "TFLOPS": 1.6
    },
    {
        "params": {
            "M": 128,
            "N": 1024,
            "K": 64,
            "block_m": 32,
            "block_n": 64,
            "block_k": 64,
            "dtype_str": "fp16",
            "num_warps": 4
        },
        "ms": 0.0198,
        "min_ms": 0.02,
        "max_ms": 0.0197,
        "GB/s": 14.86,
        "TFLOPS": 1.69
    },
    {
        "params": {
            "M": 128,
            "N": 1024,
            "K": 64,
            "block_m": 64,
            "block_n": 32,
            "block_k": 64,
            "dtype_str": "fp16",
            "num_warps": 4
        },
        "ms": 0.0267,
        "min_ms": 0.0269,
        "max_ms": 0.0266,
        "GB/s": 11.03,
        "TFLOPS": 1.25
    },
    {
        "params": {
            "M": 128,
            "N": 1024,
            "K": 64,
            "block_m": 64,
            "block_n": 64,
            "block_k": 64,
            "dtype_str": "fp16",
            "num_warps": 4
        },
        "ms": 0.0226,
        "min_ms": 0.0229,
        "max_ms": 0.0225,
        "GB/s": 13.07,
        "TFLOPS": 1.49
    },
    {
        "params": {
            "M": 128,
            "N": 1024,
            "K": 64,
            "block_m": 128,
            "block_n": 32,
            "block_k": 64,
            "dtype_str": "fp16",
            "num_warps": 4
        },
        "ms": 0.0273,
        "min_ms": 0.0275,
        "max_ms": 0.0271,
        "GB/s": 10.8,
        "TFLOPS": 1.23
    },
    {
        "params": {
            "M": 128,
            "N": 1024,
            "K": 64,
            "block_m": 128,
            "block_n": 64,
            "block_k": 64,
            "dtype_str": "fp16",
            "num_warps": 4
        },
        "ms": 0.0231,
        "min_ms": 0.0237,
        "max_ms": 0.0229,
        "GB/s": 12.77,
        "TFLOPS": 1.45
    },
    {
        "params": {
            "M": 256,
            "N": 128,
            "K": 64,
            "block_m": 32,
            "block_n": 32,
            "block_k": 64,
            "dtype_str": "fp16",
            "num_warps": 4
        },
        "ms": 0.0073,
        "min_ms": 0.0076,
        "max_ms": 0.0069,
        "GB/s": 13.55,
        "TFLOPS": 1.16
    },
    {
        "params": {
            "M": 256,
            "N": 128,
            "K": 64,
            "block_m": 32,
            "block_n": 64,
            "block_k": 64,
            "dtype_str": "fp16",
            "num_warps": 4
        },
        "ms": 0.0072,
        "min_ms": 0.0076,
        "max_ms": 0.0069,
        "GB/s": 13.62,
        "TFLOPS": 1.16
    },
    {
        "params": {
            "M": 256,
            "N": 128,
            "K": 64,
            "block_m": 64,
            "block_n": 32,
            "block_k": 64,
            "dtype_str": "fp16",
            "num_warps": 4
        },
        "ms": 0.008,
        "min_ms": 0.0081,
        "max_ms": 0.0079,
        "GB/s": 12.32,
        "TFLOPS": 1.05
    },
    {
        "params": {
            "M": 256,
            "N": 128,
            "K": 64,
            "block_m": 64,
            "block_n": 64,
            "block_k": 64,
            "dtype_str": "fp16",
            "num_warps": 4
        },
        "ms": 0.0078,
        "min_ms": 0.008,
        "max_ms": 0.0077,
        "GB/s": 12.57,
        "TFLOPS": 1.07
    },
    {
        "params": {
            "M": 256,
            "N": 128,
            "K": 64,
            "block_m": 128,
            "block_n": 32,
            "block_k": 64,
            "dtype_str": "fp16",
            "num_warps": 4
        },
        "ms": 0.0084,
        "min_ms": 0.0085,
        "max_ms": 0.0083,
        "GB/s": 11.68,
        "TFLOPS": 1.0
    },
    {
        "params": {
            "M": 256,
            "N": 128,
            "K": 64,
            "block_m": 128,
            "block_n": 64,
            "block_k": 64,
            "dtype_str": "fp16",
            "num_warps": 4
        },
        "ms": 0.0082,
        "min_ms": 0.0084,
        "max_ms": 0.0081,
        "GB/s": 11.96,
        "TFLOPS": 1.02
    },
    {
        "params": {
            "M": 256,
            "N": 256,
            "K": 64,
            "block_m": 32,
            "block_n": 32,
            "block_k": 64,
            "dtype_str": "fp16",
            "num_warps": 4
        },
        "ms": 0.009,
        "min_ms": 0.0091,
        "max_ms": 0.0089,
        "GB/s": 14.6,
        "TFLOPS": 1.87
    },
    {
        "params": {
            "M": 256,
            "N": 256,
            "K": 64,
            "block_m": 32,
            "block_n": 64,
            "block_k": 64,
            "dtype_str": "fp16",
            "num_warps": 4
        },
        "ms": 0.0088,
        "min_ms": 0.0091,
        "max_ms": 0.0087,
        "GB/s": 14.86,
        "TFLOPS": 1.9
    },
    {
        "params": {
            "M": 256,
            "N": 256,
            "K": 64,
            "block_m": 64,
            "block_n": 32,
            "block_k": 64,
            "dtype_str": "fp16",
            "num_warps": 4
        },
        "ms": 0.0107,
        "min_ms": 0.0108,
        "max_ms": 0.0105,
        "GB/s": 12.29,
        "TFLOPS": 1.57
    },
    {
        "params": {
            "M": 256,
            "N": 256,
            "K": 64,
            "block_m": 64,
            "block_n": 64,
            "block_k": 64,
            "dtype_str": "fp16",
            "num_warps": 4
        },
        "ms": 0.0099,
        "min_ms": 0.0101,
        "max_ms": 0.0099,
        "GB/s": 13.18,
        "TFLOPS": 1.69
    },
    {
        "params": {
            "M": 256,
            "N": 256,
            "K": 64,
            "block_m": 128,
            "block_n": 32,
            "block_k": 64,
            "dtype_str": "fp16",
            "num_warps": 4
        },
        "ms": 0.0111,
        "min_ms": 0.0113,
        "max_ms": 0.011,
        "GB/s": 11.8,
        "TFLOPS": 1.51
    },
    {
        "params": {
            "M": 256,
            "N": 256,
            "K": 64,
            "block_m": 128,
            "block_n": 64,
            "block_k": 64,
            "dtype_str": "fp16",
            "num_warps": 4
        },
        "ms": 0.0104,
        "min_ms": 0.0106,
        "max_ms": 0.0103,
        "GB/s": 12.62,
        "TFLOPS": 1.62
    },
    {
        "params": {
            "M": 256,
            "N": 512,
            "K": 64,
            "block_m": 32,
            "block_n": 32,
            "block_k": 64,
            "dtype_str": "fp16",
            "num_warps": 4
        },
        "ms": 0.013,
        "min_ms": 0.0132,
        "max_ms": 0.0129,
        "GB/s": 15.09,
        "TFLOPS": 2.58
    },
    {
        "params": {
            "M": 256,
            "N": 512,
            "K": 64,
            "block_m": 32,
            "block_n": 64,
            "block_k": 64,
            "dtype_str": "fp16",
            "num_warps": 4
        },
        "ms": 0.0126,
        "min_ms": 0.0129,
        "max_ms": 0.0125,
        "GB/s": 15.62,
        "TFLOPS": 2.67
    },
    {
        "params": {
            "M": 256,
            "N": 512,
            "K": 64,
            "block_m": 64,
            "block_n": 32,
            "block_k": 64,
            "dtype_str": "fp16",
            "num_warps": 4
        },
        "ms": 0.0161,
        "min_ms": 0.0162,
        "max_ms": 0.016,
        "GB/s": 12.23,
        "TFLOPS": 2.09
    },
    {
        "params": {
            "M": 256,
            "N": 512,
            "K": 64,
            "block_m": 64,
            "block_n": 64,
            "block_k": 64,
            "dtype_str": "fp16",
            "num_warps": 4
        },
        "ms": 0.0142,
        "min_ms": 0.0143,
        "max_ms": 0.0141,
        "GB/s": 13.89,
        "TFLOPS": 2.37
    },
    {
        "params": {
            "M": 256,
            "N": 512,
            "K": 64,
            "block_m": 128,
            "block_n": 32,
            "block_k": 64,
            "dtype_str": "fp16",
            "num_warps": 4
        },
        "ms": 0.0165,
        "min_ms": 0.0167,
        "max_ms": 0.0164,
        "GB/s": 11.9,
        "TFLOPS": 2.03
    },
    {
        "params": {
            "M": 256,
            "N": 512,
            "K": 64,
            "block_m": 128,
            "block_n": 64,
            "block_k": 64,
            "dtype_str": "fp16",
            "num_warps": 4
        },
        "ms": 0.0146,
        "min_ms": 0.0148,
        "max_ms": 0.0145,
        "GB/s": 13.47,
        "TFLOPS": 2.3
    },
    {
        "params": {
            "M": 256,
            "N": 1024,
            "K": 64,
            "block_m": 32,
            "block_n": 32,
            "block_k": 64,
            "dtype_str": "fp16",
            "num_warps": 4
        },
        "ms": 0.0211,
        "min_ms": 0.0213,
        "max_ms": 0.021,
        "GB/s": 15.54,
        "TFLOPS": 3.18
    },
    {
        "params": {
            "M": 256,
            "N": 1024,
            "K": 64,
            "block_m": 32,
            "block_n": 64,
            "block_k": 64,
            "dtype_str": "fp16",
            "num_warps": 4
        },
        "ms": 0.02,
        "min_ms": 0.0202,
        "max_ms": 0.0198,
        "GB/s": 16.41,
        "TFLOPS": 3.36
    },
    {
        "params": {
            "M": 256,
            "N": 1024,
            "K": 64,
            "block_m": 64,
            "block_n": 32,
            "block_k": 64,
            "dtype_str": "fp16",
            "num_warps": 4
        },
        "ms": 0.0268,
        "min_ms": 0.027,
        "max_ms": 0.0267,
        "GB/s": 12.22,
        "TFLOPS": 2.5
    },
    {
        "params": {
            "M": 256,
            "N": 1024,
            "K": 64,
            "block_m": 64,
            "block_n": 64,
            "block_k": 64,
            "dtype_str": "fp16",
            "num_warps": 4
        },
        "ms": 0.0226,
        "min_ms": 0.023,
        "max_ms": 0.0225,
        "GB/s": 14.49,
        "TFLOPS": 2.97
    },
    {
        "params": {
            "M": 256,
            "N": 1024,
            "K": 64,
            "block_m": 128,
            "block_n": 32,
            "block_k": 64,
            "dtype_str": "fp16",
            "num_warps": 4
        },
        "ms": 0.0272,
        "min_ms": 0.0273,
        "max_ms": 0.0271,
        "GB/s": 12.06,
        "TFLOPS": 2.47
    },
    {
        "params": {
            "M": 256,
            "N": 1024,
            "K": 64,
            "block_m": 128,
            "block_n": 64,
            "block_k": 64,
            "dtype_str": "fp16",
            "num_warps": 4
        },
        "ms": 0.0231,
        "min_ms": 0.0238,
        "max_ms": 0.0229,
        "GB/s": 14.19,
        "TFLOPS": 2.91
    },
    {
        "params": {
            "M": 512,
            "N": 128,
            "K": 64,
            "block_m": 32,
            "block_n": 32,
            "block_k": 64,
            "dtype_str": "fp16",
            "num_warps": 4
        },
        "ms": 0.0073,
        "min_ms": 0.0077,
        "max_ms": 0.007,
        "GB/s": 22.33,
        "TFLOPS": 2.29
    },
    {
        "params": {
            "M": 512,
            "N": 128,
            "K": 64,
            "block_m": 32,
            "block_n": 64,
            "block_k": 64,
            "dtype_str": "fp16",
            "num_warps": 4
        },
        "ms": 0.0074,
        "min_ms": 0.0077,
        "max_ms": 0.007,
        "GB/s": 22.21,
        "TFLOPS": 2.27
    },
    {
        "params": {
            "M": 512,
            "N": 128,
            "K": 64,
            "block_m": 64,
            "block_n": 32,
            "block_k": 64,
            "dtype_str": "fp16",
            "num_warps": 4
        },
        "ms": 0.0081,
        "min_ms": 0.0083,
        "max_ms": 0.008,
        "GB/s": 20.13,
        "TFLOPS": 2.06
    },
    {
        "params": {
            "M": 512,
            "N": 128,
            "K": 64,
            "block_m": 64,
            "block_n": 64,
            "block_k": 64,
            "dtype_str": "fp16",
            "num_warps": 4
        },
        "ms": 0.0079,
        "min_ms": 0.0081,
        "max_ms": 0.0078,
        "GB/s": 20.64,
        "TFLOPS": 2.11
    },
    {
        "params": {
            "M": 512,
            "N": 128,
            "K": 64,
            "block_m": 128,
            "block_n": 32,
            "block_k": 64,
            "dtype_str": "fp16",
            "num_warps": 4
        },
        "ms": 0.0085,
        "min_ms": 0.0086,
        "max_ms": 0.0084,
        "GB/s": 19.37,
        "TFLOPS": 1.98
    },
    {
        "params": {
            "M": 512,
            "N": 128,
            "K": 64,
            "block_m": 128,
            "block_n": 64,
            "block_k": 64,
            "dtype_str": "fp16",
            "num_warps": 4
        },
        "ms": 0.0083,
        "min_ms": 0.0084,
        "max_ms": 0.0082,
        "GB/s": 19.84,
        "TFLOPS": 2.03
    },
    {
        "params": {
            "M": 512,
            "N": 256,
            "K": 64,
            "block_m": 32,
            "block_n": 32,
            "block_k": 64,
            "dtype_str": "fp16",
            "num_warps": 4
        },
        "ms": 0.009,
        "min_ms": 0.0093,
        "max_ms": 0.0089,
        "GB/s": 21.79,
        "TFLOPS": 3.72
    },
    {
        "params": {
            "M": 512,
            "N": 256,
            "K": 64,
            "block_m": 32,
            "block_n": 64,
            "block_k": 64,
            "dtype_str": "fp16",
            "num_warps": 4
        },
        "ms": 0.0089,
        "min_ms": 0.0091,
        "max_ms": 0.0088,
        "GB/s": 22.19,
        "TFLOPS": 3.79
    },
    {
        "params": {
            "M": 512,
            "N": 256,
            "K": 64,
            "block_m": 64,
            "block_n": 32,
            "block_k": 64,
            "dtype_str": "fp16",
            "num_warps": 4
        },
        "ms": 0.0108,
        "min_ms": 0.011,
        "max_ms": 0.0107,
        "GB/s": 18.16,
        "TFLOPS": 3.1
    },
    {
        "params": {
            "M": 512,
            "N": 256,
            "K": 64,
            "block_m": 64,
            "block_n": 64,
            "block_k": 64,
            "dtype_str": "fp16",
            "num_warps": 4
        },
        "ms": 0.0101,
        "min_ms": 0.0103,
        "max_ms": 0.0099,
        "GB/s": 19.54,
        "TFLOPS": 3.33
    },
    {
        "params": {
            "M": 512,
            "N": 256,
            "K": 64,
            "block_m": 128,
            "block_n": 32,
            "block_k": 64,
            "dtype_str": "fp16",
            "num_warps": 4
        },
        "ms": 0.0111,
        "min_ms": 0.0113,
        "max_ms": 0.0111,
        "GB/s": 17.64,
        "TFLOPS": 3.01
    },
    {
        "params": {
            "M": 512,
            "N": 256,
            "K": 64,
            "block_m": 128,
            "block_n": 64,
            "block_k": 64,
            "dtype_str": "fp16",
            "num_warps": 4
        },
        "ms": 0.0104,
        "min_ms": 0.0105,
        "max_ms": 0.0103,
        "GB/s": 18.93,
        "TFLOPS": 3.23
    },
    {
        "params": {
            "M": 512,
            "N": 512,
            "K": 64,
            "block_m": 32,
            "block_n": 32,
            "block_k": 64,
            "dtype_str": "fp16",
            "num_warps": 4
        },
        "ms": 0.013,
        "min_ms": 0.0131,
        "max_ms": 0.0129,
        "GB/s": 20.18,
        "TFLOPS": 5.17
    },
    {
        "params": {
            "M": 512,
            "N": 512,
            "K": 64,
            "block_m": 32,
            "block_n": 64,
            "block_k": 64,
            "dtype_str": "fp16",
            "num_warps": 4
        },
        "ms": 0.0125,
        "min_ms": 0.0127,
        "max_ms": 0.0124,
        "GB/s": 20.96,
        "TFLOPS": 5.36
    },
    {
        "params": {
            "M": 512,
            "N": 512,
            "K": 64,
            "block_m": 64,
            "block_n": 32,
            "block_k": 64,
            "dtype_str": "fp16",
            "num_warps": 4
        },
        "ms": 0.0162,
        "min_ms": 0.0164,
        "max_ms": 0.0161,
        "GB/s": 16.18,
        "TFLOPS": 4.14
    },
    {
        "params": {
            "M": 512,
            "N": 512,
            "K": 64,
            "block_m": 64,
            "block_n": 64,
            "block_k": 64,
            "dtype_str": "fp16",
            "num_warps": 4
        },
        "ms": 0.0142,
        "min_ms": 0.0144,
        "max_ms": 0.0142,
        "GB/s": 18.42,
        "TFLOPS": 4.72
    },
    {
        "params": {
            "M": 512,
            "N": 512,
            "K": 64,
            "block_m": 128,
            "block_n": 32,
            "block_k": 64,
            "dtype_str": "fp16",
            "num_warps": 4
        },
        "ms": 0.0165,
        "min_ms": 0.0167,
        "max_ms": 0.0164,
        "GB/s": 15.87,
        "TFLOPS": 4.06
    },
    {
        "params": {
            "M": 512,
            "N": 512,
            "K": 64,
            "block_m": 128,
            "block_n": 64,
            "block_k": 64,
            "dtype_str": "fp16",
            "num_warps": 4
        },
        "ms": 0.0146,
        "min_ms": 0.0147,
        "max_ms": 0.0145,
        "GB/s": 18.01,
        "TFLOPS": 4.61
    },
    {
        "params": {
            "M": 512,
            "N": 1024,
            "K": 64,
            "block_m": 32,
            "block_n": 32,
            "block_k": 64,
            "dtype_str": "fp16",
            "num_warps": 4
        },
        "ms": 0.021,
        "min_ms": 0.0212,
        "max_ms": 0.0208,
        "GB/s": 18.75,
        "TFLOPS": 6.4
    },
    {
        "params": {
            "M": 512,
            "N": 1024,
            "K": 64,
            "block_m": 32,
            "block_n": 64,
            "block_k": 64,
            "dtype_str": "fp16",
            "num_warps": 4
        },
        "ms": 0.0199,
        "min_ms": 0.02,
        "max_ms": 0.0198,
        "GB/s": 19.77,
        "TFLOPS": 6.75
    },
    {
        "params": {
            "M": 512,
            "N": 1024,
            "K": 64,
            "block_m": 64,
            "block_n": 32,
            "block_k": 64,
            "dtype_str": "fp16",
            "num_warps": 4
        },
        "ms": 0.027,
        "min_ms": 0.0271,
        "max_ms": 0.0269,
        "GB/s": 14.57,
        "TFLOPS": 4.97
    },
    {
        "params": {
            "M": 512,
            "N": 1024,
            "K": 64,
            "block_m": 64,
            "block_n": 64,
            "block_k": 64,
            "dtype_str": "fp16",
            "num_warps": 4
        },
        "ms": 0.0227,
        "min_ms": 0.0231,
        "max_ms": 0.0226,
        "GB/s": 17.33,
        "TFLOPS": 5.91
    },
    {
        "params": {
            "M": 512,
            "N": 1024,
            "K": 64,
            "block_m": 128,
            "block_n": 32,
            "block_k": 64,
            "dtype_str": "fp16",
            "num_warps": 4
        },
        "ms": 0.0272,
        "min_ms": 0.0274,
        "max_ms": 0.0271,
        "GB/s": 14.47,
        "TFLOPS": 4.94
    },
    {
        "params": {
            "M": 512,
            "N": 1024,
            "K": 64,
            "block_m": 128,
            "block_n": 64,
            "block_k": 64,
            "dtype_str": "fp16",
            "num_warps": 4
        },
        "ms": 0.023,
        "min_ms": 0.0231,
        "max_ms": 0.0229,
        "GB/s": 17.12,
        "TFLOPS": 5.84
    },
    {
        "params": {
            "M": 1024,
            "N": 128,
            "K": 64,
            "block_m": 32,
            "block_n": 32,
            "block_k": 64,
            "dtype_str": "fp16",
            "num_warps": 4
        },
        "ms": 0.0073,
        "min_ms": 0.0077,
        "max_ms": 0.007,
        "GB/s": 40.42,
        "TFLOPS": 4.6
    },
    {
        "params": {
            "M": 1024,
            "N": 128,
            "K": 64,
            "block_m": 32,
            "block_n": 64,
            "block_k": 64,
            "dtype_str": "fp16",
            "num_warps": 4
        },
        "ms": 0.0073,
        "min_ms": 0.0077,
        "max_ms": 0.007,
        "GB/s": 40.2,
        "TFLOPS": 4.57
    },
    {
        "params": {
            "M": 1024,
            "N": 128,
            "K": 64,
            "block_m": 64,
            "block_n": 32,
            "block_k": 64,
            "dtype_str": "fp16",
            "num_warps": 4
        },
        "ms": 0.0081,
        "min_ms": 0.0083,
        "max_ms": 0.008,
        "GB/s": 36.41,
        "TFLOPS": 4.14
    },
    {
        "params": {
            "M": 1024,
            "N": 128,
            "K": 64,
            "block_m": 64,
            "block_n": 64,
            "block_k": 64,
            "dtype_str": "fp16",
            "num_warps": 4
        },
        "ms": 0.0079,
        "min_ms": 0.0081,
        "max_ms": 0.0079,
        "GB/s": 37.15,
        "TFLOPS": 4.23
    },
    {
        "params": {
            "M": 1024,
            "N": 128,
            "K": 64,
            "block_m": 128,
            "block_n": 32,
            "block_k": 64,
            "dtype_str": "fp16",
            "num_warps": 4
        },
        "ms": 0.0086,
        "min_ms": 0.0087,
        "max_ms": 0.0085,
        "GB/s": 34.37,
        "TFLOPS": 3.91
    },
    {
        "params": {
            "M": 1024,
            "N": 128,
            "K": 64,
            "block_m": 128,
            "block_n": 64,
            "block_k": 64,
            "dtype_str": "fp16",
            "num_warps": 4
        },
        "ms": 0.0084,
        "min_ms": 0.0086,
        "max_ms": 0.0083,
        "GB/s": 35.03,
        "TFLOPS": 3.99
    },
    {
        "params": {
            "M": 1024,
            "N": 256,
            "K": 64,
            "block_m": 32,
            "block_n": 32,
            "block_k": 64,
            "dtype_str": "fp16",
            "num_warps": 4
        },
        "ms": 0.009,
        "min_ms": 0.0093,
        "max_ms": 0.0089,
        "GB/s": 36.33,
        "TFLOPS": 7.44
    },
    {
        "params": {
            "M": 1024,
            "N": 256,
            "K": 64,
            "block_m": 32,
            "block_n": 64,
            "block_k": 64,
            "dtype_str": "fp16",
            "num_warps": 4
        },
        "ms": 0.0089,
        "min_ms": 0.0091,
        "max_ms": 0.0088,
        "GB/s": 36.98,
        "TFLOPS": 7.57
    },
    {
        "params": {
            "M": 1024,
            "N": 256,
            "K": 64,
            "block_m": 64,
            "block_n": 32,
            "block_k": 64,
            "dtype_str": "fp16",
            "num_warps": 4
        },
        "ms": 0.0108,
        "min_ms": 0.011,
        "max_ms": 0.0107,
        "GB/s": 30.38,
        "TFLOPS": 6.22
    },
    {
        "params": {
            "M": 1024,
            "N": 256,
            "K": 64,
            "block_m": 64,
            "block_n": 64,
            "block_k": 64,
            "dtype_str": "fp16",
            "num_warps": 4
        },
        "ms": 0.0101,
        "min_ms": 0.0104,
        "max_ms": 0.0099,
        "GB/s": 32.43,
        "TFLOPS": 6.64
    },
    {
        "params": {
            "M": 1024,
            "N": 256,
            "K": 64,
            "block_m": 128,
            "block_n": 32,
            "block_k": 64,
            "dtype_str": "fp16",
            "num_warps": 4
        },
        "ms": 0.0113,
        "min_ms": 0.0115,
        "max_ms": 0.0112,
        "GB/s": 29.09,
        "TFLOPS": 5.96
    },
    {
        "params": {
            "M": 1024,
            "N": 256,
            "K": 64,
            "block_m": 128,
            "block_n": 64,
            "block_k": 64,
            "dtype_str": "fp16",
            "num_warps": 4
        },
        "ms": 0.0105,
        "min_ms": 0.0107,
        "max_ms": 0.0104,
        "GB/s": 31.08,
        "TFLOPS": 6.36
    },
    {
        "params": {
            "M": 1024,
            "N": 512,
            "K": 64,
            "block_m": 32,
            "block_n": 32,
            "block_k": 64,
            "dtype_str": "fp16",
            "num_warps": 4
        },
        "ms": 0.0129,
        "min_ms": 0.0131,
        "max_ms": 0.0128,
        "GB/s": 30.46,
        "TFLOPS": 10.4
    },
    {
        "params": {
            "M": 1024,
            "N": 512,
            "K": 64,
            "block_m": 32,
            "block_n": 64,
            "block_k": 64,
            "dtype_str": "fp16",
            "num_warps": 4
        },
        "ms": 0.0125,
        "min_ms": 0.0127,
        "max_ms": 0.0124,
        "GB/s": 31.54,
        "TFLOPS": 10.76
    },
    {
        "params": {
            "M": 1024,
            "N": 512,
            "K": 64,
            "block_m": 64,
            "block_n": 32,
            "block_k": 64,
            "dtype_str": "fp16",
            "num_warps": 4
        },
        "ms": 0.0161,
        "min_ms": 0.0164,
        "max_ms": 0.016,
        "GB/s": 24.4,
        "TFLOPS": 8.33
    },
    {
        "params": {
            "M": 1024,
            "N": 512,
            "K": 64,
            "block_m": 64,
            "block_n": 64,
            "block_k": 64,
            "dtype_str": "fp16",
            "num_warps": 4
        },
        "ms": 0.0142,
        "min_ms": 0.0144,
        "max_ms": 0.0142,
        "GB/s": 27.63,
        "TFLOPS": 9.43
    },
    {
        "params": {
            "M": 1024,
            "N": 512,
            "K": 64,
            "block_m": 128,
            "block_n": 32,
            "block_k": 64,
            "dtype_str": "fp16",
            "num_warps": 4
        },
        "ms": 0.0166,
        "min_ms": 0.0168,
        "max_ms": 0.0165,
        "GB/s": 23.63,
        "TFLOPS": 8.07
    },
    {
        "params": {
            "M": 1024,
            "N": 512,
            "K": 64,
            "block_m": 128,
            "block_n": 64,
            "block_k": 64,
            "dtype_str": "fp16",
            "num_warps": 4
        },
        "ms": 0.0147,
        "min_ms": 0.0149,
        "max_ms": 0.0146,
        "GB/s": 26.72,
        "TFLOPS": 9.12
    },
    {
        "params": {
            "M": 1024,
            "N": 1024,
            "K": 64,
            "block_m": 32,
            "block_n": 32,
            "block_k": 64,
            "dtype_str": "fp16",
            "num_warps": 4
        },
        "ms": 0.021,
        "min_ms": 0.0212,
        "max_ms": 0.0208,
        "GB/s": 25.0,
        "TFLOPS": 12.8
    },
    {
        "params": {
            "M": 1024,
            "N": 1024,
            "K": 64,
            "block_m": 32,
            "block_n": 64,
            "block_k": 64,
            "dtype_str": "fp16",
            "num_warps": 4
        },
        "ms": 0.0199,
        "min_ms": 0.0202,
        "max_ms": 0.0198,
        "GB/s": 26.31,
        "TFLOPS": 13.47
    },
    {
        "params": {
            "M": 1024,
            "N": 1024,
            "K": 64,
            "block_m": 64,
            "block_n": 32,
            "block_k": 64,
            "dtype_str": "fp16",
            "num_warps": 4
        },
        "ms": 0.0269,
        "min_ms": 0.0271,
        "max_ms": 0.0268,
        "GB/s": 19.46,
        "TFLOPS": 9.96
    },
    {
        "params": {
            "M": 1024,
            "N": 1024,
            "K": 64,
            "block_m": 64,
            "block_n": 64,
            "block_k": 64,
            "dtype_str": "fp16",
            "num_warps": 4
        },
        "ms": 0.0228,
        "min_ms": 0.0231,
        "max_ms": 0.0227,
        "GB/s": 23.02,
        "TFLOPS": 11.79
    },
    {
        "params": {
            "M": 1024,
            "N": 1024,
            "K": 64,
            "block_m": 128,
            "block_n": 32,
            "block_k": 64,
            "dtype_str": "fp16",
            "num_warps": 4
        },
        "ms": 0.0274,
        "min_ms": 0.0276,
        "max_ms": 0.0273,
        "GB/s": 19.12,
        "TFLOPS": 9.79
    },
    {
        "params": {
            "M": 1024,
            "N": 1024,
            "K": 64,
            "block_m": 128,
            "block_n": 64,
            "block_k": 64,
            "dtype_str": "fp16",
            "num_warps": 4
        },
        "ms": 0.0232,
        "min_ms": 0.0235,
        "max_ms": 0.0231,
        "GB/s": 22.59,
        "TFLOPS": 11.56
    },
    {
        "params": {
            "M": 2048,
            "N": 128,
            "K": 64,
            "block_m": 32,
            "block_n": 32,
            "block_k": 64,
            "dtype_str": "fp16",
            "num_warps": 4
        },
        "ms": 0.0073,
        "min_ms": 0.0077,
        "max_ms": 0.007,
        "GB/s": 76.34,
        "TFLOPS": 9.2
    },
    {
        "params": {
            "M": 2048,
            "N": 128,
            "K": 64,
            "block_m": 32,
            "block_n": 64,
            "block_k": 64,
            "dtype_str": "fp16",
            "num_warps": 4
        },
        "ms": 0.0073,
        "min_ms": 0.0077,
        "max_ms": 0.0071,
        "GB/s": 76.34,
        "TFLOPS": 9.2
    },
    {
        "params": {
            "M": 2048,
            "N": 128,
            "K": 64,
            "block_m": 64,
            "block_n": 32,
            "block_k": 64,
            "dtype_str": "fp16",
            "num_warps": 4
        },
        "ms": 0.0081,
        "min_ms": 0.0083,
        "max_ms": 0.008,
        "GB/s": 68.44,
        "TFLOPS": 8.25
    },
    {
        "params": {
            "M": 2048,
            "N": 128,
            "K": 64,
            "block_m": 64,
            "block_n": 64,
            "block_k": 64,
            "dtype_str": "fp16",
            "num_warps": 4
        },
        "ms": 0.008,
        "min_ms": 0.0083,
        "max_ms": 0.0079,
        "GB/s": 69.48,
        "TFLOPS": 8.37
    },
    {
        "params": {
            "M": 2048,
            "N": 128,
            "K": 64,
            "block_m": 128,
            "block_n": 32,
            "block_k": 64,
            "dtype_str": "fp16",
            "num_warps": 4
        },
        "ms": 0.0086,
        "min_ms": 0.0089,
        "max_ms": 0.0085,
        "GB/s": 64.62,
        "TFLOPS": 7.79
    },
    {
        "params": {
            "M": 2048,
            "N": 128,
            "K": 64,
            "block_m": 128,
            "block_n": 64,
            "block_k": 64,
            "dtype_str": "fp16",
            "num_warps": 4
        },
        "ms": 0.0085,
        "min_ms": 0.0087,
        "max_ms": 0.0083,
        "GB/s": 65.85,
        "TFLOPS": 7.93
    },
    {
        "params": {
            "M": 2048,
            "N": 256,
            "K": 64,
            "block_m": 32,
            "block_n": 32,
            "block_k": 64,
            "dtype_str": "fp16",
            "num_warps": 4
        },
        "ms": 0.0091,
        "min_ms": 0.0093,
        "max_ms": 0.009,
        "GB/s": 64.81,
        "TFLOPS": 14.75
    },
    {
        "params": {
            "M": 2048,
            "N": 256,
            "K": 64,
            "block_m": 32,
            "block_n": 64,
            "block_k": 64,
            "dtype_str": "fp16",
            "num_warps": 4
        },
        "ms": 0.0089,
        "min_ms": 0.0092,
        "max_ms": 0.0088,
        "GB/s": 65.97,
        "TFLOPS": 15.01
    },
    {
        "params": {
            "M": 2048,
            "N": 256,
            "K": 64,
            "block_m": 64,
            "block_n": 32,
            "block_k": 64,
            "dtype_str": "fp16",
            "num_warps": 4
        },
        "ms": 0.0108,
        "min_ms": 0.011,
        "max_ms": 0.0107,
        "GB/s": 54.69,
        "TFLOPS": 12.44
    },
    {
        "params": {
            "M": 2048,
            "N": 256,
            "K": 64,
            "block_m": 64,
            "block_n": 64,
            "block_k": 64,
            "dtype_str": "fp16",
            "num_warps": 4
        },
        "ms": 0.0101,
        "min_ms": 0.0104,
        "max_ms": 0.01,
        "GB/s": 58.38,
        "TFLOPS": 13.28
    },
    {
        "params": {
            "M": 2048,
            "N": 256,
            "K": 64,
            "block_m": 128,
            "block_n": 32,
            "block_k": 64,
            "dtype_str": "fp16",
            "num_warps": 4
        },
        "ms": 0.0113,
        "min_ms": 0.0114,
        "max_ms": 0.0112,
        "GB/s": 52.35,
        "TFLOPS": 11.91
    },
    {
        "params": {
            "M": 2048,
            "N": 256,
            "K": 64,
            "block_m": 128,
            "block_n": 64,
            "block_k": 64,
            "dtype_str": "fp16",
            "num_warps": 4
        },
        "ms": 0.0106,
        "min_ms": 0.0108,
        "max_ms": 0.0105,
        "GB/s": 55.73,
        "TFLOPS": 12.68
    },
    {
        "params": {
            "M": 2048,
            "N": 512,
            "K": 64,
            "block_m": 32,
            "block_n": 32,
            "block_k": 64,
            "dtype_str": "fp16",
            "num_warps": 4
        },
        "ms": 0.013,
        "min_ms": 0.0133,
        "max_ms": 0.0129,
        "GB/s": 50.3,
        "TFLOPS": 20.6
    },
    {
        "params": {
            "M": 2048,
            "N": 512,
            "K": 64,
            "block_m": 32,
            "block_n": 64,
            "block_k": 64,
            "dtype_str": "fp16",
            "num_warps": 4
        },
        "ms": 0.0126,
        "min_ms": 0.0128,
        "max_ms": 0.0125,
        "GB/s": 51.89,
        "TFLOPS": 21.26
    },
    {
        "params": {
            "M": 2048,
            "N": 512,
            "K": 64,
            "block_m": 64,
            "block_n": 32,
            "block_k": 64,
            "dtype_str": "fp16",
            "num_warps": 4
        },
        "ms": 0.0162,
        "min_ms": 0.0164,
        "max_ms": 0.016,
        "GB/s": 40.56,
        "TFLOPS": 16.61
    },
    {
        "params": {
            "M": 2048,
            "N": 512,
            "K": 64,
            "block_m": 64,
            "block_n": 64,
            "block_k": 64,
            "dtype_str": "fp16",
            "num_warps": 4
        },
        "ms": 0.0143,
        "min_ms": 0.0145,
        "max_ms": 0.0142,
        "GB/s": 45.79,
        "TFLOPS": 18.75
    },
    {
        "params": {
            "M": 2048,
            "N": 512,
            "K": 64,
            "block_m": 128,
            "block_n": 32,
            "block_k": 64,
            "dtype_str": "fp16",
            "num_warps": 4
        },
        "ms": 0.0166,
        "min_ms": 0.0168,
        "max_ms": 0.0165,
        "GB/s": 39.48,
        "TFLOPS": 16.17
    },
    {
        "params": {
            "M": 2048,
            "N": 512,
            "K": 64,
            "block_m": 128,
            "block_n": 64,
            "block_k": 64,
            "dtype_str": "fp16",
            "num_warps": 4
        },
        "ms": 0.0148,
        "min_ms": 0.015,
        "max_ms": 0.0146,
        "GB/s": 44.42,
        "TFLOPS": 18.19
    },
    {
        "params": {
            "M": 2048,
            "N": 1024,
            "K": 64,
            "block_m": 32,
            "block_n": 32,
            "block_k": 64,
            "dtype_str": "fp16",
            "num_warps": 4
        },
        "ms": 0.021,
        "min_ms": 0.0214,
        "max_ms": 0.021,
        "GB/s": 37.36,
        "TFLOPS": 25.51
    },
    {
        "params": {
            "M": 2048,
            "N": 1024,
            "K": 64,
            "block_m": 32,
            "block_n": 64,
            "block_k": 64,
            "dtype_str": "fp16",
            "num_warps": 4
        },
        "ms": 0.02,
        "min_ms": 0.0202,
        "max_ms": 0.0199,
        "GB/s": 39.23,
        "TFLOPS": 26.78
    },
    {
        "params": {
            "M": 2048,
            "N": 1024,
            "K": 64,
            "block_m": 64,
            "block_n": 32,
            "block_k": 64,
            "dtype_str": "fp16",
            "num_warps": 4
        },
        "ms": 0.0269,
        "min_ms": 0.0271,
        "max_ms": 0.0268,
        "GB/s": 29.23,
        "TFLOPS": 19.96
    },
    {
        "params": {
            "M": 2048,
            "N": 1024,
            "K": 64,
            "block_m": 64,
            "block_n": 64,
            "block_k": 64,
            "dtype_str": "fp16",
            "num_warps": 4
        },
        "ms": 0.0228,
        "min_ms": 0.023,
        "max_ms": 0.0227,
        "GB/s": 34.53,
        "TFLOPS": 23.57
    },
    {
        "params": {
            "M": 2048,
            "N": 1024,
            "K": 64,
            "block_m": 128,
            "block_n": 32,
            "block_k": 64,
            "dtype_str": "fp16",
            "num_warps": 4
        },
        "ms": 0.0273,
        "min_ms": 0.0275,
        "max_ms": 0.0272,
        "GB/s": 28.76,
        "TFLOPS": 19.64
    },
    {
        "params": {
            "M": 2048,
            "N": 1024,
            "K": 64,
            "block_m": 128,
            "block_n": 64,
            "block_k": 64,
            "dtype_str": "fp16",
            "num_warps": 4
        },
        "ms": 0.0232,
        "min_ms": 0.0233,
        "max_ms": 0.0231,
        "GB/s": 33.88,
        "TFLOPS": 23.13
    },
    {
        "params": {
            "M": 64,
            "N": 64,
            "K": 128,
            "block_m": 16,
            "block_n": 16,
            "block_k": 128,
            "dtype_str": "fp16",
            "num_warps": 4
        },
        "ms": 0.0073,
        "min_ms": 0.0077,
        "max_ms": 0.007,
        "GB/s": 8.93,
        "TFLOPS": 0.29
    },
    {
        "params": {
            "M": 64,
            "N": 64,
            "K": 128,
            "block_m": 16,
            "block_n": 32,
            "block_k": 128,
            "dtype_str": "fp16",
            "num_warps": 4
        },
        "ms": 0.0073,
        "min_ms": 0.0076,
        "max_ms": 0.0069,
        "GB/s": 9.03,
        "TFLOPS": 0.29
    },
    {
        "params": {
            "M": 64,
            "N": 64,
            "K": 128,
            "block_m": 32,
            "block_n": 16,
            "block_k": 128,
            "dtype_str": "fp16",
            "num_warps": 4
        },
        "ms": 0.0073,
        "min_ms": 0.0077,
        "max_ms": 0.0069,
        "GB/s": 9.03,
        "TFLOPS": 0.29
    },
    {
        "params": {
            "M": 64,
            "N": 64,
            "K": 128,
            "block_m": 32,
            "block_n": 32,
            "block_k": 128,
            "dtype_str": "fp16",
            "num_warps": 4
        },
        "ms": 0.0073,
        "min_ms": 0.0076,
        "max_ms": 0.007,
        "GB/s": 8.98,
        "TFLOPS": 0.29
    },
    {
        "params": {
            "M": 64,
            "N": 64,
            "K": 128,
            "block_m": 64,
            "block_n": 16,
            "block_k": 128,
            "dtype_str": "fp16",
            "num_warps": 4
        },
        "ms": 0.0084,
        "min_ms": 0.0086,
        "max_ms": 0.0083,
        "GB/s": 7.82,
        "TFLOPS": 0.25
    },
    {
        "params": {
            "M": 64,
            "N": 64,
            "K": 128,
            "block_m": 64,
            "block_n": 32,
            "block_k": 128,
            "dtype_str": "fp16",
            "num_warps": 4
        },
        "ms": 0.0088,
        "min_ms": 0.009,
        "max_ms": 0.0087,
        "GB/s": 7.43,
        "TFLOPS": 0.24
    },
    {
        "params": {
            "M": 64,
            "N": 128,
            "K": 128,
            "block_m": 16,
            "block_n": 16,
            "block_k": 128,
            "dtype_str": "fp16",
            "num_warps": 4
        },
        "ms": 0.0075,
        "min_ms": 0.0078,
        "max_ms": 0.0074,
        "GB/s": 13.11,
        "TFLOPS": 0.56
    },
    {
        "params": {
            "M": 64,
            "N": 128,
            "K": 128,
            "block_m": 16,
            "block_n": 32,
            "block_k": 128,
            "dtype_str": "fp16",
            "num_warps": 4
        },
        "ms": 0.0072,
        "min_ms": 0.0076,
        "max_ms": 0.0071,
        "GB/s": 13.62,
        "TFLOPS": 0.58
    },
    {
        "params": {
            "M": 64,
            "N": 128,
            "K": 128,
            "block_m": 32,
            "block_n": 16,
            "block_k": 128,
            "dtype_str": "fp16",
            "num_warps": 4
        },
        "ms": 0.0078,
        "min_ms": 0.008,
        "max_ms": 0.0077,
        "GB/s": 12.57,
        "TFLOPS": 0.54
    },
    {
        "params": {
            "M": 64,
            "N": 128,
            "K": 128,
            "block_m": 32,
            "block_n": 32,
            "block_k": 128,
            "dtype_str": "fp16",
            "num_warps": 4
        },
        "ms": 0.0083,
        "min_ms": 0.0084,
        "max_ms": 0.0082,
        "GB/s": 11.85,
        "TFLOPS": 0.51
    },
    {
        "params": {
            "M": 64,
            "N": 128,
            "K": 128,
            "block_m": 64,
            "block_n": 16,
            "block_k": 128,
            "dtype_str": "fp16",
            "num_warps": 4
        },
        "ms": 0.0103,
        "min_ms": 0.0104,
        "max_ms": 0.0101,
        "GB/s": 9.58,
        "TFLOPS": 0.41
    },
    {
        "params": {
            "M": 64,
            "N": 128,
            "K": 128,
            "block_m": 64,
            "block_n": 32,
            "block_k": 128,
            "dtype_str": "fp16",
            "num_warps": 4
        },
        "ms": 0.0107,
        "min_ms": 0.0109,
        "max_ms": 0.0106,
        "GB/s": 9.18,
        "TFLOPS": 0.39
    },
    {
        "params": {
            "M": 64,
            "N": 256,
            "K": 128,
            "block_m": 16,
            "block_n": 16,
            "block_k": 128,
            "dtype_str": "fp16",
            "num_warps": 4
        },
        "ms": 0.0103,
        "min_ms": 0.0105,
        "max_ms": 0.0102,
        "GB/s": 15.9,
        "TFLOPS": 0.81
    },
    {
        "params": {
            "M": 64,
            "N": 256,
            "K": 128,
            "block_m": 16,
            "block_n": 32,
            "block_k": 128,
            "dtype_str": "fp16",
            "num_warps": 4
        },
        "ms": 0.0095,
        "min_ms": 0.0097,
        "max_ms": 0.0095,
        "GB/s": 17.17,
        "TFLOPS": 0.88
    },
    {
        "params": {
            "M": 64,
            "N": 256,
            "K": 128,
            "block_m": 32,
            "block_n": 16,
            "block_k": 128,
            "dtype_str": "fp16",
            "num_warps": 4
        },
        "ms": 0.0105,
        "min_ms": 0.0106,
        "max_ms": 0.0104,
        "GB/s": 15.6,
        "TFLOPS": 0.8
    },
    {
        "params": {
            "M": 64,
            "N": 256,
            "K": 128,
            "block_m": 32,
            "block_n": 32,
            "block_k": 128,
            "dtype_str": "fp16",
            "num_warps": 4
        },
        "ms": 0.0113,
        "min_ms": 0.0115,
        "max_ms": 0.0112,
        "GB/s": 14.44,
        "TFLOPS": 0.74
    },
    {
        "params": {
            "M": 64,
            "N": 256,
            "K": 128,
            "block_m": 64,
            "block_n": 16,
            "block_k": 128,
            "dtype_str": "fp16",
            "num_warps": 4
        },
        "ms": 0.0142,
        "min_ms": 0.0144,
        "max_ms": 0.0141,
        "GB/s": 11.51,
        "TFLOPS": 0.59
    },
    {
        "params": {
            "M": 64,
            "N": 256,
            "K": 128,
            "block_m": 64,
            "block_n": 32,
            "block_k": 128,
            "dtype_str": "fp16",
            "num_warps": 4
        },
        "ms": 0.0147,
        "min_ms": 0.0149,
        "max_ms": 0.0146,
        "GB/s": 11.13,
        "TFLOPS": 0.57
    },
    {
        "params": {
            "M": 128,
            "N": 64,
            "K": 128,
            "block_m": 16,
            "block_n": 16,
            "block_k": 128,
            "dtype_str": "fp16",
            "num_warps": 4
        },
        "ms": 0.0072,
        "min_ms": 0.0076,
        "max_ms": 0.0067,
        "GB/s": 13.7,
        "TFLOPS": 0.58
    },
    {
        "params": {
            "M": 128,
            "N": 64,
            "K": 128,
            "block_m": 16,
            "block_n": 32,
            "block_k": 128,
            "dtype_str": "fp16",
            "num_warps": 4
        },
        "ms": 0.0072,
        "min_ms": 0.0076,
        "max_ms": 0.0067,
        "GB/s": 13.7,
        "TFLOPS": 0.58
    },
    {
        "params": {
            "M": 128,
            "N": 64,
            "K": 128,
            "block_m": 32,
            "block_n": 16,
            "block_k": 128,
            "dtype_str": "fp16",
            "num_warps": 4
        },
        "ms": 0.0071,
        "min_ms": 0.0075,
        "max_ms": 0.0067,
        "GB/s": 13.78,
        "TFLOPS": 0.59
    },
    {
        "params": {
            "M": 128,
            "N": 64,
            "K": 128,
            "block_m": 32,
            "block_n": 32,
            "block_k": 128,
            "dtype_str": "fp16",
            "num_warps": 4
        },
        "ms": 0.0071,
        "min_ms": 0.0076,
        "max_ms": 0.0068,
        "GB/s": 13.78,
        "TFLOPS": 0.59
    },
    {
        "params": {
            "M": 128,
            "N": 64,
            "K": 128,
            "block_m": 64,
            "block_n": 16,
            "block_k": 128,
            "dtype_str": "fp16",
            "num_warps": 4
        },
        "ms": 0.0083,
        "min_ms": 0.0085,
        "max_ms": 0.0083,
        "GB/s": 11.79,
        "TFLOPS": 0.5
    },
    {
        "params": {
            "M": 128,
            "N": 64,
            "K": 128,
            "block_m": 64,
            "block_n": 32,
            "block_k": 128,
            "dtype_str": "fp16",
            "num_warps": 4
        },
        "ms": 0.0087,
        "min_ms": 0.0089,
        "max_ms": 0.0087,
        "GB/s": 11.25,
        "TFLOPS": 0.48
    },
    {
        "params": {
            "M": 128,
            "N": 128,
            "K": 128,
            "block_m": 16,
            "block_n": 16,
            "block_k": 128,
            "dtype_str": "fp16",
            "num_warps": 4
        },
        "ms": 0.0076,
        "min_ms": 0.0078,
        "max_ms": 0.0075,
        "GB/s": 17.3,
        "TFLOPS": 1.11
    },
    {
        "params": {
            "M": 128,
            "N": 128,
            "K": 128,
            "block_m": 16,
            "block_n": 32,
            "block_k": 128,
            "dtype_str": "fp16",
            "num_warps": 4
        },
        "ms": 0.0073,
        "min_ms": 0.0077,
        "max_ms": 0.0071,
        "GB/s": 17.87,
        "TFLOPS": 1.14
    },
    {
        "params": {
            "M": 128,
            "N": 128,
            "K": 128,
            "block_m": 32,
            "block_n": 16,
            "block_k": 128,
            "dtype_str": "fp16",
            "num_warps": 4
        },
        "ms": 0.0079,
        "min_ms": 0.0081,
        "max_ms": 0.0078,
        "GB/s": 16.68,
        "TFLOPS": 1.07
    },
    {
        "params": {
            "M": 128,
            "N": 128,
            "K": 128,
            "block_m": 32,
            "block_n": 32,
            "block_k": 128,
            "dtype_str": "fp16",
            "num_warps": 4
        },
        "ms": 0.0083,
        "min_ms": 0.0085,
        "max_ms": 0.0082,
        "GB/s": 15.72,
        "TFLOPS": 1.01
    },
    {
        "params": {
            "M": 128,
            "N": 128,
            "K": 128,
            "block_m": 64,
            "block_n": 16,
            "block_k": 128,
            "dtype_str": "fp16",
            "num_warps": 4
        },
        "ms": 0.0103,
        "min_ms": 0.0105,
        "max_ms": 0.0102,
        "GB/s": 12.72,
        "TFLOPS": 0.81
    },
    {
        "params": {
            "M": 128,
            "N": 128,
            "K": 128,
            "block_m": 64,
            "block_n": 32,
            "block_k": 128,
            "dtype_str": "fp16",
            "num_warps": 4
        },
        "ms": 0.0107,
        "min_ms": 0.0109,
        "max_ms": 0.0106,
        "GB/s": 12.24,
        "TFLOPS": 0.78
    },
    {
        "params": {
            "M": 128,
            "N": 256,
            "K": 128,
            "block_m": 16,
            "block_n": 16,
            "block_k": 128,
            "dtype_str": "fp16",
            "num_warps": 4
        },
        "ms": 0.0104,
        "min_ms": 0.0106,
        "max_ms": 0.0103,
        "GB/s": 18.86,
        "TFLOPS": 1.61
    },
    {
        "params": {
            "M": 128,
            "N": 256,
            "K": 128,
            "block_m": 16,
            "block_n": 32,
            "block_k": 128,
            "dtype_str": "fp16",
            "num_warps": 4
        },
        "ms": 0.0097,
        "min_ms": 0.0099,
        "max_ms": 0.0096,
        "GB/s": 20.35,
        "TFLOPS": 1.74
    },
    {
        "params": {
            "M": 128,
            "N": 256,
            "K": 128,
            "block_m": 32,
            "block_n": 16,
            "block_k": 128,
            "dtype_str": "fp16",
            "num_warps": 4
        },
        "ms": 0.0106,
        "min_ms": 0.0107,
        "max_ms": 0.0105,
        "GB/s": 18.58,
        "TFLOPS": 1.59
    },
    {
        "params": {
            "M": 128,
            "N": 256,
            "K": 128,
            "block_m": 32,
            "block_n": 32,
            "block_k": 128,
            "dtype_str": "fp16",
            "num_warps": 4
        },
        "ms": 0.0114,
        "min_ms": 0.0115,
        "max_ms": 0.0113,
        "GB/s": 17.27,
        "TFLOPS": 1.47
    },
    {
        "params": {
            "M": 128,
            "N": 256,
            "K": 128,
            "block_m": 64,
            "block_n": 16,
            "block_k": 128,
            "dtype_str": "fp16",
            "num_warps": 4
        },
        "ms": 0.0142,
        "min_ms": 0.0144,
        "max_ms": 0.0142,
        "GB/s": 13.81,
        "TFLOPS": 1.18
    },
    {
        "params": {
            "M": 128,
            "N": 256,
            "K": 128,
            "block_m": 64,
            "block_n": 32,
            "block_k": 128,
            "dtype_str": "fp16",
            "num_warps": 4
        },
        "ms": 0.0147,
        "min_ms": 0.0148,
        "max_ms": 0.0146,
        "GB/s": 13.36,
        "TFLOPS": 1.14
    },
    {
        "params": {
            "M": 256,
            "N": 64,
            "K": 128,
            "block_m": 16,
            "block_n": 16,
            "block_k": 128,
            "dtype_str": "fp16",
            "num_warps": 4
        },
        "ms": 0.0073,
        "min_ms": 0.0076,
        "max_ms": 0.0068,
        "GB/s": 22.58,
        "TFLOPS": 1.16
    },
    {
        "params": {
            "M": 256,
            "N": 64,
            "K": 128,
            "block_m": 16,
            "block_n": 32,
            "block_k": 128,
            "dtype_str": "fp16",
            "num_warps": 4
        },
        "ms": 0.0072,
        "min_ms": 0.0076,
        "max_ms": 0.0068,
        "GB/s": 22.71,
        "TFLOPS": 1.16
    },
    {
        "params": {
            "M": 256,
            "N": 64,
            "K": 128,
            "block_m": 32,
            "block_n": 16,
            "block_k": 128,
            "dtype_str": "fp16",
            "num_warps": 4
        },
        "ms": 0.0072,
        "min_ms": 0.0077,
        "max_ms": 0.0067,
        "GB/s": 22.83,
        "TFLOPS": 1.17
    },
    {
        "params": {
            "M": 256,
            "N": 64,
            "K": 128,
            "block_m": 32,
            "block_n": 32,
            "block_k": 128,
            "dtype_str": "fp16",
            "num_warps": 4
        },
        "ms": 0.0072,
        "min_ms": 0.0076,
        "max_ms": 0.007,
        "GB/s": 22.7,
        "TFLOPS": 1.16
    },
    {
        "params": {
            "M": 256,
            "N": 64,
            "K": 128,
            "block_m": 64,
            "block_n": 16,
            "block_k": 128,
            "dtype_str": "fp16",
            "num_warps": 4
        },
        "ms": 0.0084,
        "min_ms": 0.0085,
        "max_ms": 0.0083,
        "GB/s": 19.55,
        "TFLOPS": 1.0
    },
    {
        "params": {
            "M": 256,
            "N": 64,
            "K": 128,
            "block_m": 64,
            "block_n": 32,
            "block_k": 128,
            "dtype_str": "fp16",
            "num_warps": 4
        },
        "ms": 0.0088,
        "min_ms": 0.009,
        "max_ms": 0.0087,
        "GB/s": 18.66,
        "TFLOPS": 0.96
    },
    {
        "params": {
            "M": 256,
            "N": 128,
            "K": 128,
            "block_m": 16,
            "block_n": 16,
            "block_k": 128,
            "dtype_str": "fp16",
            "num_warps": 4
        },
        "ms": 0.0076,
        "min_ms": 0.008,
        "max_ms": 0.0075,
        "GB/s": 25.81,
        "TFLOPS": 2.2
    },
    {
        "params": {
            "M": 256,
            "N": 128,
            "K": 128,
            "block_m": 16,
            "block_n": 32,
            "block_k": 128,
            "dtype_str": "fp16",
            "num_warps": 4
        },
        "ms": 0.0074,
        "min_ms": 0.0078,
        "max_ms": 0.0072,
        "GB/s": 26.65,
        "TFLOPS": 2.27
    },
    {
        "params": {
            "M": 256,
            "N": 128,
            "K": 128,
            "block_m": 32,
            "block_n": 16,
            "block_k": 128,
            "dtype_str": "fp16",
            "num_warps": 4
        },
        "ms": 0.008,
        "min_ms": 0.0083,
        "max_ms": 0.0079,
        "GB/s": 24.52,
        "TFLOPS": 2.09
    },
    {
        "params": {
            "M": 256,
            "N": 128,
            "K": 128,
            "block_m": 32,
            "block_n": 32,
            "block_k": 128,
            "dtype_str": "fp16",
            "num_warps": 4
        },
        "ms": 0.0085,
        "min_ms": 0.0087,
        "max_ms": 0.0084,
        "GB/s": 23.02,
        "TFLOPS": 1.96
    },
    {
        "params": {
            "M": 256,
            "N": 128,
            "K": 128,
            "block_m": 64,
            "block_n": 16,
            "block_k": 128,
            "dtype_str": "fp16",
            "num_warps": 4
        },
        "ms": 0.0103,
        "min_ms": 0.0105,
        "max_ms": 0.0102,
        "GB/s": 19.01,
        "TFLOPS": 1.62
    },
    {
        "params": {
            "M": 256,
            "N": 128,
            "K": 128,
            "block_m": 64,
            "block_n": 32,
            "block_k": 128,
            "dtype_str": "fp16",
            "num_warps": 4
        },
        "ms": 0.0108,
        "min_ms": 0.0109,
        "max_ms": 0.0107,
        "GB/s": 18.23,
        "TFLOPS": 1.56
    },
    {
        "params": {
            "M": 256,
            "N": 256,
            "K": 128,
            "block_m": 16,
            "block_n": 16,
            "block_k": 128,
            "dtype_str": "fp16",
            "num_warps": 4
        },
        "ms": 0.0104,
        "min_ms": 0.0106,
        "max_ms": 0.0103,
        "GB/s": 25.24,
        "TFLOPS": 3.23
    },
    {
        "params": {
            "M": 256,
            "N": 256,
            "K": 128,
            "block_m": 16,
            "block_n": 32,
            "block_k": 128,
            "dtype_str": "fp16",
            "num_warps": 4
        },
        "ms": 0.0096,
        "min_ms": 0.0098,
        "max_ms": 0.0095,
        "GB/s": 27.24,
        "TFLOPS": 3.49
    },
    {
        "params": {
            "M": 256,
            "N": 256,
            "K": 128,
            "block_m": 32,
            "block_n": 16,
            "block_k": 128,
            "dtype_str": "fp16",
            "num_warps": 4
        },
        "ms": 0.0107,
        "min_ms": 0.0109,
        "max_ms": 0.0105,
        "GB/s": 24.58,
        "TFLOPS": 3.15
    },
    {
        "params": {
            "M": 256,
            "N": 256,
            "K": 128,
            "block_m": 32,
            "block_n": 32,
            "block_k": 128,
            "dtype_str": "fp16",
            "num_warps": 4
        },
        "ms": 0.0115,
        "min_ms": 0.0117,
        "max_ms": 0.0114,
        "GB/s": 22.78,
        "TFLOPS": 2.92
    },
    {
        "params": {
            "M": 256,
            "N": 256,
            "K": 128,
            "block_m": 64,
            "block_n": 16,
            "block_k": 128,
            "dtype_str": "fp16",
            "num_warps": 4
        },
        "ms": 0.0142,
        "min_ms": 0.0144,
        "max_ms": 0.0142,
        "GB/s": 18.42,
        "TFLOPS": 2.36
    },
    {
        "params": {
            "M": 256,
            "N": 256,
            "K": 128,
            "block_m": 64,
            "block_n": 32,
            "block_k": 128,
            "dtype_str": "fp16",
            "num_warps": 4
        },
        "ms": 0.0147,
        "min_ms": 0.0148,
        "max_ms": 0.0146,
        "GB/s": 17.82,
        "TFLOPS": 2.28
    },
    {
        "params": {
            "M": 512,
            "N": 64,
            "K": 128,
            "block_m": 16,
            "block_n": 16,
            "block_k": 128,
            "dtype_str": "fp16",
            "num_warps": 4
        },
        "ms": 0.0073,
        "min_ms": 0.0077,
        "max_ms": 0.0068,
        "GB/s": 40.64,
        "TFLOPS": 2.31
    },
    {
        "params": {
            "M": 512,
            "N": 64,
            "K": 128,
            "block_m": 16,
            "block_n": 32,
            "block_k": 128,
            "dtype_str": "fp16",
            "num_warps": 4
        },
        "ms": 0.0074,
        "min_ms": 0.0077,
        "max_ms": 0.0071,
        "GB/s": 39.98,
        "TFLOPS": 2.27
    },
    {
        "params": {
            "M": 512,
            "N": 64,
            "K": 128,
            "block_m": 32,
            "block_n": 16,
            "block_k": 128,
            "dtype_str": "fp16",
            "num_warps": 4
        },
        "ms": 0.0073,
        "min_ms": 0.0077,
        "max_ms": 0.0069,
        "GB/s": 40.64,
        "TFLOPS": 2.31
    },
    {
        "params": {
            "M": 512,
            "N": 64,
            "K": 128,
            "block_m": 32,
            "block_n": 32,
            "block_k": 128,
            "dtype_str": "fp16",
            "num_warps": 4
        },
        "ms": 0.0073,
        "min_ms": 0.0077,
        "max_ms": 0.007,
        "GB/s": 40.42,
        "TFLOPS": 2.3
    },
    {
        "params": {
            "M": 512,
            "N": 64,
            "K": 128,
            "block_m": 64,
            "block_n": 16,
            "block_k": 128,
            "dtype_str": "fp16",
            "num_warps": 4
        },
        "ms": 0.0085,
        "min_ms": 0.0087,
        "max_ms": 0.0084,
        "GB/s": 34.7,
        "TFLOPS": 1.97
    },
    {
        "params": {
            "M": 512,
            "N": 64,
            "K": 128,
            "block_m": 64,
            "block_n": 32,
            "block_k": 128,
            "dtype_str": "fp16",
            "num_warps": 4
        },
        "ms": 0.0089,
        "min_ms": 0.0091,
        "max_ms": 0.0088,
        "GB/s": 32.99,
        "TFLOPS": 1.88
    },
    {
        "params": {
            "M": 512,
            "N": 128,
            "K": 128,
            "block_m": 16,
            "block_n": 16,
            "block_k": 128,
            "dtype_str": "fp16",
            "num_warps": 4
        },
        "ms": 0.0076,
        "min_ms": 0.0078,
        "max_ms": 0.0075,
        "GB/s": 43.25,
        "TFLOPS": 4.43
    },
    {
        "params": {
            "M": 512,
            "N": 128,
            "K": 128,
            "block_m": 16,
            "block_n": 32,
            "block_k": 128,
            "dtype_str": "fp16",
            "num_warps": 4
        },
        "ms": 0.0073,
        "min_ms": 0.0078,
        "max_ms": 0.0072,
        "GB/s": 44.66,
        "TFLOPS": 4.57
    },
    {
        "params": {
            "M": 512,
            "N": 128,
            "K": 128,
            "block_m": 32,
            "block_n": 16,
            "block_k": 128,
            "dtype_str": "fp16",
            "num_warps": 4
        },
        "ms": 0.008,
        "min_ms": 0.0082,
        "max_ms": 0.0079,
        "GB/s": 40.87,
        "TFLOPS": 4.18
    },
    {
        "params": {
            "M": 512,
            "N": 128,
            "K": 128,
            "block_m": 32,
            "block_n": 32,
            "block_k": 128,
            "dtype_str": "fp16",
            "num_warps": 4
        },
        "ms": 0.0085,
        "min_ms": 0.0087,
        "max_ms": 0.0084,
        "GB/s": 38.37,
        "TFLOPS": 3.93
    },
    {
        "params": {
            "M": 512,
            "N": 128,
            "K": 128,
            "block_m": 64,
            "block_n": 16,
            "block_k": 128,
            "dtype_str": "fp16",
            "num_warps": 4
        },
        "ms": 0.0104,
        "min_ms": 0.0107,
        "max_ms": 0.0103,
        "GB/s": 31.44,
        "TFLOPS": 3.22
    },
    {
        "params": {
            "M": 512,
            "N": 128,
            "K": 128,
            "block_m": 64,
            "block_n": 32,
            "block_k": 128,
            "dtype_str": "fp16",
            "num_warps": 4
        },
        "ms": 0.0109,
        "min_ms": 0.0111,
        "max_ms": 0.0108,
        "GB/s": 30.16,
        "TFLOPS": 3.09
    },
    {
        "params": {
            "M": 512,
            "N": 256,
            "K": 128,
            "block_m": 16,
            "block_n": 16,
            "block_k": 128,
            "dtype_str": "fp16",
            "num_warps": 4
        },
        "ms": 0.0103,
        "min_ms": 0.0105,
        "max_ms": 0.0102,
        "GB/s": 38.02,
        "TFLOPS": 6.49
    },
    {
        "params": {
            "M": 512,
            "N": 256,
            "K": 128,
            "block_m": 16,
            "block_n": 32,
            "block_k": 128,
            "dtype_str": "fp16",
            "num_warps": 4
        },
        "ms": 0.0096,
        "min_ms": 0.0098,
        "max_ms": 0.0095,
        "GB/s": 40.87,
        "TFLOPS": 6.97
    },
    {
        "params": {
            "M": 512,
            "N": 256,
            "K": 128,
            "block_m": 32,
            "block_n": 16,
            "block_k": 128,
            "dtype_str": "fp16",
            "num_warps": 4
        },
        "ms": 0.0106,
        "min_ms": 0.0109,
        "max_ms": 0.0105,
        "GB/s": 37.01,
        "TFLOPS": 6.32
    },
    {
        "params": {
            "M": 512,
            "N": 256,
            "K": 128,
            "block_m": 32,
            "block_n": 32,
            "block_k": 128,
            "dtype_str": "fp16",
            "num_warps": 4
        },
        "ms": 0.0115,
        "min_ms": 0.0117,
        "max_ms": 0.0114,
        "GB/s": 34.17,
        "TFLOPS": 5.83
    },
    {
        "params": {
            "M": 512,
            "N": 256,
            "K": 128,
            "block_m": 64,
            "block_n": 16,
            "block_k": 128,
            "dtype_str": "fp16",
            "num_warps": 4
        },
        "ms": 0.0143,
        "min_ms": 0.0145,
        "max_ms": 0.0142,
        "GB/s": 27.47,
        "TFLOPS": 4.69
    },
    {
        "params": {
            "M": 512,
            "N": 256,
            "K": 128,
            "block_m": 64,
            "block_n": 32,
            "block_k": 128,
            "dtype_str": "fp16",
            "num_warps": 4
        },
        "ms": 0.0148,
        "min_ms": 0.015,
        "max_ms": 0.0147,
        "GB/s": 26.51,
        "TFLOPS": 4.52
    }
]