tb_eval/data/ROCm/data/performance/golden_results/kernel_sub_triton_perf.json
[
    {
        "params": {
            "N_val": 1024,
            "dtype_str": "fp32",
            "num_warps": 1
        },
        "ms": 0.0073,
        "min_ms": 0.0076,
        "max_ms": 0.0069,
        "GB/s": 1.69,
        "TFLOPS": 0.0
    },
    {
        "params": {
            "N_val": 2048,
            "dtype_str": "fp32",
            "num_warps": 1
        },
        "ms": 0.0063,
        "min_ms": 0.0067,
        "max_ms": 0.0061,
        "GB/s": 3.88,
        "TFLOPS": 0.0
    },
    {
        "params": {
            "N_val": 4096,
            "dtype_str": "fp32",
            "num_warps": 1
        },
        "ms": 0.0063,
        "min_ms": 0.0067,
        "max_ms": 0.0061,
        "GB/s": 7.81,
        "TFLOPS": 0.0
    },
    {
        "params": {
            "N_val": 8192,
            "dtype_str": "fp32",
            "num_warps": 1
        },
        "ms": 0.0063,
        "min_ms": 0.0067,
        "max_ms": 0.0061,
        "GB/s": 15.52,
        "TFLOPS": 0.0
    },
    {
        "params": {
            "N_val": 16384,
            "dtype_str": "fp32",
            "num_warps": 1
        },
        "ms": 0.0065,
        "min_ms": 0.0068,
        "max_ms": 0.0062,
        "GB/s": 30.27,
        "TFLOPS": 0.01
    },
    {
        "params": {
            "N_val": 32768,
            "dtype_str": "fp32",
            "num_warps": 1
        },
        "ms": 0.0476,
        "min_ms": 0.0481,
        "max_ms": 0.0471,
        "GB/s": 8.26,
        "TFLOPS": 0.0
    },
    {
        "params": {
            "N_val": 65536,
            "dtype_str": "fp32",
            "num_warps": 1
        },
        "ms": 0.1958,
        "min_ms": 0.1974,
        "max_ms": 0.1942,
        "GB/s": 4.02,
        "TFLOPS": 0.0
    },
    {
        "params": {
            "N_val": 1024,
            "dtype_str": "fp16",
            "num_warps": 1
        },
        "ms": 0.0063,
        "min_ms": 0.0068,
        "max_ms": 0.0061,
        "GB/s": 0.97,
        "TFLOPS": 0.0
    },
    {
        "params": {
            "N_val": 2048,
            "dtype_str": "fp16",
            "num_warps": 1
        },
        "ms": 0.0063,
        "min_ms": 0.0067,
        "max_ms": 0.0061,
        "GB/s": 1.94,
        "TFLOPS": 0.0
    },
    {
        "params": {
            "N_val": 4096,
            "dtype_str": "fp16",
            "num_warps": 1
        },
        "ms": 0.0063,
        "min_ms": 0.0067,
        "max_ms": 0.0061,
        "GB/s": 3.9,
        "TFLOPS": 0.0
    },
    {
        "params": {
            "N_val": 8192,
            "dtype_str": "fp16",
            "num_warps": 1
        },
        "ms": 0.0063,
        "min_ms": 0.0067,
        "max_ms": 0.0061,
        "GB/s": 7.86,
        "TFLOPS": 0.0
    },
    {
        "params": {
            "N_val": 16384,
            "dtype_str": "fp16",
            "num_warps": 1
        },
        "ms": 0.0063,
        "min_ms": 0.0067,
        "max_ms": 0.0061,
        "GB/s": 15.52,
        "TFLOPS": 0.01
    },
    {
        "params": {
            "N_val": 32768,
            "dtype_str": "fp16",
            "num_warps": 1
        },
        "ms": 0.0163,
        "min_ms": 0.0167,
        "max_ms": 0.0157,
        "GB/s": 12.08,
        "TFLOPS": 0.0
    },
    {
        "params": {
            "N_val": 65536,
            "dtype_str": "fp16",
            "num_warps": 1
        },
        "ms": 0.1232,
        "min_ms": 0.1243,
        "max_ms": 0.1222,
        "GB/s": 3.19,
        "TFLOPS": 0.0
    },
    {
        "params": {
            "N_val": 1024,
            "dtype_str": "fp32",
            "num_warps": 2
        },
        "ms": 0.0063,
        "min_ms": 0.0067,
        "max_ms": 0.0061,
        "GB/s": 1.94,
        "TFLOPS": 0.0
    },
    {
        "params": {
            "N_val": 2048,
            "dtype_str": "fp32",
            "num_warps": 2
        },
        "ms": 0.0063,
        "min_ms": 0.0066,
        "max_ms": 0.0061,
        "GB/s": 3.93,
        "TFLOPS": 0.0
    },
    {
        "params": {
            "N_val": 4096,
            "dtype_str": "fp32",
            "num_warps": 2
        },
        "ms": 0.0063,
        "min_ms": 0.0067,
        "max_ms": 0.0061,
        "GB/s": 7.81,
        "TFLOPS": 0.0
    },
    {
        "params": {
            "N_val": 8192,
            "dtype_str": "fp32",
            "num_warps": 2
        },
        "ms": 0.0063,
        "min_ms": 0.0067,
        "max_ms": 0.0061,
        "GB/s": 15.52,
        "TFLOPS": 0.0
    },
    {
        "params": {
            "N_val": 16384,
            "dtype_str": "fp32",
            "num_warps": 2
        },
        "ms": 0.0064,
        "min_ms": 0.0067,
        "max_ms": 0.0061,
        "GB/s": 30.65,
        "TFLOPS": 0.01
    },
    {
        "params": {
            "N_val": 32768,
            "dtype_str": "fp32",
            "num_warps": 2
        },
        "ms": 0.0082,
        "min_ms": 0.0084,
        "max_ms": 0.0081,
        "GB/s": 47.84,
        "TFLOPS": 0.01
    },
    {
        "params": {
            "N_val": 65536,
            "dtype_str": "fp32",
            "num_warps": 2
        },
        "ms": 0.0525,
        "min_ms": 0.053,
        "max_ms": 0.0519,
        "GB/s": 14.99,
        "TFLOPS": 0.0
    },
    {
        "params": {
            "N_val": 1024,
            "dtype_str": "fp16",
            "num_warps": 2
        },
        "ms": 0.0063,
        "min_ms": 0.0067,
        "max_ms": 0.0061,
        "GB/s": 0.98,
        "TFLOPS": 0.0
    },
    {
        "params": {
            "N_val": 2048,
            "dtype_str": "fp16",
            "num_warps": 2
        },
        "ms": 0.0063,
        "min_ms": 0.0067,
        "max_ms": 0.0061,
        "GB/s": 1.95,
        "TFLOPS": 0.0
    },
    {
        "params": {
            "N_val": 4096,
            "dtype_str": "fp16",
            "num_warps": 2
        },
        "ms": 0.0063,
        "min_ms": 0.0067,
        "max_ms": 0.0061,
        "GB/s": 3.9,
        "TFLOPS": 0.0
    },
    {
        "params": {
            "N_val": 8192,
            "dtype_str": "fp16",
            "num_warps": 2
        },
        "ms": 0.0063,
        "min_ms": 0.0067,
        "max_ms": 0.0061,
        "GB/s": 7.86,
        "TFLOPS": 0.0
    },
    {
        "params": {
            "N_val": 16384,
            "dtype_str": "fp16",
            "num_warps": 2
        },
        "ms": 0.0063,
        "min_ms": 0.0067,
        "max_ms": 0.0061,
        "GB/s": 15.52,
        "TFLOPS": 0.01
    },
    {
        "params": {
            "N_val": 32768,
            "dtype_str": "fp16",
            "num_warps": 2
        },
        "ms": 0.0064,
        "min_ms": 0.0068,
        "max_ms": 0.0061,
        "GB/s": 30.65,
        "TFLOPS": 0.01
    },
    {
        "params": {
            "N_val": 65536,
            "dtype_str": "fp16",
            "num_warps": 2
        },
        "ms": 0.0201,
        "min_ms": 0.0204,
        "max_ms": 0.0199,
        "GB/s": 19.54,
        "TFLOPS": 0.01
    },
    {
        "params": {
            "N_val": 1024,
            "dtype_str": "fp32",
            "num_warps": 4
        },
        "ms": 0.0063,
        "min_ms": 0.0067,
        "max_ms": 0.0061,
        "GB/s": 1.95,
        "TFLOPS": 0.0
    },
    {
        "params": {
            "N_val": 2048,
            "dtype_str": "fp32",
            "num_warps": 4
        },
        "ms": 0.0063,
        "min_ms": 0.0067,
        "max_ms": 0.0061,
        "GB/s": 3.9,
        "TFLOPS": 0.0
    },
    {
        "params": {
            "N_val": 4096,
            "dtype_str": "fp32",
            "num_warps": 4
        },
        "ms": 0.0063,
        "min_ms": 0.0067,
        "max_ms": 0.0061,
        "GB/s": 7.81,
        "TFLOPS": 0.0
    },
    {
        "params": {
            "N_val": 8192,
            "dtype_str": "fp32",
            "num_warps": 4
        },
        "ms": 0.0063,
        "min_ms": 0.0067,
        "max_ms": 0.0061,
        "GB/s": 15.52,
        "TFLOPS": 0.0
    },
    {
        "params": {
            "N_val": 16384,
            "dtype_str": "fp32",
            "num_warps": 4
        },
        "ms": 0.0063,
        "min_ms": 0.0067,
        "max_ms": 0.0061,
        "GB/s": 31.23,
        "TFLOPS": 0.01
    },
    {
        "params": {
            "N_val": 32768,
            "dtype_str": "fp32",
            "num_warps": 4
        },
        "ms": 0.0078,
        "min_ms": 0.008,
        "max_ms": 0.0077,
        "GB/s": 50.55,
        "TFLOPS": 0.01
    },
    {
        "params": {
            "N_val": 65536,
            "dtype_str": "fp32",
            "num_warps": 4
        },
        "ms": 0.0123,
        "min_ms": 0.0125,
        "max_ms": 0.0121,
        "GB/s": 64.1,
        "TFLOPS": 0.01
    },
    {
        "params": {
            "N_val": 1024,
            "dtype_str": "fp16",
            "num_warps": 4
        },
        "ms": 0.0063,
        "min_ms": 0.0067,
        "max_ms": 0.0061,
        "GB/s": 0.98,
        "TFLOPS": 0.0
    },
    {
        "params": {
            "N_val": 2048,
            "dtype_str": "fp16",
            "num_warps": 4
        },
        "ms": 0.0063,
        "min_ms": 0.0067,
        "max_ms": 0.0061,
        "GB/s": 1.95,
        "TFLOPS": 0.0
    },
    {
        "params": {
            "N_val": 4096,
            "dtype_str": "fp16",
            "num_warps": 4
        },
        "ms": 0.0063,
        "min_ms": 0.0067,
        "max_ms": 0.0061,
        "GB/s": 3.9,
        "TFLOPS": 0.0
    },
    {
        "params": {
            "N_val": 8192,
            "dtype_str": "fp16",
            "num_warps": 4
        },
        "ms": 0.0063,
        "min_ms": 0.0067,
        "max_ms": 0.0061,
        "GB/s": 7.81,
        "TFLOPS": 0.0
    },
    {
        "params": {
            "N_val": 16384,
            "dtype_str": "fp16",
            "num_warps": 4
        },
        "ms": 0.0063,
        "min_ms": 0.0067,
        "max_ms": 0.0061,
        "GB/s": 15.52,
        "TFLOPS": 0.01
    },
    {
        "params": {
            "N_val": 32768,
            "dtype_str": "fp16",
            "num_warps": 4
        },
        "ms": 0.0063,
        "min_ms": 0.0067,
        "max_ms": 0.0061,
        "GB/s": 31.04,
        "TFLOPS": 0.01
    },
    {
        "params": {
            "N_val": 65536,
            "dtype_str": "fp16",
            "num_warps": 4
        },
        "ms": 0.0077,
        "min_ms": 0.0079,
        "max_ms": 0.0075,
        "GB/s": 51.08,
        "TFLOPS": 0.02
    }
]