geak_eval/data/ROCm/data/performance/golden_results/gemm_fusion_triton_perf.json
[
    {
        "params": {
            "M": 128,
            "N": 128,
            "K": 32,
            "block_m": 32,
            "block_n": 32,
            "block_k": 32,
            "dtype_str": "fp16",
            "num_warps": 4
        },
        "ms": 0.007,
        "min_ms": 0.0074,
        "max_ms": 0.0067,
        "GB/s": 4.7,
        "TFLOPS": 0.3
    },
    {
        "params": {
            "M": 128,
            "N": 128,
            "K": 32,
            "block_m": 32,
            "block_n": 64,
            "block_k": 32,
            "dtype_str": "fp16",
            "num_warps": 4
        },
        "ms": 0.0067,
        "min_ms": 0.007,
        "max_ms": 0.0063,
        "GB/s": 4.87,
        "TFLOPS": 0.31
    },
    {
        "params": {
            "M": 128,
            "N": 128,
            "K": 32,
            "block_m": 32,
            "block_n": 128,
            "block_k": 32,
            "dtype_str": "fp16",
            "num_warps": 4
        },
        "ms": 0.0068,
        "min_ms": 0.0071,
        "max_ms": 0.0064,
        "GB/s": 4.81,
        "TFLOPS": 0.31
    },
    {
        "params": {
            "M": 128,
            "N": 128,
            "K": 32,
            "block_m": 64,
            "block_n": 32,
            "block_k": 32,
            "dtype_str": "fp16",
            "num_warps": 4
        },
        "ms": 0.0067,
        "min_ms": 0.007,
        "max_ms": 0.0064,
        "GB/s": 4.87,
        "TFLOPS": 0.31
    },
    {
        "params": {
            "M": 128,
            "N": 128,
            "K": 32,
            "block_m": 64,
            "block_n": 64,
            "block_k": 32,
            "dtype_str": "fp16",
            "num_warps": 4
        },
        "ms": 0.0067,
        "min_ms": 0.007,
        "max_ms": 0.0062,
        "GB/s": 4.89,
        "TFLOPS": 0.31
    },
    {
        "params": {
            "M": 128,
            "N": 128,
            "K": 32,
            "block_m": 64,
            "block_n": 128,
            "block_k": 32,
            "dtype_str": "fp16",
            "num_warps": 4
        },
        "ms": 0.0067,
        "min_ms": 0.007,
        "max_ms": 0.0062,
        "GB/s": 4.89,
        "TFLOPS": 0.31
    },
    {
        "params": {
            "M": 128,
            "N": 128,
            "K": 32,
            "block_m": 128,
            "block_n": 32,
            "block_k": 32,
            "dtype_str": "fp16",
            "num_warps": 4
        },
        "ms": 0.0067,
        "min_ms": 0.007,
        "max_ms": 0.0066,
        "GB/s": 4.86,
        "TFLOPS": 0.31
    },
    {
        "params": {
            "M": 128,
            "N": 128,
            "K": 32,
            "block_m": 128,
            "block_n": 64,
            "block_k": 32,
            "dtype_str": "fp16",
            "num_warps": 4
        },
        "ms": 0.0067,
        "min_ms": 0.0069,
        "max_ms": 0.0062,
        "GB/s": 4.92,
        "TFLOPS": 0.32
    },
    {
        "params": {
            "M": 128,
            "N": 128,
            "K": 32,
            "block_m": 128,
            "block_n": 128,
            "block_k": 32,
            "dtype_str": "fp16",
            "num_warps": 4
        },
        "ms": 0.0067,
        "min_ms": 0.0069,
        "max_ms": 0.0062,
        "GB/s": 4.92,
        "TFLOPS": 0.32
    },
    {
        "params": {
            "M": 128,
            "N": 256,
            "K": 32,
            "block_m": 32,
            "block_n": 32,
            "block_k": 32,
            "dtype_str": "fp16",
            "num_warps": 4
        },
        "ms": 0.0076,
        "min_ms": 0.0077,
        "max_ms": 0.0075,
        "GB/s": 6.49,
        "TFLOPS": 0.55
    },
    {
        "params": {
            "M": 128,
            "N": 256,
            "K": 32,
            "block_m": 32,
            "block_n": 64,
            "block_k": 32,
            "dtype_str": "fp16",
            "num_warps": 4
        },
        "ms": 0.0068,
        "min_ms": 0.0071,
        "max_ms": 0.0067,
        "GB/s": 7.25,
        "TFLOPS": 0.62
    },
    {
        "params": {
            "M": 128,
            "N": 256,
            "K": 32,
            "block_m": 32,
            "block_n": 128,
            "block_k": 32,
            "dtype_str": "fp16",
            "num_warps": 4
        },
        "ms": 0.007,
        "min_ms": 0.0073,
        "max_ms": 0.0069,
        "GB/s": 7.05,
        "TFLOPS": 0.6
    },
    {
        "params": {
            "M": 128,
            "N": 256,
            "K": 32,
            "block_m": 64,
            "block_n": 32,
            "block_k": 32,
            "dtype_str": "fp16",
            "num_warps": 4
        },
        "ms": 0.0077,
        "min_ms": 0.0079,
        "max_ms": 0.0076,
        "GB/s": 6.39,
        "TFLOPS": 0.54
    },
    {
        "params": {
            "M": 128,
            "N": 256,
            "K": 32,
            "block_m": 64,
            "block_n": 64,
            "block_k": 32,
            "dtype_str": "fp16",
            "num_warps": 4
        },
        "ms": 0.007,
        "min_ms": 0.0071,
        "max_ms": 0.0069,
        "GB/s": 7.05,
        "TFLOPS": 0.6
    },
    {
        "params": {
            "M": 128,
            "N": 256,
            "K": 32,
            "block_m": 64,
            "block_n": 128,
            "block_k": 32,
            "dtype_str": "fp16",
            "num_warps": 4
        },
        "ms": 0.0072,
        "min_ms": 0.0073,
        "max_ms": 0.0071,
        "GB/s": 6.85,
        "TFLOPS": 0.58
    },
    {
        "params": {
            "M": 128,
            "N": 256,
            "K": 32,
            "block_m": 128,
            "block_n": 32,
            "block_k": 32,
            "dtype_str": "fp16",
            "num_warps": 4
        },
        "ms": 0.0081,
        "min_ms": 0.0083,
        "max_ms": 0.008,
        "GB/s": 6.04,
        "TFLOPS": 0.52
    },
    {
        "params": {
            "M": 128,
            "N": 256,
            "K": 32,
            "block_m": 128,
            "block_n": 64,
            "block_k": 32,
            "dtype_str": "fp16",
            "num_warps": 4
        },
        "ms": 0.007,
        "min_ms": 0.0072,
        "max_ms": 0.0069,
        "GB/s": 7.01,
        "TFLOPS": 0.6
    },
    {
        "params": {
            "M": 128,
            "N": 256,
            "K": 32,
            "block_m": 128,
            "block_n": 128,
            "block_k": 32,
            "dtype_str": "fp16",
            "num_warps": 4
        },
        "ms": 0.007,
        "min_ms": 0.0072,
        "max_ms": 0.0069,
        "GB/s": 7.01,
        "TFLOPS": 0.6
    },
    {
        "params": {
            "M": 128,
            "N": 512,
            "K": 32,
            "block_m": 32,
            "block_n": 32,
            "block_k": 32,
            "dtype_str": "fp16",
            "num_warps": 4
        },
        "ms": 0.0107,
        "min_ms": 0.0108,
        "max_ms": 0.0106,
        "GB/s": 7.68,
        "TFLOPS": 0.79
    },
    {
        "params": {
            "M": 128,
            "N": 512,
            "K": 32,
            "block_m": 32,
            "block_n": 64,
            "block_k": 32,
            "dtype_str": "fp16",
            "num_warps": 4
        },
        "ms": 0.009,
        "min_ms": 0.0091,
        "max_ms": 0.0089,
        "GB/s": 9.12,
        "TFLOPS": 0.93
    },
    {
        "params": {
            "M": 128,
            "N": 512,
            "K": 32,
            "block_m": 32,
            "block_n": 128,
            "block_k": 32,
            "dtype_str": "fp16",
            "num_warps": 4
        },
        "ms": 0.009,
        "min_ms": 0.0091,
        "max_ms": 0.0089,
        "GB/s": 9.12,
        "TFLOPS": 0.93
    },
    {
        "params": {
            "M": 128,
            "N": 512,
            "K": 32,
            "block_m": 64,
            "block_n": 32,
            "block_k": 32,
            "dtype_str": "fp16",
            "num_warps": 4
        },
        "ms": 0.0108,
        "min_ms": 0.0109,
        "max_ms": 0.0107,
        "GB/s": 7.57,
        "TFLOPS": 0.77
    },
    {
        "params": {
            "M": 128,
            "N": 512,
            "K": 32,
            "block_m": 64,
            "block_n": 64,
            "block_k": 32,
            "dtype_str": "fp16",
            "num_warps": 4
        },
        "ms": 0.0091,
        "min_ms": 0.0093,
        "max_ms": 0.0091,
        "GB/s": 8.96,
        "TFLOPS": 0.92
    },
    {
        "params": {
            "M": 128,
            "N": 512,
            "K": 32,
            "block_m": 64,
            "block_n": 128,
            "block_k": 32,
            "dtype_str": "fp16",
            "num_warps": 4
        },
        "ms": 0.0091,
        "min_ms": 0.0093,
        "max_ms": 0.0091,
        "GB/s": 8.96,
        "TFLOPS": 0.92
    },
    {
        "params": {
            "M": 128,
            "N": 512,
            "K": 32,
            "block_m": 128,
            "block_n": 32,
            "block_k": 32,
            "dtype_str": "fp16",
            "num_warps": 4
        },
        "ms": 0.0114,
        "min_ms": 0.0115,
        "max_ms": 0.0111,
        "GB/s": 7.19,
        "TFLOPS": 0.74
    },
    {
        "params": {
            "M": 128,
            "N": 512,
            "K": 32,
            "block_m": 128,
            "block_n": 64,
            "block_k": 32,
            "dtype_str": "fp16",
            "num_warps": 4
        },
        "ms": 0.0091,
        "min_ms": 0.0093,
        "max_ms": 0.009,
        "GB/s": 9.0,
        "TFLOPS": 0.92
    },
    {
        "params": {
            "M": 128,
            "N": 512,
            "K": 32,
            "block_m": 128,
            "block_n": 128,
            "block_k": 32,
            "dtype_str": "fp16",
            "num_warps": 4
        },
        "ms": 0.0091,
        "min_ms": 0.0092,
        "max_ms": 0.009,
        "GB/s": 9.04,
        "TFLOPS": 0.93
    },
    {
        "params": {
            "M": 128,
            "N": 1024,
            "K": 32,
            "block_m": 32,
            "block_n": 32,
            "block_k": 32,
            "dtype_str": "fp16",
            "num_warps": 4
        },
        "ms": 0.0169,
        "min_ms": 0.0171,
        "max_ms": 0.0168,
        "GB/s": 8.72,
        "TFLOPS": 0.99
    },
    {
        "params": {
            "M": 128,
            "N": 1024,
            "K": 32,
            "block_m": 32,
            "block_n": 64,
            "block_k": 32,
            "dtype_str": "fp16",
            "num_warps": 4
        },
        "ms": 0.0133,
        "min_ms": 0.0134,
        "max_ms": 0.0133,
        "GB/s": 11.08,
        "TFLOPS": 1.26
    },
    {
        "params": {
            "M": 128,
            "N": 1024,
            "K": 32,
            "block_m": 32,
            "block_n": 128,
            "block_k": 32,
            "dtype_str": "fp16",
            "num_warps": 4
        },
        "ms": 0.0129,
        "min_ms": 0.013,
        "max_ms": 0.0129,
        "GB/s": 11.39,
        "TFLOPS": 1.3
    },
    {
        "params": {
            "M": 128,
            "N": 1024,
            "K": 32,
            "block_m": 64,
            "block_n": 32,
            "block_k": 32,
            "dtype_str": "fp16",
            "num_warps": 4
        },
        "ms": 0.0171,
        "min_ms": 0.0172,
        "max_ms": 0.017,
        "GB/s": 8.63,
        "TFLOPS": 0.98
    },
    {
        "params": {
            "M": 128,
            "N": 1024,
            "K": 32,
            "block_m": 64,
            "block_n": 64,
            "block_k": 32,
            "dtype_str": "fp16",
            "num_warps": 4
        },
        "ms": 0.0135,
        "min_ms": 0.0136,
        "max_ms": 0.0134,
        "GB/s": 10.95,
        "TFLOPS": 1.25
    },
    {
        "params": {
            "M": 128,
            "N": 1024,
            "K": 32,
            "block_m": 64,
            "block_n": 128,
            "block_k": 32,
            "dtype_str": "fp16",
            "num_warps": 4
        },
        "ms": 0.0132,
        "min_ms": 0.0134,
        "max_ms": 0.0131,
        "GB/s": 11.15,
        "TFLOPS": 1.27
    },
    {
        "params": {
            "M": 128,
            "N": 1024,
            "K": 32,
            "block_m": 128,
            "block_n": 32,
            "block_k": 32,
            "dtype_str": "fp16",
            "num_warps": 4
        },
        "ms": 0.0192,
        "min_ms": 0.0196,
        "max_ms": 0.0185,
        "GB/s": 7.66,
        "TFLOPS": 0.87
    },
    {
        "params": {
            "M": 128,
            "N": 1024,
            "K": 32,
            "block_m": 128,
            "block_n": 64,
            "block_k": 32,
            "dtype_str": "fp16",
            "num_warps": 4
        },
        "ms": 0.0135,
        "min_ms": 0.0136,
        "max_ms": 0.0134,
        "GB/s": 10.95,
        "TFLOPS": 1.25
    },
    {
        "params": {
            "M": 128,
            "N": 1024,
            "K": 32,
            "block_m": 128,
            "block_n": 128,
            "block_k": 32,
            "dtype_str": "fp16",
            "num_warps": 4
        },
        "ms": 0.0132,
        "min_ms": 0.0133,
        "max_ms": 0.0131,
        "GB/s": 11.18,
        "TFLOPS": 1.27
    },
    {
        "params": {
            "M": 128,
            "N": 2048,
            "K": 32,
            "block_m": 32,
            "block_n": 32,
            "block_k": 32,
            "dtype_str": "fp16",
            "num_warps": 4
        },
        "ms": 0.0293,
        "min_ms": 0.0295,
        "max_ms": 0.0292,
        "GB/s": 9.5,
        "TFLOPS": 1.14
    },
    {
        "params": {
            "M": 128,
            "N": 2048,
            "K": 32,
            "block_m": 32,
            "block_n": 64,
            "block_k": 32,
            "dtype_str": "fp16",
            "num_warps": 4
        },
        "ms": 0.022,
        "min_ms": 0.0221,
        "max_ms": 0.0219,
        "GB/s": 12.68,
        "TFLOPS": 1.53
    },
    {
        "params": {
            "M": 128,
            "N": 2048,
            "K": 32,
            "block_m": 32,
            "block_n": 128,
            "block_k": 32,
            "dtype_str": "fp16",
            "num_warps": 4
        },
        "ms": 0.0209,
        "min_ms": 0.0211,
        "max_ms": 0.0208,
        "GB/s": 13.33,
        "TFLOPS": 1.61
    },
    {
        "params": {
            "M": 128,
            "N": 2048,
            "K": 32,
            "block_m": 64,
            "block_n": 32,
            "block_k": 32,
            "dtype_str": "fp16",
            "num_warps": 4
        },
        "ms": 0.0295,
        "min_ms": 0.0296,
        "max_ms": 0.0293,
        "GB/s": 9.45,
        "TFLOPS": 1.14
    },
    {
        "params": {
            "M": 128,
            "N": 2048,
            "K": 32,
            "block_m": 64,
            "block_n": 64,
            "block_k": 32,
            "dtype_str": "fp16",
            "num_warps": 4
        },
        "ms": 0.0223,
        "min_ms": 0.0226,
        "max_ms": 0.0222,
        "GB/s": 12.47,
        "TFLOPS": 1.5
    },
    {
        "params": {
            "M": 128,
            "N": 2048,
            "K": 32,
            "block_m": 64,
            "block_n": 128,
            "block_k": 32,
            "dtype_str": "fp16",
            "num_warps": 4
        },
        "ms": 0.0214,
        "min_ms": 0.0215,
        "max_ms": 0.0213,
        "GB/s": 13.01,
        "TFLOPS": 1.57
    },
    {
        "params": {
            "M": 128,
            "N": 2048,
            "K": 32,
            "block_m": 128,
            "block_n": 32,
            "block_k": 32,
            "dtype_str": "fp16",
            "num_warps": 4
        },
        "ms": 0.0306,
        "min_ms": 0.0311,
        "max_ms": 0.0302,
        "GB/s": 9.11,
        "TFLOPS": 1.1
    },
    {
        "params": {
            "M": 128,
            "N": 2048,
            "K": 32,
            "block_m": 128,
            "block_n": 64,
            "block_k": 32,
            "dtype_str": "fp16",
            "num_warps": 4
        },
        "ms": 0.0221,
        "min_ms": 0.0225,
        "max_ms": 0.0219,
        "GB/s": 12.63,
        "TFLOPS": 1.52
    },
    {
        "params": {
            "M": 128,
            "N": 2048,
            "K": 32,
            "block_m": 128,
            "block_n": 128,
            "block_k": 32,
            "dtype_str": "fp16",
            "num_warps": 4
        },
        "ms": 0.0214,
        "min_ms": 0.0216,
        "max_ms": 0.0213,
        "GB/s": 13.01,
        "TFLOPS": 1.57
    },
    {
        "params": {
            "M": 128,
            "N": 4096,
            "K": 32,
            "block_m": 32,
            "block_n": 32,
            "block_k": 32,
            "dtype_str": "fp16",
            "num_warps": 4
        },
        "ms": 0.0547,
        "min_ms": 0.0549,
        "max_ms": 0.0545,
        "GB/s": 9.89,
        "TFLOPS": 1.23
    },
    {
        "params": {
            "M": 128,
            "N": 4096,
            "K": 32,
            "block_m": 32,
            "block_n": 64,
            "block_k": 32,
            "dtype_str": "fp16",
            "num_warps": 4
        },
        "ms": 0.0394,
        "min_ms": 0.0395,
        "max_ms": 0.0393,
        "GB/s": 13.73,
        "TFLOPS": 1.7
    },
    {
        "params": {
            "M": 128,
            "N": 4096,
            "K": 32,
            "block_m": 32,
            "block_n": 128,
            "block_k": 32,
            "dtype_str": "fp16",
            "num_warps": 4
        },
        "ms": 0.0368,
        "min_ms": 0.0368,
        "max_ms": 0.0366,
        "GB/s": 14.71,
        "TFLOPS": 1.83
    },
    {
        "params": {
            "M": 128,
            "N": 4096,
            "K": 32,
            "block_m": 64,
            "block_n": 32,
            "block_k": 32,
            "dtype_str": "fp16",
            "num_warps": 4
        },
        "ms": 0.0548,
        "min_ms": 0.055,
        "max_ms": 0.0546,
        "GB/s": 9.87,
        "TFLOPS": 1.22
    },
    {
        "params": {
            "M": 128,
            "N": 4096,
            "K": 32,
            "block_m": 64,
            "block_n": 64,
            "block_k": 32,
            "dtype_str": "fp16",
            "num_warps": 4
        },
        "ms": 0.0398,
        "min_ms": 0.0399,
        "max_ms": 0.0397,
        "GB/s": 13.58,
        "TFLOPS": 1.69
    },
    {
        "params": {
            "M": 128,
            "N": 4096,
            "K": 32,
            "block_m": 64,
            "block_n": 128,
            "block_k": 32,
            "dtype_str": "fp16",
            "num_warps": 4
        },
        "ms": 0.0377,
        "min_ms": 0.0378,
        "max_ms": 0.0376,
        "GB/s": 14.35,
        "TFLOPS": 1.78
    },
    {
        "params": {
            "M": 128,
            "N": 4096,
            "K": 32,
            "block_m": 128,
            "block_n": 32,
            "block_k": 32,
            "dtype_str": "fp16",
            "num_warps": 4
        },
        "ms": 0.0599,
        "min_ms": 0.0607,
        "max_ms": 0.0586,
        "GB/s": 9.03,
        "TFLOPS": 1.12
    },
    {
        "params": {
            "M": 128,
            "N": 4096,
            "K": 32,
            "block_m": 128,
            "block_n": 64,
            "block_k": 32,
            "dtype_str": "fp16",
            "num_warps": 4
        },
        "ms": 0.0391,
        "min_ms": 0.0393,
        "max_ms": 0.039,
        "GB/s": 13.82,
        "TFLOPS": 1.72
    },
    {
        "params": {
            "M": 128,
            "N": 4096,
            "K": 32,
            "block_m": 128,
            "block_n": 128,
            "block_k": 32,
            "dtype_str": "fp16",
            "num_warps": 4
        },
        "ms": 0.0376,
        "min_ms": 0.0377,
        "max_ms": 0.0375,
        "GB/s": 14.36,
        "TFLOPS": 1.78
    },
    {
        "params": {
            "M": 256,
            "N": 128,
            "K": 32,
            "block_m": 32,
            "block_n": 32,
            "block_k": 32,
            "dtype_str": "fp16",
            "num_warps": 4
        },
        "ms": 0.0068,
        "min_ms": 0.0071,
        "max_ms": 0.0063,
        "GB/s": 7.25,
        "TFLOPS": 0.62
    },
    {
        "params": {
            "M": 256,
            "N": 128,
            "K": 32,
            "block_m": 32,
            "block_n": 64,
            "block_k": 32,
            "dtype_str": "fp16",
            "num_warps": 4
        },
        "ms": 0.0067,
        "min_ms": 0.007,
        "max_ms": 0.0062,
        "GB/s": 7.39,
        "TFLOPS": 0.63
    },
    {
        "params": {
            "M": 256,
            "N": 128,
            "K": 32,
            "block_m": 32,
            "block_n": 128,
            "block_k": 32,
            "dtype_str": "fp16",
            "num_warps": 4
        },
        "ms": 0.0067,
        "min_ms": 0.007,
        "max_ms": 0.0063,
        "GB/s": 7.34,
        "TFLOPS": 0.63
    },
    {
        "params": {
            "M": 256,
            "N": 128,
            "K": 32,
            "block_m": 64,
            "block_n": 32,
            "block_k": 32,
            "dtype_str": "fp16",
            "num_warps": 4
        },
        "ms": 0.0068,
        "min_ms": 0.0071,
        "max_ms": 0.0064,
        "GB/s": 7.25,
        "TFLOPS": 0.62
    },
    {
        "params": {
            "M": 256,
            "N": 128,
            "K": 32,
            "block_m": 64,
            "block_n": 64,
            "block_k": 32,
            "dtype_str": "fp16",
            "num_warps": 4
        },
        "ms": 0.0068,
        "min_ms": 0.0071,
        "max_ms": 0.0063,
        "GB/s": 7.25,
        "TFLOPS": 0.62
    },
    {
        "params": {
            "M": 256,
            "N": 128,
            "K": 32,
            "block_m": 64,
            "block_n": 128,
            "block_k": 32,
            "dtype_str": "fp16",
            "num_warps": 4
        },
        "ms": 0.0068,
        "min_ms": 0.0071,
        "max_ms": 0.0063,
        "GB/s": 7.21,
        "TFLOPS": 0.62
    },
    {
        "params": {
            "M": 256,
            "N": 128,
            "K": 32,
            "block_m": 128,
            "block_n": 32,
            "block_k": 32,
            "dtype_str": "fp16",
            "num_warps": 4
        },
        "ms": 0.0066,
        "min_ms": 0.0069,
        "max_ms": 0.0064,
        "GB/s": 7.43,
        "TFLOPS": 0.63
    },
    {
        "params": {
            "M": 256,
            "N": 128,
            "K": 32,
            "block_m": 128,
            "block_n": 64,
            "block_k": 32,
            "dtype_str": "fp16",
            "num_warps": 4
        },
        "ms": 0.0066,
        "min_ms": 0.0069,
        "max_ms": 0.0062,
        "GB/s": 7.43,
        "TFLOPS": 0.63
    },
    {
        "params": {
            "M": 256,
            "N": 128,
            "K": 32,
            "block_m": 128,
            "block_n": 128,
            "block_k": 32,
            "dtype_str": "fp16",
            "num_warps": 4
        },
        "ms": 0.0066,
        "min_ms": 0.0069,
        "max_ms": 0.0062,
        "GB/s": 7.43,
        "TFLOPS": 0.63
    },
    {
        "params": {
            "M": 256,
            "N": 256,
            "K": 32,
            "block_m": 32,
            "block_n": 32,
            "block_k": 32,
            "dtype_str": "fp16",
            "num_warps": 4
        },
        "ms": 0.0078,
        "min_ms": 0.0079,
        "max_ms": 0.0077,
        "GB/s": 8.43,
        "TFLOPS": 1.08
    },
    {
        "params": {
            "M": 256,
            "N": 256,
            "K": 32,
            "block_m": 32,
            "block_n": 64,
            "block_k": 32,
            "dtype_str": "fp16",
            "num_warps": 4
        },
        "ms": 0.0069,
        "min_ms": 0.0072,
        "max_ms": 0.0067,
        "GB/s": 9.56,
        "TFLOPS": 1.22
    },
    {
        "params": {
            "M": 256,
            "N": 256,
            "K": 32,
            "block_m": 32,
            "block_n": 128,
            "block_k": 32,
            "dtype_str": "fp16",
            "num_warps": 4
        },
        "ms": 0.0071,
        "min_ms": 0.0073,
        "max_ms": 0.007,
        "GB/s": 9.18,
        "TFLOPS": 1.18
    },
    {
        "params": {
            "M": 256,
            "N": 256,
            "K": 32,
            "block_m": 64,
            "block_n": 32,
            "block_k": 32,
            "dtype_str": "fp16",
            "num_warps": 4
        },
        "ms": 0.0079,
        "min_ms": 0.0079,
        "max_ms": 0.0078,
        "GB/s": 8.34,
        "TFLOPS": 1.07
    },
    {
        "params": {
            "M": 256,
            "N": 256,
            "K": 32,
            "block_m": 64,
            "block_n": 64,
            "block_k": 32,
            "dtype_str": "fp16",
            "num_warps": 4
        },
        "ms": 0.0071,
        "min_ms": 0.0073,
        "max_ms": 0.007,
        "GB/s": 9.29,
        "TFLOPS": 1.19
    },
    {
        "params": {
            "M": 256,
            "N": 256,
            "K": 32,
            "block_m": 64,
            "block_n": 128,
            "block_k": 32,
            "dtype_str": "fp16",
            "num_warps": 4
        },
        "ms": 0.0072,
        "min_ms": 0.0074,
        "max_ms": 0.0071,
        "GB/s": 9.08,
        "TFLOPS": 1.16
    },
    {
        "params": {
            "M": 256,
            "N": 256,
            "K": 32,
            "block_m": 128,
            "block_n": 32,
            "block_k": 32,
            "dtype_str": "fp16",
            "num_warps": 4
        },
        "ms": 0.0079,
        "min_ms": 0.008,
        "max_ms": 0.0077,
        "GB/s": 8.34,
        "TFLOPS": 1.07
    },
    {
        "params": {
            "M": 256,
            "N": 256,
            "K": 32,
            "block_m": 128,
            "block_n": 64,
            "block_k": 32,
            "dtype_str": "fp16",
            "num_warps": 4
        },
        "ms": 0.0071,
        "min_ms": 0.0073,
        "max_ms": 0.0069,
        "GB/s": 9.29,
        "TFLOPS": 1.19
    },
    {
        "params": {
            "M": 256,
            "N": 256,
            "K": 32,
            "block_m": 128,
            "block_n": 128,
            "block_k": 32,
            "dtype_str": "fp16",
            "num_warps": 4
        },
        "ms": 0.0071,
        "min_ms": 0.0073,
        "max_ms": 0.007,
        "GB/s": 9.24,
        "TFLOPS": 1.18
    },
    {
        "params": {
            "M": 256,
            "N": 512,
            "K": 32,
            "block_m": 32,
            "block_n": 32,
            "block_k": 32,
            "dtype_str": "fp16",
            "num_warps": 4
        },
        "ms": 0.0109,
        "min_ms": 0.011,
        "max_ms": 0.0108,
        "GB/s": 9.01,
        "TFLOPS": 1.54
    },
    {
        "params": {
            "M": 256,
            "N": 512,
            "K": 32,
            "block_m": 32,
            "block_n": 64,
            "block_k": 32,
            "dtype_str": "fp16",
            "num_warps": 4
        },
        "ms": 0.009,
        "min_ms": 0.0093,
        "max_ms": 0.0089,
        "GB/s": 10.9,
        "TFLOPS": 1.86
    },
    {
        "params": {
            "M": 256,
            "N": 512,
            "K": 32,
            "block_m": 32,
            "block_n": 128,
            "block_k": 32,
            "dtype_str": "fp16",
            "num_warps": 4
        },
        "ms": 0.0091,
        "min_ms": 0.0093,
        "max_ms": 0.009,
        "GB/s": 10.8,
        "TFLOPS": 1.84
    },
    {
        "params": {
            "M": 256,
            "N": 512,
            "K": 32,
            "block_m": 64,
            "block_n": 32,
            "block_k": 32,
            "dtype_str": "fp16",
            "num_warps": 4
        },
        "ms": 0.0109,
        "min_ms": 0.011,
        "max_ms": 0.0108,
        "GB/s": 9.01,
        "TFLOPS": 1.54
    },
    {
        "params": {
            "M": 256,
            "N": 512,
            "K": 32,
            "block_m": 64,
            "block_n": 64,
            "block_k": 32,
            "dtype_str": "fp16",
            "num_warps": 4
        },
        "ms": 0.0092,
        "min_ms": 0.0093,
        "max_ms": 0.0091,
        "GB/s": 10.71,
        "TFLOPS": 1.83
    },
    {
        "params": {
            "M": 256,
            "N": 512,
            "K": 32,
            "block_m": 64,
            "block_n": 128,
            "block_k": 32,
            "dtype_str": "fp16",
            "num_warps": 4
        },
        "ms": 0.0093,
        "min_ms": 0.0094,
        "max_ms": 0.0092,
        "GB/s": 10.61,
        "TFLOPS": 1.81
    },
    {
        "params": {
            "M": 256,
            "N": 512,
            "K": 32,
            "block_m": 128,
            "block_n": 32,
            "block_k": 32,
            "dtype_str": "fp16",
            "num_warps": 4
        },
        "ms": 0.0109,
        "min_ms": 0.0111,
        "max_ms": 0.0108,
        "GB/s": 9.01,
        "TFLOPS": 1.54
    },
    {
        "params": {
            "M": 256,
            "N": 512,
            "K": 32,
            "block_m": 128,
            "block_n": 64,
            "block_k": 32,
            "dtype_str": "fp16",
            "num_warps": 4
        },
        "ms": 0.0092,
        "min_ms": 0.0094,
        "max_ms": 0.0091,
        "GB/s": 10.71,
        "TFLOPS": 1.83
    },
    {
        "params": {
            "M": 256,
            "N": 512,
            "K": 32,
            "block_m": 128,
            "block_n": 128,
            "block_k": 32,
            "dtype_str": "fp16",
            "num_warps": 4
        },
        "ms": 0.0091,
        "min_ms": 0.0093,
        "max_ms": 0.009,
        "GB/s": 10.75,
        "TFLOPS": 1.84
    },
    {
        "params": {
            "M": 256,
            "N": 1024,
            "K": 32,
            "block_m": 32,
            "block_n": 32,
            "block_k": 32,
            "dtype_str": "fp16",
            "num_warps": 4
        },
        "ms": 0.0172,
        "min_ms": 0.0173,
        "max_ms": 0.0171,
        "GB/s": 9.55,
        "TFLOPS": 1.96
    },
    {
        "params": {
            "M": 256,
            "N": 1024,
            "K": 32,
            "block_m": 32,
            "block_n": 64,
            "block_k": 32,
            "dtype_str": "fp16",
            "num_warps": 4
        },
        "ms": 0.0134,
        "min_ms": 0.0136,
        "max_ms": 0.0133,
        "GB/s": 12.24,
        "TFLOPS": 2.51
    },
    {
        "params": {
            "M": 256,
            "N": 1024,
            "K": 32,
            "block_m": 32,
            "block_n": 128,
            "block_k": 32,
            "dtype_str": "fp16",
            "num_warps": 4
        },
        "ms": 0.0131,
        "min_ms": 0.0132,
        "max_ms": 0.013,
        "GB/s": 12.54,
        "TFLOPS": 2.57
    },
    {
        "params": {
            "M": 256,
            "N": 1024,
            "K": 32,
            "block_m": 64,
            "block_n": 32,
            "block_k": 32,
            "dtype_str": "fp16",
            "num_warps": 4
        },
        "ms": 0.0172,
        "min_ms": 0.0174,
        "max_ms": 0.0172,
        "GB/s": 9.5,
        "TFLOPS": 1.95
    },
    {
        "params": {
            "M": 256,
            "N": 1024,
            "K": 32,
            "block_m": 64,
            "block_n": 64,
            "block_k": 32,
            "dtype_str": "fp16",
            "num_warps": 4
        },
        "ms": 0.0136,
        "min_ms": 0.0137,
        "max_ms": 0.0135,
        "GB/s": 12.06,
        "TFLOPS": 2.47
    },
    {
        "params": {
            "M": 256,
            "N": 1024,
            "K": 32,
            "block_m": 64,
            "block_n": 128,
            "block_k": 32,
            "dtype_str": "fp16",
            "num_warps": 4
        },
        "ms": 0.0132,
        "min_ms": 0.0134,
        "max_ms": 0.0132,
        "GB/s": 12.38,
        "TFLOPS": 2.54
    },
    {
        "params": {
            "M": 256,
            "N": 1024,
            "K": 32,
            "block_m": 128,
            "block_n": 32,
            "block_k": 32,
            "dtype_str": "fp16",
            "num_warps": 4
        },
        "ms": 0.017,
        "min_ms": 0.0172,
        "max_ms": 0.0169,
        "GB/s": 9.64,
        "TFLOPS": 1.97
    },
    {
        "params": {
            "M": 256,
            "N": 1024,
            "K": 32,
            "block_m": 128,
            "block_n": 64,
            "block_k": 32,
            "dtype_str": "fp16",
            "num_warps": 4
        },
        "ms": 0.0134,
        "min_ms": 0.0136,
        "max_ms": 0.0134,
        "GB/s": 12.2,
        "TFLOPS": 2.5
    },
    {
        "params": {
            "M": 256,
            "N": 1024,
            "K": 32,
            "block_m": 128,
            "block_n": 128,
            "block_k": 32,
            "dtype_str": "fp16",
            "num_warps": 4
        },
        "ms": 0.0132,
        "min_ms": 0.0134,
        "max_ms": 0.0132,
        "GB/s": 12.38,
        "TFLOPS": 2.54
    },
    {
        "params": {
            "M": 256,
            "N": 2048,
            "K": 32,
            "block_m": 32,
            "block_n": 32,
            "block_k": 32,
            "dtype_str": "fp16",
            "num_warps": 4
        },
        "ms": 0.0297,
        "min_ms": 0.0298,
        "max_ms": 0.0295,
        "GB/s": 9.94,
        "TFLOPS": 2.26
    },
    {
        "params": {
            "M": 256,
            "N": 2048,
            "K": 32,
            "block_m": 32,
            "block_n": 64,
            "block_k": 32,
            "dtype_str": "fp16",
            "num_warps": 4
        },
        "ms": 0.0221,
        "min_ms": 0.0223,
        "max_ms": 0.022,
        "GB/s": 13.35,
        "TFLOPS": 3.04
    },
    {
        "params": {
            "M": 256,
            "N": 2048,
            "K": 32,
            "block_m": 32,
            "block_n": 128,
            "block_k": 32,
            "dtype_str": "fp16",
            "num_warps": 4
        },
        "ms": 0.021,
        "min_ms": 0.0212,
        "max_ms": 0.0209,
        "GB/s": 14.01,
        "TFLOPS": 3.19
    },
    {
        "params": {
            "M": 256,
            "N": 2048,
            "K": 32,
            "block_m": 64,
            "block_n": 32,
            "block_k": 32,
            "dtype_str": "fp16",
            "num_warps": 4
        },
        "ms": 0.0296,
        "min_ms": 0.0297,
        "max_ms": 0.0295,
        "GB/s": 9.95,
        "TFLOPS": 2.27
    },
    {
        "params": {
            "M": 256,
            "N": 2048,
            "K": 32,
            "block_m": 64,
            "block_n": 64,
            "block_k": 32,
            "dtype_str": "fp16",
            "num_warps": 4
        },
        "ms": 0.0223,
        "min_ms": 0.0225,
        "max_ms": 0.0222,
        "GB/s": 13.21,
        "TFLOPS": 3.01
    },
    {
        "params": {
            "M": 256,
            "N": 2048,
            "K": 32,
            "block_m": 64,
            "block_n": 128,
            "block_k": 32,
            "dtype_str": "fp16",
            "num_warps": 4
        },
        "ms": 0.0214,
        "min_ms": 0.0216,
        "max_ms": 0.0214,
        "GB/s": 13.75,
        "TFLOPS": 3.13
    },
    {
        "params": {
            "M": 256,
            "N": 2048,
            "K": 32,
            "block_m": 128,
            "block_n": 32,
            "block_k": 32,
            "dtype_str": "fp16",
            "num_warps": 4
        },
        "ms": 0.0292,
        "min_ms": 0.0293,
        "max_ms": 0.0291,
        "GB/s": 10.1,
        "TFLOPS": 2.3
    },
    {
        "params": {
            "M": 256,
            "N": 2048,
            "K": 32,
            "block_m": 128,
            "block_n": 64,
            "block_k": 32,
            "dtype_str": "fp16",
            "num_warps": 4
        },
        "ms": 0.0219,
        "min_ms": 0.0222,
        "max_ms": 0.0218,
        "GB/s": 13.45,
        "TFLOPS": 3.06
    },
    {
        "params": {
            "M": 256,
            "N": 2048,
            "K": 32,
            "block_m": 128,
            "block_n": 128,
            "block_k": 32,
            "dtype_str": "fp16",
            "num_warps": 4
        },
        "ms": 0.0213,
        "min_ms": 0.0214,
        "max_ms": 0.0212,
        "GB/s": 13.83,
        "TFLOPS": 3.15
    },
    {
        "params": {
            "M": 256,
            "N": 4096,
            "K": 32,
            "block_m": 32,
            "block_n": 32,
            "block_k": 32,
            "dtype_str": "fp16",
            "num_warps": 4
        },
        "ms": 0.0551,
        "min_ms": 0.0553,
        "max_ms": 0.0549,
        "GB/s": 10.11,
        "TFLOPS": 2.44
    },
    {
        "params": {
            "M": 256,
            "N": 4096,
            "K": 32,
            "block_m": 32,
            "block_n": 64,
            "block_k": 32,
            "dtype_str": "fp16",
            "num_warps": 4
        },
        "ms": 0.0395,
        "min_ms": 0.0396,
        "max_ms": 0.0394,
        "GB/s": 14.11,
        "TFLOPS": 3.4
    },
    {
        "params": {
            "M": 256,
            "N": 4096,
            "K": 32,
            "block_m": 32,
            "block_n": 128,
            "block_k": 32,
            "dtype_str": "fp16",
            "num_warps": 4
        },
        "ms": 0.0369,
        "min_ms": 0.037,
        "max_ms": 0.0368,
        "GB/s": 15.09,
        "TFLOPS": 3.63
    },
    {
        "params": {
            "M": 256,
            "N": 4096,
            "K": 32,
            "block_m": 64,
            "block_n": 32,
            "block_k": 32,
            "dtype_str": "fp16",
            "num_warps": 4
        },
        "ms": 0.055,
        "min_ms": 0.0552,
        "max_ms": 0.0548,
        "GB/s": 10.13,
        "TFLOPS": 2.44
    },
    {
        "params": {
            "M": 256,
            "N": 4096,
            "K": 32,
            "block_m": 64,
            "block_n": 64,
            "block_k": 32,
            "dtype_str": "fp16",
            "num_warps": 4
        },
        "ms": 0.0399,
        "min_ms": 0.04,
        "max_ms": 0.0397,
        "GB/s": 13.98,
        "TFLOPS": 3.37
    },
    {
        "params": {
            "M": 256,
            "N": 4096,
            "K": 32,
            "block_m": 64,
            "block_n": 128,
            "block_k": 32,
            "dtype_str": "fp16",
            "num_warps": 4
        },
        "ms": 0.0377,
        "min_ms": 0.0378,
        "max_ms": 0.0376,
        "GB/s": 14.77,
        "TFLOPS": 3.56
    },
    {
        "params": {
            "M": 256,
            "N": 4096,
            "K": 32,
            "block_m": 128,
            "block_n": 32,
            "block_k": 32,
            "dtype_str": "fp16",
            "num_warps": 4
        },
        "ms": 0.0539,
        "min_ms": 0.0542,
        "max_ms": 0.0537,
        "GB/s": 10.33,
        "TFLOPS": 2.49
    },
    {
        "params": {
            "M": 256,
            "N": 4096,
            "K": 32,
            "block_m": 128,
            "block_n": 64,
            "block_k": 32,
            "dtype_str": "fp16",
            "num_warps": 4
        },
        "ms": 0.039,
        "min_ms": 0.0392,
        "max_ms": 0.0389,
        "GB/s": 14.27,
        "TFLOPS": 3.44
    },
    {
        "params": {
            "M": 256,
            "N": 4096,
            "K": 32,
            "block_m": 128,
            "block_n": 128,
            "block_k": 32,
            "dtype_str": "fp16",
            "num_warps": 4
        },
        "ms": 0.0376,
        "min_ms": 0.0378,
        "max_ms": 0.0376,
        "GB/s": 14.8,
        "TFLOPS": 3.57
    },
    {
        "params": {
            "M": 512,
            "N": 128,
            "K": 32,
            "block_m": 32,
            "block_n": 32,
            "block_k": 32,
            "dtype_str": "fp16",
            "num_warps": 4
        },
        "ms": 0.0069,
        "min_ms": 0.0072,
        "max_ms": 0.0066,
        "GB/s": 11.88,
        "TFLOPS": 1.22
    },
    {
        "params": {
            "M": 512,
            "N": 128,
            "K": 32,
            "block_m": 32,
            "block_n": 64,
            "block_k": 32,
            "dtype_str": "fp16",
            "num_warps": 4
        },
        "ms": 0.0067,
        "min_ms": 0.007,
        "max_ms": 0.0063,
        "GB/s": 12.16,
        "TFLOPS": 1.25
    },
    {
        "params": {
            "M": 512,
            "N": 128,
            "K": 32,
            "block_m": 32,
            "block_n": 128,
            "block_k": 32,
            "dtype_str": "fp16",
            "num_warps": 4
        },
        "ms": 0.0068,
        "min_ms": 0.0071,
        "max_ms": 0.0063,
        "GB/s": 12.09,
        "TFLOPS": 1.24
    },
    {
        "params": {
            "M": 512,
            "N": 128,
            "K": 32,
            "block_m": 64,
            "block_n": 32,
            "block_k": 32,
            "dtype_str": "fp16",
            "num_warps": 4
        },
        "ms": 0.0068,
        "min_ms": 0.0071,
        "max_ms": 0.0064,
        "GB/s": 12.02,
        "TFLOPS": 1.23
    },
    {
        "params": {
            "M": 512,
            "N": 128,
            "K": 32,
            "block_m": 64,
            "block_n": 64,
            "block_k": 32,
            "dtype_str": "fp16",
            "num_warps": 4
        },
        "ms": 0.0068,
        "min_ms": 0.0071,
        "max_ms": 0.0063,
        "GB/s": 12.02,
        "TFLOPS": 1.23
    },
    {
        "params": {
            "M": 512,
            "N": 128,
            "K": 32,
            "block_m": 64,
            "block_n": 128,
            "block_k": 32,
            "dtype_str": "fp16",
            "num_warps": 4
        },
        "ms": 0.0068,
        "min_ms": 0.0071,
        "max_ms": 0.0063,
        "GB/s": 12.09,
        "TFLOPS": 1.24
    },
    {
        "params": {
            "M": 512,
            "N": 128,
            "K": 32,
            "block_m": 128,
            "block_n": 32,
            "block_k": 32,
            "dtype_str": "fp16",
            "num_warps": 4
        },
        "ms": 0.0067,
        "min_ms": 0.007,
        "max_ms": 0.0065,
        "GB/s": 12.24,
        "TFLOPS": 1.25
    },
    {
        "params": {
            "M": 512,
            "N": 128,
            "K": 32,
            "block_m": 128,
            "block_n": 64,
            "block_k": 32,
            "dtype_str": "fp16",
            "num_warps": 4
        },
        "ms": 0.0068,
        "min_ms": 0.0071,
        "max_ms": 0.0063,
        "GB/s": 12.09,
        "TFLOPS": 1.24
    },
    {
        "params": {
            "M": 512,
            "N": 128,
            "K": 32,
            "block_m": 128,
            "block_n": 128,
            "block_k": 32,
            "dtype_str": "fp16",
            "num_warps": 4
        },
        "ms": 0.0067,
        "min_ms": 0.007,
        "max_ms": 0.0063,
        "GB/s": 12.16,
        "TFLOPS": 1.25
    },
    {
        "params": {
            "M": 512,
            "N": 256,
            "K": 32,
            "block_m": 32,
            "block_n": 32,
            "block_k": 32,
            "dtype_str": "fp16",
            "num_warps": 4
        },
        "ms": 0.0078,
        "min_ms": 0.0079,
        "max_ms": 0.0077,
        "GB/s": 12.57,
        "TFLOPS": 2.15
    },
    {
        "params": {
            "M": 512,
            "N": 256,
            "K": 32,
            "block_m": 32,
            "block_n": 64,
            "block_k": 32,
            "dtype_str": "fp16",
            "num_warps": 4
        },
        "ms": 0.0069,
        "min_ms": 0.0072,
        "max_ms": 0.0068,
        "GB/s": 14.26,
        "TFLOPS": 2.43
    },
    {
        "params": {
            "M": 512,
            "N": 256,
            "K": 32,
            "block_m": 32,
            "block_n": 128,
            "block_k": 32,
            "dtype_str": "fp16",
            "num_warps": 4
        },
        "ms": 0.0071,
        "min_ms": 0.0074,
        "max_ms": 0.0071,
        "GB/s": 13.77,
        "TFLOPS": 2.35
    },
    {
        "params": {
            "M": 512,
            "N": 256,
            "K": 32,
            "block_m": 64,
            "block_n": 32,
            "block_k": 32,
            "dtype_str": "fp16",
            "num_warps": 4
        },
        "ms": 0.008,
        "min_ms": 0.0081,
        "max_ms": 0.0079,
        "GB/s": 12.32,
        "TFLOPS": 2.1
    },
    {
        "params": {
            "M": 512,
            "N": 256,
            "K": 32,
            "block_m": 64,
            "block_n": 64,
            "block_k": 32,
            "dtype_str": "fp16",
            "num_warps": 4
        },
        "ms": 0.0071,
        "min_ms": 0.0075,
        "max_ms": 0.007,
        "GB/s": 13.78,
        "TFLOPS": 2.35
    },
    {
        "params": {
            "M": 512,
            "N": 256,
            "K": 32,
            "block_m": 64,
            "block_n": 128,
            "block_k": 32,
            "dtype_str": "fp16",
            "num_warps": 4
        },
        "ms": 0.0073,
        "min_ms": 0.0076,
        "max_ms": 0.0072,
        "GB/s": 13.47,
        "TFLOPS": 2.3
    },
    {
        "params": {
            "M": 512,
            "N": 256,
            "K": 32,
            "block_m": 128,
            "block_n": 32,
            "block_k": 32,
            "dtype_str": "fp16",
            "num_warps": 4
        },
        "ms": 0.0079,
        "min_ms": 0.0081,
        "max_ms": 0.0079,
        "GB/s": 12.38,
        "TFLOPS": 2.11
    },
    {
        "params": {
            "M": 512,
            "N": 256,
            "K": 32,
            "block_m": 128,
            "block_n": 64,
            "block_k": 32,
            "dtype_str": "fp16",
            "num_warps": 4
        },
        "ms": 0.0071,
        "min_ms": 0.0073,
        "max_ms": 0.007,
        "GB/s": 13.93,
        "TFLOPS": 2.38
    },
    {
        "params": {
            "M": 512,
            "N": 256,
            "K": 32,
            "block_m": 128,
            "block_n": 128,
            "block_k": 32,
            "dtype_str": "fp16",
            "num_warps": 4
        },
        "ms": 0.0071,
        "min_ms": 0.0073,
        "max_ms": 0.007,
        "GB/s": 13.85,
        "TFLOPS": 2.36
    },
    {
        "params": {
            "M": 512,
            "N": 512,
            "K": 32,
            "block_m": 32,
            "block_n": 32,
            "block_k": 32,
            "dtype_str": "fp16",
            "num_warps": 4
        },
        "ms": 0.0109,
        "min_ms": 0.011,
        "max_ms": 0.0108,
        "GB/s": 12.06,
        "TFLOPS": 3.09
    },
    {
        "params": {
            "M": 512,
            "N": 512,
            "K": 32,
            "block_m": 32,
            "block_n": 64,
            "block_k": 32,
            "dtype_str": "fp16",
            "num_warps": 4
        },
        "ms": 0.0091,
        "min_ms": 0.0092,
        "max_ms": 0.0089,
        "GB/s": 14.47,
        "TFLOPS": 3.7
    },
    {
        "params": {
            "M": 512,
            "N": 512,
            "K": 32,
            "block_m": 32,
            "block_n": 128,
            "block_k": 32,
            "dtype_str": "fp16",
            "num_warps": 4
        },
        "ms": 0.0091,
        "min_ms": 0.0094,
        "max_ms": 0.009,
        "GB/s": 14.34,
        "TFLOPS": 3.67
    },
    {
        "params": {
            "M": 512,
            "N": 512,
            "K": 32,
            "block_m": 64,
            "block_n": 32,
            "block_k": 32,
            "dtype_str": "fp16",
            "num_warps": 4
        },
        "ms": 0.011,
        "min_ms": 0.0111,
        "max_ms": 0.0109,
        "GB/s": 11.89,
        "TFLOPS": 3.04
    },
    {
        "params": {
            "M": 512,
            "N": 512,
            "K": 32,
            "block_m": 64,
            "block_n": 64,
            "block_k": 32,
            "dtype_str": "fp16",
            "num_warps": 4
        },
        "ms": 0.0093,
        "min_ms": 0.0095,
        "max_ms": 0.0092,
        "GB/s": 14.09,
        "TFLOPS": 3.61
    },
    {
        "params": {
            "M": 512,
            "N": 512,
            "K": 32,
            "block_m": 64,
            "block_n": 128,
            "block_k": 32,
            "dtype_str": "fp16",
            "num_warps": 4
        },
        "ms": 0.0093,
        "min_ms": 0.0095,
        "max_ms": 0.0092,
        "GB/s": 14.09,
        "TFLOPS": 3.61
    },
    {
        "params": {
            "M": 512,
            "N": 512,
            "K": 32,
            "block_m": 128,
            "block_n": 32,
            "block_k": 32,
            "dtype_str": "fp16",
            "num_warps": 4
        },
        "ms": 0.0109,
        "min_ms": 0.0111,
        "max_ms": 0.0109,
        "GB/s": 11.98,
        "TFLOPS": 3.07
    },
    {
        "params": {
            "M": 512,
            "N": 512,
            "K": 32,
            "block_m": 128,
            "block_n": 64,
            "block_k": 32,
            "dtype_str": "fp16",
            "num_warps": 4
        },
        "ms": 0.0091,
        "min_ms": 0.0093,
        "max_ms": 0.0091,
        "GB/s": 14.34,
        "TFLOPS": 3.67
    },
    {
        "params": {
            "M": 512,
            "N": 512,
            "K": 32,
            "block_m": 128,
            "block_n": 128,
            "block_k": 32,
            "dtype_str": "fp16",
            "num_warps": 4
        },
        "ms": 0.0091,
        "min_ms": 0.0093,
        "max_ms": 0.0091,
        "GB/s": 14.4,
        "TFLOPS": 3.69
    },
    {
        "params": {
            "M": 512,
            "N": 1024,
            "K": 32,
            "block_m": 32,
            "block_n": 32,
            "block_k": 32,
            "dtype_str": "fp16",
            "num_warps": 4
        },
        "ms": 0.0171,
        "min_ms": 0.0173,
        "max_ms": 0.017,
        "GB/s": 11.48,
        "TFLOPS": 3.92
    },
    {
        "params": {
            "M": 512,
            "N": 1024,
            "K": 32,
            "block_m": 32,
            "block_n": 64,
            "block_k": 32,
            "dtype_str": "fp16",
            "num_warps": 4
        },
        "ms": 0.0134,
        "min_ms": 0.0136,
        "max_ms": 0.0133,
        "GB/s": 14.68,
        "TFLOPS": 5.01
    },
    {
        "params": {
            "M": 512,
            "N": 1024,
            "K": 32,
            "block_m": 32,
            "block_n": 128,
            "block_k": 32,
            "dtype_str": "fp16",
            "num_warps": 4
        },
        "ms": 0.0131,
        "min_ms": 0.0133,
        "max_ms": 0.013,
        "GB/s": 15.0,
        "TFLOPS": 5.12
    },
    {
        "params": {
            "M": 512,
            "N": 1024,
            "K": 32,
            "block_m": 64,
            "block_n": 32,
            "block_k": 32,
            "dtype_str": "fp16",
            "num_warps": 4
        },
        "ms": 0.0173,
        "min_ms": 0.0175,
        "max_ms": 0.0172,
        "GB/s": 11.35,
        "TFLOPS": 3.87
    },
    {
        "params": {
            "M": 512,
            "N": 1024,
            "K": 32,
            "block_m": 64,
            "block_n": 64,
            "block_k": 32,
            "dtype_str": "fp16",
            "num_warps": 4
        },
        "ms": 0.0137,
        "min_ms": 0.0138,
        "max_ms": 0.0136,
        "GB/s": 14.38,
        "TFLOPS": 4.91
    },
    {
        "params": {
            "M": 512,
            "N": 1024,
            "K": 32,
            "block_m": 64,
            "block_n": 128,
            "block_k": 32,
            "dtype_str": "fp16",
            "num_warps": 4
        },
        "ms": 0.0134,
        "min_ms": 0.0136,
        "max_ms": 0.0133,
        "GB/s": 14.68,
        "TFLOPS": 5.01
    },
    {
        "params": {
            "M": 512,
            "N": 1024,
            "K": 32,
            "block_m": 128,
            "block_n": 32,
            "block_k": 32,
            "dtype_str": "fp16",
            "num_warps": 4
        },
        "ms": 0.017,
        "min_ms": 0.0172,
        "max_ms": 0.0169,
        "GB/s": 11.54,
        "TFLOPS": 3.94
    },
    {
        "params": {
            "M": 512,
            "N": 1024,
            "K": 32,
            "block_m": 128,
            "block_n": 64,
            "block_k": 32,
            "dtype_str": "fp16",
            "num_warps": 4
        },
        "ms": 0.0134,
        "min_ms": 0.0136,
        "max_ms": 0.0134,
        "GB/s": 14.64,
        "TFLOPS": 5.0
    },
    {
        "params": {
            "M": 512,
            "N": 1024,
            "K": 32,
            "block_m": 128,
            "block_n": 128,
            "block_k": 32,
            "dtype_str": "fp16",
            "num_warps": 4
        },
        "ms": 0.0132,
        "min_ms": 0.0133,
        "max_ms": 0.0131,
        "GB/s": 14.95,
        "TFLOPS": 5.1
    },
    {
        "params": {
            "M": 512,
            "N": 2048,
            "K": 32,
            "block_m": 32,
            "block_n": 32,
            "block_k": 32,
            "dtype_str": "fp16",
            "num_warps": 4
        },
        "ms": 0.0296,
        "min_ms": 0.0298,
        "max_ms": 0.0295,
        "GB/s": 11.06,
        "TFLOPS": 4.53
    },
    {
        "params": {
            "M": 512,
            "N": 2048,
            "K": 32,
            "block_m": 32,
            "block_n": 64,
            "block_k": 32,
            "dtype_str": "fp16",
            "num_warps": 4
        },
        "ms": 0.0222,
        "min_ms": 0.0224,
        "max_ms": 0.0221,
        "GB/s": 14.78,
        "TFLOPS": 6.05
    },
    {
        "params": {
            "M": 512,
            "N": 2048,
            "K": 32,
            "block_m": 32,
            "block_n": 128,
            "block_k": 32,
            "dtype_str": "fp16",
            "num_warps": 4
        },
        "ms": 0.0211,
        "min_ms": 0.0213,
        "max_ms": 0.021,
        "GB/s": 15.54,
        "TFLOPS": 6.36
    },
    {
        "params": {
            "M": 512,
            "N": 2048,
            "K": 32,
            "block_m": 64,
            "block_n": 32,
            "block_k": 32,
            "dtype_str": "fp16",
            "num_warps": 4
        },
        "ms": 0.0299,
        "min_ms": 0.03,
        "max_ms": 0.0297,
        "GB/s": 10.97,
        "TFLOPS": 4.49
    },
    {
        "params": {
            "M": 512,
            "N": 2048,
            "K": 32,
            "block_m": 64,
            "block_n": 64,
            "block_k": 32,
            "dtype_str": "fp16",
            "num_warps": 4
        },
        "ms": 0.0224,
        "min_ms": 0.0225,
        "max_ms": 0.0223,
        "GB/s": 14.62,
        "TFLOPS": 5.99
    },
    {
        "params": {
            "M": 512,
            "N": 2048,
            "K": 32,
            "block_m": 64,
            "block_n": 128,
            "block_k": 32,
            "dtype_str": "fp16",
            "num_warps": 4
        },
        "ms": 0.0215,
        "min_ms": 0.0218,
        "max_ms": 0.0214,
        "GB/s": 15.22,
        "TFLOPS": 6.23
    },
    {
        "params": {
            "M": 512,
            "N": 2048,
            "K": 32,
            "block_m": 128,
            "block_n": 32,
            "block_k": 32,
            "dtype_str": "fp16",
            "num_warps": 4
        },
        "ms": 0.0293,
        "min_ms": 0.0295,
        "max_ms": 0.0292,
        "GB/s": 11.18,
        "TFLOPS": 4.58
    },
    {
        "params": {
            "M": 512,
            "N": 2048,
            "K": 32,
            "block_m": 128,
            "block_n": 64,
            "block_k": 32,
            "dtype_str": "fp16",
            "num_warps": 4
        },
        "ms": 0.022,
        "min_ms": 0.0221,
        "max_ms": 0.0219,
        "GB/s": 14.91,
        "TFLOPS": 6.11
    },
    {
        "params": {
            "M": 512,
            "N": 2048,
            "K": 32,
            "block_m": 128,
            "block_n": 128,
            "block_k": 32,
            "dtype_str": "fp16",
            "num_warps": 4
        },
        "ms": 0.0214,
        "min_ms": 0.0216,
        "max_ms": 0.0213,
        "GB/s": 15.31,
        "TFLOPS": 6.27
    },
    {
        "params": {
            "M": 512,
            "N": 4096,
            "K": 32,
            "block_m": 32,
            "block_n": 32,
            "block_k": 32,
            "dtype_str": "fp16",
            "num_warps": 4
        },
        "ms": 0.0549,
        "min_ms": 0.055,
        "max_ms": 0.0547,
        "GB/s": 10.75,
        "TFLOPS": 4.89
    },
    {
        "params": {
            "M": 512,
            "N": 4096,
            "K": 32,
            "block_m": 32,
            "block_n": 64,
            "block_k": 32,
            "dtype_str": "fp16",
            "num_warps": 4
        },
        "ms": 0.0396,
        "min_ms": 0.0397,
        "max_ms": 0.0395,
        "GB/s": 14.91,
        "TFLOPS": 6.78
    },
    {
        "params": {
            "M": 512,
            "N": 4096,
            "K": 32,
            "block_m": 32,
            "block_n": 128,
            "block_k": 32,
            "dtype_str": "fp16",
            "num_warps": 4
        },
        "ms": 0.037,
        "min_ms": 0.0371,
        "max_ms": 0.0369,
        "GB/s": 15.94,
        "TFLOPS": 7.25
    },
    {
        "params": {
            "M": 512,
            "N": 4096,
            "K": 32,
            "block_m": 64,
            "block_n": 32,
            "block_k": 32,
            "dtype_str": "fp16",
            "num_warps": 4
        },
        "ms": 0.0552,
        "min_ms": 0.0554,
        "max_ms": 0.0551,
        "GB/s": 10.68,
        "TFLOPS": 4.86
    },
    {
        "params": {
            "M": 512,
            "N": 4096,
            "K": 32,
            "block_m": 64,
            "block_n": 64,
            "block_k": 32,
            "dtype_str": "fp16",
            "num_warps": 4
        },
        "ms": 0.0399,
        "min_ms": 0.04,
        "max_ms": 0.0398,
        "GB/s": 14.79,
        "TFLOPS": 6.73
    },
    {
        "params": {
            "M": 512,
            "N": 4096,
            "K": 32,
            "block_m": 64,
            "block_n": 128,
            "block_k": 32,
            "dtype_str": "fp16",
            "num_warps": 4
        },
        "ms": 0.0378,
        "min_ms": 0.0379,
        "max_ms": 0.0377,
        "GB/s": 15.6,
        "TFLOPS": 7.1
    },
    {
        "params": {
            "M": 512,
            "N": 4096,
            "K": 32,
            "block_m": 128,
            "block_n": 32,
            "block_k": 32,
            "dtype_str": "fp16",
            "num_warps": 4
        },
        "ms": 0.0541,
        "min_ms": 0.0543,
        "max_ms": 0.054,
        "GB/s": 10.9,
        "TFLOPS": 4.96
    },
    {
        "params": {
            "M": 512,
            "N": 4096,
            "K": 32,
            "block_m": 128,
            "block_n": 64,
            "block_k": 32,
            "dtype_str": "fp16",
            "num_warps": 4
        },
        "ms": 0.039,
        "min_ms": 0.0391,
        "max_ms": 0.0388,
        "GB/s": 15.14,
        "TFLOPS": 6.89
    },
    {
        "params": {
            "M": 512,
            "N": 4096,
            "K": 32,
            "block_m": 128,
            "block_n": 128,
            "block_k": 32,
            "dtype_str": "fp16",
            "num_warps": 4
        },
        "ms": 0.0376,
        "min_ms": 0.0377,
        "max_ms": 0.0375,
        "GB/s": 15.68,
        "TFLOPS": 7.14
    },
    {
        "params": {
            "M": 1024,
            "N": 128,
            "K": 32,
            "block_m": 32,
            "block_n": 32,
            "block_k": 32,
            "dtype_str": "fp16",
            "num_warps": 4
        },
        "ms": 0.0068,
        "min_ms": 0.0071,
        "max_ms": 0.0064,
        "GB/s": 21.63,
        "TFLOPS": 2.46
    },
    {
        "params": {
            "M": 1024,
            "N": 128,
            "K": 32,
            "block_m": 32,
            "block_n": 64,
            "block_k": 32,
            "dtype_str": "fp16",
            "num_warps": 4
        },
        "ms": 0.0067,
        "min_ms": 0.007,
        "max_ms": 0.0063,
        "GB/s": 22.02,
        "TFLOPS": 2.51
    },
    {
        "params": {
            "M": 1024,
            "N": 128,
            "K": 32,
            "block_m": 32,
            "block_n": 128,
            "block_k": 32,
            "dtype_str": "fp16",
            "num_warps": 4
        },
        "ms": 0.0067,
        "min_ms": 0.0071,
        "max_ms": 0.0063,
        "GB/s": 21.89,
        "TFLOPS": 2.49
    },
    {
        "params": {
            "M": 1024,
            "N": 128,
            "K": 32,
            "block_m": 64,
            "block_n": 32,
            "block_k": 32,
            "dtype_str": "fp16",
            "num_warps": 4
        },
        "ms": 0.0069,
        "min_ms": 0.0071,
        "max_ms": 0.0064,
        "GB/s": 21.51,
        "TFLOPS": 2.45
    },
    {
        "params": {
            "M": 1024,
            "N": 128,
            "K": 32,
            "block_m": 64,
            "block_n": 64,
            "block_k": 32,
            "dtype_str": "fp16",
            "num_warps": 4
        },
        "ms": 0.0068,
        "min_ms": 0.0071,
        "max_ms": 0.0063,
        "GB/s": 21.63,
        "TFLOPS": 2.46
    },
    {
        "params": {
            "M": 1024,
            "N": 128,
            "K": 32,
            "block_m": 64,
            "block_n": 128,
            "block_k": 32,
            "dtype_str": "fp16",
            "num_warps": 4
        },
        "ms": 0.0068,
        "min_ms": 0.0071,
        "max_ms": 0.0064,
        "GB/s": 21.63,
        "TFLOPS": 2.46
    },
    {
        "params": {
            "M": 1024,
            "N": 128,
            "K": 32,
            "block_m": 128,
            "block_n": 32,
            "block_k": 32,
            "dtype_str": "fp16",
            "num_warps": 4
        },
        "ms": 0.0067,
        "min_ms": 0.0071,
        "max_ms": 0.0065,
        "GB/s": 21.89,
        "TFLOPS": 2.49
    },
    {
        "params": {
            "M": 1024,
            "N": 128,
            "K": 32,
            "block_m": 128,
            "block_n": 64,
            "block_k": 32,
            "dtype_str": "fp16",
            "num_warps": 4
        },
        "ms": 0.0067,
        "min_ms": 0.007,
        "max_ms": 0.0063,
        "GB/s": 21.89,
        "TFLOPS": 2.49
    },
    {
        "params": {
            "M": 1024,
            "N": 128,
            "K": 32,
            "block_m": 128,
            "block_n": 128,
            "block_k": 32,
            "dtype_str": "fp16",
            "num_warps": 4
        },
        "ms": 0.0067,
        "min_ms": 0.007,
        "max_ms": 0.0063,
        "GB/s": 22.02,
        "TFLOPS": 2.51
    },
    {
        "params": {
            "M": 1024,
            "N": 256,
            "K": 32,
            "block_m": 32,
            "block_n": 32,
            "block_k": 32,
            "dtype_str": "fp16",
            "num_warps": 4
        },
        "ms": 0.0078,
        "min_ms": 0.008,
        "max_ms": 0.0077,
        "GB/s": 20.96,
        "TFLOPS": 4.29
    },
    {
        "params": {
            "M": 1024,
            "N": 256,
            "K": 32,
            "block_m": 32,
            "block_n": 64,
            "block_k": 32,
            "dtype_str": "fp16",
            "num_warps": 4
        },
        "ms": 0.0069,
        "min_ms": 0.0073,
        "max_ms": 0.0068,
        "GB/s": 23.62,
        "TFLOPS": 4.84
    },
    {
        "params": {
            "M": 1024,
            "N": 256,
            "K": 32,
            "block_m": 32,
            "block_n": 128,
            "block_k": 32,
            "dtype_str": "fp16",
            "num_warps": 4
        },
        "ms": 0.0072,
        "min_ms": 0.0074,
        "max_ms": 0.0071,
        "GB/s": 22.83,
        "TFLOPS": 4.68
    },
    {
        "params": {
            "M": 1024,
            "N": 256,
            "K": 32,
            "block_m": 64,
            "block_n": 32,
            "block_k": 32,
            "dtype_str": "fp16",
            "num_warps": 4
        },
        "ms": 0.008,
        "min_ms": 0.0081,
        "max_ms": 0.0079,
        "GB/s": 20.54,
        "TFLOPS": 4.21
    },
    {
        "params": {
            "M": 1024,
            "N": 256,
            "K": 32,
            "block_m": 64,
            "block_n": 64,
            "block_k": 32,
            "dtype_str": "fp16",
            "num_warps": 4
        },
        "ms": 0.0072,
        "min_ms": 0.0074,
        "max_ms": 0.0071,
        "GB/s": 22.83,
        "TFLOPS": 4.68
    },
    {
        "params": {
            "M": 1024,
            "N": 256,
            "K": 32,
            "block_m": 64,
            "block_n": 128,
            "block_k": 32,
            "dtype_str": "fp16",
            "num_warps": 4
        },
        "ms": 0.0073,
        "min_ms": 0.0076,
        "max_ms": 0.0072,
        "GB/s": 22.33,
        "TFLOPS": 4.57
    },
    {
        "params": {
            "M": 1024,
            "N": 256,
            "K": 32,
            "block_m": 128,
            "block_n": 32,
            "block_k": 32,
            "dtype_str": "fp16",
            "num_warps": 4
        },
        "ms": 0.008,
        "min_ms": 0.0081,
        "max_ms": 0.0079,
        "GB/s": 20.53,
        "TFLOPS": 4.21
    },
    {
        "params": {
            "M": 1024,
            "N": 256,
            "K": 32,
            "block_m": 128,
            "block_n": 64,
            "block_k": 32,
            "dtype_str": "fp16",
            "num_warps": 4
        },
        "ms": 0.0071,
        "min_ms": 0.0074,
        "max_ms": 0.007,
        "GB/s": 22.96,
        "TFLOPS": 4.7
    },
    {
        "params": {
            "M": 1024,
            "N": 256,
            "K": 32,
            "block_m": 128,
            "block_n": 128,
            "block_k": 32,
            "dtype_str": "fp16",
            "num_warps": 4
        },
        "ms": 0.0072,
        "min_ms": 0.0075,
        "max_ms": 0.0071,
        "GB/s": 22.7,
        "TFLOPS": 4.65
    },
    {
        "params": {
            "M": 1024,
            "N": 512,
            "K": 32,
            "block_m": 32,
            "block_n": 32,
            "block_k": 32,
            "dtype_str": "fp16",
            "num_warps": 4
        },
        "ms": 0.0109,
        "min_ms": 0.0111,
        "max_ms": 0.0108,
        "GB/s": 18.03,
        "TFLOPS": 6.15
    },
    {
        "params": {
            "M": 1024,
            "N": 512,
            "K": 32,
            "block_m": 32,
            "block_n": 64,
            "block_k": 32,
            "dtype_str": "fp16",
            "num_warps": 4
        },
        "ms": 0.0091,
        "min_ms": 0.0093,
        "max_ms": 0.009,
        "GB/s": 21.51,
        "TFLOPS": 7.34
    },
    {
        "params": {
            "M": 1024,
            "N": 512,
            "K": 32,
            "block_m": 32,
            "block_n": 128,
            "block_k": 32,
            "dtype_str": "fp16",
            "num_warps": 4
        },
        "ms": 0.0092,
        "min_ms": 0.0094,
        "max_ms": 0.0091,
        "GB/s": 21.32,
        "TFLOPS": 7.28
    },
    {
        "params": {
            "M": 1024,
            "N": 512,
            "K": 32,
            "block_m": 64,
            "block_n": 32,
            "block_k": 32,
            "dtype_str": "fp16",
            "num_warps": 4
        },
        "ms": 0.011,
        "min_ms": 0.0112,
        "max_ms": 0.0109,
        "GB/s": 17.83,
        "TFLOPS": 6.09
    },
    {
        "params": {
            "M": 1024,
            "N": 512,
            "K": 32,
            "block_m": 64,
            "block_n": 64,
            "block_k": 32,
            "dtype_str": "fp16",
            "num_warps": 4
        },
        "ms": 0.0093,
        "min_ms": 0.0095,
        "max_ms": 0.0093,
        "GB/s": 21.05,
        "TFLOPS": 7.18
    },
    {
        "params": {
            "M": 1024,
            "N": 512,
            "K": 32,
            "block_m": 64,
            "block_n": 128,
            "block_k": 32,
            "dtype_str": "fp16",
            "num_warps": 4
        },
        "ms": 0.0094,
        "min_ms": 0.0096,
        "max_ms": 0.0093,
        "GB/s": 20.96,
        "TFLOPS": 7.15
    },
    {
        "params": {
            "M": 1024,
            "N": 512,
            "K": 32,
            "block_m": 128,
            "block_n": 32,
            "block_k": 32,
            "dtype_str": "fp16",
            "num_warps": 4
        },
        "ms": 0.011,
        "min_ms": 0.0112,
        "max_ms": 0.0109,
        "GB/s": 17.83,
        "TFLOPS": 6.09
    },
    {
        "params": {
            "M": 1024,
            "N": 512,
            "K": 32,
            "block_m": 128,
            "block_n": 64,
            "block_k": 32,
            "dtype_str": "fp16",
            "num_warps": 4
        },
        "ms": 0.0093,
        "min_ms": 0.0095,
        "max_ms": 0.0092,
        "GB/s": 21.23,
        "TFLOPS": 7.25
    },
    {
        "params": {
            "M": 1024,
            "N": 512,
            "K": 32,
            "block_m": 128,
            "block_n": 128,
            "block_k": 32,
            "dtype_str": "fp16",
            "num_warps": 4
        },
        "ms": 0.0093,
        "min_ms": 0.0095,
        "max_ms": 0.0091,
        "GB/s": 21.23,
        "TFLOPS": 7.25
    },
    {
        "params": {
            "M": 1024,
            "N": 1024,
            "K": 32,
            "block_m": 32,
            "block_n": 32,
            "block_k": 32,
            "dtype_str": "fp16",
            "num_warps": 4
        },
        "ms": 0.0171,
        "min_ms": 0.0173,
        "max_ms": 0.017,
        "GB/s": 15.31,
        "TFLOPS": 7.84
    },
    {
        "params": {
            "M": 1024,
            "N": 1024,
            "K": 32,
            "block_m": 32,
            "block_n": 64,
            "block_k": 32,
            "dtype_str": "fp16",
            "num_warps": 4
        },
        "ms": 0.0135,
        "min_ms": 0.0136,
        "max_ms": 0.0134,
        "GB/s": 19.46,
        "TFLOPS": 9.96
    },
    {
        "params": {
            "M": 1024,
            "N": 1024,
            "K": 32,
            "block_m": 32,
            "block_n": 128,
            "block_k": 32,
            "dtype_str": "fp16",
            "num_warps": 4
        },
        "ms": 0.0132,
        "min_ms": 0.0134,
        "max_ms": 0.0131,
        "GB/s": 19.87,
        "TFLOPS": 10.18
    },
    {
        "params": {
            "M": 1024,
            "N": 1024,
            "K": 32,
            "block_m": 64,
            "block_n": 32,
            "block_k": 32,
            "dtype_str": "fp16",
            "num_warps": 4
        },
        "ms": 0.0173,
        "min_ms": 0.0175,
        "max_ms": 0.0172,
        "GB/s": 15.14,
        "TFLOPS": 7.75
    },
    {
        "params": {
            "M": 1024,
            "N": 1024,
            "K": 32,
            "block_m": 64,
            "block_n": 64,
            "block_k": 32,
            "dtype_str": "fp16",
            "num_warps": 4
        },
        "ms": 0.0138,
        "min_ms": 0.0139,
        "max_ms": 0.0136,
        "GB/s": 19.06,
        "TFLOPS": 9.76
    },
    {
        "params": {
            "M": 1024,
            "N": 1024,
            "K": 32,
            "block_m": 64,
            "block_n": 128,
            "block_k": 32,
            "dtype_str": "fp16",
            "num_warps": 4
        },
        "ms": 0.0134,
        "min_ms": 0.0136,
        "max_ms": 0.0134,
        "GB/s": 19.52,
        "TFLOPS": 9.99
    },
    {
        "params": {
            "M": 1024,
            "N": 1024,
            "K": 32,
            "block_m": 128,
            "block_n": 32,
            "block_k": 32,
            "dtype_str": "fp16",
            "num_warps": 4
        },
        "ms": 0.0173,
        "min_ms": 0.0174,
        "max_ms": 0.0172,
        "GB/s": 15.17,
        "TFLOPS": 7.77
    },
    {
        "params": {
            "M": 1024,
            "N": 1024,
            "K": 32,
            "block_m": 128,
            "block_n": 64,
            "block_k": 32,
            "dtype_str": "fp16",
            "num_warps": 4
        },
        "ms": 0.0136,
        "min_ms": 0.0137,
        "max_ms": 0.0134,
        "GB/s": 19.34,
        "TFLOPS": 9.9
    },
    {
        "params": {
            "M": 1024,
            "N": 1024,
            "K": 32,
            "block_m": 128,
            "block_n": 128,
            "block_k": 32,
            "dtype_str": "fp16",
            "num_warps": 4
        },
        "ms": 0.0133,
        "min_ms": 0.0135,
        "max_ms": 0.0132,
        "GB/s": 19.69,
        "TFLOPS": 10.08
    },
    {
        "params": {
            "M": 1024,
            "N": 2048,
            "K": 32,
            "block_m": 32,
            "block_n": 32,
            "block_k": 32,
            "dtype_str": "fp16",
            "num_warps": 4
        },
        "ms": 0.0296,
        "min_ms": 0.0297,
        "max_ms": 0.0295,
        "GB/s": 13.29,
        "TFLOPS": 9.07
    },
    {
        "params": {
            "M": 1024,
            "N": 2048,
            "K": 32,
            "block_m": 32,
            "block_n": 64,
            "block_k": 32,
            "dtype_str": "fp16",
            "num_warps": 4
        },
        "ms": 0.0223,
        "min_ms": 0.0227,
        "max_ms": 0.0222,
        "GB/s": 17.64,
        "TFLOPS": 12.04
    },
    {
        "params": {
            "M": 1024,
            "N": 2048,
            "K": 32,
            "block_m": 32,
            "block_n": 128,
            "block_k": 32,
            "dtype_str": "fp16",
            "num_warps": 4
        },
        "ms": 0.0212,
        "min_ms": 0.0216,
        "max_ms": 0.0211,
        "GB/s": 18.51,
        "TFLOPS": 12.63
    },
    {
        "params": {
            "M": 1024,
            "N": 2048,
            "K": 32,
            "block_m": 64,
            "block_n": 32,
            "block_k": 32,
            "dtype_str": "fp16",
            "num_warps": 4
        },
        "ms": 0.0298,
        "min_ms": 0.0299,
        "max_ms": 0.0297,
        "GB/s": 13.18,
        "TFLOPS": 9.0
    },
    {
        "params": {
            "M": 1024,
            "N": 2048,
            "K": 32,
            "block_m": 64,
            "block_n": 64,
            "block_k": 32,
            "dtype_str": "fp16",
            "num_warps": 4
        },
        "ms": 0.0225,
        "min_ms": 0.0229,
        "max_ms": 0.0224,
        "GB/s": 17.48,
        "TFLOPS": 11.93
    },
    {
        "params": {
            "M": 1024,
            "N": 2048,
            "K": 32,
            "block_m": 64,
            "block_n": 128,
            "block_k": 32,
            "dtype_str": "fp16",
            "num_warps": 4
        },
        "ms": 0.0216,
        "min_ms": 0.0221,
        "max_ms": 0.0215,
        "GB/s": 18.2,
        "TFLOPS": 12.42
    },
    {
        "params": {
            "M": 1024,
            "N": 2048,
            "K": 32,
            "block_m": 128,
            "block_n": 32,
            "block_k": 32,
            "dtype_str": "fp16",
            "num_warps": 4
        },
        "ms": 0.0296,
        "min_ms": 0.0297,
        "max_ms": 0.0295,
        "GB/s": 13.27,
        "TFLOPS": 9.06
    },
    {
        "params": {
            "M": 1024,
            "N": 2048,
            "K": 32,
            "block_m": 128,
            "block_n": 64,
            "block_k": 32,
            "dtype_str": "fp16",
            "num_warps": 4
        },
        "ms": 0.0221,
        "min_ms": 0.0223,
        "max_ms": 0.022,
        "GB/s": 17.83,
        "TFLOPS": 12.17
    },
    {
        "params": {
            "M": 1024,
            "N": 2048,
            "K": 32,
            "block_m": 128,
            "block_n": 128,
            "block_k": 32,
            "dtype_str": "fp16",
            "num_warps": 4
        },
        "ms": 0.0214,
        "min_ms": 0.0218,
        "max_ms": 0.0213,
        "GB/s": 18.33,
        "TFLOPS": 12.52
    },
    {
        "params": {
            "M": 1024,
            "N": 4096,
            "K": 32,
            "block_m": 32,
            "block_n": 32,
            "block_k": 32,
            "dtype_str": "fp16",
            "num_warps": 4
        },
        "ms": 0.0547,
        "min_ms": 0.0549,
        "max_ms": 0.0546,
        "GB/s": 11.98,
        "TFLOPS": 9.81
    },
    {
        "params": {
            "M": 1024,
            "N": 4096,
            "K": 32,
            "block_m": 32,
            "block_n": 64,
            "block_k": 32,
            "dtype_str": "fp16",
            "num_warps": 4
        },
        "ms": 0.0398,
        "min_ms": 0.0399,
        "max_ms": 0.0397,
        "GB/s": 16.48,
        "TFLOPS": 13.5
    },
    {
        "params": {
            "M": 1024,
            "N": 4096,
            "K": 32,
            "block_m": 32,
            "block_n": 128,
            "block_k": 32,
            "dtype_str": "fp16",
            "num_warps": 4
        },
        "ms": 0.0372,
        "min_ms": 0.0373,
        "max_ms": 0.0371,
        "GB/s": 17.63,
        "TFLOPS": 14.45
    },
    {
        "params": {
            "M": 1024,
            "N": 4096,
            "K": 32,
            "block_m": 64,
            "block_n": 32,
            "block_k": 32,
            "dtype_str": "fp16",
            "num_warps": 4
        },
        "ms": 0.0551,
        "min_ms": 0.0553,
        "max_ms": 0.055,
        "GB/s": 11.9,
        "TFLOPS": 9.75
    },
    {
        "params": {
            "M": 1024,
            "N": 4096,
            "K": 32,
            "block_m": 64,
            "block_n": 64,
            "block_k": 32,
            "dtype_str": "fp16",
            "num_warps": 4
        },
        "ms": 0.04,
        "min_ms": 0.0401,
        "max_ms": 0.0399,
        "GB/s": 16.38,
        "TFLOPS": 13.42
    },
    {
        "params": {
            "M": 1024,
            "N": 4096,
            "K": 32,
            "block_m": 64,
            "block_n": 128,
            "block_k": 32,
            "dtype_str": "fp16",
            "num_warps": 4
        },
        "ms": 0.0379,
        "min_ms": 0.038,
        "max_ms": 0.0378,
        "GB/s": 17.3,
        "TFLOPS": 14.17
    },
    {
        "params": {
            "M": 1024,
            "N": 4096,
            "K": 32,
            "block_m": 128,
            "block_n": 32,
            "block_k": 32,
            "dtype_str": "fp16",
            "num_warps": 4
        },
        "ms": 0.0546,
        "min_ms": 0.0547,
        "max_ms": 0.0544,
        "GB/s": 12.01,
        "TFLOPS": 9.84
    },
    {
        "params": {
            "M": 1024,
            "N": 4096,
            "K": 32,
            "block_m": 128,
            "block_n": 64,
            "block_k": 32,
            "dtype_str": "fp16",
            "num_warps": 4
        },
        "ms": 0.0391,
        "min_ms": 0.0393,
        "max_ms": 0.039,
        "GB/s": 16.77,
        "TFLOPS": 13.73
    },
    {
        "params": {
            "M": 1024,
            "N": 4096,
            "K": 32,
            "block_m": 128,
            "block_n": 128,
            "block_k": 32,
            "dtype_str": "fp16",
            "num_warps": 4
        },
        "ms": 0.0377,
        "min_ms": 0.0378,
        "max_ms": 0.0376,
        "GB/s": 17.37,
        "TFLOPS": 14.23
    },
    {
        "params": {
            "M": 2048,
            "N": 128,
            "K": 32,
            "block_m": 32,
            "block_n": 32,
            "block_k": 32,
            "dtype_str": "fp16",
            "num_warps": 4
        },
        "ms": 0.0069,
        "min_ms": 0.0072,
        "max_ms": 0.0064,
        "GB/s": 40.63,
        "TFLOPS": 4.89
    },
    {
        "params": {
            "M": 2048,
            "N": 128,
            "K": 32,
            "block_m": 32,
            "block_n": 64,
            "block_k": 32,
            "dtype_str": "fp16",
            "num_warps": 4
        },
        "ms": 0.0067,
        "min_ms": 0.007,
        "max_ms": 0.0063,
        "GB/s": 41.35,
        "TFLOPS": 4.98
    },
    {
        "params": {
            "M": 2048,
            "N": 128,
            "K": 32,
            "block_m": 32,
            "block_n": 128,
            "block_k": 32,
            "dtype_str": "fp16",
            "num_warps": 4
        },
        "ms": 0.0068,
        "min_ms": 0.0071,
        "max_ms": 0.0063,
        "GB/s": 41.11,
        "TFLOPS": 4.95
    },
    {
        "params": {
            "M": 2048,
            "N": 128,
            "K": 32,
            "block_m": 64,
            "block_n": 32,
            "block_k": 32,
            "dtype_str": "fp16",
            "num_warps": 4
        },
        "ms": 0.0069,
        "min_ms": 0.0072,
        "max_ms": 0.0065,
        "GB/s": 40.16,
        "TFLOPS": 4.84
    },
    {
        "params": {
            "M": 2048,
            "N": 128,
            "K": 32,
            "block_m": 64,
            "block_n": 64,
            "block_k": 32,
            "dtype_str": "fp16",
            "num_warps": 4
        },
        "ms": 0.0068,
        "min_ms": 0.0071,
        "max_ms": 0.0064,
        "GB/s": 40.87,
        "TFLOPS": 4.92
    },
    {
        "params": {
            "M": 2048,
            "N": 128,
            "K": 32,
            "block_m": 64,
            "block_n": 128,
            "block_k": 32,
            "dtype_str": "fp16",
            "num_warps": 4
        },
        "ms": 0.0069,
        "min_ms": 0.0071,
        "max_ms": 0.0064,
        "GB/s": 40.63,
        "TFLOPS": 4.89
    },
    {
        "params": {
            "M": 2048,
            "N": 128,
            "K": 32,
            "block_m": 128,
            "block_n": 32,
            "block_k": 32,
            "dtype_str": "fp16",
            "num_warps": 4
        },
        "ms": 0.0068,
        "min_ms": 0.0071,
        "max_ms": 0.0066,
        "GB/s": 41.11,
        "TFLOPS": 4.95
    },
    {
        "params": {
            "M": 2048,
            "N": 128,
            "K": 32,
            "block_m": 128,
            "block_n": 64,
            "block_k": 32,
            "dtype_str": "fp16",
            "num_warps": 4
        },
        "ms": 0.0067,
        "min_ms": 0.007,
        "max_ms": 0.0063,
        "GB/s": 41.35,
        "TFLOPS": 4.98
    },
    {
        "params": {
            "M": 2048,
            "N": 128,
            "K": 32,
            "block_m": 128,
            "block_n": 128,
            "block_k": 32,
            "dtype_str": "fp16",
            "num_warps": 4
        },
        "ms": 0.0067,
        "min_ms": 0.0071,
        "max_ms": 0.0063,
        "GB/s": 41.36,
        "TFLOPS": 4.98
    },
    {
        "params": {
            "M": 2048,
            "N": 256,
            "K": 32,
            "block_m": 32,
            "block_n": 32,
            "block_k": 32,
            "dtype_str": "fp16",
            "num_warps": 4
        },
        "ms": 0.0079,
        "min_ms": 0.0081,
        "max_ms": 0.0078,
        "GB/s": 37.34,
        "TFLOPS": 8.5
    },
    {
        "params": {
            "M": 2048,
            "N": 256,
            "K": 32,
            "block_m": 32,
            "block_n": 64,
            "block_k": 32,
            "dtype_str": "fp16",
            "num_warps": 4
        },
        "ms": 0.007,
        "min_ms": 0.0073,
        "max_ms": 0.0069,
        "GB/s": 42.03,
        "TFLOPS": 9.57
    },
    {
        "params": {
            "M": 2048,
            "N": 256,
            "K": 32,
            "block_m": 32,
            "block_n": 128,
            "block_k": 32,
            "dtype_str": "fp16",
            "num_warps": 4
        },
        "ms": 0.0073,
        "min_ms": 0.0076,
        "max_ms": 0.0072,
        "GB/s": 40.42,
        "TFLOPS": 9.2
    },
    {
        "params": {
            "M": 2048,
            "N": 256,
            "K": 32,
            "block_m": 64,
            "block_n": 32,
            "block_k": 32,
            "dtype_str": "fp16",
            "num_warps": 4
        },
        "ms": 0.008,
        "min_ms": 0.0081,
        "max_ms": 0.0079,
        "GB/s": 36.96,
        "TFLOPS": 8.41
    },
    {
        "params": {
            "M": 2048,
            "N": 256,
            "K": 32,
            "block_m": 64,
            "block_n": 64,
            "block_k": 32,
            "dtype_str": "fp16",
            "num_warps": 4
        },
        "ms": 0.0073,
        "min_ms": 0.0075,
        "max_ms": 0.0071,
        "GB/s": 40.64,
        "TFLOPS": 9.25
    },
    {
        "params": {
            "M": 2048,
            "N": 256,
            "K": 32,
            "block_m": 64,
            "block_n": 128,
            "block_k": 32,
            "dtype_str": "fp16",
            "num_warps": 4
        },
        "ms": 0.0074,
        "min_ms": 0.0076,
        "max_ms": 0.0073,
        "GB/s": 39.76,
        "TFLOPS": 9.05
    },
    {
        "params": {
            "M": 2048,
            "N": 256,
            "K": 32,
            "block_m": 128,
            "block_n": 32,
            "block_k": 32,
            "dtype_str": "fp16",
            "num_warps": 4
        },
        "ms": 0.0081,
        "min_ms": 0.0083,
        "max_ms": 0.0079,
        "GB/s": 36.59,
        "TFLOPS": 8.33
    },
    {
        "params": {
            "M": 2048,
            "N": 256,
            "K": 32,
            "block_m": 128,
            "block_n": 64,
            "block_k": 32,
            "dtype_str": "fp16",
            "num_warps": 4
        },
        "ms": 0.0073,
        "min_ms": 0.0074,
        "max_ms": 0.0071,
        "GB/s": 40.64,
        "TFLOPS": 9.25
    },
    {
        "params": {
            "M": 2048,
            "N": 256,
            "K": 32,
            "block_m": 128,
            "block_n": 128,
            "block_k": 32,
            "dtype_str": "fp16",
            "num_warps": 4
        },
        "ms": 0.0073,
        "min_ms": 0.0076,
        "max_ms": 0.0072,
        "GB/s": 40.2,
        "TFLOPS": 9.15
    },
    {
        "params": {
            "M": 2048,
            "N": 512,
            "K": 32,
            "block_m": 32,
            "block_n": 32,
            "block_k": 32,
            "dtype_str": "fp16",
            "num_warps": 4
        },
        "ms": 0.011,
        "min_ms": 0.0112,
        "max_ms": 0.0109,
        "GB/s": 29.83,
        "TFLOPS": 12.22
    },
    {
        "params": {
            "M": 2048,
            "N": 512,
            "K": 32,
            "block_m": 32,
            "block_n": 64,
            "block_k": 32,
            "dtype_str": "fp16",
            "num_warps": 4
        },
        "ms": 0.0093,
        "min_ms": 0.0094,
        "max_ms": 0.0091,
        "GB/s": 35.38,
        "TFLOPS": 14.49
    },
    {
        "params": {
            "M": 2048,
            "N": 512,
            "K": 32,
            "block_m": 32,
            "block_n": 128,
            "block_k": 32,
            "dtype_str": "fp16",
            "num_warps": 4
        },
        "ms": 0.0093,
        "min_ms": 0.0096,
        "max_ms": 0.0092,
        "GB/s": 35.08,
        "TFLOPS": 14.37
    },
    {
        "params": {
            "M": 2048,
            "N": 512,
            "K": 32,
            "block_m": 64,
            "block_n": 32,
            "block_k": 32,
            "dtype_str": "fp16",
            "num_warps": 4
        },
        "ms": 0.0111,
        "min_ms": 0.0112,
        "max_ms": 0.011,
        "GB/s": 29.61,
        "TFLOPS": 12.13
    },
    {
        "params": {
            "M": 2048,
            "N": 512,
            "K": 32,
            "block_m": 64,
            "block_n": 64,
            "block_k": 32,
            "dtype_str": "fp16",
            "num_warps": 4
        },
        "ms": 0.0094,
        "min_ms": 0.0096,
        "max_ms": 0.0093,
        "GB/s": 34.78,
        "TFLOPS": 14.25
    },
    {
        "params": {
            "M": 2048,
            "N": 512,
            "K": 32,
            "block_m": 64,
            "block_n": 128,
            "block_k": 32,
            "dtype_str": "fp16",
            "num_warps": 4
        },
        "ms": 0.0095,
        "min_ms": 0.0097,
        "max_ms": 0.0093,
        "GB/s": 34.63,
        "TFLOPS": 14.19
    },
    {
        "params": {
            "M": 2048,
            "N": 512,
            "K": 32,
            "block_m": 128,
            "block_n": 32,
            "block_k": 32,
            "dtype_str": "fp16",
            "num_warps": 4
        },
        "ms": 0.0111,
        "min_ms": 0.0112,
        "max_ms": 0.011,
        "GB/s": 29.61,
        "TFLOPS": 12.13
    },
    {
        "params": {
            "M": 2048,
            "N": 512,
            "K": 32,
            "block_m": 128,
            "block_n": 64,
            "block_k": 32,
            "dtype_str": "fp16",
            "num_warps": 4
        },
        "ms": 0.0094,
        "min_ms": 0.0096,
        "max_ms": 0.0093,
        "GB/s": 34.93,
        "TFLOPS": 14.31
    },
    {
        "params": {
            "M": 2048,
            "N": 512,
            "K": 32,
            "block_m": 128,
            "block_n": 128,
            "block_k": 32,
            "dtype_str": "fp16",
            "num_warps": 4
        },
        "ms": 0.0093,
        "min_ms": 0.0096,
        "max_ms": 0.0092,
        "GB/s": 35.08,
        "TFLOPS": 14.37
    },
    {
        "params": {
            "M": 2048,
            "N": 1024,
            "K": 32,
            "block_m": 32,
            "block_n": 32,
            "block_k": 32,
            "dtype_str": "fp16",
            "num_warps": 4
        },
        "ms": 0.0172,
        "min_ms": 0.0174,
        "max_ms": 0.0171,
        "GB/s": 22.86,
        "TFLOPS": 15.61
    },
    {
        "params": {
            "M": 2048,
            "N": 1024,
            "K": 32,
            "block_m": 32,
            "block_n": 64,
            "block_k": 32,
            "dtype_str": "fp16",
            "num_warps": 4
        },
        "ms": 0.0136,
        "min_ms": 0.0139,
        "max_ms": 0.0136,
        "GB/s": 28.85,
        "TFLOPS": 19.69
    },
    {
        "params": {
            "M": 2048,
            "N": 1024,
            "K": 32,
            "block_m": 32,
            "block_n": 128,
            "block_k": 32,
            "dtype_str": "fp16",
            "num_warps": 4
        },
        "ms": 0.0133,
        "min_ms": 0.0136,
        "max_ms": 0.0132,
        "GB/s": 29.45,
        "TFLOPS": 20.11
    },
    {
        "params": {
            "M": 2048,
            "N": 1024,
            "K": 32,
            "block_m": 64,
            "block_n": 32,
            "block_k": 32,
            "dtype_str": "fp16",
            "num_warps": 4
        },
        "ms": 0.0173,
        "min_ms": 0.0175,
        "max_ms": 0.0172,
        "GB/s": 22.76,
        "TFLOPS": 15.54
    },
    {
        "params": {
            "M": 2048,
            "N": 1024,
            "K": 32,
            "block_m": 64,
            "block_n": 64,
            "block_k": 32,
            "dtype_str": "fp16",
            "num_warps": 4
        },
        "ms": 0.0138,
        "min_ms": 0.014,
        "max_ms": 0.0137,
        "GB/s": 28.51,
        "TFLOPS": 19.46
    },
    {
        "params": {
            "M": 2048,
            "N": 1024,
            "K": 32,
            "block_m": 64,
            "block_n": 128,
            "block_k": 32,
            "dtype_str": "fp16",
            "num_warps": 4
        },
        "ms": 0.0135,
        "min_ms": 0.0137,
        "max_ms": 0.0134,
        "GB/s": 29.1,
        "TFLOPS": 19.87
    },
    {
        "params": {
            "M": 2048,
            "N": 1024,
            "K": 32,
            "block_m": 128,
            "block_n": 32,
            "block_k": 32,
            "dtype_str": "fp16",
            "num_warps": 4
        },
        "ms": 0.0172,
        "min_ms": 0.0174,
        "max_ms": 0.0171,
        "GB/s": 22.81,
        "TFLOPS": 15.57
    },
    {
        "params": {
            "M": 2048,
            "N": 1024,
            "K": 32,
            "block_m": 128,
            "block_n": 64,
            "block_k": 32,
            "dtype_str": "fp16",
            "num_warps": 4
        },
        "ms": 0.0136,
        "min_ms": 0.0138,
        "max_ms": 0.0135,
        "GB/s": 29.02,
        "TFLOPS": 19.81
    },
    {
        "params": {
            "M": 2048,
            "N": 1024,
            "K": 32,
            "block_m": 128,
            "block_n": 128,
            "block_k": 32,
            "dtype_str": "fp16",
            "num_warps": 4
        },
        "ms": 0.0134,
        "min_ms": 0.0136,
        "max_ms": 0.0133,
        "GB/s": 29.36,
        "TFLOPS": 20.05
    },
    {
        "params": {
            "M": 2048,
            "N": 2048,
            "K": 32,
            "block_m": 32,
            "block_n": 32,
            "block_k": 32,
            "dtype_str": "fp16",
            "num_warps": 4
        },
        "ms": 0.0298,
        "min_ms": 0.0299,
        "max_ms": 0.0297,
        "GB/s": 17.58,
        "TFLOPS": 18.0
    },
    {
        "params": {
            "M": 2048,
            "N": 2048,
            "K": 32,
            "block_m": 32,
            "block_n": 64,
            "block_k": 32,
            "dtype_str": "fp16",
            "num_warps": 4
        },
        "ms": 0.0226,
        "min_ms": 0.023,
        "max_ms": 0.0225,
        "GB/s": 23.23,
        "TFLOPS": 23.78
    },
    {
        "params": {
            "M": 2048,
            "N": 2048,
            "K": 32,
            "block_m": 32,
            "block_n": 128,
            "block_k": 32,
            "dtype_str": "fp16",
            "num_warps": 4
        },
        "ms": 0.0215,
        "min_ms": 0.0218,
        "max_ms": 0.0213,
        "GB/s": 24.4,
        "TFLOPS": 24.98
    },
    {
        "params": {
            "M": 2048,
            "N": 2048,
            "K": 32,
            "block_m": 64,
            "block_n": 32,
            "block_k": 32,
            "dtype_str": "fp16",
            "num_warps": 4
        },
        "ms": 0.0299,
        "min_ms": 0.03,
        "max_ms": 0.0297,
        "GB/s": 17.55,
        "TFLOPS": 17.97
    },
    {
        "params": {
            "M": 2048,
            "N": 2048,
            "K": 32,
            "block_m": 64,
            "block_n": 64,
            "block_k": 32,
            "dtype_str": "fp16",
            "num_warps": 4
        },
        "ms": 0.0226,
        "min_ms": 0.023,
        "max_ms": 0.0225,
        "GB/s": 23.19,
        "TFLOPS": 23.74
    },
    {
        "params": {
            "M": 2048,
            "N": 2048,
            "K": 32,
            "block_m": 64,
            "block_n": 128,
            "block_k": 32,
            "dtype_str": "fp16",
            "num_warps": 4
        },
        "ms": 0.0217,
        "min_ms": 0.022,
        "max_ms": 0.0216,
        "GB/s": 24.13,
        "TFLOPS": 24.71
    },
    {
        "params": {
            "M": 2048,
            "N": 2048,
            "K": 32,
            "block_m": 128,
            "block_n": 32,
            "block_k": 32,
            "dtype_str": "fp16",
            "num_warps": 4
        },
        "ms": 0.0297,
        "min_ms": 0.0299,
        "max_ms": 0.0296,
        "GB/s": 17.67,
        "TFLOPS": 18.1
    },
    {
        "params": {
            "M": 2048,
            "N": 2048,
            "K": 32,
            "block_m": 128,
            "block_n": 64,
            "block_k": 32,
            "dtype_str": "fp16",
            "num_warps": 4
        },
        "ms": 0.0222,
        "min_ms": 0.0224,
        "max_ms": 0.0221,
        "GB/s": 23.6,
        "TFLOPS": 24.17
    },
    {
        "params": {
            "M": 2048,
            "N": 2048,
            "K": 32,
            "block_m": 128,
            "block_n": 128,
            "block_k": 32,
            "dtype_str": "fp16",
            "num_warps": 4
        },
        "ms": 0.0216,
        "min_ms": 0.0218,
        "max_ms": 0.0214,
        "GB/s": 24.31,
        "TFLOPS": 24.89
    },
    {
        "params": {
            "M": 2048,
            "N": 4096,
            "K": 32,
            "block_m": 32,
            "block_n": 32,
            "block_k": 32,
            "dtype_str": "fp16",
            "num_warps": 4
        },
        "ms": 0.055,
        "min_ms": 0.0552,
        "max_ms": 0.0549,
        "GB/s": 14.3,
        "TFLOPS": 19.52
    },
    {
        "params": {
            "M": 2048,
            "N": 4096,
            "K": 32,
            "block_m": 32,
            "block_n": 64,
            "block_k": 32,
            "dtype_str": "fp16",
            "num_warps": 4
        },
        "ms": 0.0401,
        "min_ms": 0.0403,
        "max_ms": 0.0401,
        "GB/s": 19.6,
        "TFLOPS": 26.75
    },
    {
        "params": {
            "M": 2048,
            "N": 4096,
            "K": 32,
            "block_m": 32,
            "block_n": 128,
            "block_k": 32,
            "dtype_str": "fp16",
            "num_warps": 4
        },
        "ms": 0.0375,
        "min_ms": 0.0376,
        "max_ms": 0.0374,
        "GB/s": 20.98,
        "TFLOPS": 28.64
    },
    {
        "params": {
            "M": 2048,
            "N": 4096,
            "K": 32,
            "block_m": 64,
            "block_n": 32,
            "block_k": 32,
            "dtype_str": "fp16",
            "num_warps": 4
        },
        "ms": 0.055,
        "min_ms": 0.0552,
        "max_ms": 0.0549,
        "GB/s": 14.3,
        "TFLOPS": 19.52
    },
    {
        "params": {
            "M": 2048,
            "N": 4096,
            "K": 32,
            "block_m": 64,
            "block_n": 64,
            "block_k": 32,
            "dtype_str": "fp16",
            "num_warps": 4
        },
        "ms": 0.0402,
        "min_ms": 0.0403,
        "max_ms": 0.0401,
        "GB/s": 19.58,
        "TFLOPS": 26.73
    },
    {
        "params": {
            "M": 2048,
            "N": 4096,
            "K": 32,
            "block_m": 64,
            "block_n": 128,
            "block_k": 32,
            "dtype_str": "fp16",
            "num_warps": 4
        },
        "ms": 0.0381,
        "min_ms": 0.0382,
        "max_ms": 0.038,
        "GB/s": 20.65,
        "TFLOPS": 28.19
    },
    {
        "params": {
            "M": 2048,
            "N": 4096,
            "K": 32,
            "block_m": 128,
            "block_n": 32,
            "block_k": 32,
            "dtype_str": "fp16",
            "num_warps": 4
        },
        "ms": 0.0545,
        "min_ms": 0.0547,
        "max_ms": 0.0543,
        "GB/s": 14.43,
        "TFLOPS": 19.71
    },
    {
        "params": {
            "M": 2048,
            "N": 4096,
            "K": 32,
            "block_m": 128,
            "block_n": 64,
            "block_k": 32,
            "dtype_str": "fp16",
            "num_warps": 4
        },
        "ms": 0.0392,
        "min_ms": 0.0394,
        "max_ms": 0.0391,
        "GB/s": 20.06,
        "TFLOPS": 27.38
    },
    {
        "params": {
            "M": 2048,
            "N": 4096,
            "K": 32,
            "block_m": 128,
            "block_n": 128,
            "block_k": 32,
            "dtype_str": "fp16",
            "num_warps": 4
        },
        "ms": 0.0378,
        "min_ms": 0.038,
        "max_ms": 0.0377,
        "GB/s": 20.78,
        "TFLOPS": 28.37
    },
    {
        "params": {
            "M": 4096,
            "N": 128,
            "K": 32,
            "block_m": 32,
            "block_n": 32,
            "block_k": 32,
            "dtype_str": "fp16",
            "num_warps": 4
        },
        "ms": 0.0069,
        "min_ms": 0.0072,
        "max_ms": 0.0065,
        "GB/s": 78.87,
        "TFLOPS": 9.79
    },
    {
        "params": {
            "M": 4096,
            "N": 128,
            "K": 32,
            "block_m": 32,
            "block_n": 64,
            "block_k": 32,
            "dtype_str": "fp16",
            "num_warps": 4
        },
        "ms": 0.0067,
        "min_ms": 0.007,
        "max_ms": 0.0063,
        "GB/s": 80.75,
        "TFLOPS": 10.02
    },
    {
        "params": {
            "M": 4096,
            "N": 128,
            "K": 32,
            "block_m": 32,
            "block_n": 128,
            "block_k": 32,
            "dtype_str": "fp16",
            "num_warps": 4
        },
        "ms": 0.0068,
        "min_ms": 0.0071,
        "max_ms": 0.0063,
        "GB/s": 79.79,
        "TFLOPS": 9.9
    },
    {
        "params": {
            "M": 4096,
            "N": 128,
            "K": 32,
            "block_m": 64,
            "block_n": 32,
            "block_k": 32,
            "dtype_str": "fp16",
            "num_warps": 4
        },
        "ms": 0.0069,
        "min_ms": 0.0072,
        "max_ms": 0.0065,
        "GB/s": 78.86,
        "TFLOPS": 9.79
    },
    {
        "params": {
            "M": 4096,
            "N": 128,
            "K": 32,
            "block_m": 64,
            "block_n": 64,
            "block_k": 32,
            "dtype_str": "fp16",
            "num_warps": 4
        },
        "ms": 0.0069,
        "min_ms": 0.0072,
        "max_ms": 0.0064,
        "GB/s": 78.87,
        "TFLOPS": 9.79
    },
    {
        "params": {
            "M": 4096,
            "N": 128,
            "K": 32,
            "block_m": 64,
            "block_n": 128,
            "block_k": 32,
            "dtype_str": "fp16",
            "num_warps": 4
        },
        "ms": 0.0069,
        "min_ms": 0.0072,
        "max_ms": 0.0064,
        "GB/s": 78.87,
        "TFLOPS": 9.79
    },
    {
        "params": {
            "M": 4096,
            "N": 128,
            "K": 32,
            "block_m": 128,
            "block_n": 32,
            "block_k": 32,
            "dtype_str": "fp16",
            "num_warps": 4
        },
        "ms": 0.0068,
        "min_ms": 0.0072,
        "max_ms": 0.0067,
        "GB/s": 79.32,
        "TFLOPS": 9.85
    },
    {
        "params": {
            "M": 4096,
            "N": 128,
            "K": 32,
            "block_m": 128,
            "block_n": 64,
            "block_k": 32,
            "dtype_str": "fp16",
            "num_warps": 4
        },
        "ms": 0.0067,
        "min_ms": 0.0071,
        "max_ms": 0.0063,
        "GB/s": 80.27,
        "TFLOPS": 9.96
    },
    {
        "params": {
            "M": 4096,
            "N": 128,
            "K": 32,
            "block_m": 128,
            "block_n": 128,
            "block_k": 32,
            "dtype_str": "fp16",
            "num_warps": 4
        },
        "ms": 0.0067,
        "min_ms": 0.007,
        "max_ms": 0.0063,
        "GB/s": 80.27,
        "TFLOPS": 9.96
    },
    {
        "params": {
            "M": 4096,
            "N": 256,
            "K": 32,
            "block_m": 32,
            "block_n": 32,
            "block_k": 32,
            "dtype_str": "fp16",
            "num_warps": 4
        },
        "ms": 0.0081,
        "min_ms": 0.0083,
        "max_ms": 0.008,
        "GB/s": 68.78,
        "TFLOPS": 16.57
    },
    {
        "params": {
            "M": 4096,
            "N": 256,
            "K": 32,
            "block_m": 32,
            "block_n": 64,
            "block_k": 32,
            "dtype_str": "fp16",
            "num_warps": 4
        },
        "ms": 0.0072,
        "min_ms": 0.0074,
        "max_ms": 0.0071,
        "GB/s": 77.2,
        "TFLOPS": 18.6
    },
    {
        "params": {
            "M": 4096,
            "N": 256,
            "K": 32,
            "block_m": 32,
            "block_n": 128,
            "block_k": 32,
            "dtype_str": "fp16",
            "num_warps": 4
        },
        "ms": 0.0075,
        "min_ms": 0.0077,
        "max_ms": 0.0073,
        "GB/s": 74.7,
        "TFLOPS": 18.0
    },
    {
        "params": {
            "M": 4096,
            "N": 256,
            "K": 32,
            "block_m": 64,
            "block_n": 32,
            "block_k": 32,
            "dtype_str": "fp16",
            "num_warps": 4
        },
        "ms": 0.0081,
        "min_ms": 0.0082,
        "max_ms": 0.008,
        "GB/s": 69.12,
        "TFLOPS": 16.65
    },
    {
        "params": {
            "M": 4096,
            "N": 256,
            "K": 32,
            "block_m": 64,
            "block_n": 64,
            "block_k": 32,
            "dtype_str": "fp16",
            "num_warps": 4
        },
        "ms": 0.0074,
        "min_ms": 0.0076,
        "max_ms": 0.0073,
        "GB/s": 75.51,
        "TFLOPS": 18.19
    },
    {
        "params": {
            "M": 4096,
            "N": 256,
            "K": 32,
            "block_m": 64,
            "block_n": 128,
            "block_k": 32,
            "dtype_str": "fp16",
            "num_warps": 4
        },
        "ms": 0.0075,
        "min_ms": 0.0077,
        "max_ms": 0.0074,
        "GB/s": 73.91,
        "TFLOPS": 17.81
    },
    {
        "params": {
            "M": 4096,
            "N": 256,
            "K": 32,
            "block_m": 128,
            "block_n": 32,
            "block_k": 32,
            "dtype_str": "fp16",
            "num_warps": 4
        },
        "ms": 0.0081,
        "min_ms": 0.0083,
        "max_ms": 0.008,
        "GB/s": 68.44,
        "TFLOPS": 16.49
    },
    {
        "params": {
            "M": 4096,
            "N": 256,
            "K": 32,
            "block_m": 128,
            "block_n": 64,
            "block_k": 32,
            "dtype_str": "fp16",
            "num_warps": 4
        },
        "ms": 0.0073,
        "min_ms": 0.0075,
        "max_ms": 0.0072,
        "GB/s": 75.92,
        "TFLOPS": 18.29
    },
    {
        "params": {
            "M": 4096,
            "N": 256,
            "K": 32,
            "block_m": 128,
            "block_n": 128,
            "block_k": 32,
            "dtype_str": "fp16",
            "num_warps": 4
        },
        "ms": 0.0074,
        "min_ms": 0.0076,
        "max_ms": 0.0073,
        "GB/s": 75.11,
        "TFLOPS": 18.1
    },
    {
        "params": {
            "M": 4096,
            "N": 512,
            "K": 32,
            "block_m": 32,
            "block_n": 32,
            "block_k": 32,
            "dtype_str": "fp16",
            "num_warps": 4
        },
        "ms": 0.0113,
        "min_ms": 0.0115,
        "max_ms": 0.0112,
        "GB/s": 52.17,
        "TFLOPS": 23.74
    },
    {
        "params": {
            "M": 4096,
            "N": 512,
            "K": 32,
            "block_m": 32,
            "block_n": 64,
            "block_k": 32,
            "dtype_str": "fp16",
            "num_warps": 4
        },
        "ms": 0.0095,
        "min_ms": 0.0098,
        "max_ms": 0.0094,
        "GB/s": 61.81,
        "TFLOPS": 28.13
    },
    {
        "params": {
            "M": 4096,
            "N": 512,
            "K": 32,
            "block_m": 32,
            "block_n": 128,
            "block_k": 32,
            "dtype_str": "fp16",
            "num_warps": 4
        },
        "ms": 0.0096,
        "min_ms": 0.0098,
        "max_ms": 0.0095,
        "GB/s": 61.3,
        "TFLOPS": 27.9
    },
    {
        "params": {
            "M": 4096,
            "N": 512,
            "K": 32,
            "block_m": 64,
            "block_n": 32,
            "block_k": 32,
            "dtype_str": "fp16",
            "num_warps": 4
        },
        "ms": 0.0111,
        "min_ms": 0.0113,
        "max_ms": 0.0111,
        "GB/s": 52.92,
        "TFLOPS": 24.08
    },
    {
        "params": {
            "M": 4096,
            "N": 512,
            "K": 32,
            "block_m": 64,
            "block_n": 64,
            "block_k": 32,
            "dtype_str": "fp16",
            "num_warps": 4
        },
        "ms": 0.0096,
        "min_ms": 0.0098,
        "max_ms": 0.0095,
        "GB/s": 61.56,
        "TFLOPS": 28.01
    },
    {
        "params": {
            "M": 4096,
            "N": 512,
            "K": 32,
            "block_m": 64,
            "block_n": 128,
            "block_k": 32,
            "dtype_str": "fp16",
            "num_warps": 4
        },
        "ms": 0.0096,
        "min_ms": 0.0099,
        "max_ms": 0.0095,
        "GB/s": 61.56,
        "TFLOPS": 28.01
    },
    {
        "params": {
            "M": 4096,
            "N": 512,
            "K": 32,
            "block_m": 128,
            "block_n": 32,
            "block_k": 32,
            "dtype_str": "fp16",
            "num_warps": 4
        },
        "ms": 0.0111,
        "min_ms": 0.0113,
        "max_ms": 0.011,
        "GB/s": 53.11,
        "TFLOPS": 24.17
    },
    {
        "params": {
            "M": 4096,
            "N": 512,
            "K": 32,
            "block_m": 128,
            "block_n": 64,
            "block_k": 32,
            "dtype_str": "fp16",
            "num_warps": 4
        },
        "ms": 0.0095,
        "min_ms": 0.0097,
        "max_ms": 0.0093,
        "GB/s": 62.34,
        "TFLOPS": 28.37
    },
    {
        "params": {
            "M": 4096,
            "N": 512,
            "K": 32,
            "block_m": 128,
            "block_n": 128,
            "block_k": 32,
            "dtype_str": "fp16",
            "num_warps": 4
        },
        "ms": 0.0094,
        "min_ms": 0.0096,
        "max_ms": 0.0093,
        "GB/s": 62.61,
        "TFLOPS": 28.49
    },
    {
        "params": {
            "M": 4096,
            "N": 1024,
            "K": 32,
            "block_m": 32,
            "block_n": 32,
            "block_k": 32,
            "dtype_str": "fp16",
            "num_warps": 4
        },
        "ms": 0.0176,
        "min_ms": 0.0178,
        "max_ms": 0.0174,
        "GB/s": 37.32,
        "TFLOPS": 30.57
    },
    {
        "params": {
            "M": 4096,
            "N": 1024,
            "K": 32,
            "block_m": 32,
            "block_n": 64,
            "block_k": 32,
            "dtype_str": "fp16",
            "num_warps": 4
        },
        "ms": 0.0142,
        "min_ms": 0.0146,
        "max_ms": 0.014,
        "GB/s": 46.05,
        "TFLOPS": 37.72
    },
    {
        "params": {
            "M": 4096,
            "N": 1024,
            "K": 32,
            "block_m": 32,
            "block_n": 128,
            "block_k": 32,
            "dtype_str": "fp16",
            "num_warps": 4
        },
        "ms": 0.014,
        "min_ms": 0.0144,
        "max_ms": 0.0138,
        "GB/s": 46.84,
        "TFLOPS": 38.37
    },
    {
        "params": {
            "M": 4096,
            "N": 1024,
            "K": 32,
            "block_m": 64,
            "block_n": 32,
            "block_k": 32,
            "dtype_str": "fp16",
            "num_warps": 4
        },
        "ms": 0.0174,
        "min_ms": 0.0176,
        "max_ms": 0.0173,
        "GB/s": 37.66,
        "TFLOPS": 30.85
    },
    {
        "params": {
            "M": 4096,
            "N": 1024,
            "K": 32,
            "block_m": 64,
            "block_n": 64,
            "block_k": 32,
            "dtype_str": "fp16",
            "num_warps": 4
        },
        "ms": 0.014,
        "min_ms": 0.0142,
        "max_ms": 0.0139,
        "GB/s": 46.84,
        "TFLOPS": 38.37
    },
    {
        "params": {
            "M": 4096,
            "N": 1024,
            "K": 32,
            "block_m": 64,
            "block_n": 128,
            "block_k": 32,
            "dtype_str": "fp16",
            "num_warps": 4
        },
        "ms": 0.0137,
        "min_ms": 0.014,
        "max_ms": 0.0136,
        "GB/s": 47.8,
        "TFLOPS": 39.16
    },
    {
        "params": {
            "M": 4096,
            "N": 1024,
            "K": 32,
            "block_m": 128,
            "block_n": 32,
            "block_k": 32,
            "dtype_str": "fp16",
            "num_warps": 4
        },
        "ms": 0.0173,
        "min_ms": 0.0175,
        "max_ms": 0.0172,
        "GB/s": 37.93,
        "TFLOPS": 31.07
    },
    {
        "params": {
            "M": 4096,
            "N": 1024,
            "K": 32,
            "block_m": 128,
            "block_n": 64,
            "block_k": 32,
            "dtype_str": "fp16",
            "num_warps": 4
        },
        "ms": 0.0137,
        "min_ms": 0.014,
        "max_ms": 0.0136,
        "GB/s": 47.79,
        "TFLOPS": 39.15
    },
    {
        "params": {
            "M": 4096,
            "N": 1024,
            "K": 32,
            "block_m": 128,
            "block_n": 128,
            "block_k": 32,
            "dtype_str": "fp16",
            "num_warps": 4
        },
        "ms": 0.0135,
        "min_ms": 0.0137,
        "max_ms": 0.0134,
        "GB/s": 48.65,
        "TFLOPS": 39.85
    },
    {
        "params": {
            "M": 4096,
            "N": 2048,
            "K": 32,
            "block_m": 32,
            "block_n": 32,
            "block_k": 32,
            "dtype_str": "fp16",
            "num_warps": 4
        },
        "ms": 0.0302,
        "min_ms": 0.0304,
        "max_ms": 0.03,
        "GB/s": 26.08,
        "TFLOPS": 35.61
    },
    {
        "params": {
            "M": 4096,
            "N": 2048,
            "K": 32,
            "block_m": 32,
            "block_n": 64,
            "block_k": 32,
            "dtype_str": "fp16",
            "num_warps": 4
        },
        "ms": 0.0244,
        "min_ms": 0.0248,
        "max_ms": 0.0235,
        "GB/s": 32.26,
        "TFLOPS": 44.05
    },
    {
        "params": {
            "M": 4096,
            "N": 2048,
            "K": 32,
            "block_m": 32,
            "block_n": 128,
            "block_k": 32,
            "dtype_str": "fp16",
            "num_warps": 4
        },
        "ms": 0.0235,
        "min_ms": 0.024,
        "max_ms": 0.0228,
        "GB/s": 33.53,
        "TFLOPS": 45.78
    },
    {
        "params": {
            "M": 4096,
            "N": 2048,
            "K": 32,
            "block_m": 64,
            "block_n": 32,
            "block_k": 32,
            "dtype_str": "fp16",
            "num_warps": 4
        },
        "ms": 0.0299,
        "min_ms": 0.03,
        "max_ms": 0.0297,
        "GB/s": 26.33,
        "TFLOPS": 35.95
    },
    {
        "params": {
            "M": 4096,
            "N": 2048,
            "K": 32,
            "block_m": 64,
            "block_n": 64,
            "block_k": 32,
            "dtype_str": "fp16",
            "num_warps": 4
        },
        "ms": 0.0229,
        "min_ms": 0.0231,
        "max_ms": 0.0227,
        "GB/s": 34.35,
        "TFLOPS": 46.9
    },
    {
        "params": {
            "M": 4096,
            "N": 2048,
            "K": 32,
            "block_m": 64,
            "block_n": 128,
            "block_k": 32,
            "dtype_str": "fp16",
            "num_warps": 4
        },
        "ms": 0.022,
        "min_ms": 0.0223,
        "max_ms": 0.0218,
        "GB/s": 35.79,
        "TFLOPS": 48.87
    },
    {
        "params": {
            "M": 4096,
            "N": 2048,
            "K": 32,
            "block_m": 128,
            "block_n": 32,
            "block_k": 32,
            "dtype_str": "fp16",
            "num_warps": 4
        },
        "ms": 0.0295,
        "min_ms": 0.0296,
        "max_ms": 0.0293,
        "GB/s": 26.69,
        "TFLOPS": 36.44
    },
    {
        "params": {
            "M": 4096,
            "N": 2048,
            "K": 32,
            "block_m": 128,
            "block_n": 64,
            "block_k": 32,
            "dtype_str": "fp16",
            "num_warps": 4
        },
        "ms": 0.0223,
        "min_ms": 0.0225,
        "max_ms": 0.0222,
        "GB/s": 35.28,
        "TFLOPS": 48.17
    },
    {
        "params": {
            "M": 4096,
            "N": 2048,
            "K": 32,
            "block_m": 128,
            "block_n": 128,
            "block_k": 32,
            "dtype_str": "fp16",
            "num_warps": 4
        },
        "ms": 0.0217,
        "min_ms": 0.022,
        "max_ms": 0.0216,
        "GB/s": 36.19,
        "TFLOPS": 49.41
    },
    {
        "params": {
            "M": 4096,
            "N": 4096,
            "K": 32,
            "block_m": 32,
            "block_n": 32,
            "block_k": 32,
            "dtype_str": "fp16",
            "num_warps": 4
        },
        "ms": 0.056,
        "min_ms": 0.0562,
        "max_ms": 0.0559,
        "GB/s": 18.72,
        "TFLOPS": 38.34
    },
    {
        "params": {
            "M": 4096,
            "N": 4096,
            "K": 32,
            "block_m": 32,
            "block_n": 64,
            "block_k": 32,
            "dtype_str": "fp16",
            "num_warps": 4
        },
        "ms": 0.0425,
        "min_ms": 0.043,
        "max_ms": 0.0419,
        "GB/s": 24.67,
        "TFLOPS": 50.53
    },
    {
        "params": {
            "M": 4096,
            "N": 4096,
            "K": 32,
            "block_m": 32,
            "block_n": 128,
            "block_k": 32,
            "dtype_str": "fp16",
            "num_warps": 4
        },
        "ms": 0.0401,
        "min_ms": 0.0407,
        "max_ms": 0.0396,
        "GB/s": 26.18,
        "TFLOPS": 53.62
    },
    {
        "params": {
            "M": 4096,
            "N": 4096,
            "K": 32,
            "block_m": 64,
            "block_n": 32,
            "block_k": 32,
            "dtype_str": "fp16",
            "num_warps": 4
        },
        "ms": 0.0554,
        "min_ms": 0.0555,
        "max_ms": 0.0552,
        "GB/s": 18.94,
        "TFLOPS": 38.79
    },
    {
        "params": {
            "M": 4096,
            "N": 4096,
            "K": 32,
            "block_m": 64,
            "block_n": 64,
            "block_k": 32,
            "dtype_str": "fp16",
            "num_warps": 4
        },
        "ms": 0.0405,
        "min_ms": 0.0407,
        "max_ms": 0.0405,
        "GB/s": 25.87,
        "TFLOPS": 52.98
    },
    {
        "params": {
            "M": 4096,
            "N": 4096,
            "K": 32,
            "block_m": 64,
            "block_n": 128,
            "block_k": 32,
            "dtype_str": "fp16",
            "num_warps": 4
        },
        "ms": 0.0384,
        "min_ms": 0.0386,
        "max_ms": 0.0383,
        "GB/s": 27.3,
        "TFLOPS": 55.91
    },
    {
        "params": {
            "M": 4096,
            "N": 4096,
            "K": 32,
            "block_m": 128,
            "block_n": 32,
            "block_k": 32,
            "dtype_str": "fp16",
            "num_warps": 4
        },
        "ms": 0.0544,
        "min_ms": 0.0546,
        "max_ms": 0.0543,
        "GB/s": 19.26,
        "TFLOPS": 39.44
    },
    {
        "params": {
            "M": 4096,
            "N": 4096,
            "K": 32,
            "block_m": 128,
            "block_n": 64,
            "block_k": 32,
            "dtype_str": "fp16",
            "num_warps": 4
        },
        "ms": 0.0394,
        "min_ms": 0.0395,
        "max_ms": 0.0393,
        "GB/s": 26.61,
        "TFLOPS": 54.49
    },
    {
        "params": {
            "M": 4096,
            "N": 4096,
            "K": 32,
            "block_m": 128,
            "block_n": 128,
            "block_k": 32,
            "dtype_str": "fp16",
            "num_warps": 4
        },
        "ms": 0.038,
        "min_ms": 0.0381,
        "max_ms": 0.0378,
        "GB/s": 27.62,
        "TFLOPS": 56.56
    },
    {
        "params": {
            "M": 128,
            "N": 128,
            "K": 64,
            "block_m": 32,
            "block_n": 32,
            "block_k": 64,
            "dtype_str": "fp16",
            "num_warps": 4
        },
        "ms": 0.0071,
        "min_ms": 0.0074,
        "max_ms": 0.007,
        "GB/s": 9.29,
        "TFLOPS": 0.59
    },
    {
        "params": {
            "M": 128,
            "N": 128,
            "K": 64,
            "block_m": 32,
            "block_n": 64,
            "block_k": 64,
            "dtype_str": "fp16",
            "num_warps": 4
        },
        "ms": 0.0073,
        "min_ms": 0.0075,
        "max_ms": 0.0072,
        "GB/s": 8.98,
        "TFLOPS": 0.57
    },
    {
        "params": {
            "M": 128,
            "N": 128,
            "K": 64,
            "block_m": 64,
            "block_n": 32,
            "block_k": 64,
            "dtype_str": "fp16",
            "num_warps": 4
        },
        "ms": 0.0075,
        "min_ms": 0.0078,
        "max_ms": 0.0074,
        "GB/s": 8.7,
        "TFLOPS": 0.56
    },
    {
        "params": {
            "M": 128,
            "N": 128,
            "K": 64,
            "block_m": 64,
            "block_n": 64,
            "block_k": 64,
            "dtype_str": "fp16",
            "num_warps": 4
        },
        "ms": 0.0076,
        "min_ms": 0.0078,
        "max_ms": 0.0075,
        "GB/s": 8.6,
        "TFLOPS": 0.55
    },
    {
        "params": {
            "M": 128,
            "N": 128,
            "K": 64,
            "block_m": 128,
            "block_n": 32,
            "block_k": 64,
            "dtype_str": "fp16",
            "num_warps": 4
        },
        "ms": 0.0082,
        "min_ms": 0.0084,
        "max_ms": 0.0081,
        "GB/s": 8.01,
        "TFLOPS": 0.51
    },
    {
        "params": {
            "M": 128,
            "N": 128,
            "K": 64,
            "block_m": 128,
            "block_n": 64,
            "block_k": 64,
            "dtype_str": "fp16",
            "num_warps": 4
        },
        "ms": 0.0081,
        "min_ms": 0.0083,
        "max_ms": 0.0081,
        "GB/s": 8.05,
        "TFLOPS": 0.52
    },
    {
        "params": {
            "M": 128,
            "N": 256,
            "K": 64,
            "block_m": 32,
            "block_n": 32,
            "block_k": 64,
            "dtype_str": "fp16",
            "num_warps": 4
        },
        "ms": 0.0091,
        "min_ms": 0.0093,
        "max_ms": 0.0091,
        "GB/s": 10.8,
        "TFLOPS": 0.92
    },
    {
        "params": {
            "M": 128,
            "N": 256,
            "K": 64,
            "block_m": 32,
            "block_n": 64,
            "block_k": 64,
            "dtype_str": "fp16",
            "num_warps": 4
        },
        "ms": 0.0095,
        "min_ms": 0.0096,
        "max_ms": 0.0095,
        "GB/s": 10.35,
        "TFLOPS": 0.88
    },
    {
        "params": {
            "M": 128,
            "N": 256,
            "K": 64,
            "block_m": 64,
            "block_n": 32,
            "block_k": 64,
            "dtype_str": "fp16",
            "num_warps": 4
        },
        "ms": 0.0097,
        "min_ms": 0.0099,
        "max_ms": 0.0096,
        "GB/s": 10.09,
        "TFLOPS": 0.86
    },
    {
        "params": {
            "M": 128,
            "N": 256,
            "K": 64,
            "block_m": 64,
            "block_n": 64,
            "block_k": 64,
            "dtype_str": "fp16",
            "num_warps": 4
        },
        "ms": 0.0098,
        "min_ms": 0.0099,
        "max_ms": 0.0097,
        "GB/s": 10.05,
        "TFLOPS": 0.86
    },
    {
        "params": {
            "M": 128,
            "N": 256,
            "K": 64,
            "block_m": 128,
            "block_n": 32,
            "block_k": 64,
            "dtype_str": "fp16",
            "num_warps": 4
        },
        "ms": 0.0105,
        "min_ms": 0.0107,
        "max_ms": 0.0104,
        "GB/s": 9.32,
        "TFLOPS": 0.8
    },
    {
        "params": {
            "M": 128,
            "N": 256,
            "K": 64,
            "block_m": 128,
            "block_n": 64,
            "block_k": 64,
            "dtype_str": "fp16",
            "num_warps": 4
        },
        "ms": 0.0103,
        "min_ms": 0.0104,
        "max_ms": 0.0102,
        "GB/s": 9.54,
        "TFLOPS": 0.81
    },
    {
        "params": {
            "M": 128,
            "N": 512,
            "K": 64,
            "block_m": 32,
            "block_n": 32,
            "block_k": 64,
            "dtype_str": "fp16",
            "num_warps": 4
        },
        "ms": 0.0131,
        "min_ms": 0.0132,
        "max_ms": 0.013,
        "GB/s": 12.54,
        "TFLOPS": 1.28
    },
    {
        "params": {
            "M": 128,
            "N": 512,
            "K": 64,
            "block_m": 32,
            "block_n": 64,
            "block_k": 64,
            "dtype_str": "fp16",
            "num_warps": 4
        },
        "ms": 0.0137,
        "min_ms": 0.0137,
        "max_ms": 0.0136,
        "GB/s": 11.98,
        "TFLOPS": 1.23
    },
    {
        "params": {
            "M": 128,
            "N": 512,
            "K": 64,
            "block_m": 64,
            "block_n": 32,
            "block_k": 64,
            "dtype_str": "fp16",
            "num_warps": 4
        },
        "ms": 0.0141,
        "min_ms": 0.0142,
        "max_ms": 0.014,
        "GB/s": 11.64,
        "TFLOPS": 1.19
    },
    {
        "params": {
            "M": 128,
            "N": 512,
            "K": 64,
            "block_m": 64,
            "block_n": 64,
            "block_k": 64,
            "dtype_str": "fp16",
            "num_warps": 4
        },
        "ms": 0.014,
        "min_ms": 0.0142,
        "max_ms": 0.0139,
        "GB/s": 11.68,
        "TFLOPS": 1.2
    },
    {
        "params": {
            "M": 128,
            "N": 512,
            "K": 64,
            "block_m": 128,
            "block_n": 32,
            "block_k": 64,
            "dtype_str": "fp16",
            "num_warps": 4
        },
        "ms": 0.0151,
        "min_ms": 0.0153,
        "max_ms": 0.0149,
        "GB/s": 10.87,
        "TFLOPS": 1.11
    },
    {
        "params": {
            "M": 128,
            "N": 512,
            "K": 64,
            "block_m": 128,
            "block_n": 64,
            "block_k": 64,
            "dtype_str": "fp16",
            "num_warps": 4
        },
        "ms": 0.0145,
        "min_ms": 0.0146,
        "max_ms": 0.0144,
        "GB/s": 11.29,
        "TFLOPS": 1.16
    },
    {
        "params": {
            "M": 128,
            "N": 1024,
            "K": 64,
            "block_m": 32,
            "block_n": 32,
            "block_k": 64,
            "dtype_str": "fp16",
            "num_warps": 4
        },
        "ms": 0.0208,
        "min_ms": 0.021,
        "max_ms": 0.0208,
        "GB/s": 14.15,
        "TFLOPS": 1.61
    },
    {
        "params": {
            "M": 128,
            "N": 1024,
            "K": 64,
            "block_m": 32,
            "block_n": 64,
            "block_k": 64,
            "dtype_str": "fp16",
            "num_warps": 4
        },
        "ms": 0.0221,
        "min_ms": 0.0223,
        "max_ms": 0.0221,
        "GB/s": 13.33,
        "TFLOPS": 1.52
    },
    {
        "params": {
            "M": 128,
            "N": 1024,
            "K": 64,
            "block_m": 64,
            "block_n": 32,
            "block_k": 64,
            "dtype_str": "fp16",
            "num_warps": 4
        },
        "ms": 0.0228,
        "min_ms": 0.0229,
        "max_ms": 0.0227,
        "GB/s": 12.95,
        "TFLOPS": 1.47
    },
    {
        "params": {
            "M": 128,
            "N": 1024,
            "K": 64,
            "block_m": 64,
            "block_n": 64,
            "block_k": 64,
            "dtype_str": "fp16",
            "num_warps": 4
        },
        "ms": 0.0227,
        "min_ms": 0.023,
        "max_ms": 0.0225,
        "GB/s": 13.02,
        "TFLOPS": 1.48
    },
    {
        "params": {
            "M": 128,
            "N": 1024,
            "K": 64,
            "block_m": 128,
            "block_n": 32,
            "block_k": 64,
            "dtype_str": "fp16",
            "num_warps": 4
        },
        "ms": 0.0247,
        "min_ms": 0.0251,
        "max_ms": 0.0242,
        "GB/s": 11.92,
        "TFLOPS": 1.36
    },
    {
        "params": {
            "M": 128,
            "N": 1024,
            "K": 64,
            "block_m": 128,
            "block_n": 64,
            "block_k": 64,
            "dtype_str": "fp16",
            "num_warps": 4
        },
        "ms": 0.0231,
        "min_ms": 0.0235,
        "max_ms": 0.023,
        "GB/s": 12.77,
        "TFLOPS": 1.45
    },
    {
        "params": {
            "M": 256,
            "N": 128,
            "K": 64,
            "block_m": 32,
            "block_n": 32,
            "block_k": 64,
            "dtype_str": "fp16",
            "num_warps": 4
        },
        "ms": 0.0071,
        "min_ms": 0.0074,
        "max_ms": 0.0071,
        "GB/s": 13.78,
        "TFLOPS": 1.18
    },
    {
        "params": {
            "M": 256,
            "N": 128,
            "K": 64,
            "block_m": 32,
            "block_n": 64,
            "block_k": 64,
            "dtype_str": "fp16",
            "num_warps": 4
        },
        "ms": 0.0074,
        "min_ms": 0.0076,
        "max_ms": 0.0073,
        "GB/s": 13.33,
        "TFLOPS": 1.14
    },
    {
        "params": {
            "M": 256,
            "N": 128,
            "K": 64,
            "block_m": 64,
            "block_n": 32,
            "block_k": 64,
            "dtype_str": "fp16",
            "num_warps": 4
        },
        "ms": 0.0075,
        "min_ms": 0.0077,
        "max_ms": 0.0075,
        "GB/s": 13.04,
        "TFLOPS": 1.11
    },
    {
        "params": {
            "M": 256,
            "N": 128,
            "K": 64,
            "block_m": 64,
            "block_n": 64,
            "block_k": 64,
            "dtype_str": "fp16",
            "num_warps": 4
        },
        "ms": 0.0076,
        "min_ms": 0.0078,
        "max_ms": 0.0075,
        "GB/s": 12.9,
        "TFLOPS": 1.1
    },
    {
        "params": {
            "M": 256,
            "N": 128,
            "K": 64,
            "block_m": 128,
            "block_n": 32,
            "block_k": 64,
            "dtype_str": "fp16",
            "num_warps": 4
        },
        "ms": 0.0081,
        "min_ms": 0.0083,
        "max_ms": 0.0081,
        "GB/s": 12.08,
        "TFLOPS": 1.03
    },
    {
        "params": {
            "M": 256,
            "N": 128,
            "K": 64,
            "block_m": 128,
            "block_n": 64,
            "block_k": 64,
            "dtype_str": "fp16",
            "num_warps": 4
        },
        "ms": 0.0081,
        "min_ms": 0.0083,
        "max_ms": 0.008,
        "GB/s": 12.08,
        "TFLOPS": 1.03
    },
    {
        "params": {
            "M": 256,
            "N": 256,
            "K": 64,
            "block_m": 32,
            "block_n": 32,
            "block_k": 64,
            "dtype_str": "fp16",
            "num_warps": 4
        },
        "ms": 0.0091,
        "min_ms": 0.0093,
        "max_ms": 0.0091,
        "GB/s": 14.34,
        "TFLOPS": 1.84
    },
    {
        "params": {
            "M": 256,
            "N": 256,
            "K": 64,
            "block_m": 32,
            "block_n": 64,
            "block_k": 64,
            "dtype_str": "fp16",
            "num_warps": 4
        },
        "ms": 0.0095,
        "min_ms": 0.0097,
        "max_ms": 0.0095,
        "GB/s": 13.79,
        "TFLOPS": 1.77
    },
    {
        "params": {
            "M": 256,
            "N": 256,
            "K": 64,
            "block_m": 64,
            "block_n": 32,
            "block_k": 64,
            "dtype_str": "fp16",
            "num_warps": 4
        },
        "ms": 0.0097,
        "min_ms": 0.0099,
        "max_ms": 0.0096,
        "GB/s": 13.51,
        "TFLOPS": 1.73
    },
    {
        "params": {
            "M": 256,
            "N": 256,
            "K": 64,
            "block_m": 64,
            "block_n": 64,
            "block_k": 64,
            "dtype_str": "fp16",
            "num_warps": 4
        },
        "ms": 0.0098,
        "min_ms": 0.01,
        "max_ms": 0.0097,
        "GB/s": 13.34,
        "TFLOPS": 1.71
    },
    {
        "params": {
            "M": 256,
            "N": 256,
            "K": 64,
            "block_m": 128,
            "block_n": 32,
            "block_k": 64,
            "dtype_str": "fp16",
            "num_warps": 4
        },
        "ms": 0.0104,
        "min_ms": 0.0105,
        "max_ms": 0.0103,
        "GB/s": 12.62,
        "TFLOPS": 1.62
    },
    {
        "params": {
            "M": 256,
            "N": 256,
            "K": 64,
            "block_m": 128,
            "block_n": 64,
            "block_k": 64,
            "dtype_str": "fp16",
            "num_warps": 4
        },
        "ms": 0.0103,
        "min_ms": 0.0104,
        "max_ms": 0.0102,
        "GB/s": 12.77,
        "TFLOPS": 1.63
    },
    {
        "params": {
            "M": 256,
            "N": 512,
            "K": 64,
            "block_m": 32,
            "block_n": 32,
            "block_k": 64,
            "dtype_str": "fp16",
            "num_warps": 4
        },
        "ms": 0.0131,
        "min_ms": 0.0132,
        "max_ms": 0.0131,
        "GB/s": 15.0,
        "TFLOPS": 2.56
    },
    {
        "params": {
            "M": 256,
            "N": 512,
            "K": 64,
            "block_m": 32,
            "block_n": 64,
            "block_k": 64,
            "dtype_str": "fp16",
            "num_warps": 4
        },
        "ms": 0.0137,
        "min_ms": 0.0139,
        "max_ms": 0.0136,
        "GB/s": 14.34,
        "TFLOPS": 2.45
    },
    {
        "params": {
            "M": 256,
            "N": 512,
            "K": 64,
            "block_m": 64,
            "block_n": 32,
            "block_k": 64,
            "dtype_str": "fp16",
            "num_warps": 4
        },
        "ms": 0.0141,
        "min_ms": 0.0142,
        "max_ms": 0.014,
        "GB/s": 13.97,
        "TFLOPS": 2.38
    },
    {
        "params": {
            "M": 256,
            "N": 512,
            "K": 64,
            "block_m": 64,
            "block_n": 64,
            "block_k": 64,
            "dtype_str": "fp16",
            "num_warps": 4
        },
        "ms": 0.0141,
        "min_ms": 0.0142,
        "max_ms": 0.014,
        "GB/s": 13.97,
        "TFLOPS": 2.38
    },
    {
        "params": {
            "M": 256,
            "N": 512,
            "K": 64,
            "block_m": 128,
            "block_n": 32,
            "block_k": 64,
            "dtype_str": "fp16",
            "num_warps": 4
        },
        "ms": 0.0148,
        "min_ms": 0.0149,
        "max_ms": 0.0147,
        "GB/s": 13.33,
        "TFLOPS": 2.27
    },
    {
        "params": {
            "M": 256,
            "N": 512,
            "K": 64,
            "block_m": 128,
            "block_n": 64,
            "block_k": 64,
            "dtype_str": "fp16",
            "num_warps": 4
        },
        "ms": 0.0146,
        "min_ms": 0.0147,
        "max_ms": 0.0145,
        "GB/s": 13.51,
        "TFLOPS": 2.31
    },
    {
        "params": {
            "M": 256,
            "N": 1024,
            "K": 64,
            "block_m": 32,
            "block_n": 32,
            "block_k": 64,
            "dtype_str": "fp16",
            "num_warps": 4
        },
        "ms": 0.021,
        "min_ms": 0.0213,
        "max_ms": 0.0208,
        "GB/s": 15.63,
        "TFLOPS": 3.2
    },
    {
        "params": {
            "M": 256,
            "N": 1024,
            "K": 64,
            "block_m": 32,
            "block_n": 64,
            "block_k": 64,
            "dtype_str": "fp16",
            "num_warps": 4
        },
        "ms": 0.0222,
        "min_ms": 0.0225,
        "max_ms": 0.0221,
        "GB/s": 14.75,
        "TFLOPS": 3.02
    },
    {
        "params": {
            "M": 256,
            "N": 1024,
            "K": 64,
            "block_m": 64,
            "block_n": 32,
            "block_k": 64,
            "dtype_str": "fp16",
            "num_warps": 4
        },
        "ms": 0.0229,
        "min_ms": 0.0232,
        "max_ms": 0.0227,
        "GB/s": 14.31,
        "TFLOPS": 2.93
    },
    {
        "params": {
            "M": 256,
            "N": 1024,
            "K": 64,
            "block_m": 64,
            "block_n": 64,
            "block_k": 64,
            "dtype_str": "fp16",
            "num_warps": 4
        },
        "ms": 0.0226,
        "min_ms": 0.0228,
        "max_ms": 0.0225,
        "GB/s": 14.52,
        "TFLOPS": 2.97
    },
    {
        "params": {
            "M": 256,
            "N": 1024,
            "K": 64,
            "block_m": 128,
            "block_n": 32,
            "block_k": 64,
            "dtype_str": "fp16",
            "num_warps": 4
        },
        "ms": 0.0237,
        "min_ms": 0.0241,
        "max_ms": 0.0235,
        "GB/s": 13.85,
        "TFLOPS": 2.84
    },
    {
        "params": {
            "M": 256,
            "N": 1024,
            "K": 64,
            "block_m": 128,
            "block_n": 64,
            "block_k": 64,
            "dtype_str": "fp16",
            "num_warps": 4
        },
        "ms": 0.0232,
        "min_ms": 0.0237,
        "max_ms": 0.023,
        "GB/s": 14.14,
        "TFLOPS": 2.9
    },
    {
        "params": {
            "M": 512,
            "N": 128,
            "K": 64,
            "block_m": 32,
            "block_n": 32,
            "block_k": 64,
            "dtype_str": "fp16",
            "num_warps": 4
        },
        "ms": 0.0071,
        "min_ms": 0.0074,
        "max_ms": 0.0071,
        "GB/s": 22.96,
        "TFLOPS": 2.35
    },
    {
        "params": {
            "M": 512,
            "N": 128,
            "K": 64,
            "block_m": 32,
            "block_n": 64,
            "block_k": 64,
            "dtype_str": "fp16",
            "num_warps": 4
        },
        "ms": 0.0074,
        "min_ms": 0.0075,
        "max_ms": 0.0073,
        "GB/s": 22.21,
        "TFLOPS": 2.27
    },
    {
        "params": {
            "M": 512,
            "N": 128,
            "K": 64,
            "block_m": 64,
            "block_n": 32,
            "block_k": 64,
            "dtype_str": "fp16",
            "num_warps": 4
        },
        "ms": 0.0077,
        "min_ms": 0.0078,
        "max_ms": 0.0076,
        "GB/s": 21.39,
        "TFLOPS": 2.19
    },
    {
        "params": {
            "M": 512,
            "N": 128,
            "K": 64,
            "block_m": 64,
            "block_n": 64,
            "block_k": 64,
            "dtype_str": "fp16",
            "num_warps": 4
        },
        "ms": 0.0077,
        "min_ms": 0.0079,
        "max_ms": 0.0077,
        "GB/s": 21.17,
        "TFLOPS": 2.17
    },
    {
        "params": {
            "M": 512,
            "N": 128,
            "K": 64,
            "block_m": 128,
            "block_n": 32,
            "block_k": 64,
            "dtype_str": "fp16",
            "num_warps": 4
        },
        "ms": 0.0082,
        "min_ms": 0.0084,
        "max_ms": 0.0081,
        "GB/s": 19.93,
        "TFLOPS": 2.04
    },
    {
        "params": {
            "M": 512,
            "N": 128,
            "K": 64,
            "block_m": 128,
            "block_n": 64,
            "block_k": 64,
            "dtype_str": "fp16",
            "num_warps": 4
        },
        "ms": 0.0082,
        "min_ms": 0.0083,
        "max_ms": 0.0081,
        "GB/s": 20.03,
        "TFLOPS": 2.05
    },
    {
        "params": {
            "M": 512,
            "N": 256,
            "K": 64,
            "block_m": 32,
            "block_n": 32,
            "block_k": 64,
            "dtype_str": "fp16",
            "num_warps": 4
        },
        "ms": 0.0091,
        "min_ms": 0.0094,
        "max_ms": 0.0091,
        "GB/s": 21.51,
        "TFLOPS": 3.67
    },
    {
        "params": {
            "M": 512,
            "N": 256,
            "K": 64,
            "block_m": 32,
            "block_n": 64,
            "block_k": 64,
            "dtype_str": "fp16",
            "num_warps": 4
        },
        "ms": 0.0095,
        "min_ms": 0.0097,
        "max_ms": 0.0095,
        "GB/s": 20.6,
        "TFLOPS": 3.52
    },
    {
        "params": {
            "M": 512,
            "N": 256,
            "K": 64,
            "block_m": 64,
            "block_n": 32,
            "block_k": 64,
            "dtype_str": "fp16",
            "num_warps": 4
        },
        "ms": 0.0098,
        "min_ms": 0.01,
        "max_ms": 0.0097,
        "GB/s": 20.1,
        "TFLOPS": 3.43
    },
    {
        "params": {
            "M": 512,
            "N": 256,
            "K": 64,
            "block_m": 64,
            "block_n": 64,
            "block_k": 64,
            "dtype_str": "fp16",
            "num_warps": 4
        },
        "ms": 0.0099,
        "min_ms": 0.01,
        "max_ms": 0.0097,
        "GB/s": 19.94,
        "TFLOPS": 3.4
    },
    {
        "params": {
            "M": 512,
            "N": 256,
            "K": 64,
            "block_m": 128,
            "block_n": 32,
            "block_k": 64,
            "dtype_str": "fp16",
            "num_warps": 4
        },
        "ms": 0.0104,
        "min_ms": 0.0106,
        "max_ms": 0.0103,
        "GB/s": 18.93,
        "TFLOPS": 3.23
    },
    {
        "params": {
            "M": 512,
            "N": 256,
            "K": 64,
            "block_m": 128,
            "block_n": 64,
            "block_k": 64,
            "dtype_str": "fp16",
            "num_warps": 4
        },
        "ms": 0.0103,
        "min_ms": 0.0105,
        "max_ms": 0.0102,
        "GB/s": 19.08,
        "TFLOPS": 3.26
    },
    {
        "params": {
            "M": 512,
            "N": 512,
            "K": 64,
            "block_m": 32,
            "block_n": 32,
            "block_k": 64,
            "dtype_str": "fp16",
            "num_warps": 4
        },
        "ms": 0.0132,
        "min_ms": 0.0133,
        "max_ms": 0.0131,
        "GB/s": 19.93,
        "TFLOPS": 5.1
    },
    {
        "params": {
            "M": 512,
            "N": 512,
            "K": 64,
            "block_m": 32,
            "block_n": 64,
            "block_k": 64,
            "dtype_str": "fp16",
            "num_warps": 4
        },
        "ms": 0.0138,
        "min_ms": 0.014,
        "max_ms": 0.0138,
        "GB/s": 18.95,
        "TFLOPS": 4.85
    },
    {
        "params": {
            "M": 512,
            "N": 512,
            "K": 64,
            "block_m": 64,
            "block_n": 32,
            "block_k": 64,
            "dtype_str": "fp16",
            "num_warps": 4
        },
        "ms": 0.0142,
        "min_ms": 0.0144,
        "max_ms": 0.0141,
        "GB/s": 18.42,
        "TFLOPS": 4.72
    },
    {
        "params": {
            "M": 512,
            "N": 512,
            "K": 64,
            "block_m": 64,
            "block_n": 64,
            "block_k": 64,
            "dtype_str": "fp16",
            "num_warps": 4
        },
        "ms": 0.0142,
        "min_ms": 0.0143,
        "max_ms": 0.014,
        "GB/s": 18.52,
        "TFLOPS": 4.74
    },
    {
        "params": {
            "M": 512,
            "N": 512,
            "K": 64,
            "block_m": 128,
            "block_n": 32,
            "block_k": 64,
            "dtype_str": "fp16",
            "num_warps": 4
        },
        "ms": 0.0149,
        "min_ms": 0.015,
        "max_ms": 0.0148,
        "GB/s": 17.62,
        "TFLOPS": 4.51
    },
    {
        "params": {
            "M": 512,
            "N": 512,
            "K": 64,
            "block_m": 128,
            "block_n": 64,
            "block_k": 64,
            "dtype_str": "fp16",
            "num_warps": 4
        },
        "ms": 0.0146,
        "min_ms": 0.0147,
        "max_ms": 0.0146,
        "GB/s": 17.96,
        "TFLOPS": 4.6
    },
    {
        "params": {
            "M": 512,
            "N": 1024,
            "K": 64,
            "block_m": 32,
            "block_n": 32,
            "block_k": 64,
            "dtype_str": "fp16",
            "num_warps": 4
        },
        "ms": 0.021,
        "min_ms": 0.0213,
        "max_ms": 0.0209,
        "GB/s": 18.72,
        "TFLOPS": 6.39
    },
    {
        "params": {
            "M": 512,
            "N": 1024,
            "K": 64,
            "block_m": 32,
            "block_n": 64,
            "block_k": 64,
            "dtype_str": "fp16",
            "num_warps": 4
        },
        "ms": 0.0223,
        "min_ms": 0.0226,
        "max_ms": 0.0222,
        "GB/s": 17.64,
        "TFLOPS": 6.02
    },
    {
        "params": {
            "M": 512,
            "N": 1024,
            "K": 64,
            "block_m": 64,
            "block_n": 32,
            "block_k": 64,
            "dtype_str": "fp16",
            "num_warps": 4
        },
        "ms": 0.023,
        "min_ms": 0.0234,
        "max_ms": 0.0229,
        "GB/s": 17.09,
        "TFLOPS": 5.83
    },
    {
        "params": {
            "M": 512,
            "N": 1024,
            "K": 64,
            "block_m": 64,
            "block_n": 64,
            "block_k": 64,
            "dtype_str": "fp16",
            "num_warps": 4
        },
        "ms": 0.0227,
        "min_ms": 0.023,
        "max_ms": 0.0226,
        "GB/s": 17.33,
        "TFLOPS": 5.91
    },
    {
        "params": {
            "M": 512,
            "N": 1024,
            "K": 64,
            "block_m": 128,
            "block_n": 32,
            "block_k": 64,
            "dtype_str": "fp16",
            "num_warps": 4
        },
        "ms": 0.0237,
        "min_ms": 0.0239,
        "max_ms": 0.0236,
        "GB/s": 16.62,
        "TFLOPS": 5.67
    },
    {
        "params": {
            "M": 512,
            "N": 1024,
            "K": 64,
            "block_m": 128,
            "block_n": 64,
            "block_k": 64,
            "dtype_str": "fp16",
            "num_warps": 4
        },
        "ms": 0.0231,
        "min_ms": 0.0234,
        "max_ms": 0.023,
        "GB/s": 17.03,
        "TFLOPS": 5.81
    },
    {
        "params": {
            "M": 1024,
            "N": 128,
            "K": 64,
            "block_m": 32,
            "block_n": 32,
            "block_k": 64,
            "dtype_str": "fp16",
            "num_warps": 4
        },
        "ms": 0.0073,
        "min_ms": 0.0074,
        "max_ms": 0.0072,
        "GB/s": 40.64,
        "TFLOPS": 4.62
    },
    {
        "params": {
            "M": 1024,
            "N": 128,
            "K": 64,
            "block_m": 32,
            "block_n": 64,
            "block_k": 64,
            "dtype_str": "fp16",
            "num_warps": 4
        },
        "ms": 0.0075,
        "min_ms": 0.0077,
        "max_ms": 0.0074,
        "GB/s": 39.34,
        "TFLOPS": 4.48
    },
    {
        "params": {
            "M": 1024,
            "N": 128,
            "K": 64,
            "block_m": 64,
            "block_n": 32,
            "block_k": 64,
            "dtype_str": "fp16",
            "num_warps": 4
        },
        "ms": 0.0077,
        "min_ms": 0.0078,
        "max_ms": 0.0076,
        "GB/s": 38.51,
        "TFLOPS": 4.38
    },
    {
        "params": {
            "M": 1024,
            "N": 128,
            "K": 64,
            "block_m": 64,
            "block_n": 64,
            "block_k": 64,
            "dtype_str": "fp16",
            "num_warps": 4
        },
        "ms": 0.0079,
        "min_ms": 0.008,
        "max_ms": 0.0077,
        "GB/s": 37.53,
        "TFLOPS": 4.27
    },
    {
        "params": {
            "M": 1024,
            "N": 128,
            "K": 64,
            "block_m": 128,
            "block_n": 32,
            "block_k": 64,
            "dtype_str": "fp16",
            "num_warps": 4
        },
        "ms": 0.0083,
        "min_ms": 0.0085,
        "max_ms": 0.0081,
        "GB/s": 35.71,
        "TFLOPS": 4.06
    },
    {
        "params": {
            "M": 1024,
            "N": 128,
            "K": 64,
            "block_m": 128,
            "block_n": 64,
            "block_k": 64,
            "dtype_str": "fp16",
            "num_warps": 4
        },
        "ms": 0.0083,
        "min_ms": 0.0085,
        "max_ms": 0.0082,
        "GB/s": 35.54,
        "TFLOPS": 4.04
    },
    {
        "params": {
            "M": 1024,
            "N": 256,
            "K": 64,
            "block_m": 32,
            "block_n": 32,
            "block_k": 64,
            "dtype_str": "fp16",
            "num_warps": 4
        },
        "ms": 0.0092,
        "min_ms": 0.0094,
        "max_ms": 0.0091,
        "GB/s": 35.54,
        "TFLOPS": 7.28
    },
    {
        "params": {
            "M": 1024,
            "N": 256,
            "K": 64,
            "block_m": 32,
            "block_n": 64,
            "block_k": 64,
            "dtype_str": "fp16",
            "num_warps": 4
        },
        "ms": 0.0096,
        "min_ms": 0.0098,
        "max_ms": 0.0095,
        "GB/s": 34.06,
        "TFLOPS": 6.97
    },
    {
        "params": {
            "M": 1024,
            "N": 256,
            "K": 64,
            "block_m": 64,
            "block_n": 32,
            "block_k": 64,
            "dtype_str": "fp16",
            "num_warps": 4
        },
        "ms": 0.0099,
        "min_ms": 0.0101,
        "max_ms": 0.0098,
        "GB/s": 33.22,
        "TFLOPS": 6.8
    },
    {
        "params": {
            "M": 1024,
            "N": 256,
            "K": 64,
            "block_m": 64,
            "block_n": 64,
            "block_k": 64,
            "dtype_str": "fp16",
            "num_warps": 4
        },
        "ms": 0.0099,
        "min_ms": 0.0101,
        "max_ms": 0.0099,
        "GB/s": 32.96,
        "TFLOPS": 6.75
    },
    {
        "params": {
            "M": 1024,
            "N": 256,
            "K": 64,
            "block_m": 128,
            "block_n": 32,
            "block_k": 64,
            "dtype_str": "fp16",
            "num_warps": 4
        },
        "ms": 0.0105,
        "min_ms": 0.0107,
        "max_ms": 0.0104,
        "GB/s": 31.31,
        "TFLOPS": 6.41
    },
    {
        "params": {
            "M": 1024,
            "N": 256,
            "K": 64,
            "block_m": 128,
            "block_n": 64,
            "block_k": 64,
            "dtype_str": "fp16",
            "num_warps": 4
        },
        "ms": 0.0104,
        "min_ms": 0.0105,
        "max_ms": 0.0103,
        "GB/s": 31.56,
        "TFLOPS": 6.46
    },
    {
        "params": {
            "M": 1024,
            "N": 512,
            "K": 64,
            "block_m": 32,
            "block_n": 32,
            "block_k": 64,
            "dtype_str": "fp16",
            "num_warps": 4
        },
        "ms": 0.0131,
        "min_ms": 0.0133,
        "max_ms": 0.0131,
        "GB/s": 29.99,
        "TFLOPS": 10.24
    },
    {
        "params": {
            "M": 1024,
            "N": 512,
            "K": 64,
            "block_m": 32,
            "block_n": 64,
            "block_k": 64,
            "dtype_str": "fp16",
            "num_warps": 4
        },
        "ms": 0.0138,
        "min_ms": 0.014,
        "max_ms": 0.0137,
        "GB/s": 28.51,
        "TFLOPS": 9.73
    },
    {
        "params": {
            "M": 1024,
            "N": 512,
            "K": 64,
            "block_m": 64,
            "block_n": 32,
            "block_k": 64,
            "dtype_str": "fp16",
            "num_warps": 4
        },
        "ms": 0.0142,
        "min_ms": 0.0144,
        "max_ms": 0.0141,
        "GB/s": 27.71,
        "TFLOPS": 9.46
    },
    {
        "params": {
            "M": 1024,
            "N": 512,
            "K": 64,
            "block_m": 64,
            "block_n": 64,
            "block_k": 64,
            "dtype_str": "fp16",
            "num_warps": 4
        },
        "ms": 0.0142,
        "min_ms": 0.0143,
        "max_ms": 0.014,
        "GB/s": 27.79,
        "TFLOPS": 9.48
    },
    {
        "params": {
            "M": 1024,
            "N": 512,
            "K": 64,
            "block_m": 128,
            "block_n": 32,
            "block_k": 64,
            "dtype_str": "fp16",
            "num_warps": 4
        },
        "ms": 0.0149,
        "min_ms": 0.015,
        "max_ms": 0.0148,
        "GB/s": 26.44,
        "TFLOPS": 9.02
    },
    {
        "params": {
            "M": 1024,
            "N": 512,
            "K": 64,
            "block_m": 128,
            "block_n": 64,
            "block_k": 64,
            "dtype_str": "fp16",
            "num_warps": 4
        },
        "ms": 0.0146,
        "min_ms": 0.0147,
        "max_ms": 0.0145,
        "GB/s": 26.95,
        "TFLOPS": 9.2
    },
    {
        "params": {
            "M": 1024,
            "N": 1024,
            "K": 64,
            "block_m": 32,
            "block_n": 32,
            "block_k": 64,
            "dtype_str": "fp16",
            "num_warps": 4
        },
        "ms": 0.0212,
        "min_ms": 0.0215,
        "max_ms": 0.0211,
        "GB/s": 24.77,
        "TFLOPS": 12.68
    },
    {
        "params": {
            "M": 1024,
            "N": 1024,
            "K": 64,
            "block_m": 32,
            "block_n": 64,
            "block_k": 64,
            "dtype_str": "fp16",
            "num_warps": 4
        },
        "ms": 0.0224,
        "min_ms": 0.0227,
        "max_ms": 0.0223,
        "GB/s": 23.44,
        "TFLOPS": 12.0
    },
    {
        "params": {
            "M": 1024,
            "N": 1024,
            "K": 64,
            "block_m": 64,
            "block_n": 32,
            "block_k": 64,
            "dtype_str": "fp16",
            "num_warps": 4
        },
        "ms": 0.023,
        "min_ms": 0.0233,
        "max_ms": 0.0229,
        "GB/s": 22.82,
        "TFLOPS": 11.68
    },
    {
        "params": {
            "M": 1024,
            "N": 1024,
            "K": 64,
            "block_m": 64,
            "block_n": 64,
            "block_k": 64,
            "dtype_str": "fp16",
            "num_warps": 4
        },
        "ms": 0.0228,
        "min_ms": 0.0231,
        "max_ms": 0.0226,
        "GB/s": 23.02,
        "TFLOPS": 11.79
    },
    {
        "params": {
            "M": 1024,
            "N": 1024,
            "K": 64,
            "block_m": 128,
            "block_n": 32,
            "block_k": 64,
            "dtype_str": "fp16",
            "num_warps": 4
        },
        "ms": 0.0238,
        "min_ms": 0.024,
        "max_ms": 0.0237,
        "GB/s": 22.05,
        "TFLOPS": 11.29
    },
    {
        "params": {
            "M": 1024,
            "N": 1024,
            "K": 64,
            "block_m": 128,
            "block_n": 64,
            "block_k": 64,
            "dtype_str": "fp16",
            "num_warps": 4
        },
        "ms": 0.0232,
        "min_ms": 0.0237,
        "max_ms": 0.0231,
        "GB/s": 22.6,
        "TFLOPS": 11.57
    },
    {
        "params": {
            "M": 2048,
            "N": 128,
            "K": 64,
            "block_m": 32,
            "block_n": 32,
            "block_k": 64,
            "dtype_str": "fp16",
            "num_warps": 4
        },
        "ms": 0.0073,
        "min_ms": 0.0075,
        "max_ms": 0.0072,
        "GB/s": 76.76,
        "TFLOPS": 9.25
    },
    {
        "params": {
            "M": 2048,
            "N": 128,
            "K": 64,
            "block_m": 32,
            "block_n": 64,
            "block_k": 64,
            "dtype_str": "fp16",
            "num_warps": 4
        },
        "ms": 0.0076,
        "min_ms": 0.0078,
        "max_ms": 0.0075,
        "GB/s": 73.52,
        "TFLOPS": 8.86
    },
    {
        "params": {
            "M": 2048,
            "N": 128,
            "K": 64,
            "block_m": 64,
            "block_n": 32,
            "block_k": 64,
            "dtype_str": "fp16",
            "num_warps": 4
        },
        "ms": 0.0077,
        "min_ms": 0.0079,
        "max_ms": 0.0076,
        "GB/s": 72.36,
        "TFLOPS": 8.72
    },
    {
        "params": {
            "M": 2048,
            "N": 128,
            "K": 64,
            "block_m": 64,
            "block_n": 64,
            "block_k": 64,
            "dtype_str": "fp16",
            "num_warps": 4
        },
        "ms": 0.0079,
        "min_ms": 0.0081,
        "max_ms": 0.0077,
        "GB/s": 70.89,
        "TFLOPS": 8.54
    },
    {
        "params": {
            "M": 2048,
            "N": 128,
            "K": 64,
            "block_m": 128,
            "block_n": 32,
            "block_k": 64,
            "dtype_str": "fp16",
            "num_warps": 4
        },
        "ms": 0.0083,
        "min_ms": 0.0085,
        "max_ms": 0.0082,
        "GB/s": 67.12,
        "TFLOPS": 8.09
    },
    {
        "params": {
            "M": 2048,
            "N": 128,
            "K": 64,
            "block_m": 128,
            "block_n": 64,
            "block_k": 64,
            "dtype_str": "fp16",
            "num_warps": 4
        },
        "ms": 0.0083,
        "min_ms": 0.0085,
        "max_ms": 0.0082,
        "GB/s": 66.8,
        "TFLOPS": 8.05
    },
    {
        "params": {
            "M": 2048,
            "N": 256,
            "K": 64,
            "block_m": 32,
            "block_n": 32,
            "block_k": 64,
            "dtype_str": "fp16",
            "num_warps": 4
        },
        "ms": 0.0093,
        "min_ms": 0.0096,
        "max_ms": 0.0092,
        "GB/s": 63.14,
        "TFLOPS": 14.37
    },
    {
        "params": {
            "M": 2048,
            "N": 256,
            "K": 64,
            "block_m": 32,
            "block_n": 64,
            "block_k": 64,
            "dtype_str": "fp16",
            "num_warps": 4
        },
        "ms": 0.0097,
        "min_ms": 0.01,
        "max_ms": 0.0096,
        "GB/s": 60.54,
        "TFLOPS": 13.78
    },
    {
        "params": {
            "M": 2048,
            "N": 256,
            "K": 64,
            "block_m": 64,
            "block_n": 32,
            "block_k": 64,
            "dtype_str": "fp16",
            "num_warps": 4
        },
        "ms": 0.0099,
        "min_ms": 0.0101,
        "max_ms": 0.0098,
        "GB/s": 59.8,
        "TFLOPS": 13.61
    },
    {
        "params": {
            "M": 2048,
            "N": 256,
            "K": 64,
            "block_m": 64,
            "block_n": 64,
            "block_k": 64,
            "dtype_str": "fp16",
            "num_warps": 4
        },
        "ms": 0.01,
        "min_ms": 0.0102,
        "max_ms": 0.0099,
        "GB/s": 58.85,
        "TFLOPS": 13.39
    },
    {
        "params": {
            "M": 2048,
            "N": 256,
            "K": 64,
            "block_m": 128,
            "block_n": 32,
            "block_k": 64,
            "dtype_str": "fp16",
            "num_warps": 4
        },
        "ms": 0.0105,
        "min_ms": 0.0106,
        "max_ms": 0.0104,
        "GB/s": 56.37,
        "TFLOPS": 12.83
    },
    {
        "params": {
            "M": 2048,
            "N": 256,
            "K": 64,
            "block_m": 128,
            "block_n": 64,
            "block_k": 64,
            "dtype_str": "fp16",
            "num_warps": 4
        },
        "ms": 0.0105,
        "min_ms": 0.0107,
        "max_ms": 0.0103,
        "GB/s": 56.37,
        "TFLOPS": 12.83
    },
    {
        "params": {
            "M": 2048,
            "N": 512,
            "K": 64,
            "block_m": 32,
            "block_n": 32,
            "block_k": 64,
            "dtype_str": "fp16",
            "num_warps": 4
        },
        "ms": 0.0133,
        "min_ms": 0.0135,
        "max_ms": 0.0132,
        "GB/s": 49.23,
        "TFLOPS": 20.17
    },
    {
        "params": {
            "M": 2048,
            "N": 512,
            "K": 64,
            "block_m": 32,
            "block_n": 64,
            "block_k": 64,
            "dtype_str": "fp16",
            "num_warps": 4
        },
        "ms": 0.014,
        "min_ms": 0.0143,
        "max_ms": 0.0139,
        "GB/s": 46.84,
        "TFLOPS": 19.18
    },
    {
        "params": {
            "M": 2048,
            "N": 512,
            "K": 64,
            "block_m": 64,
            "block_n": 32,
            "block_k": 64,
            "dtype_str": "fp16",
            "num_warps": 4
        },
        "ms": 0.0142,
        "min_ms": 0.0144,
        "max_ms": 0.0141,
        "GB/s": 46.17,
        "TFLOPS": 18.91
    },
    {
        "params": {
            "M": 2048,
            "N": 512,
            "K": 64,
            "block_m": 64,
            "block_n": 64,
            "block_k": 64,
            "dtype_str": "fp16",
            "num_warps": 4
        },
        "ms": 0.0142,
        "min_ms": 0.0144,
        "max_ms": 0.0141,
        "GB/s": 46.05,
        "TFLOPS": 18.86
    },
    {
        "params": {
            "M": 2048,
            "N": 512,
            "K": 64,
            "block_m": 128,
            "block_n": 32,
            "block_k": 64,
            "dtype_str": "fp16",
            "num_warps": 4
        },
        "ms": 0.0149,
        "min_ms": 0.015,
        "max_ms": 0.0148,
        "GB/s": 44.06,
        "TFLOPS": 18.05
    },
    {
        "params": {
            "M": 2048,
            "N": 512,
            "K": 64,
            "block_m": 128,
            "block_n": 64,
            "block_k": 64,
            "dtype_str": "fp16",
            "num_warps": 4
        },
        "ms": 0.0147,
        "min_ms": 0.0149,
        "max_ms": 0.0146,
        "GB/s": 44.54,
        "TFLOPS": 18.24
    },
    {
        "params": {
            "M": 2048,
            "N": 1024,
            "K": 64,
            "block_m": 32,
            "block_n": 32,
            "block_k": 64,
            "dtype_str": "fp16",
            "num_warps": 4
        },
        "ms": 0.0214,
        "min_ms": 0.0219,
        "max_ms": 0.0213,
        "GB/s": 36.67,
        "TFLOPS": 25.03
    },
    {
        "params": {
            "M": 2048,
            "N": 1024,
            "K": 64,
            "block_m": 32,
            "block_n": 64,
            "block_k": 64,
            "dtype_str": "fp16",
            "num_warps": 4
        },
        "ms": 0.0226,
        "min_ms": 0.023,
        "max_ms": 0.0225,
        "GB/s": 34.84,
        "TFLOPS": 23.78
    },
    {
        "params": {
            "M": 2048,
            "N": 1024,
            "K": 64,
            "block_m": 64,
            "block_n": 32,
            "block_k": 64,
            "dtype_str": "fp16",
            "num_warps": 4
        },
        "ms": 0.023,
        "min_ms": 0.0232,
        "max_ms": 0.0229,
        "GB/s": 34.17,
        "TFLOPS": 23.33
    },
    {
        "params": {
            "M": 2048,
            "N": 1024,
            "K": 64,
            "block_m": 64,
            "block_n": 64,
            "block_k": 64,
            "dtype_str": "fp16",
            "num_warps": 4
        },
        "ms": 0.0228,
        "min_ms": 0.0231,
        "max_ms": 0.0227,
        "GB/s": 34.47,
        "TFLOPS": 23.53
    },
    {
        "params": {
            "M": 2048,
            "N": 1024,
            "K": 64,
            "block_m": 128,
            "block_n": 32,
            "block_k": 64,
            "dtype_str": "fp16",
            "num_warps": 4
        },
        "ms": 0.0238,
        "min_ms": 0.024,
        "max_ms": 0.0237,
        "GB/s": 33.08,
        "TFLOPS": 22.58
    },
    {
        "params": {
            "M": 2048,
            "N": 1024,
            "K": 64,
            "block_m": 128,
            "block_n": 64,
            "block_k": 64,
            "dtype_str": "fp16",
            "num_warps": 4
        },
        "ms": 0.0233,
        "min_ms": 0.0235,
        "max_ms": 0.0231,
        "GB/s": 33.82,
        "TFLOPS": 23.09
    },
    {
        "params": {
            "M": 64,
            "N": 64,
            "K": 128,
            "block_m": 16,
            "block_n": 16,
            "block_k": 128,
            "dtype_str": "fp16",
            "num_warps": 4
        },
        "ms": 0.0071,
        "min_ms": 0.0074,
        "max_ms": 0.0071,
        "GB/s": 9.18,
        "TFLOPS": 0.29
    },
    {
        "params": {
            "M": 64,
            "N": 64,
            "K": 128,
            "block_m": 16,
            "block_n": 32,
            "block_k": 128,
            "dtype_str": "fp16",
            "num_warps": 4
        },
        "ms": 0.0071,
        "min_ms": 0.0074,
        "max_ms": 0.007,
        "GB/s": 9.24,
        "TFLOPS": 0.3
    },
    {
        "params": {
            "M": 64,
            "N": 64,
            "K": 128,
            "block_m": 32,
            "block_n": 16,
            "block_k": 128,
            "dtype_str": "fp16",
            "num_warps": 4
        },
        "ms": 0.0076,
        "min_ms": 0.0077,
        "max_ms": 0.0075,
        "GB/s": 8.65,
        "TFLOPS": 0.28
    },
    {
        "params": {
            "M": 64,
            "N": 64,
            "K": 128,
            "block_m": 32,
            "block_n": 32,
            "block_k": 128,
            "dtype_str": "fp16",
            "num_warps": 4
        },
        "ms": 0.008,
        "min_ms": 0.0082,
        "max_ms": 0.0079,
        "GB/s": 8.17,
        "TFLOPS": 0.26
    },
    {
        "params": {
            "M": 64,
            "N": 64,
            "K": 128,
            "block_m": 64,
            "block_n": 16,
            "block_k": 128,
            "dtype_str": "fp16",
            "num_warps": 4
        },
        "ms": 0.0083,
        "min_ms": 0.0084,
        "max_ms": 0.0081,
        "GB/s": 7.94,
        "TFLOPS": 0.25
    },
    {
        "params": {
            "M": 64,
            "N": 64,
            "K": 128,
            "block_m": 64,
            "block_n": 32,
            "block_k": 128,
            "dtype_str": "fp16",
            "num_warps": 4
        },
        "ms": 0.0087,
        "min_ms": 0.0089,
        "max_ms": 0.0086,
        "GB/s": 7.5,
        "TFLOPS": 0.24
    },
    {
        "params": {
            "M": 64,
            "N": 128,
            "K": 128,
            "block_m": 16,
            "block_n": 16,
            "block_k": 128,
            "dtype_str": "fp16",
            "num_warps": 4
        },
        "ms": 0.0091,
        "min_ms": 0.0092,
        "max_ms": 0.009,
        "GB/s": 10.8,
        "TFLOPS": 0.46
    },
    {
        "params": {
            "M": 64,
            "N": 128,
            "K": 128,
            "block_m": 16,
            "block_n": 32,
            "block_k": 128,
            "dtype_str": "fp16",
            "num_warps": 4
        },
        "ms": 0.009,
        "min_ms": 0.0092,
        "max_ms": 0.009,
        "GB/s": 10.9,
        "TFLOPS": 0.46
    },
    {
        "params": {
            "M": 64,
            "N": 128,
            "K": 128,
            "block_m": 32,
            "block_n": 16,
            "block_k": 128,
            "dtype_str": "fp16",
            "num_warps": 4
        },
        "ms": 0.0094,
        "min_ms": 0.0096,
        "max_ms": 0.0093,
        "GB/s": 10.43,
        "TFLOPS": 0.45
    },
    {
        "params": {
            "M": 64,
            "N": 128,
            "K": 128,
            "block_m": 32,
            "block_n": 32,
            "block_k": 128,
            "dtype_str": "fp16",
            "num_warps": 4
        },
        "ms": 0.0099,
        "min_ms": 0.0101,
        "max_ms": 0.0099,
        "GB/s": 9.89,
        "TFLOPS": 0.42
    },
    {
        "params": {
            "M": 64,
            "N": 128,
            "K": 128,
            "block_m": 64,
            "block_n": 16,
            "block_k": 128,
            "dtype_str": "fp16",
            "num_warps": 4
        },
        "ms": 0.0101,
        "min_ms": 0.0103,
        "max_ms": 0.01,
        "GB/s": 9.73,
        "TFLOPS": 0.42
    },
    {
        "params": {
            "M": 64,
            "N": 128,
            "K": 128,
            "block_m": 64,
            "block_n": 32,
            "block_k": 128,
            "dtype_str": "fp16",
            "num_warps": 4
        },
        "ms": 0.0107,
        "min_ms": 0.0109,
        "max_ms": 0.0106,
        "GB/s": 9.18,
        "TFLOPS": 0.39
    },
    {
        "params": {
            "M": 64,
            "N": 256,
            "K": 128,
            "block_m": 16,
            "block_n": 16,
            "block_k": 128,
            "dtype_str": "fp16",
            "num_warps": 4
        },
        "ms": 0.0132,
        "min_ms": 0.0133,
        "max_ms": 0.0131,
        "GB/s": 12.46,
        "TFLOPS": 0.64
    },
    {
        "params": {
            "M": 64,
            "N": 256,
            "K": 128,
            "block_m": 16,
            "block_n": 32,
            "block_k": 128,
            "dtype_str": "fp16",
            "num_warps": 4
        },
        "ms": 0.013,
        "min_ms": 0.0131,
        "max_ms": 0.013,
        "GB/s": 12.57,
        "TFLOPS": 0.64
    },
    {
        "params": {
            "M": 64,
            "N": 256,
            "K": 128,
            "block_m": 32,
            "block_n": 16,
            "block_k": 128,
            "dtype_str": "fp16",
            "num_warps": 4
        },
        "ms": 0.0132,
        "min_ms": 0.0134,
        "max_ms": 0.0132,
        "GB/s": 12.38,
        "TFLOPS": 0.63
    },
    {
        "params": {
            "M": 64,
            "N": 256,
            "K": 128,
            "block_m": 32,
            "block_n": 32,
            "block_k": 128,
            "dtype_str": "fp16",
            "num_warps": 4
        },
        "ms": 0.0139,
        "min_ms": 0.014,
        "max_ms": 0.0138,
        "GB/s": 11.81,
        "TFLOPS": 0.6
    },
    {
        "params": {
            "M": 64,
            "N": 256,
            "K": 128,
            "block_m": 64,
            "block_n": 16,
            "block_k": 128,
            "dtype_str": "fp16",
            "num_warps": 4
        },
        "ms": 0.0142,
        "min_ms": 0.0144,
        "max_ms": 0.014,
        "GB/s": 11.58,
        "TFLOPS": 0.59
    },
    {
        "params": {
            "M": 64,
            "N": 256,
            "K": 128,
            "block_m": 64,
            "block_n": 32,
            "block_k": 128,
            "dtype_str": "fp16",
            "num_warps": 4
        },
        "ms": 0.0147,
        "min_ms": 0.0148,
        "max_ms": 0.0146,
        "GB/s": 11.17,
        "TFLOPS": 0.57
    },
    {
        "params": {
            "M": 128,
            "N": 64,
            "K": 128,
            "block_m": 16,
            "block_n": 16,
            "block_k": 128,
            "dtype_str": "fp16",
            "num_warps": 4
        },
        "ms": 0.0072,
        "min_ms": 0.0074,
        "max_ms": 0.0071,
        "GB/s": 13.7,
        "TFLOPS": 0.58
    },
    {
        "params": {
            "M": 128,
            "N": 64,
            "K": 128,
            "block_m": 16,
            "block_n": 32,
            "block_k": 128,
            "dtype_str": "fp16",
            "num_warps": 4
        },
        "ms": 0.0071,
        "min_ms": 0.0074,
        "max_ms": 0.007,
        "GB/s": 13.85,
        "TFLOPS": 0.59
    },
    {
        "params": {
            "M": 128,
            "N": 64,
            "K": 128,
            "block_m": 32,
            "block_n": 16,
            "block_k": 128,
            "dtype_str": "fp16",
            "num_warps": 4
        },
        "ms": 0.0075,
        "min_ms": 0.0077,
        "max_ms": 0.0075,
        "GB/s": 13.04,
        "TFLOPS": 0.56
    },
    {
        "params": {
            "M": 128,
            "N": 64,
            "K": 128,
            "block_m": 32,
            "block_n": 32,
            "block_k": 128,
            "dtype_str": "fp16",
            "num_warps": 4
        },
        "ms": 0.0081,
        "min_ms": 0.0083,
        "max_ms": 0.0079,
        "GB/s": 12.2,
        "TFLOPS": 0.52
    },
    {
        "params": {
            "M": 128,
            "N": 64,
            "K": 128,
            "block_m": 64,
            "block_n": 16,
            "block_k": 128,
            "dtype_str": "fp16",
            "num_warps": 4
        },
        "ms": 0.0082,
        "min_ms": 0.0083,
        "max_ms": 0.0081,
        "GB/s": 12.02,
        "TFLOPS": 0.51
    },
    {
        "params": {
            "M": 128,
            "N": 64,
            "K": 128,
            "block_m": 64,
            "block_n": 32,
            "block_k": 128,
            "dtype_str": "fp16",
            "num_warps": 4
        },
        "ms": 0.0087,
        "min_ms": 0.0089,
        "max_ms": 0.0086,
        "GB/s": 11.25,
        "TFLOPS": 0.48
    },
    {
        "params": {
            "M": 128,
            "N": 128,
            "K": 128,
            "block_m": 16,
            "block_n": 16,
            "block_k": 128,
            "dtype_str": "fp16",
            "num_warps": 4
        },
        "ms": 0.0091,
        "min_ms": 0.0093,
        "max_ms": 0.009,
        "GB/s": 14.34,
        "TFLOPS": 0.92
    },
    {
        "params": {
            "M": 128,
            "N": 128,
            "K": 128,
            "block_m": 16,
            "block_n": 32,
            "block_k": 128,
            "dtype_str": "fp16",
            "num_warps": 4
        },
        "ms": 0.009,
        "min_ms": 0.0092,
        "max_ms": 0.0089,
        "GB/s": 14.53,
        "TFLOPS": 0.93
    },
    {
        "params": {
            "M": 128,
            "N": 128,
            "K": 128,
            "block_m": 32,
            "block_n": 16,
            "block_k": 128,
            "dtype_str": "fp16",
            "num_warps": 4
        },
        "ms": 0.0095,
        "min_ms": 0.0096,
        "max_ms": 0.0094,
        "GB/s": 13.85,
        "TFLOPS": 0.89
    },
    {
        "params": {
            "M": 128,
            "N": 128,
            "K": 128,
            "block_m": 32,
            "block_n": 32,
            "block_k": 128,
            "dtype_str": "fp16",
            "num_warps": 4
        },
        "ms": 0.01,
        "min_ms": 0.0102,
        "max_ms": 0.0099,
        "GB/s": 13.08,
        "TFLOPS": 0.84
    },
    {
        "params": {
            "M": 128,
            "N": 128,
            "K": 128,
            "block_m": 64,
            "block_n": 16,
            "block_k": 128,
            "dtype_str": "fp16",
            "num_warps": 4
        },
        "ms": 0.0101,
        "min_ms": 0.0103,
        "max_ms": 0.01,
        "GB/s": 12.97,
        "TFLOPS": 0.83
    },
    {
        "params": {
            "M": 128,
            "N": 128,
            "K": 128,
            "block_m": 64,
            "block_n": 32,
            "block_k": 128,
            "dtype_str": "fp16",
            "num_warps": 4
        },
        "ms": 0.0107,
        "min_ms": 0.0109,
        "max_ms": 0.0106,
        "GB/s": 12.24,
        "TFLOPS": 0.78
    },
    {
        "params": {
            "M": 128,
            "N": 256,
            "K": 128,
            "block_m": 16,
            "block_n": 16,
            "block_k": 128,
            "dtype_str": "fp16",
            "num_warps": 4
        },
        "ms": 0.0132,
        "min_ms": 0.0133,
        "max_ms": 0.0131,
        "GB/s": 14.95,
        "TFLOPS": 1.28
    },
    {
        "params": {
            "M": 128,
            "N": 256,
            "K": 128,
            "block_m": 16,
            "block_n": 32,
            "block_k": 128,
            "dtype_str": "fp16",
            "num_warps": 4
        },
        "ms": 0.013,
        "min_ms": 0.0133,
        "max_ms": 0.0129,
        "GB/s": 15.09,
        "TFLOPS": 1.29
    },
    {
        "params": {
            "M": 128,
            "N": 256,
            "K": 128,
            "block_m": 32,
            "block_n": 16,
            "block_k": 128,
            "dtype_str": "fp16",
            "num_warps": 4
        },
        "ms": 0.0132,
        "min_ms": 0.0134,
        "max_ms": 0.0132,
        "GB/s": 14.86,
        "TFLOPS": 1.27
    },
    {
        "params": {
            "M": 128,
            "N": 256,
            "K": 128,
            "block_m": 32,
            "block_n": 32,
            "block_k": 128,
            "dtype_str": "fp16",
            "num_warps": 4
        },
        "ms": 0.014,
        "min_ms": 0.0141,
        "max_ms": 0.0138,
        "GB/s": 14.09,
        "TFLOPS": 1.2
    },
    {
        "params": {
            "M": 128,
            "N": 256,
            "K": 128,
            "block_m": 64,
            "block_n": 16,
            "block_k": 128,
            "dtype_str": "fp16",
            "num_warps": 4
        },
        "ms": 0.0139,
        "min_ms": 0.014,
        "max_ms": 0.0138,
        "GB/s": 14.17,
        "TFLOPS": 1.21
    },
    {
        "params": {
            "M": 128,
            "N": 256,
            "K": 128,
            "block_m": 64,
            "block_n": 32,
            "block_k": 128,
            "dtype_str": "fp16",
            "num_warps": 4
        },
        "ms": 0.0146,
        "min_ms": 0.0148,
        "max_ms": 0.0145,
        "GB/s": 13.44,
        "TFLOPS": 1.15
    },
    {
        "params": {
            "M": 256,
            "N": 64,
            "K": 128,
            "block_m": 16,
            "block_n": 16,
            "block_k": 128,
            "dtype_str": "fp16",
            "num_warps": 4
        },
        "ms": 0.0072,
        "min_ms": 0.0075,
        "max_ms": 0.0071,
        "GB/s": 22.83,
        "TFLOPS": 1.17
    },
    {
        "params": {
            "M": 256,
            "N": 64,
            "K": 128,
            "block_m": 16,
            "block_n": 32,
            "block_k": 128,
            "dtype_str": "fp16",
            "num_warps": 4
        },
        "ms": 0.0071,
        "min_ms": 0.0074,
        "max_ms": 0.0071,
        "GB/s": 22.96,
        "TFLOPS": 1.18
    },
    {
        "params": {
            "M": 256,
            "N": 64,
            "K": 128,
            "block_m": 32,
            "block_n": 16,
            "block_k": 128,
            "dtype_str": "fp16",
            "num_warps": 4
        },
        "ms": 0.0077,
        "min_ms": 0.0079,
        "max_ms": 0.0076,
        "GB/s": 21.28,
        "TFLOPS": 1.09
    },
    {
        "params": {
            "M": 256,
            "N": 64,
            "K": 128,
            "block_m": 32,
            "block_n": 32,
            "block_k": 128,
            "dtype_str": "fp16",
            "num_warps": 4
        },
        "ms": 0.0082,
        "min_ms": 0.0084,
        "max_ms": 0.0081,
        "GB/s": 20.03,
        "TFLOPS": 1.03
    },
    {
        "params": {
            "M": 256,
            "N": 64,
            "K": 128,
            "block_m": 64,
            "block_n": 16,
            "block_k": 128,
            "dtype_str": "fp16",
            "num_warps": 4
        },
        "ms": 0.0083,
        "min_ms": 0.0084,
        "max_ms": 0.0082,
        "GB/s": 19.84,
        "TFLOPS": 1.02
    },
    {
        "params": {
            "M": 256,
            "N": 64,
            "K": 128,
            "block_m": 64,
            "block_n": 32,
            "block_k": 128,
            "dtype_str": "fp16",
            "num_warps": 4
        },
        "ms": 0.0088,
        "min_ms": 0.009,
        "max_ms": 0.0087,
        "GB/s": 18.66,
        "TFLOPS": 0.96
    },
    {
        "params": {
            "M": 256,
            "N": 128,
            "K": 128,
            "block_m": 16,
            "block_n": 16,
            "block_k": 128,
            "dtype_str": "fp16",
            "num_warps": 4
        },
        "ms": 0.0092,
        "min_ms": 0.0093,
        "max_ms": 0.0091,
        "GB/s": 21.41,
        "TFLOPS": 1.83
    },
    {
        "params": {
            "M": 256,
            "N": 128,
            "K": 128,
            "block_m": 16,
            "block_n": 32,
            "block_k": 128,
            "dtype_str": "fp16",
            "num_warps": 4
        },
        "ms": 0.0091,
        "min_ms": 0.0093,
        "max_ms": 0.009,
        "GB/s": 21.61,
        "TFLOPS": 1.84
    },
    {
        "params": {
            "M": 256,
            "N": 128,
            "K": 128,
            "block_m": 32,
            "block_n": 16,
            "block_k": 128,
            "dtype_str": "fp16",
            "num_warps": 4
        },
        "ms": 0.0095,
        "min_ms": 0.0097,
        "max_ms": 0.0094,
        "GB/s": 20.6,
        "TFLOPS": 1.76
    },
    {
        "params": {
            "M": 256,
            "N": 128,
            "K": 128,
            "block_m": 32,
            "block_n": 32,
            "block_k": 128,
            "dtype_str": "fp16",
            "num_warps": 4
        },
        "ms": 0.0101,
        "min_ms": 0.0103,
        "max_ms": 0.01,
        "GB/s": 19.54,
        "TFLOPS": 1.67
    },
    {
        "params": {
            "M": 256,
            "N": 128,
            "K": 128,
            "block_m": 64,
            "block_n": 16,
            "block_k": 128,
            "dtype_str": "fp16",
            "num_warps": 4
        },
        "ms": 0.0101,
        "min_ms": 0.0103,
        "max_ms": 0.0101,
        "GB/s": 19.38,
        "TFLOPS": 1.65
    },
    {
        "params": {
            "M": 256,
            "N": 128,
            "K": 128,
            "block_m": 64,
            "block_n": 32,
            "block_k": 128,
            "dtype_str": "fp16",
            "num_warps": 4
        },
        "ms": 0.0107,
        "min_ms": 0.0109,
        "max_ms": 0.0106,
        "GB/s": 18.37,
        "TFLOPS": 1.57
    },
    {
        "params": {
            "M": 256,
            "N": 256,
            "K": 128,
            "block_m": 16,
            "block_n": 16,
            "block_k": 128,
            "dtype_str": "fp16",
            "num_warps": 4
        },
        "ms": 0.0132,
        "min_ms": 0.0134,
        "max_ms": 0.0132,
        "GB/s": 19.87,
        "TFLOPS": 2.54
    },
    {
        "params": {
            "M": 256,
            "N": 256,
            "K": 128,
            "block_m": 16,
            "block_n": 32,
            "block_k": 128,
            "dtype_str": "fp16",
            "num_warps": 4
        },
        "ms": 0.0131,
        "min_ms": 0.0132,
        "max_ms": 0.013,
        "GB/s": 20.06,
        "TFLOPS": 2.57
    },
    {
        "params": {
            "M": 256,
            "N": 256,
            "K": 128,
            "block_m": 32,
            "block_n": 16,
            "block_k": 128,
            "dtype_str": "fp16",
            "num_warps": 4
        },
        "ms": 0.0133,
        "min_ms": 0.0135,
        "max_ms": 0.0132,
        "GB/s": 19.69,
        "TFLOPS": 2.52
    },
    {
        "params": {
            "M": 256,
            "N": 256,
            "K": 128,
            "block_m": 32,
            "block_n": 32,
            "block_k": 128,
            "dtype_str": "fp16",
            "num_warps": 4
        },
        "ms": 0.014,
        "min_ms": 0.0142,
        "max_ms": 0.0139,
        "GB/s": 18.68,
        "TFLOPS": 2.39
    },
    {
        "params": {
            "M": 256,
            "N": 256,
            "K": 128,
            "block_m": 64,
            "block_n": 16,
            "block_k": 128,
            "dtype_str": "fp16",
            "num_warps": 4
        },
        "ms": 0.0139,
        "min_ms": 0.014,
        "max_ms": 0.0138,
        "GB/s": 18.84,
        "TFLOPS": 2.41
    },
    {
        "params": {
            "M": 256,
            "N": 256,
            "K": 128,
            "block_m": 64,
            "block_n": 32,
            "block_k": 128,
            "dtype_str": "fp16",
            "num_warps": 4
        },
        "ms": 0.0147,
        "min_ms": 0.0148,
        "max_ms": 0.0146,
        "GB/s": 17.82,
        "TFLOPS": 2.28
    },
    {
        "params": {
            "M": 512,
            "N": 64,
            "K": 128,
            "block_m": 16,
            "block_n": 16,
            "block_k": 128,
            "dtype_str": "fp16",
            "num_warps": 4
        },
        "ms": 0.0072,
        "min_ms": 0.0075,
        "max_ms": 0.0071,
        "GB/s": 41.09,
        "TFLOPS": 2.34
    },
    {
        "params": {
            "M": 512,
            "N": 64,
            "K": 128,
            "block_m": 16,
            "block_n": 32,
            "block_k": 128,
            "dtype_str": "fp16",
            "num_warps": 4
        },
        "ms": 0.0072,
        "min_ms": 0.0074,
        "max_ms": 0.0071,
        "GB/s": 41.09,
        "TFLOPS": 2.34
    },
    {
        "params": {
            "M": 512,
            "N": 64,
            "K": 128,
            "block_m": 32,
            "block_n": 16,
            "block_k": 128,
            "dtype_str": "fp16",
            "num_warps": 4
        },
        "ms": 0.0077,
        "min_ms": 0.0079,
        "max_ms": 0.0077,
        "GB/s": 38.11,
        "TFLOPS": 2.17
    },
    {
        "params": {
            "M": 512,
            "N": 64,
            "K": 128,
            "block_m": 32,
            "block_n": 32,
            "block_k": 128,
            "dtype_str": "fp16",
            "num_warps": 4
        },
        "ms": 0.0082,
        "min_ms": 0.0083,
        "max_ms": 0.0081,
        "GB/s": 36.06,
        "TFLOPS": 2.05
    },
    {
        "params": {
            "M": 512,
            "N": 64,
            "K": 128,
            "block_m": 64,
            "block_n": 16,
            "block_k": 128,
            "dtype_str": "fp16",
            "num_warps": 4
        },
        "ms": 0.0083,
        "min_ms": 0.0085,
        "max_ms": 0.0082,
        "GB/s": 35.37,
        "TFLOPS": 2.01
    },
    {
        "params": {
            "M": 512,
            "N": 64,
            "K": 128,
            "block_m": 64,
            "block_n": 32,
            "block_k": 128,
            "dtype_str": "fp16",
            "num_warps": 4
        },
        "ms": 0.0089,
        "min_ms": 0.0091,
        "max_ms": 0.0088,
        "GB/s": 33.28,
        "TFLOPS": 1.89
    },
    {
        "params": {
            "M": 512,
            "N": 128,
            "K": 128,
            "block_m": 16,
            "block_n": 16,
            "block_k": 128,
            "dtype_str": "fp16",
            "num_warps": 4
        },
        "ms": 0.0092,
        "min_ms": 0.0094,
        "max_ms": 0.0091,
        "GB/s": 35.54,
        "TFLOPS": 3.64
    },
    {
        "params": {
            "M": 512,
            "N": 128,
            "K": 128,
            "block_m": 16,
            "block_n": 32,
            "block_k": 128,
            "dtype_str": "fp16",
            "num_warps": 4
        },
        "ms": 0.0091,
        "min_ms": 0.0093,
        "max_ms": 0.0091,
        "GB/s": 35.85,
        "TFLOPS": 3.67
    },
    {
        "params": {
            "M": 512,
            "N": 128,
            "K": 128,
            "block_m": 32,
            "block_n": 16,
            "block_k": 128,
            "dtype_str": "fp16",
            "num_warps": 4
        },
        "ms": 0.0096,
        "min_ms": 0.0098,
        "max_ms": 0.0095,
        "GB/s": 34.06,
        "TFLOPS": 3.49
    },
    {
        "params": {
            "M": 512,
            "N": 128,
            "K": 128,
            "block_m": 32,
            "block_n": 32,
            "block_k": 128,
            "dtype_str": "fp16",
            "num_warps": 4
        },
        "ms": 0.0102,
        "min_ms": 0.0104,
        "max_ms": 0.0101,
        "GB/s": 32.18,
        "TFLOPS": 3.3
    },
    {
        "params": {
            "M": 512,
            "N": 128,
            "K": 128,
            "block_m": 64,
            "block_n": 16,
            "block_k": 128,
            "dtype_str": "fp16",
            "num_warps": 4
        },
        "ms": 0.0102,
        "min_ms": 0.0104,
        "max_ms": 0.0101,
        "GB/s": 32.05,
        "TFLOPS": 3.28
    },
    {
        "params": {
            "M": 512,
            "N": 128,
            "K": 128,
            "block_m": 64,
            "block_n": 32,
            "block_k": 128,
            "dtype_str": "fp16",
            "num_warps": 4
        },
        "ms": 0.0109,
        "min_ms": 0.011,
        "max_ms": 0.0107,
        "GB/s": 30.16,
        "TFLOPS": 3.09
    },
    {
        "params": {
            "M": 512,
            "N": 256,
            "K": 128,
            "block_m": 16,
            "block_n": 16,
            "block_k": 128,
            "dtype_str": "fp16",
            "num_warps": 4
        },
        "ms": 0.0132,
        "min_ms": 0.0133,
        "max_ms": 0.0131,
        "GB/s": 29.9,
        "TFLOPS": 5.1
    },
    {
        "params": {
            "M": 512,
            "N": 256,
            "K": 128,
            "block_m": 16,
            "block_n": 32,
            "block_k": 128,
            "dtype_str": "fp16",
            "num_warps": 4
        },
        "ms": 0.0131,
        "min_ms": 0.0132,
        "max_ms": 0.013,
        "GB/s": 30.09,
        "TFLOPS": 5.13
    },
    {
        "params": {
            "M": 512,
            "N": 256,
            "K": 128,
            "block_m": 32,
            "block_n": 16,
            "block_k": 128,
            "dtype_str": "fp16",
            "num_warps": 4
        },
        "ms": 0.0134,
        "min_ms": 0.0135,
        "max_ms": 0.0133,
        "GB/s": 29.45,
        "TFLOPS": 5.03
    },
    {
        "params": {
            "M": 512,
            "N": 256,
            "K": 128,
            "block_m": 32,
            "block_n": 32,
            "block_k": 128,
            "dtype_str": "fp16",
            "num_warps": 4
        },
        "ms": 0.0141,
        "min_ms": 0.0143,
        "max_ms": 0.014,
        "GB/s": 27.94,
        "TFLOPS": 4.77
    },
    {
        "params": {
            "M": 512,
            "N": 256,
            "K": 128,
            "block_m": 64,
            "block_n": 16,
            "block_k": 128,
            "dtype_str": "fp16",
            "num_warps": 4
        },
        "ms": 0.014,
        "min_ms": 0.0142,
        "max_ms": 0.0139,
        "GB/s": 28.1,
        "TFLOPS": 4.8
    },
    {
        "params": {
            "M": 512,
            "N": 256,
            "K": 128,
            "block_m": 64,
            "block_n": 32,
            "block_k": 128,
            "dtype_str": "fp16",
            "num_warps": 4
        },
        "ms": 0.0148,
        "min_ms": 0.0149,
        "max_ms": 0.0147,
        "GB/s": 26.65,
        "TFLOPS": 4.55
    }
]