geak_eval/evaluators/data/ROCm/data/performance/golden_results/kernel_dot_triton_perf.json
[
    {
        "params": {
            "DIM": 16,
            "dtype_str": "fp32",
            "num_warps": 1
        },
        "ms": 0.0063,
        "min_ms": 0.0068,
        "max_ms": 0.0062,
        "GB/s": 0.49,
        "TFLOPS": 0.0
    },
    {
        "params": {
            "DIM": 16,
            "dtype_str": "fp16",
            "num_warps": 1
        },
        "ms": 0.0063,
        "min_ms": 0.0067,
        "max_ms": 0.0062,
        "GB/s": 0.24,
        "TFLOPS": 0.0
    },
    {
        "params": {
            "DIM": 16,
            "dtype_str": "fp32",
            "num_warps": 2
        },
        "ms": 0.0063,
        "min_ms": 0.0066,
        "max_ms": 0.0062,
        "GB/s": 0.49,
        "TFLOPS": 0.0
    },
    {
        "params": {
            "DIM": 16,
            "dtype_str": "fp16",
            "num_warps": 2
        },
        "ms": 0.0063,
        "min_ms": 0.0067,
        "max_ms": 0.0062,
        "GB/s": 0.24,
        "TFLOPS": 0.0
    },
    {
        "params": {
            "DIM": 16,
            "dtype_str": "fp32",
            "num_warps": 4
        },
        "ms": 0.0063,
        "min_ms": 0.0067,
        "max_ms": 0.0062,
        "GB/s": 0.49,
        "TFLOPS": 0.0
    },
    {
        "params": {
            "DIM": 16,
            "dtype_str": "fp16",
            "num_warps": 4
        },
        "ms": 0.0063,
        "min_ms": 0.0067,
        "max_ms": 0.0062,
        "GB/s": 0.24,
        "TFLOPS": 0.0
    }
]