tb_eval/data/ROCm/data/performance/golden_results/.ipynb_checkpoints/triton_swizzle2d_perf-checkpoint.json
[
    {
        "params": {
            "size_i_kernel": 32,
            "size_j_kernel": 32,
            "size_g_kernel": 4,
            "output_dtype_str": "int32",
            "num_warps": 4
        },
        "ms": 0.1746,
        "min_ms": 0.1747,
        "max_ms": 0.1745,
        "GB/s": 0.02,
        "TFLOPS": 0.0
    },
    {
        "params": {
            "size_i_kernel": 64,
            "size_j_kernel": 64,
            "size_g_kernel": 8,
            "output_dtype_str": "int32",
            "num_warps": 4
        },
        "ms": 0.6855,
        "min_ms": 0.6857,
        "max_ms": 0.6854,
        "GB/s": 0.02,
        "TFLOPS": 0.0
    },
    {
        "params": {
            "size_i_kernel": 128,
            "size_j_kernel": 128,
            "size_g_kernel": 16,
            "output_dtype_str": "int32",
            "num_warps": 4
        },
        "ms": 2.7261,
        "min_ms": 2.7265,
        "max_ms": 2.7257,
        "GB/s": 0.02,
        "TFLOPS": 0.0
    },
    {
        "params": {
            "size_i_kernel": 256,
            "size_j_kernel": 256,
            "size_g_kernel": 16,
            "output_dtype_str": "int32",
            "num_warps": 4
        },
        "ms": 10.8833,
        "min_ms": 10.8849,
        "max_ms": 10.8816,
        "GB/s": 0.02,
        "TFLOPS": 0.0
    },
    {
        "params": {
            "size_i_kernel": 256,
            "size_j_kernel": 256,
            "size_g_kernel": 32,
            "output_dtype_str": "int32",
            "num_warps": 4
        },
        "ms": 10.883,
        "min_ms": 10.8848,
        "max_ms": 10.8819,
        "GB/s": 0.02,
        "TFLOPS": 0.0
    },
    {
        "params": {
            "size_i_kernel": 512,
            "size_j_kernel": 512,
            "size_g_kernel": 32,
            "output_dtype_str": "int32",
            "num_warps": 4
        },
        "ms": 43.5107,
        "min_ms": 43.5112,
        "max_ms": 43.5104,
        "GB/s": 0.02,
        "TFLOPS": 0.0
    },
    {
        "params": {
            "size_i_kernel": 512,
            "size_j_kernel": 64,
            "size_g_kernel": 8,
            "output_dtype_str": "int32",
            "num_warps": 4
        },
        "ms": 5.4581,
        "min_ms": 5.459,
        "max_ms": 5.4571,
        "GB/s": 0.02,
        "TFLOPS": 0.0
    },
    {
        "params": {
            "size_i_kernel": 64,
            "size_j_kernel": 512,
            "size_g_kernel": 8,
            "output_dtype_str": "int32",
            "num_warps": 4
        },
        "ms": 5.441,
        "min_ms": 5.4419,
        "max_ms": 5.44,
        "GB/s": 0.02,
        "TFLOPS": 0.0
    },
    {
        "params": {
            "size_i_kernel": 32,
            "size_j_kernel": 32,
            "size_g_kernel": 4,
            "output_dtype_str": "int64",
            "num_warps": 4
        },
        "ms": 0.1706,
        "min_ms": 0.1708,
        "max_ms": 0.1706,
        "GB/s": 0.05,
        "TFLOPS": 0.0
    },
    {
        "params": {
            "size_i_kernel": 64,
            "size_j_kernel": 64,
            "size_g_kernel": 8,
            "output_dtype_str": "int64",
            "num_warps": 4
        },
        "ms": 0.6698,
        "min_ms": 0.67,
        "max_ms": 0.6697,
        "GB/s": 0.05,
        "TFLOPS": 0.0
    },
    {
        "params": {
            "size_i_kernel": 128,
            "size_j_kernel": 128,
            "size_g_kernel": 16,
            "output_dtype_str": "int64",
            "num_warps": 4
        },
        "ms": 2.6633,
        "min_ms": 2.664,
        "max_ms": 2.6626,
        "GB/s": 0.05,
        "TFLOPS": 0.0
    },
    {
        "params": {
            "size_i_kernel": 256,
            "size_j_kernel": 256,
            "size_g_kernel": 16,
            "output_dtype_str": "int64",
            "num_warps": 4
        },
        "ms": 10.6343,
        "min_ms": 10.6359,
        "max_ms": 10.6327,
        "GB/s": 0.05,
        "TFLOPS": 0.0
    },
    {
        "params": {
            "size_i_kernel": 256,
            "size_j_kernel": 256,
            "size_g_kernel": 32,
            "output_dtype_str": "int64",
            "num_warps": 4
        },
        "ms": 10.636,
        "min_ms": 10.6372,
        "max_ms": 10.6348,
        "GB/s": 0.05,
        "TFLOPS": 0.0
    },
    {
        "params": {
            "size_i_kernel": 512,
            "size_j_kernel": 512,
            "size_g_kernel": 32,
            "output_dtype_str": "int64",
            "num_warps": 4
        },
        "ms": 42.5073,
        "min_ms": 42.5103,
        "max_ms": 42.5064,
        "GB/s": 0.05,
        "TFLOPS": 0.0
    },
    {
        "params": {
            "size_i_kernel": 512,
            "size_j_kernel": 64,
            "size_g_kernel": 8,
            "output_dtype_str": "int64",
            "num_warps": 4
        },
        "ms": 5.3343,
        "min_ms": 5.335,
        "max_ms": 5.3334,
        "GB/s": 0.05,
        "TFLOPS": 0.0
    },
    {
        "params": {
            "size_i_kernel": 64,
            "size_j_kernel": 512,
            "size_g_kernel": 8,
            "output_dtype_str": "int64",
            "num_warps": 4
        },
        "ms": 5.3165,
        "min_ms": 5.3173,
        "max_ms": 5.3156,
        "GB/s": 0.05,
        "TFLOPS": 0.0
    }
]