tb_eval/data/ROCm/data/performance/golden_results/.ipynb_checkpoints/triton_sort_perf-checkpoint.json
[
    {
        "params": {
            "N_tile_rows": 1,
            "M_tile_cols": 1024,
            "descending": false,
            "dtype_str": "int32",
            "num_warps": 4
        },
        "ms": 0.012,
        "min_ms": 0.0122,
        "max_ms": 0.0119,
        "GB/s": 0.68,
        "TFLOPS": 0.0
    },
    {
        "params": {
            "N_tile_rows": 1,
            "M_tile_cols": 4096,
            "descending": false,
            "dtype_str": "int32",
            "num_warps": 4
        },
        "ms": 0.0631,
        "min_ms": 0.0636,
        "max_ms": 0.0627,
        "GB/s": 0.52,
        "TFLOPS": 0.0
    },
    {
        "params": {
            "N_tile_rows": 1,
            "M_tile_cols": 8192,
            "descending": false,
            "dtype_str": "int32",
            "num_warps": 4
        },
        "ms": 0.1466,
        "min_ms": 0.1473,
        "max_ms": 0.1459,
        "GB/s": 0.45,
        "TFLOPS": 0.0
    },
    {
        "params": {
            "N_tile_rows": 1,
            "M_tile_cols": 16384,
            "descending": false,
            "dtype_str": "int32",
            "num_warps": 4
        },
        "ms": 0.3304,
        "min_ms": 0.3317,
        "max_ms": 0.3293,
        "GB/s": 0.4,
        "TFLOPS": 0.0
    },
    {
        "params": {
            "N_tile_rows": 8,
            "M_tile_cols": 512,
            "descending": false,
            "dtype_str": "int32",
            "num_warps": 4
        },
        "ms": 0.0231,
        "min_ms": 0.0233,
        "max_ms": 0.0229,
        "GB/s": 1.42,
        "TFLOPS": 0.0
    },
    {
        "params": {
            "N_tile_rows": 8,
            "M_tile_cols": 1024,
            "descending": false,
            "dtype_str": "int32",
            "num_warps": 4
        },
        "ms": 0.0753,
        "min_ms": 0.0759,
        "max_ms": 0.0747,
        "GB/s": 0.87,
        "TFLOPS": 0.0
    },
    {
        "params": {
            "N_tile_rows": 8,
            "M_tile_cols": 2048,
            "descending": false,
            "dtype_str": "int32",
            "num_warps": 4
        },
        "ms": 0.1908,
        "min_ms": 0.1916,
        "max_ms": 0.1901,
        "GB/s": 0.69,
        "TFLOPS": 0.0
    },
    {
        "params": {
            "N_tile_rows": 64,
            "M_tile_cols": 128,
            "descending": false,
            "dtype_str": "int32",
            "num_warps": 4
        },
        "ms": 0.0233,
        "min_ms": 0.0236,
        "max_ms": 0.0232,
        "GB/s": 2.81,
        "TFLOPS": 0.0
    },
    {
        "params": {
            "N_tile_rows": 64,
            "M_tile_cols": 256,
            "descending": false,
            "dtype_str": "int32",
            "num_warps": 4
        },
        "ms": 0.0702,
        "min_ms": 0.0706,
        "max_ms": 0.0697,
        "GB/s": 1.87,
        "TFLOPS": 0.0
    },
    {
        "params": {
            "N_tile_rows": 256,
            "M_tile_cols": 64,
            "descending": false,
            "dtype_str": "int32",
            "num_warps": 4
        },
        "ms": 0.0321,
        "min_ms": 0.0323,
        "max_ms": 0.0319,
        "GB/s": 4.09,
        "TFLOPS": 0.0
    },
    {
        "params": {
            "N_tile_rows": 256,
            "M_tile_cols": 128,
            "descending": false,
            "dtype_str": "int32",
            "num_warps": 4
        },
        "ms": 0.0986,
        "min_ms": 0.0993,
        "max_ms": 0.098,
        "GB/s": 2.66,
        "TFLOPS": 0.0
    },
    {
        "params": {
            "N_tile_rows": 256,
            "M_tile_cols": 256,
            "descending": false,
            "dtype_str": "int32",
            "num_warps": 4
        },
        "ms": 0.2756,
        "min_ms": 0.2766,
        "max_ms": 0.2746,
        "GB/s": 1.9,
        "TFLOPS": 0.0
    },
    {
        "params": {
            "N_tile_rows": 1,
            "M_tile_cols": 1024,
            "descending": true,
            "dtype_str": "int32",
            "num_warps": 4
        },
        "ms": 0.0121,
        "min_ms": 0.0122,
        "max_ms": 0.012,
        "GB/s": 0.68,
        "TFLOPS": 0.0
    },
    {
        "params": {
            "N_tile_rows": 1,
            "M_tile_cols": 4096,
            "descending": true,
            "dtype_str": "int32",
            "num_warps": 4
        },
        "ms": 0.0626,
        "min_ms": 0.063,
        "max_ms": 0.0622,
        "GB/s": 0.52,
        "TFLOPS": 0.0
    },
    {
        "params": {
            "N_tile_rows": 1,
            "M_tile_cols": 8192,
            "descending": true,
            "dtype_str": "int32",
            "num_warps": 4
        },
        "ms": 0.1461,
        "min_ms": 0.1469,
        "max_ms": 0.1455,
        "GB/s": 0.45,
        "TFLOPS": 0.0
    },
    {
        "params": {
            "N_tile_rows": 1,
            "M_tile_cols": 16384,
            "descending": true,
            "dtype_str": "int32",
            "num_warps": 4
        },
        "ms": 0.3307,
        "min_ms": 0.3316,
        "max_ms": 0.3297,
        "GB/s": 0.4,
        "TFLOPS": 0.0
    },
    {
        "params": {
            "N_tile_rows": 8,
            "M_tile_cols": 512,
            "descending": true,
            "dtype_str": "int32",
            "num_warps": 4
        },
        "ms": 0.0231,
        "min_ms": 0.0233,
        "max_ms": 0.0229,
        "GB/s": 1.42,
        "TFLOPS": 0.0
    },
    {
        "params": {
            "N_tile_rows": 8,
            "M_tile_cols": 1024,
            "descending": true,
            "dtype_str": "int32",
            "num_warps": 4
        },
        "ms": 0.0749,
        "min_ms": 0.0753,
        "max_ms": 0.0744,
        "GB/s": 0.88,
        "TFLOPS": 0.0
    },
    {
        "params": {
            "N_tile_rows": 8,
            "M_tile_cols": 2048,
            "descending": true,
            "dtype_str": "int32",
            "num_warps": 4
        },
        "ms": 0.1907,
        "min_ms": 0.1915,
        "max_ms": 0.1899,
        "GB/s": 0.69,
        "TFLOPS": 0.0
    },
    {
        "params": {
            "N_tile_rows": 64,
            "M_tile_cols": 128,
            "descending": true,
            "dtype_str": "int32",
            "num_warps": 4
        },
        "ms": 0.0234,
        "min_ms": 0.0236,
        "max_ms": 0.0232,
        "GB/s": 2.8,
        "TFLOPS": 0.0
    },
    {
        "params": {
            "N_tile_rows": 64,
            "M_tile_cols": 256,
            "descending": true,
            "dtype_str": "int32",
            "num_warps": 4
        },
        "ms": 0.0698,
        "min_ms": 0.0702,
        "max_ms": 0.0694,
        "GB/s": 1.88,
        "TFLOPS": 0.0
    },
    {
        "params": {
            "N_tile_rows": 256,
            "M_tile_cols": 64,
            "descending": true,
            "dtype_str": "int32",
            "num_warps": 4
        },
        "ms": 0.0321,
        "min_ms": 0.0324,
        "max_ms": 0.032,
        "GB/s": 4.08,
        "TFLOPS": 0.0
    },
    {
        "params": {
            "N_tile_rows": 256,
            "M_tile_cols": 128,
            "descending": true,
            "dtype_str": "int32",
            "num_warps": 4
        },
        "ms": 0.0987,
        "min_ms": 0.0993,
        "max_ms": 0.0981,
        "GB/s": 2.66,
        "TFLOPS": 0.0
    },
    {
        "params": {
            "N_tile_rows": 256,
            "M_tile_cols": 256,
            "descending": true,
            "dtype_str": "int32",
            "num_warps": 4
        },
        "ms": 0.276,
        "min_ms": 0.2769,
        "max_ms": 0.2751,
        "GB/s": 1.9,
        "TFLOPS": 0.0
    },
    {
        "params": {
            "N_tile_rows": 1,
            "M_tile_cols": 1024,
            "descending": false,
            "dtype_str": "float16",
            "num_warps": 4
        },
        "ms": 0.0116,
        "min_ms": 0.0118,
        "max_ms": 0.0115,
        "GB/s": 0.35,
        "TFLOPS": 0.0
    },
    {
        "params": {
            "N_tile_rows": 1,
            "M_tile_cols": 4096,
            "descending": false,
            "dtype_str": "float16",
            "num_warps": 4
        },
        "ms": 0.0582,
        "min_ms": 0.0587,
        "max_ms": 0.0578,
        "GB/s": 0.28,
        "TFLOPS": 0.0
    },
    {
        "params": {
            "N_tile_rows": 1,
            "M_tile_cols": 8192,
            "descending": false,
            "dtype_str": "float16",
            "num_warps": 4
        },
        "ms": 0.1396,
        "min_ms": 0.1402,
        "max_ms": 0.1391,
        "GB/s": 0.23,
        "TFLOPS": 0.0
    },
    {
        "params": {
            "N_tile_rows": 1,
            "M_tile_cols": 16384,
            "descending": false,
            "dtype_str": "float16",
            "num_warps": 4
        },
        "ms": 0.3198,
        "min_ms": 0.3211,
        "max_ms": 0.3189,
        "GB/s": 0.2,
        "TFLOPS": 0.0
    },
    {
        "params": {
            "N_tile_rows": 8,
            "M_tile_cols": 512,
            "descending": false,
            "dtype_str": "float16",
            "num_warps": 4
        },
        "ms": 0.019,
        "min_ms": 0.0192,
        "max_ms": 0.0189,
        "GB/s": 0.86,
        "TFLOPS": 0.0
    },
    {
        "params": {
            "N_tile_rows": 8,
            "M_tile_cols": 1024,
            "descending": false,
            "dtype_str": "float16",
            "num_warps": 4
        },
        "ms": 0.061,
        "min_ms": 0.0616,
        "max_ms": 0.0605,
        "GB/s": 0.54,
        "TFLOPS": 0.0
    },
    {
        "params": {
            "N_tile_rows": 8,
            "M_tile_cols": 2048,
            "descending": false,
            "dtype_str": "float16",
            "num_warps": 4
        },
        "ms": 0.1685,
        "min_ms": 0.1695,
        "max_ms": 0.1675,
        "GB/s": 0.39,
        "TFLOPS": 0.0
    },
    {
        "params": {
            "N_tile_rows": 64,
            "M_tile_cols": 128,
            "descending": false,
            "dtype_str": "float16",
            "num_warps": 4
        },
        "ms": 0.02,
        "min_ms": 0.0202,
        "max_ms": 0.0199,
        "GB/s": 1.64,
        "TFLOPS": 0.0
    },
    {
        "params": {
            "N_tile_rows": 64,
            "M_tile_cols": 256,
            "descending": false,
            "dtype_str": "float16",
            "num_warps": 4
        },
        "ms": 0.0634,
        "min_ms": 0.064,
        "max_ms": 0.0628,
        "GB/s": 1.03,
        "TFLOPS": 0.0
    },
    {
        "params": {
            "N_tile_rows": 256,
            "M_tile_cols": 64,
            "descending": false,
            "dtype_str": "float16",
            "num_warps": 4
        },
        "ms": 0.0251,
        "min_ms": 0.0253,
        "max_ms": 0.0249,
        "GB/s": 2.61,
        "TFLOPS": 0.0
    },
    {
        "params": {
            "N_tile_rows": 256,
            "M_tile_cols": 128,
            "descending": false,
            "dtype_str": "float16",
            "num_warps": 4
        },
        "ms": 0.0876,
        "min_ms": 0.0884,
        "max_ms": 0.0868,
        "GB/s": 1.5,
        "TFLOPS": 0.0
    },
    {
        "params": {
            "N_tile_rows": 256,
            "M_tile_cols": 256,
            "descending": false,
            "dtype_str": "float16",
            "num_warps": 4
        },
        "ms": 0.2448,
        "min_ms": 0.2462,
        "max_ms": 0.2437,
        "GB/s": 1.07,
        "TFLOPS": 0.0
    },
    {
        "params": {
            "N_tile_rows": 1,
            "M_tile_cols": 1024,
            "descending": true,
            "dtype_str": "float16",
            "num_warps": 4
        },
        "ms": 0.0116,
        "min_ms": 0.0118,
        "max_ms": 0.0115,
        "GB/s": 0.35,
        "TFLOPS": 0.0
    },
    {
        "params": {
            "N_tile_rows": 1,
            "M_tile_cols": 4096,
            "descending": true,
            "dtype_str": "float16",
            "num_warps": 4
        },
        "ms": 0.0583,
        "min_ms": 0.0588,
        "max_ms": 0.0579,
        "GB/s": 0.28,
        "TFLOPS": 0.0
    },
    {
        "params": {
            "N_tile_rows": 1,
            "M_tile_cols": 8192,
            "descending": true,
            "dtype_str": "float16",
            "num_warps": 4
        },
        "ms": 0.1406,
        "min_ms": 0.1413,
        "max_ms": 0.1399,
        "GB/s": 0.23,
        "TFLOPS": 0.0
    },
    {
        "params": {
            "N_tile_rows": 1,
            "M_tile_cols": 16384,
            "descending": true,
            "dtype_str": "float16",
            "num_warps": 4
        },
        "ms": 0.3209,
        "min_ms": 0.3221,
        "max_ms": 0.3195,
        "GB/s": 0.2,
        "TFLOPS": 0.0
    },
    {
        "params": {
            "N_tile_rows": 8,
            "M_tile_cols": 512,
            "descending": true,
            "dtype_str": "float16",
            "num_warps": 4
        },
        "ms": 0.0189,
        "min_ms": 0.0191,
        "max_ms": 0.0188,
        "GB/s": 0.87,
        "TFLOPS": 0.0
    },
    {
        "params": {
            "N_tile_rows": 8,
            "M_tile_cols": 1024,
            "descending": true,
            "dtype_str": "float16",
            "num_warps": 4
        },
        "ms": 0.0611,
        "min_ms": 0.0617,
        "max_ms": 0.0605,
        "GB/s": 0.54,
        "TFLOPS": 0.0
    },
    {
        "params": {
            "N_tile_rows": 8,
            "M_tile_cols": 2048,
            "descending": true,
            "dtype_str": "float16",
            "num_warps": 4
        },
        "ms": 0.1685,
        "min_ms": 0.1695,
        "max_ms": 0.1675,
        "GB/s": 0.39,
        "TFLOPS": 0.0
    },
    {
        "params": {
            "N_tile_rows": 64,
            "M_tile_cols": 128,
            "descending": true,
            "dtype_str": "float16",
            "num_warps": 4
        },
        "ms": 0.0199,
        "min_ms": 0.0201,
        "max_ms": 0.0198,
        "GB/s": 1.64,
        "TFLOPS": 0.0
    },
    {
        "params": {
            "N_tile_rows": 64,
            "M_tile_cols": 256,
            "descending": true,
            "dtype_str": "float16",
            "num_warps": 4
        },
        "ms": 0.0635,
        "min_ms": 0.0641,
        "max_ms": 0.0629,
        "GB/s": 1.03,
        "TFLOPS": 0.0
    },
    {
        "params": {
            "N_tile_rows": 256,
            "M_tile_cols": 64,
            "descending": true,
            "dtype_str": "float16",
            "num_warps": 4
        },
        "ms": 0.0249,
        "min_ms": 0.0251,
        "max_ms": 0.0248,
        "GB/s": 2.63,
        "TFLOPS": 0.0
    },
    {
        "params": {
            "N_tile_rows": 256,
            "M_tile_cols": 128,
            "descending": true,
            "dtype_str": "float16",
            "num_warps": 4
        },
        "ms": 0.0868,
        "min_ms": 0.0876,
        "max_ms": 0.0861,
        "GB/s": 1.51,
        "TFLOPS": 0.0
    },
    {
        "params": {
            "N_tile_rows": 256,
            "M_tile_cols": 256,
            "descending": true,
            "dtype_str": "float16",
            "num_warps": 4
        },
        "ms": 0.2451,
        "min_ms": 0.2463,
        "max_ms": 0.2439,
        "GB/s": 1.07,
        "TFLOPS": 0.0
    },
    {
        "params": {
            "N_tile_rows": 1,
            "M_tile_cols": 1024,
            "descending": false,
            "dtype_str": "float32",
            "num_warps": 4
        },
        "ms": 0.0112,
        "min_ms": 0.0114,
        "max_ms": 0.0111,
        "GB/s": 0.73,
        "TFLOPS": 0.0
    },
    {
        "params": {
            "N_tile_rows": 1,
            "M_tile_cols": 4096,
            "descending": false,
            "dtype_str": "float32",
            "num_warps": 4
        },
        "ms": 0.0604,
        "min_ms": 0.0609,
        "max_ms": 0.0599,
        "GB/s": 0.54,
        "TFLOPS": 0.0
    },
    {
        "params": {
            "N_tile_rows": 1,
            "M_tile_cols": 8192,
            "descending": false,
            "dtype_str": "float32",
            "num_warps": 4
        },
        "ms": 0.1396,
        "min_ms": 0.1402,
        "max_ms": 0.139,
        "GB/s": 0.47,
        "TFLOPS": 0.0
    },
    {
        "params": {
            "N_tile_rows": 1,
            "M_tile_cols": 16384,
            "descending": false,
            "dtype_str": "float32",
            "num_warps": 4
        },
        "ms": 0.315,
        "min_ms": 0.316,
        "max_ms": 0.314,
        "GB/s": 0.42,
        "TFLOPS": 0.0
    },
    {
        "params": {
            "N_tile_rows": 8,
            "M_tile_cols": 512,
            "descending": false,
            "dtype_str": "float32",
            "num_warps": 4
        },
        "ms": 0.0215,
        "min_ms": 0.0217,
        "max_ms": 0.0214,
        "GB/s": 1.52,
        "TFLOPS": 0.0
    },
    {
        "params": {
            "N_tile_rows": 8,
            "M_tile_cols": 1024,
            "descending": false,
            "dtype_str": "float32",
            "num_warps": 4
        },
        "ms": 0.071,
        "min_ms": 0.0715,
        "max_ms": 0.0706,
        "GB/s": 0.92,
        "TFLOPS": 0.0
    },
    {
        "params": {
            "N_tile_rows": 8,
            "M_tile_cols": 2048,
            "descending": false,
            "dtype_str": "float32",
            "num_warps": 4
        },
        "ms": 0.1807,
        "min_ms": 0.1816,
        "max_ms": 0.1799,
        "GB/s": 0.73,
        "TFLOPS": 0.0
    },
    {
        "params": {
            "N_tile_rows": 64,
            "M_tile_cols": 128,
            "descending": false,
            "dtype_str": "float32",
            "num_warps": 4
        },
        "ms": 0.02,
        "min_ms": 0.0202,
        "max_ms": 0.0199,
        "GB/s": 3.27,
        "TFLOPS": 0.0
    },
    {
        "params": {
            "N_tile_rows": 64,
            "M_tile_cols": 256,
            "descending": false,
            "dtype_str": "float32",
            "num_warps": 4
        },
        "ms": 0.0608,
        "min_ms": 0.0614,
        "max_ms": 0.0602,
        "GB/s": 2.16,
        "TFLOPS": 0.0
    },
    {
        "params": {
            "N_tile_rows": 256,
            "M_tile_cols": 64,
            "descending": false,
            "dtype_str": "float32",
            "num_warps": 4
        },
        "ms": 0.0265,
        "min_ms": 0.0267,
        "max_ms": 0.0265,
        "GB/s": 4.94,
        "TFLOPS": 0.0
    },
    {
        "params": {
            "N_tile_rows": 256,
            "M_tile_cols": 128,
            "descending": false,
            "dtype_str": "float32",
            "num_warps": 4
        },
        "ms": 0.089,
        "min_ms": 0.0897,
        "max_ms": 0.0884,
        "GB/s": 2.94,
        "TFLOPS": 0.0
    },
    {
        "params": {
            "N_tile_rows": 256,
            "M_tile_cols": 256,
            "descending": false,
            "dtype_str": "float32",
            "num_warps": 4
        },
        "ms": 0.2451,
        "min_ms": 0.2462,
        "max_ms": 0.2439,
        "GB/s": 2.14,
        "TFLOPS": 0.0
    },
    {
        "params": {
            "N_tile_rows": 1,
            "M_tile_cols": 1024,
            "descending": true,
            "dtype_str": "float32",
            "num_warps": 4
        },
        "ms": 0.0111,
        "min_ms": 0.0113,
        "max_ms": 0.011,
        "GB/s": 0.74,
        "TFLOPS": 0.0
    },
    {
        "params": {
            "N_tile_rows": 1,
            "M_tile_cols": 4096,
            "descending": true,
            "dtype_str": "float32",
            "num_warps": 4
        },
        "ms": 0.0602,
        "min_ms": 0.0607,
        "max_ms": 0.0597,
        "GB/s": 0.54,
        "TFLOPS": 0.0
    },
    {
        "params": {
            "N_tile_rows": 1,
            "M_tile_cols": 8192,
            "descending": true,
            "dtype_str": "float32",
            "num_warps": 4
        },
        "ms": 0.1394,
        "min_ms": 0.14,
        "max_ms": 0.1388,
        "GB/s": 0.47,
        "TFLOPS": 0.0
    },
    {
        "params": {
            "N_tile_rows": 1,
            "M_tile_cols": 16384,
            "descending": true,
            "dtype_str": "float32",
            "num_warps": 4
        },
        "ms": 0.314,
        "min_ms": 0.3149,
        "max_ms": 0.313,
        "GB/s": 0.42,
        "TFLOPS": 0.0
    },
    {
        "params": {
            "N_tile_rows": 8,
            "M_tile_cols": 512,
            "descending": true,
            "dtype_str": "float32",
            "num_warps": 4
        },
        "ms": 0.0214,
        "min_ms": 0.0216,
        "max_ms": 0.0213,
        "GB/s": 1.53,
        "TFLOPS": 0.0
    },
    {
        "params": {
            "N_tile_rows": 8,
            "M_tile_cols": 1024,
            "descending": true,
            "dtype_str": "float32",
            "num_warps": 4
        },
        "ms": 0.0711,
        "min_ms": 0.0716,
        "max_ms": 0.0706,
        "GB/s": 0.92,
        "TFLOPS": 0.0
    },
    {
        "params": {
            "N_tile_rows": 8,
            "M_tile_cols": 2048,
            "descending": true,
            "dtype_str": "float32",
            "num_warps": 4
        },
        "ms": 0.1811,
        "min_ms": 0.1821,
        "max_ms": 0.1802,
        "GB/s": 0.72,
        "TFLOPS": 0.0
    },
    {
        "params": {
            "N_tile_rows": 64,
            "M_tile_cols": 128,
            "descending": true,
            "dtype_str": "float32",
            "num_warps": 4
        },
        "ms": 0.0199,
        "min_ms": 0.0201,
        "max_ms": 0.0198,
        "GB/s": 3.29,
        "TFLOPS": 0.0
    },
    {
        "params": {
            "N_tile_rows": 64,
            "M_tile_cols": 256,
            "descending": true,
            "dtype_str": "float32",
            "num_warps": 4
        },
        "ms": 0.0612,
        "min_ms": 0.0618,
        "max_ms": 0.0607,
        "GB/s": 2.14,
        "TFLOPS": 0.0
    },
    {
        "params": {
            "N_tile_rows": 256,
            "M_tile_cols": 64,
            "descending": true,
            "dtype_str": "float32",
            "num_warps": 4
        },
        "ms": 0.0265,
        "min_ms": 0.0267,
        "max_ms": 0.0263,
        "GB/s": 4.95,
        "TFLOPS": 0.0
    },
    {
        "params": {
            "N_tile_rows": 256,
            "M_tile_cols": 128,
            "descending": true,
            "dtype_str": "float32",
            "num_warps": 4
        },
        "ms": 0.0886,
        "min_ms": 0.0892,
        "max_ms": 0.088,
        "GB/s": 2.96,
        "TFLOPS": 0.0
    },
    {
        "params": {
            "N_tile_rows": 256,
            "M_tile_cols": 256,
            "descending": true,
            "dtype_str": "float32",
            "num_warps": 4
        },
        "ms": 0.2472,
        "min_ms": 0.2485,
        "max_ms": 0.2462,
        "GB/s": 2.12,
        "TFLOPS": 0.0
    },
    {
        "params": {
            "N_tile_rows": 1,
            "M_tile_cols": 1024,
            "descending": false,
            "dtype_str": "bfloat16",
            "num_warps": 4
        },
        "ms": 0.021,
        "min_ms": 0.0211,
        "max_ms": 0.0208,
        "GB/s": 0.2,
        "TFLOPS": 0.0
    },
    {
        "params": {
            "N_tile_rows": 1,
            "M_tile_cols": 4096,
            "descending": false,
            "dtype_str": "bfloat16",
            "num_warps": 4
        },
        "ms": 0.1325,
        "min_ms": 0.1337,
        "max_ms": 0.1315,
        "GB/s": 0.12,
        "TFLOPS": 0.0
    },
    {
        "params": {
            "N_tile_rows": 1,
            "M_tile_cols": 8192,
            "descending": false,
            "dtype_str": "bfloat16",
            "num_warps": 4
        },
        "ms": 0.3162,
        "min_ms": 0.3185,
        "max_ms": 0.3141,
        "GB/s": 0.1,
        "TFLOPS": 0.0
    },
    {
        "params": {
            "N_tile_rows": 1,
            "M_tile_cols": 16384,
            "descending": false,
            "dtype_str": "bfloat16",
            "num_warps": 4
        },
        "ms": 0.7421,
        "min_ms": 0.7458,
        "max_ms": 0.7375,
        "GB/s": 0.09,
        "TFLOPS": 0.0
    },
    {
        "params": {
            "N_tile_rows": 8,
            "M_tile_cols": 512,
            "descending": false,
            "dtype_str": "bfloat16",
            "num_warps": 4
        },
        "ms": 0.0596,
        "min_ms": 0.0606,
        "max_ms": 0.0588,
        "GB/s": 0.27,
        "TFLOPS": 0.0
    },
    {
        "params": {
            "N_tile_rows": 8,
            "M_tile_cols": 1024,
            "descending": false,
            "dtype_str": "bfloat16",
            "num_warps": 4
        },
        "ms": 0.1515,
        "min_ms": 0.1531,
        "max_ms": 0.1502,
        "GB/s": 0.22,
        "TFLOPS": 0.0
    },
    {
        "params": {
            "N_tile_rows": 8,
            "M_tile_cols": 2048,
            "descending": false,
            "dtype_str": "bfloat16",
            "num_warps": 4
        },
        "ms": 0.4105,
        "min_ms": 0.4134,
        "max_ms": 0.408,
        "GB/s": 0.16,
        "TFLOPS": 0.0
    },
    {
        "params": {
            "N_tile_rows": 64,
            "M_tile_cols": 128,
            "descending": false,
            "dtype_str": "bfloat16",
            "num_warps": 4
        },
        "ms": 0.0645,
        "min_ms": 0.0654,
        "max_ms": 0.0637,
        "GB/s": 0.51,
        "TFLOPS": 0.0
    },
    {
        "params": {
            "N_tile_rows": 64,
            "M_tile_cols": 256,
            "descending": false,
            "dtype_str": "bfloat16",
            "num_warps": 4
        },
        "ms": 0.1689,
        "min_ms": 0.1704,
        "max_ms": 0.1672,
        "GB/s": 0.39,
        "TFLOPS": 0.0
    },
    {
        "params": {
            "N_tile_rows": 256,
            "M_tile_cols": 64,
            "descending": false,
            "dtype_str": "bfloat16",
            "num_warps": 4
        },
        "ms": 0.0874,
        "min_ms": 0.0885,
        "max_ms": 0.0862,
        "GB/s": 0.75,
        "TFLOPS": 0.0
    },
    {
        "params": {
            "N_tile_rows": 256,
            "M_tile_cols": 128,
            "descending": false,
            "dtype_str": "bfloat16",
            "num_warps": 4
        },
        "ms": 0.2565,
        "min_ms": 0.2589,
        "max_ms": 0.2539,
        "GB/s": 0.51,
        "TFLOPS": 0.0
    },
    {
        "params": {
            "N_tile_rows": 256,
            "M_tile_cols": 256,
            "descending": false,
            "dtype_str": "bfloat16",
            "num_warps": 4
        },
        "ms": 0.6707,
        "min_ms": 0.6756,
        "max_ms": 0.6658,
        "GB/s": 0.39,
        "TFLOPS": 0.0
    },
    {
        "params": {
            "N_tile_rows": 1,
            "M_tile_cols": 1024,
            "descending": true,
            "dtype_str": "bfloat16",
            "num_warps": 4
        },
        "ms": 0.0208,
        "min_ms": 0.021,
        "max_ms": 0.0207,
        "GB/s": 0.2,
        "TFLOPS": 0.0
    },
    {
        "params": {
            "N_tile_rows": 1,
            "M_tile_cols": 4096,
            "descending": true,
            "dtype_str": "bfloat16",
            "num_warps": 4
        },
        "ms": 0.1307,
        "min_ms": 0.1317,
        "max_ms": 0.1297,
        "GB/s": 0.13,
        "TFLOPS": 0.0
    },
    {
        "params": {
            "N_tile_rows": 1,
            "M_tile_cols": 8192,
            "descending": true,
            "dtype_str": "bfloat16",
            "num_warps": 4
        },
        "ms": 0.3153,
        "min_ms": 0.3175,
        "max_ms": 0.3126,
        "GB/s": 0.1,
        "TFLOPS": 0.0
    },
    {
        "params": {
            "N_tile_rows": 1,
            "M_tile_cols": 16384,
            "descending": true,
            "dtype_str": "bfloat16",
            "num_warps": 4
        },
        "ms": 0.7396,
        "min_ms": 0.7435,
        "max_ms": 0.7358,
        "GB/s": 0.09,
        "TFLOPS": 0.0
    },
    {
        "params": {
            "N_tile_rows": 8,
            "M_tile_cols": 512,
            "descending": true,
            "dtype_str": "bfloat16",
            "num_warps": 4
        },
        "ms": 0.0572,
        "min_ms": 0.0581,
        "max_ms": 0.0562,
        "GB/s": 0.29,
        "TFLOPS": 0.0
    },
    {
        "params": {
            "N_tile_rows": 8,
            "M_tile_cols": 1024,
            "descending": true,
            "dtype_str": "bfloat16",
            "num_warps": 4
        },
        "ms": 0.1507,
        "min_ms": 0.1521,
        "max_ms": 0.1492,
        "GB/s": 0.22,
        "TFLOPS": 0.0
    },
    {
        "params": {
            "N_tile_rows": 8,
            "M_tile_cols": 2048,
            "descending": true,
            "dtype_str": "bfloat16",
            "num_warps": 4
        },
        "ms": 0.4109,
        "min_ms": 0.4139,
        "max_ms": 0.4083,
        "GB/s": 0.16,
        "TFLOPS": 0.0
    },
    {
        "params": {
            "N_tile_rows": 64,
            "M_tile_cols": 128,
            "descending": true,
            "dtype_str": "bfloat16",
            "num_warps": 4
        },
        "ms": 0.0651,
        "min_ms": 0.066,
        "max_ms": 0.0643,
        "GB/s": 0.5,
        "TFLOPS": 0.0
    },
    {
        "params": {
            "N_tile_rows": 64,
            "M_tile_cols": 256,
            "descending": true,
            "dtype_str": "bfloat16",
            "num_warps": 4
        },
        "ms": 0.1689,
        "min_ms": 0.1707,
        "max_ms": 0.1669,
        "GB/s": 0.39,
        "TFLOPS": 0.0
    },
    {
        "params": {
            "N_tile_rows": 256,
            "M_tile_cols": 64,
            "descending": true,
            "dtype_str": "bfloat16",
            "num_warps": 4
        },
        "ms": 0.0879,
        "min_ms": 0.0891,
        "max_ms": 0.0866,
        "GB/s": 0.75,
        "TFLOPS": 0.0
    },
    {
        "params": {
            "N_tile_rows": 256,
            "M_tile_cols": 128,
            "descending": true,
            "dtype_str": "bfloat16",
            "num_warps": 4
        },
        "ms": 0.2566,
        "min_ms": 0.259,
        "max_ms": 0.2537,
        "GB/s": 0.51,
        "TFLOPS": 0.0
    },
    {
        "params": {
            "N_tile_rows": 256,
            "M_tile_cols": 256,
            "descending": true,
            "dtype_str": "bfloat16",
            "num_warps": 4
        },
        "ms": 0.671,
        "min_ms": 0.677,
        "max_ms": 0.6665,
        "GB/s": 0.39,
        "TFLOPS": 0.0
    }
]